HIGHER_GEOG,SPEC_LOCALITY,VERBATIM_LOCALITY,DEC_LAT,DEC_LONG,DATUM,MAX_ERROR_DISTANCE,MAX_ERROR_UNITS,GEOREFERENCE_PROTOCOL,GEOREFERENCE_SOURCE,EVENT_ASSIGNED_BY_AGENT,EVENT_ASSIGNED_DATE,TAXON_NAME,GUID,VERBATIM_DATE,BEGAN_DATE,END_DATE,SPECIMEN_EVENT_TYPE,VERIFICATIONSTATUS
"Africa, Kenya, Kilifi County",Kilifi,"Kilifi, Kenya",-3.630453,39.849915,World Geodetic System 1984,17930,m,GeoLocate,GeoLocate,Adam Glueckert,2016-10-19,Centropus superciliosus,CHAS:Bird:19246,04/10/1960,1960-04-10,1960-04-10,accepted place of collection,unverified
"Africa, Kenya, Kilifi County","Kilifi, alt 100 ft","Kilifi, alt 100f",-3.630453,39.849915,World Geodetic System 1984,17930,m,GeoLocate,GeoLocate,Adam Glueckert,2016-10-19,Campephaga flava,CHAS:Bird:19211,08/04/1965,1965-08-04,1965-08-04,accepted place of collection,unverified
"Africa, Kenya, Kilifi County","Kilifi, alt 100 ft",alt 100',-3.630453,39.849915,World Geodetic System 1984,17930,m,GeoLocate,GeoLocate,Adam Glueckert,2016-10-19,Cossypha natalensis,CHAS:Bird:19233,08/03/1965,1965-08-03,1965-08-03,accepted place of collection,unverified
"Africa, Kenya, Kilifi County","Kilifi, alt 50 ft",alt 50',-3.630453,39.849915,World Geodetic System 1984,17930,m,GeoLocate,GeoLocate,Adam Glueckert,2016-10-19,Lagonosticta rubricata,CHAS:Bird:19176,08/03/1965,1965-08-03,1965-08-03,accepted place of collection,unverified
"Africa, Kenya, Kilifi County","Kilifi, alt 50 ft","Kilifi, Kenya, alt 50'",-3.630453,39.849915,World Geodetic System 1984,17930,m,GeoLocate,GeoLocate,Adam Glueckert,2016-10-19,Ploceus nigricollis melanoxanthus,CHAS:Bird:19204,08/07/1965,1965-08-07,1965-08-07,accepted place of collection,unverified
"Africa, Kenya, Kilifi County","Kilifi, alt 50 ft","Kilifi, Kenya, alt 50'",-3.630453,39.849915,World Geodetic System 1984,17930,m,GeoLocate,GeoLocate,Adam Glueckert,2016-10-19,Ploceus nigricollis melanoxanthus,CHAS:Bird:19205,08/07/1965,1965-08-07,1965-08-07,accepted place of collection,unverified
"Africa, Kenya, Kilifi County","Kilifi, alt 50 ft","Kilifi, Kenya, alt 50'",-3.630453,39.849915,World Geodetic System 1984,17930,m,GeoLocate,GeoLocate,Adam Glueckert,2016-10-19,Ploceus ocularis,CHAS:Bird:19206,08/06/1965,1965-08-06,1965-08-06,accepted place of collection,unverified
"Africa, Kenya, Kilifi County","Kilifi, alt 50 ft",alt 50',-3.630453,39.849915,World Geodetic System 1984,17930,m,GeoLocate,GeoLocate,Adam Glueckert,2016-10-19,Serinus mozambicus,CHAS:Bird:19207,08/03/1965,1965-08-03,1965-08-03,accepted place of collection,unverified
"Africa, Kenya, Kilifi County","Kilifi, alt 50 ft",alt 50',-3.630453,39.849915,World Geodetic System 1984,17930,m,GeoLocate,GeoLocate,Adam Glueckert,2016-10-19,Serinus mozambicus,CHAS:Bird:19208,08/03/1965,1965-08-03,1965-08-03,accepted place of collection,unverified
"Africa, Kenya, Kilifi County","Kilifi, alt 50 ft",alt 50',-3.630453,39.849915,World Geodetic System 1984,17930,m,GeoLocate,GeoLocate,Adam Glueckert,2016-10-19,Tmetothylacus tenellus,CHAS:Bird:19225,08/03/1965,1965-08-03,1965-08-03,accepted place of collection,unverified
"Africa, Kenya, Kilifi County","Kilifi, alt 50 ft","Kilifi, alt 50'",-3.630453,39.849915,World Geodetic System 1984,17930,m,GeoLocate,GeoLocate,Adam Glueckert,2016-10-19,Colius striatus,CHAS:Bird:19242,08/03/1965,1965-08-03,1965-08-03,accepted place of collection,unverified
"Africa, Kenya, Nakuru District","Lake Naivasha, alt 6000'","Lake Naivasha, Rift Valley, Alt. 6000'",-0.767317,36.359749,World Geodetic System 1984,11173,m,GeoLocate,GeoLocate,Adam Glueckert,2016-09-21,Egretta garzetta garzetta,CHAS:Bird:19251,04/18/1965,1965-04-18,1965-04-18,accepted place of collection,unverified
"Africa, Kenya, Nakuru District","Lake Naivasha, alt 6000'","Lake Naivasha, Rift Valley, alt. 6000'",-0.767317,36.359749,World Geodetic System 1984,11173,m,GeoLocate,GeoLocate,Adam Glueckert,2016-09-21,Polyboroides typus,CHAS:Bird:19267,04/18/1965,1965-04-18,1965-04-18,accepted place of collection,unverified
"Africa, Kenya, Nakuru District","Lake Naivasha, alt 6000'","Lake Naivasha, alt 6000'",-0.767317,36.359749,World Geodetic System 1984,11173,m,GeoLocate,GeoLocate,Adam Glueckert,2016-09-21,Cisticola galactotes,CHAS:Bird:19186,10/23/1970,1970-10-23,1970-10-23,accepted place of collection,unverified
"Africa, Kenya, Nakuru District","Lake Naivasha, alt 6000'","Lake Naivasha, alt 6000'",-0.767317,36.359749,World Geodetic System 1984,11173,m,GeoLocate,GeoLocate,Adam Glueckert,2016-09-21,Riparia paludicola,CHAS:Bird:19187,10/23/1970,1970-10-23,1970-10-23,accepted place of collection,unverified
"Africa, Kenya, Nakuru District","Lake Naivasha, alt 6000'","Lake Naivasha, alt 6000'",-0.767317,36.359749,World Geodetic System 1984,11173,m,GeoLocate,GeoLocate,Adam Glueckert,2016-09-21,Estrilda astrild,CHAS:Bird:19192,10/23/1970,1970-10-23,1970-10-23,accepted place of collection,unverified
"Africa, Kenya, Nakuru District","Lake Naivasha, alt 6000'","Lake Naivasha, alt 6000'",-0.767317,36.359749,World Geodetic System 1984,11173,m,GeoLocate,GeoLocate,Adam Glueckert,2016-09-21,Estrilda astrild,CHAS:Bird:19193,10/23/1970,1970-10-23,1970-10-23,accepted place of collection,unverified
"Africa, Kenya, Nakuru District","Lake Naivasha, alt 6000'","Lake Naivasha, Kenya, alt 6000'",-0.767317,36.359749,World Geodetic System 1984,11173,m,GeoLocate,GeoLocate,Adam Glueckert,2016-09-21,Ploceus velatus,CHAS:Bird:19197,10/23/1970,1970-10-23,1970-10-23,accepted place of collection,unverified
"Africa, Kenya, Nakuru District","Lake Naivasha, alt 6000'","Lake Naivasha, alt 6000'",-0.767317,36.359749,World Geodetic System 1984,11173,m,GeoLocate,GeoLocate,Adam Glueckert,2016-09-21,Cisticola galactotes,CHAS:Bird:19198,[10/23/1970],1970-10-23,1970-10-23,accepted place of collection,unverified
"Africa, Kenya, Nakuru District","Lake Naivasha, alt 6000'","Lake Naivasha, alt 6000'",-0.767317,36.359749,World Geodetic System 1984,11173,m,GeoLocate,GeoLocate,Adam Glueckert,2016-09-21,Motacilla aguimp,CHAS:Bird:19215,1970,1970-01-01,1971-12-31,accepted place of collection,unverified
"Africa, Kenya, Nakuru District","Lake Naivasha, alt 6000'","Lake Naivasha, alt 6000'",-0.767317,36.359749,World Geodetic System 1984,11173,m,GeoLocate,GeoLocate,Adam Glueckert,2016-09-21,Acrocephalus rufescens,CHAS:Bird:19222,10/23/1970,1970-10-23,1970-10-23,accepted place of collection,unverified
"Africa, Kenya, Nakuru District","Lake Naivasha, alt 6000'","Lake Naivasha, alt 6000'",-0.767317,36.359749,World Geodetic System 1984,11173,m,GeoLocate,GeoLocate,Adam Glueckert,2016-09-21,Acrocephalus rufescens,CHAS:Bird:19223,10/23/1970,1970-10-23,1970-10-23,accepted place of collection,unverified
"Africa, Kenya, Nakuru District","Lake Naivasha, alt 6000'","Lake Naivasha, Kenya, alt 6000'",-0.767317,36.359749,World Geodetic System 1984,11173,m,GeoLocate,GeoLocate,Adam Glueckert,2016-09-21,Ploceus spekei,CHAS:Bird:19224,10/23/1970,1970-10-23,1970-10-23,accepted place of collection,unverified
"Africa, Kenya, Nakuru District","Lake Naivasha, alt 6000'","Lake Naivasha, alt 6000'",-0.767317,36.359749,World Geodetic System 1984,11173,m,GeoLocate,GeoLocate,Adam Glueckert,2016-09-21,Amaurornis flavirostra,CHAS:Bird:19255,10/23/1970,1970-10-23,1970-10-23,accepted place of collection,unverified
"Africa, Kenya, Nakuru District","Lake Naivasha, alt 6000'","Lake Naivasha, alt 6000'",-0.767317,36.359749,World Geodetic System 1984,11173,m,GeoLocate,GeoLocate,Adam Glueckert,2016-09-21,Fulica cristata,CHAS:Bird:19260,11/12/1964,1964-11-12,1964-11-12,accepted place of collection,unverified
"Africa, Kenya, Nakuru District","Lake Naivasha, alt 6000'","Lake Naivasha, alt 6000'",-0.767317,36.359749,World Geodetic System 1984,11173,m,GeoLocate,GeoLocate,Adam Glueckert,2016-09-21,Fulica cristata,CHAS:Bird:19261,12/18/1964,1964-12-18,1964-12-18,accepted place of collection,unverified
"Africa, Kenya, Nakuru District","Lake Naivasha, alt 6500'","Lake Naivasha, alt 6500'",-0.767317,36.359749,World Geodetic System 1984,11173,m,GeoLocate,GeoLocate,Adam Glueckert,2016-09-21,Alcedo cristata,CHAS:Bird:19179,10/23/1970,1970-10-23,1970-10-23,accepted place of collection,unverified
"Africa, Kenya, Nakuru District","Lake Naivasha, alt 6500'","Lake Naivasha, alt 6500'",-0.767317,36.359749,World Geodetic System 1984,11173,m,GeoLocate,GeoLocate,Adam Glueckert,2016-09-21,Alcedo cristata,CHAS:Bird:19180,10/22/1970,1970-10-22,1970-10-22,accepted place of collection,unverified
"Africa, Kenya, Nakuru District","Lake Naivasha, alt 6500'","Lake Naivasha, Kenya, alt 6500'",-0.767317,36.359749,World Geodetic System 1984,11173,m,GeoLocate,GeoLocate,Adam Glueckert,2016-09-21,Eminia lepida,CHAS:Bird:19196,10/23/1970,1970-10-23,1970-10-23,accepted place of collection,unverified
"Africa, Kenya, Nakuru District","Lake Naivasha, alt 6500'","Lake Naivasha, alt 6500'",-0.767317,36.359749,World Geodetic System 1984,11173,m,GeoLocate,GeoLocate,Adam Glueckert,2016-09-21,Pycnonotus barbatus tricolor,CHAS:Bird:19221,10/23/1970,1970-10-23,1970-10-23,accepted place of collection,unverified
"Africa, Kenya, Nakuru District","Lake Naivasha, alt 6500'","Lake Naivasha, alt 6500'",-0.767317,36.359749,World Geodetic System 1984,11173,m,GeoLocate,GeoLocate,Adam Glueckert,2016-09-21,Dicrurus adsimilis,CHAS:Bird:19240,10/22/1970,1970-10-22,1970-10-22,accepted place of collection,unverified
"Africa, Kenya, Samburu County",Wamba,"Wamba, NFD, Kenya",0.982646,37.316667,World Geodetic System 1984,4692,m,GeoLocate,GeoLocate,Adam Glueckert,2016-09-30,Tockus flavirostris,CHAS:Bird:19236,10/17/1970,1970-10-17,1970-10-17,accepted place of collection,unverified
"Africa, Kenya, Samburu County",Wamba,"Wamba, NFD [Northern Frontier District]",0.982646,37.316667,World Geodetic System 1984,4692,m,GeoLocate,GeoLocate,Adam Glueckert,2016-09-30,Pseudonigrita cabanisi,CHAS:Bird:19181,10/15/1970,1970-10-15,1970-10-15,accepted place of collection,unverified
"Africa, Kenya, Samburu County",Wamba,"Wamba, NFD [Northern Frontier District]",0.982646,37.316667,World Geodetic System 1984,4692,m,GeoLocate,GeoLocate,Adam Glueckert,2016-09-30,Trachyphonus darnaudii,CHAS:Bird:19182,10/15/1970,1970-10-15,1970-10-15,accepted place of collection,unverified
"Africa, Kenya, Samburu County",Wamba,"Wamba, NFD [Northern Frontier District], Kenya, NFP",0.982646,37.316667,World Geodetic System 1984,4692,m,GeoLocate,GeoLocate,Adam Glueckert,2016-09-30,Urorhipis rufifrons,CHAS:Bird:19183,10/15/1970,1970-10-15,1970-10-15,accepted place of collection,unverified
"Africa, Kenya, Samburu County",Wamba,"Wamba, NFD [Northern Frontier District]",0.982646,37.316667,World Geodetic System 1984,4692,m,GeoLocate,GeoLocate,Adam Glueckert,2016-09-30,Batis perkeo,CHAS:Bird:19190,10/15/1970,1970-10-15,1970-10-15,accepted place of collection,unverified
"Africa, Kenya, Samburu County",Wamba,"Wamba, NFD [Northern Frontier District], Kenya, NFP",0.982646,37.316667,World Geodetic System 1984,4692,m,GeoLocate,GeoLocate,Adam Glueckert,2016-09-30,Uraeginthus cyanocephalus,CHAS:Bird:19194,10/18/1970,1970-10-18,1970-10-18,accepted place of collection,unverified
"Africa, Kenya, Samburu County",Wamba,"Wamba, NFD [Northern Frontier District]",0.982646,37.316667,World Geodetic System 1984,4692,m,GeoLocate,GeoLocate,Adam Glueckert,2016-09-30,Urocolius macrourus,CHAS:Bird:19245,10/17/1970,1970-10-17,1970-10-17,accepted place of collection,unverified
"Africa, Kenya, Samburu County",Wamba,"Wamba, NFD [Northern Frontier District]",0.982646,37.316667,World Geodetic System 1984,4692,m,GeoLocate,GeoLocate,Adam Glueckert,2016-09-30,Rhinoptilus cinctus,CHAS:Bird:19253,10/18/1970,1970-10-18,1970-10-18,accepted place of collection,unverified
"Africa, Kenya, Samburu County",Wamba,"Wamba, NFD [Northern Frontier District]",0.982646,37.316667,World Geodetic System 1984,4692,m,GeoLocate,GeoLocate,Adam Glueckert,2016-09-30,Rhinoptilus cinctus,CHAS:Bird:19254,10/18/1970,1970-10-18,1970-10-18,accepted place of collection,unverified
"Africa, Kenya, Samburu County","Wamba, alt 3000'","Wamba, NFD [Northern Frontier District], alt 3000'",0.982646,37.316667,World Geodetic System 1984,4692,m,GeoLocate,GeoLocate,Adam Glueckert,2016-09-30,Chrysococcyx klaas,CHAS:Bird:19174,[no date recorded],1800,2016-03-12,accepted place of collection,unverified
"Africa, Kenya, Samburu County","Wamba, alt 3000'","Wamba, NFD [Northern Frontier District], alt 3000'",0.982646,37.316667,World Geodetic System 1984,4692,m,GeoLocate,GeoLocate,Adam Glueckert,2016-09-30,Rhodophoneus cruentus,CHAS:Bird:19216,10/17/1970,1970-10-17,1970-10-17,accepted place of collection,unverified
"Africa, Kenya, Samburu County","Wamba, alt 3000'","Wamba, NFD [Northern Frontier District], alt 3000'",0.982646,37.316667,World Geodetic System 1984,4692,m,GeoLocate,GeoLocate,Adam Glueckert,2016-09-30,Colius leucocephalus,CHAS:Bird:19244,10/17/1970,1970-10-17,1970-10-17,accepted place of collection,unverified
"Africa, Kenya, Samburu County","Wamba, alt 3000'","Wamba, NFD [Northern Frontier District], alt 3000'",0.982646,37.316667,World Geodetic System 1984,4692,m,GeoLocate,GeoLocate,Adam Glueckert,2016-09-30,Corythaixoides leucogaster,CHAS:Bird:19259,10/17/1970,1970-10-17,1970-10-17,accepted place of collection,unverified
"Africa, Kenya, West Pokot",Sigor,"Sigor, Kenya",1.484517,35.471673,World Geodetic System 1984,4693,m,GeoLocate,GeoLocate,Adam Glueckert,2016-10-19,Tchagra australis,CHAS:Bird:19232,06/06/1965,1965-06-06,1965-06-06,accepted place of collection,unverified
"Africa, Kenya, West Pokot",Sigor,,1.484517,35.471673,World Geodetic System 1984,4693,m,GeoLocate,GeoLocate,Adam Glueckert,2016-10-19,Oriolus auratus,CHAS:Bird:19239,06/16/1965,1965-06-16,1965-06-16,accepted place of collection,unverified
"Africa, Kenya, West Pokot",Sigor,Sigor,1.484517,35.471673,World Geodetic System 1984,4693,m,GeoLocate,GeoLocate,Adam Glueckert,2016-10-19,Clamator jacobinus,CHAS:Bird:19249,06/05/1965,1965-06-05,1965-06-05,accepted place of collection,unverified
"Africa, Kenya, West Pokot",Sigor,Sigor Wei Wei,1.484517,35.471673,World Geodetic System 1984,4693,m,GeoLocate,GeoLocate,Adam Glueckert,2016-10-19,Turdoides plebejus,CHAS:Bird:2016.5.21,06/01/1965,1965-06-01,1965-06-01,accepted place of collection,unverified
"Africa, Kenya, West Pokot",Sigor,"""Masol NR: Sigor"" [Kenya?]",1.484517,35.471673,World Geodetic System 1984,4693,m,GeoLocate,GeoLocate,Adam Glueckert,2016-10-19,Creatophora cinerea,CHAS:Bird:2016.5.22,02/06/1905,1905-02-06,1905-02-06,accepted place of collection,unverified
"Africa, Kenya, West Pokot","Sigor, Wei Wei River",Wei Wei River,1.552869,35.533719,World Geodetic System 1984,301,m,GeoLocate,GeoLocate,Adam Glueckert,2016-12-14,Cossypha heuglini,CHAS:Bird:19209,06/03/1965,1965-06-03,1965-06-03,accepted place of collection,unverified
"Africa, Kenya, West Pokot","Sigor, Wei Wei River",Wei Wei River,1.552869,35.533719,World Geodetic System 1984,301,m,GeoLocate,GeoLocate,Adam Glueckert,2016-12-14,Cossypha heuglini,CHAS:Bird:19210,06/01/1965,1965-06-01,1965-06-01,accepted place of collection,unverified
"Asia, Japan, Tochigi Prefecture, Honshu",Nikko,,36.818839,139.581179,World Geodetic System 1984,1025,m,GeoLocate,GeoLocate,Adam Glueckert,2016-12-07,Loxia curvirostra albiventris,CHAS:Bird:18150,01/20/1917,1917-01-20,1917-01-20,accepted place of collection,unverified
"Asia, Japan, Tochigi Prefecture, Honshu",Nikko,,36.818839,139.581179,World Geodetic System 1984,1025,m,GeoLocate,GeoLocate,Adam Glueckert,2016-12-07,Loxia curvirostra albiventris,CHAS:Bird:18165,02/18/1918,1918-02-18,1918-02-18,accepted place of collection,unverified
"Asia, Malaysia, Sabah, Indonesian Archipelago, Borneo",Suanlamba,Suanlamba,5.6071,118.1369,World Geodetic System 1984,4682,m,GeoLocate,GeoLocate,Adam Glueckert,2016-11-16,Platysmurus leocopterus atterimus,CHAS:Bird:19228,08/21/1887,1887-08-21,1887-08-21,accepted place of collection,unverified
"Asia, Malaysia, Sabah, Indonesian Archipelago, Borneo",Suanlamba,Suanlamba,5.6071,118.1369,World Geodetic System 1984,4682,m,GeoLocate,GeoLocate,Adam Glueckert,2016-11-16,Platylophus galericulatus coronatus,CHAS:Bird:19164,01/20/1888,1888-01-20,1888-01-20,accepted place of collection,unverified
"Central America, Costa Rica, Guanacaste",Punta Piedra,C.R.: Guanacaste: Punta Piedra,10.161,-85.13382,World Geodetic System 1984,8754,m,GeoLocate,GeoLocate,Adam Glueckert,2016-09-21,Dendroica petechia castaneiceps,CHAS:Bird:19270,02/06/1924,1924-02-06,1924-02-06,accepted place of collection,unverified
"Central America, Costa Rica",Irazu,Irazu,9.982388,-83.84958,World Geodetic System 1984,1463,m,GeoLocate,GeoLocate,Adam Glueckert,2016-09-21,Cardellina pusilla pileolata,CHAS:Bird:17599,12/22/1906,1906-12-01,1907-12-30,accepted place of collection,unverified
"Central America, Costa Rica, San Jose",San Jose,"San Jose, C.R. [Costa Rica]",9.933333,-84.083333,World Geodetic System 1984,15768,m,GeoLocate,GeoLocate,Adam Glueckert,2016-09-21,Tyrannus savana,CHAS:Bird:501,June 1892,1892-06-01,1892-06-30,accepted place of collection,unverified
"Europe, Denmark",Sjaelland,Denmark: Sjaelland,55.416667,11.833333,World Geodetic System 1984,87804,m,GeoLocate,GeoLocate,Adam Glueckert,2016-09-21,Scolopax rusticola rusticola,CHAS:Bird:5280,06/12/1924,1924-06-12,1924-06-12,accepted place of collection,unverified
"Europe, Germany, Bavaria, Upper Bavaria",Chieming,"Chieming, Germany",47.893021,12.538562,World Geodetic System 1984,1358,m,GeoLocate,GeoLocate,Adam Glueckert,2016-12-14,Podiceps ruficollis,CHAS:Bird:2016.5.13,"""Dec. 15, 1965""",1965-12-15,1965-12-15,accepted place of collection,unverified
"Europe, Germany, Bavaria, Upper Bavaria",Munich,,48.15,11.583333,World Geodetic System 1984,31710,m,GeoLocate,GeoLocate,Adam Glueckert,2016-12-14,Loxia curvirostra,CHAS:Bird:18167,07/03/1920,1920-07-03,1920-07-03,accepted place of collection,unverified
"Europe, Germany, Bavaria, Upper Bavaria",Obing,,47.999157,12.406472,World Geodetic System 1984,1526,m,GeoLocate,GeoLocate,Adam Glueckert,2016-12-14,Larus ridibundus,CHAS:Bird:19332,07/07/1965,1965-07-07,1965-07-07,accepted place of collection,unverified
"Europe, Germany, Bavaria, Upper Bavaria",Obing,"Obing/Obb, Germany",47.999157,12.406472,World Geodetic System 1984,1526,m,GeoLocate,GeoLocate,Adam Glueckert,2016-12-14,Podiceps cristatus,CHAS:Bird:2016.5.9,"""July 7, 1965""",1965-07-07,1965-07-07,accepted place of collection,unverified
"Europe, Germany, Bavaria, Upper Bavaria",Obing,"Germany, Obing/Obb",47.999157,12.406472,World Geodetic System 1984,1526,m,GeoLocate,GeoLocate,Adam Glueckert,2016-12-14,Chroicocephalus ridibundus,CHAS:Bird:9809,07/07/1965,1965-07-07,1965-07-07,accepted place of collection,unverified
"Europe, Germany, Bavaria, Upper Bavaria",Prien am Chiemsee,"Prien-Obb, Germany",47.855491,12.346183,World Geodetic System 1984,3036,m,GeoLocate,GeoLocate,Adam Glueckert,2016-12-14,Buteo buteo,CHAS:Bird:2016.5.6,"""13.6.1965""",1965-06-13,1965-06-13,accepted place of collection,unverified
"Europe, Germany, Bavaria, Upper Bavaria",Prien am Chiemsee,Prien-Obb Germany,47.855491,12.346183,World Geodetic System 1984,3036,m,GeoLocate,GeoLocate,Adam Glueckert,2016-12-14,Cuculus canorus,CHAS:Bird:2016.5.7,"""June 11, 1965""",1965-06-11,1965-06-11,accepted place of collection,unverified
"Europe, Germany, Bavaria, Upper Bavaria",Prien am Chiemsee,"Germany, Prien-Obb",47.855491,12.346183,World Geodetic System 1984,3036,m,GeoLocate,GeoLocate,Adam Glueckert,2016-12-14,Columba palumbus,CHAS:Bird:9805,05/06/1965,1965-05-06,1965-05-06,accepted place of collection,unverified
"Europe, Germany, Bavaria, Upper Bavaria",Prien am Chiemsee,"Germany, Prien-Obb",47.855491,12.346183,World Geodetic System 1984,3036,m,GeoLocate,GeoLocate,Adam Glueckert,2016-12-14,Cuculus canorus,CHAS:Bird:9806,05/11/1965,1965-05-11,1965-05-11,accepted place of collection,unverified
"Europe, Germany, Bavaria, Upper Bavaria",Prien am Chiemsee,"Germany, Prien",47.855491,12.346183,World Geodetic System 1984,3036,m,GeoLocate,GeoLocate,Adam Glueckert,2016-12-14,Buteo buteo,CHAS:Bird:9808,04/04/1965,1965-04-04,1965-04-04,accepted place of collection,unverified
"Europe, Germany, Bavaria, Upper Bavaria",Schleching,"Germany, Schleching-Obb",47.720764,12.395903,World Geodetic System 1984,1748,m,GeoLocate,GeoLocate,Adam Glueckert,2016-12-14,Nucifraga caryocatactes,CHAS:Bird:2016.5.10,"""3.12.1965""",1965-12-12,1965-12-12,accepted place of collection,unverified
"Europe, Germany, Bavaria, Upper Bavaria",Traunstein,"Traunstein, Germany",47.868247,12.643347,World Geodetic System 1984,3046,m,GeoLocate,GeoLocate,Adam Glueckert,2016-11-16,Accipiter gentilis,CHAS:Bird:9919,"""May 1966""",1966-05-01,1966-05-30,accepted place of collection,unverified
"Europe, Germany, Bavaria, Upper Bavaria",Traunstein,"Traunstein, Germany",47.868247,12.643347,World Geodetic System 1984,3046,m,GeoLocate,GeoLocate,Adam Glueckert,2016-11-16,Turdus pilaris,CHAS:Bird:2016.5.8,"""29.3.1965""",1965-03-29,1965-03-29,accepted place of collection,unverified
"Europe, Germany, Bavaria, Upper Bavaria",Traunstein,Traunstein-Germany,47.868247,12.643347,World Geodetic System 1984,3046,m,GeoLocate,GeoLocate,Adam Glueckert,2016-11-16,Corvus corone corone,CHAS:Bird:2016.5.11,"""18.4.1965""",1965-04-18,1965-04-18,accepted place of collection,unverified
"Europe, Germany, Bavaria, Upper Bavaria",Traunstein,"Traunstein, Germany",47.868247,12.643347,World Geodetic System 1984,3046,m,GeoLocate,GeoLocate,Adam Glueckert,2016-11-16,Turdus viscivorous,CHAS:Bird:2016.5.12,"""30.3.1965""",1965-03-30,1965-03-30,accepted place of collection,unverified
"Europe, Germany, Bavaria, Upper Bavaria",Traunstein,"Germany, Traunstein",47.868247,12.643347,World Geodetic System 1984,3046,m,GeoLocate,GeoLocate,Adam Glueckert,2016-11-16,Corvus corone corone,CHAS:Bird:9807,04/16/1965,1965-04-16,1965-04-16,accepted place of collection,unverified
"Europe, Germany, Bavaria, Upper Bavaria",Traunstein,"Germany, Traunstein",47.868247,12.643347,World Geodetic System 1984,3046,m,GeoLocate,GeoLocate,Adam Glueckert,2016-11-16,Pyrrhula pyrrhula,CHAS:Bird:9885,"Jan. 21, 1966",1966-01-21,1966-01-21,accepted place of collection,unverified
"Europe, Germany, Bavaria, Upper Bavaria",Traunstein,"Traunstein, Germany",47.868247,12.643347,World Geodetic System 1984,3046,m,GeoLocate,GeoLocate,Adam Glueckert,2016-11-16,Garrulus glandarius,CHAS:Bird:2016.5.14,"""10.4.1965""",1965-04-10,1965-04-10,accepted place of collection,unverified
"Europe, Germany, Bavaria, Upper Bavaria",Traunstein,Traunstein - Germany,47.868247,12.643347,World Geodetic System 1984,3046,m,GeoLocate,GeoLocate,Adam Glueckert,2016-11-16,Streptopelia decaocto,CHAS:Bird:2016.5.15,"""22.1.1966""",1966-01-22,1966-01-22,accepted place of collection,unverified
"Europe, Germany, Bavaria, Upper Bavaria",Traunstein,"Traunstein, Germany",47.868247,12.643347,World Geodetic System 1984,3046,m,GeoLocate,GeoLocate,Adam Glueckert,2016-11-16,Turdus merula,CHAS:Bird:2016.5.16,"""4.4.1965""",1965-04-04,1965-04-04,accepted place of collection,unverified
"North America, Bering Sea, United States, Alaska, Unalaska Quad, Fox Islands, Aleutian Islands, Unalaska Island",Unalaska,,53.873611,-166.536667,World Geodetic System 1984,6927,m,GeoLocate,GeoLocate,Adam Glueckert,2016-11-18,Podiceps auritus,CHAS:Bird:4500,9/21/1921 or 1922,1921-09-21,1921-09-22,accepted place of collection,unverified
"North America, Bering Sea, United States, Alaska, Unalaska Quad, Fox Islands, Aleutian Islands, Unalaska Island",Unalaska,,53.873611,-166.536667,World Geodetic System 1984,6927,m,GeoLocate,GeoLocate,Adam Glueckert,2016-11-18,Calidris ptilocnemis couesi,CHAS:Bird:4870,09/24/1922,1922-09-24,1922-09-24,accepted place of collection,unverified
"North America, Bering Sea, United States, Alaska, Unalaska Quad, Fox Islands, Aleutian Islands, Unalaska Island",Unalaska,,53.873611,-166.536667,World Geodetic System 1984,6927,m,GeoLocate,GeoLocate,Adam Glueckert,2016-11-18,Calidris ptilocnemis couesi,CHAS:Bird:4871,09/26/1922,1922-09-26,1922-09-26,accepted place of collection,unverified
"North America, Bering Sea, United States, Alaska, Unalaska Quad, Fox Islands, Aleutian Islands, Unalaska Island",Unalaska,,53.873611,-166.536667,World Geodetic System 1984,6927,m,GeoLocate,GeoLocate,Adam Glueckert,2016-11-18,Falco columbarius columbarius,CHAS:Bird:4431,09/25/1922,1922-09-25,1922-09-25,accepted place of collection,unverified
"North America, Bering Sea, United States, Alaska, Unalaska Quad, Fox Islands, Aleutian Islands, Unalaska Island",Unalaska,Unalaska,53.873611,-166.536667,World Geodetic System 1984,6927,m,GeoLocate,GeoLocate,Adam Glueckert,2016-11-18,Passerculus sandwichensis sandwichensis,CHAS:Bird:8224,06/08/1911,1911-06-08,1911-06-08,accepted place of collection,unverified
"North America, Bering Sea, United States, Alaska, Unalaska Quad, Fox Islands, Aleutian Islands, Unalaska Island",Unalaska,,53.873611,-166.536667,World Geodetic System 1984,6927,m,GeoLocate,GeoLocate,Adam Glueckert,2016-11-18,Lunda cirrhata,CHAS:Bird:1556,08/16/1890,1890-08-16,1890-08-16,accepted place of collection,unverified
"North America, Bering Sea, United States, Alaska, Unalaska Quad, Fox Islands, Aleutian Islands, Unalaska Island",Unalaska,,53.873611,-166.536667,World Geodetic System 1984,6927,m,GeoLocate,GeoLocate,Adam Glueckert,2016-11-18,Fratercula corniculata,CHAS:Bird:1557,08/16/1890,1890-08-16,1890-08-16,accepted place of collection,unverified
"North America, Canada, Alberta, Calgary Region","28 miles west of High River, alt. 4350 ft","High River, 28 miles west, Alt. 4,350 feet",50.582686,-114.501299,World Geodetic System 1984,16884,m,GeoLocate,GeoLocate,Adam Glueckert,2016-09-17,Euphagus carolinus,CHAS:Bird:4937,06/24/1931,1931-06-24,1931-06-24,accepted place of collection,unverified
"North America, Canada, Alberta, Calgary Region",30 miles west of High River,30 miles west of High River,50.576908,-114.545244,World Geodetic System 1984,16884,m,GeoLocate,GeoLocate,Adam Glueckert,2016-09-17,Agelaius phoeniceus,CHAS:Bird:5410,"6/17/1931; July 17, 1931",1931-07-17,1931-07-17,accepted place of collection,unverified
"North America, Canada, Alberta, Calgary Region","30 miles west of Highwood River, alt. 4450 ft","30 miles west of Highwood River, alt. 4,450'.  Canada: Alberta",50.576908,-114.545244,World Geodetic System 1984,6109,m,GeoLocate,GeoLocate,Adam Glueckert,2016-09-17,Actitis macularius,CHAS:Bird:5419,06/21/1931,1931-06-21,1931-06-21,accepted place of collection,unverified
"North America, Canada, Alberta, Calgary Region","31 miles west of west High River, alt. 4500 ft","31 mi W of W High River, alt 4500'",50.583885,-114.571337,World Geodetic System 1984,10666,m,GeoLocate,GeoLocate,Adam Glueckert,2016-09-17,Pooecetes gramineus confinis,CHAS:Bird:4925,06/30/1931,1931-06-30,1931-06-30,accepted place of collection,unverified
"North America, Canada, Alberta, Calgary Region",32 miles west of High River,32mi W High River,50.585539,-114.59444,World Geodetic System 1984,6000,m,GeoLocate,GeoLocate,Adam Glueckert,2016-09-17,Colaptes auratus luteus,CHAS:Bird:5407,07/03/1931,1931-07-03,1931-07-03,accepted place of collection,unverified
"North America, Canada, Alberta, Calgary Region",32 miles west of High River,"32 mi W High River, Alberta, Can.",50.585539,-114.59444,World Geodetic System 1984,6000,m,GeoLocate,GeoLocate,Adam Glueckert,2016-09-17,Setophaga ruticilla,CHAS:Bird:5413,06/16/1931,1931-06-16,1931-06-16,accepted place of collection,unverified
"North America, Canada, Alberta, Calgary Region",32 miles west of High River,32 miles west of High River,50.585539,-114.59444,World Geodetic System 1984,6000,m,GeoLocate,GeoLocate,Adam Glueckert,2016-09-17,Sialia currucoides,CHAS:Bird:4934,06/28/1931,1931-06-28,1931-06-28,accepted place of collection,unverified
"North America, Canada, Alberta, Calgary Region",32 miles west of High River,32 mi W High River,50.585539,-114.59444,World Geodetic System 1984,6000,m,GeoLocate,GeoLocate,Adam Glueckert,2016-09-17,Nucifraga columbiana,CHAS:Bird:5409,07/22/1931,1931-07-22,1931-07-22,accepted place of collection,unverified
"North America, Canada, Alberta, Calgary Region","32 miles west of High River, alt. 4450 ft","32 miles, W High River, Alt. 4450 ft",50.585539,-114.59444,World Geodetic System 1984,15960,m,GeoLocate,GeoLocate,Adam Glueckert,2016-09-17,Tyrannus tyrannus,CHAS:Bird:4928,06/28/1931,1931-06-28,1931-06-28,accepted place of collection,unverified
"North America, Canada, Alberta, Calgary Region","32 miles west of High River, alt. 4500 ft",32mi W High River; alt. 4500 ft,50.585539,-114.59444,World Geodetic System 1984,10000,m,GeoLocate,GeoLocate,Adam Glueckert,2016-09-17,Colaptes auratus luteus,CHAS:Bird:5406,"1/1/1903 or 7/3/1903 (?); July 3, 1931",1903-01-01,1903-07-03,accepted place of collection,unverified
"North America, Canada, Alberta, Calgary Region","32 miles west of High River, alt. 4500 ft","32 mi W High River, 4500' alt.",50.585539,-114.59444,World Geodetic System 1984,10000,m,GeoLocate,GeoLocate,Adam Glueckert,2016-09-17,Bombycilla cedrorum,CHAS:Bird:5418,06/16/1931,1931-06-16,1931-06-16,accepted place of collection,unverified
"North America, Canada, Alberta, Calgary Region","32 miles west of High River, alt. 4500 ft","32 mi W High River, 4500' alt.",50.585539,-114.59444,World Geodetic System 1984,10000,m,GeoLocate,GeoLocate,Adam Glueckert,2016-09-17,Bombycilla cedrorum,CHAS:Bird:4930,06/18/1931,1931-06-18,1931-06-18,accepted place of collection,unverified
"North America, Canada, Alberta, Calgary Region","32 miles west of High River, alt. 4500 ft","32 mi W. High River, Alt 4500'",50.585539,-114.59444,World Geodetic System 1984,10000,m,GeoLocate,GeoLocate,Adam Glueckert,2016-09-17,Pooecetes gramineus confinis,CHAS:Bird:4927,06/20/1931,1931-06-20,1931-06-20,accepted place of collection,unverified
"North America, Canada, Alberta, Calgary Region","32 miles west of High River, alt. 4500 ft","32 mi W High River, alt. 4500'",50.585539,-114.59444,World Geodetic System 1984,10000,m,GeoLocate,GeoLocate,Adam Glueckert,2016-09-17,Carduelis tristis tristis,CHAS:Bird:4936,06/28/1931,1931-06-28,1931-06-28,accepted place of collection,unverified
"North America, Canada, Alberta, Calgary Region","32 miles west of High River, alt. 4500 ft","32mi W High River, alt. 4500'",50.585539,-114.59444,World Geodetic System 1984,10000,m,GeoLocate,GeoLocate,Adam Glueckert,2016-09-17,Asio otus,CHAS:Bird:4922,06/29/1931,1931-06-29,1931-06-29,accepted place of collection,unverified
"North America, Canada, Alberta, Calgary Region","32 miles west of High River, alt. 4500 ft","32mi W High River, alt. 4500'",50.585539,-114.59444,World Geodetic System 1984,10000,m,GeoLocate,GeoLocate,Adam Glueckert,2016-09-17,Falco sparverius sparverius,CHAS:Bird:4923,07/02/1931,1931-07-02,1931-07-02,accepted place of collection,unverified
"North America, Canada, Alberta, Calgary Region","32 miles west of High River, alt. 4500 ft","32 mi W High River, alt. 4400'",50.585539,-114.59444,World Geodetic System 1984,10000,m,GeoLocate,GeoLocate,Adam Glueckert,2016-09-17,Catharus guttata guttata,CHAS:Bird:4935,07/05/1931,1931-07-05,1931-07-05,accepted place of collection,unverified
"North America, Canada, Alberta, Calgary Region","32 miles west of High River, alt. 4500 ft","32 miles west of High River, alt. 4500'.  Canada: Alberta",50.585539,-114.59444,World Geodetic System 1984,10000,m,GeoLocate,GeoLocate,Adam Glueckert,2016-09-17,Bonasa umbellus umbelloides,CHAS:Bird:5422,07/25/1931,1931-07-25,1931-07-25,accepted place of collection,unverified
"North America, Canada, Alberta, Calgary Region","32 miles west of High River, alt. 4500 ft","32 miles west of High River, alt. 4,500 feet, Canada: Alberta",50.585539,-114.59444,World Geodetic System 1984,10000,m,GeoLocate,GeoLocate,Adam Glueckert,2016-09-17,Bonasa umbellus umbelloides,CHAS:Bird:4920,07/28/1931,1931-07-28,1931-07-28,accepted place of collection,unverified
"North America, Canada, Alberta, Calgary Region","32 miles west of High River, alt. 4500 ft","32 miles west of High River, alt. 4,500 feet, Canada: Alberta",50.585539,-114.59444,World Geodetic System 1984,10000,m,GeoLocate,GeoLocate,Adam Glueckert,2016-09-17,Bonasa umbellus umbelloides,CHAS:Bird:4921,07/24/1931,1931-07-24,1931-07-24,accepted place of collection,unverified
"North America, Canada, Alberta, Calgary Region","32 miles west of High River, alt. 4500 ft","32 mi W High River, 4500' alt.",50.585539,-114.59444,World Geodetic System 1984,10000,m,GeoLocate,GeoLocate,Adam Glueckert,2016-09-17,Bombycilla cedrorum,CHAS:Bird:4931,06/18/1931,1931-06-18,1931-06-18,accepted place of collection,unverified
"North America, Canada, Alberta, Calgary Region",33 miles west of High River,"33 mi W High River, Alberta, Can.",50.582141,-114.609789,World Geodetic System 1984,14942,m,GeoLocate,GeoLocate,Adam Glueckert,2016-09-17,Spizella passerina,CHAS:Bird:5414,06/12/1931,1931-06-12,1931-06-12,accepted place of collection,unverified
"North America, Canada, Alberta, Calgary Region","33 miles west of High River, alt. 4400 ft","33 miles, W High River, Alt. 4400 ft",50.582141,-114.609789,World Geodetic System 1984,7942,m,GeoLocate,GeoLocate,Adam Glueckert,2016-09-17,Tyrannus tyrannus,CHAS:Bird:4929,06/27/1931,1931-06-27,1931-06-27,accepted place of collection,unverified
"North America, Canada, Alberta, Calgary Region","33 miles west of High River, alt. 4450 ft",33mi W High River; alt 4450 Ft,50.582141,-114.609789,World Geodetic System 1984,8000,m,GeoLocate,GeoLocate,Adam Glueckert,2016-09-17,Colaptes auratus luteus,CHAS:Bird:5408,07/11/1930,1930-07-11,1930-07-11,accepted place of collection,unverified
"North America, Canada, Alberta, Calgary Region","33 miles west of High River, alt. 4450 ft",33mi W High River Alt. 4450,50.582141,-114.609789,World Geodetic System 1984,8000,m,GeoLocate,GeoLocate,Adam Glueckert,2016-09-17,Zonotrichia leucophrys gambelii,CHAS:Bird:4932,07/10/1931,1931-07-10,1931-07-10,accepted place of collection,unverified
"North America, Canada, Alberta, Calgary Region","33 miles west of High River, alt. 4450 ft","33 miles west of High River, alt. 4,450 (feet)",50.582141,-114.609789,World Geodetic System 1984,8000,m,GeoLocate,GeoLocate,Adam Glueckert,2016-09-17,Contopus sordidulus sordidulus,CHAS:Bird:5421,"July 11, 193?; July 11, 1931",1931-07-11,1931-07-11,accepted place of collection,unverified
"North America, Canada, Alberta, Calgary Region","35 miles west of High River, alt. 4450 ft",35mi W High River alt 4450',50.582483,-114.667721,World Geodetic System 1984,16281,m,GeoLocate,GeoLocate,Adam Glueckert,2016-09-17,Spizella passerina arizonae,CHAS:Bird:4924,06/28/1931,1931-06-28,1931-06-28,accepted place of collection,unverified
"North America, Canada, Alberta, Calgary Region","36 miles west of High River, alt. 4500 ft","36 miles west of High River, alt. 4500', Alberta, Canada",50.579525,-114.675707,World Geodetic System 1984,7942,m,GeoLocate,GeoLocate,Adam Glueckert,2016-09-17,Dendroica coronata,CHAS:Bird:5411,"6/17/1931; July 17, 1931",1931-07-17,1931-07-17,accepted place of collection,unverified
"North America, Canada, Alberta, Calgary Region",38 miles west of High River,"38 mi. W High River, Alberta, Can.",50.575164,-114.734759,World Geodetic System 1984,16884,m,GeoLocate,GeoLocate,Adam Glueckert,2016-09-17,Dendroica fusca,CHAS:Bird:5412,"6/17/1931; July 17, 1931",1931-07-17,1931-07-17,accepted place of collection,unverified
"North America, Canada, Alberta, Calgary Region",38 miles west of High River,38 miles west of High River,50.575164,-114.734759,World Geodetic System 1984,16884,m,GeoLocate,GeoLocate,Adam Glueckert,2016-09-17,Pheucticus ludovicianus,CHAS:Bird:5417,06/17/1931,1931-06-17,1931-06-17,accepted place of collection,unverified
"North America, Canada, Alberta, Calgary Region","Flat Creek, 35 miles west of High River, alt. 4500 ft","Flat Cr. 35 mi W High River, Alt 4500'",50.576036,-114.663347,World Geodetic System 1984,4553,m,GeoLocate,GeoLocate,Adam Glueckert,2016-09-17,Pooecetes gramineus confinis,CHAS:Bird:4926,06/19/1931,1931-06-19,1931-06-19,accepted place of collection,unverified
"North America, Canada, Alberta, Calgary Region","Flat Creek, 35 miles west of High River, alt. 4650 ft","Flat Creek 35 miles west of High River; Alt. 4,650 feet",50.582483,-114.667721,World Geodetic System 1984,16884,m,GeoLocate,GeoLocate,Adam Glueckert,2016-09-17,Molothrus ater ater,CHAS:Bird:4933,06/19/1931,1931-06-19,1931-06-19,accepted place of collection,unverified
"North America, Canada, Alberta, Calgary Region",Foothills 40 miles southwest of Calgary,foothills 40 mi SW Calgary,50.770853,-114.871602,World Geodetic System 1984,30649,m,GeoLocate,GeoLocate,Adam Glueckert,2016-10-19,Perisoreus canadensis,CHAS:Bird:15922,08/04/1895,1895-08-04,1895-08-04,accepted place of collection,unverified
"North America, Canada, Alberta, Calgary Region","Pekisko Cove, 28 miles west of High River",Pekisko Cove; 28 miles west of High River. Canada: Alberta,50.432778,-114.160556,World Geodetic System 1984,27521,m,GeoLocate,GeoLocate,Adam Glueckert,2016-09-17,Actitis macularius,CHAS:Bird:5420,06/24/1931,1931-06-24,1931-06-24,accepted place of collection,unverified
"North America, Canada, Alberta, Calgary Region","Pekisko Creek, 28 miles west of High River","Pekisko Creek, 28 mi W High River",50.432778,-114.160556,World Geodetic System 1984,27521,m,GeoLocate,GeoLocate,Adam Glueckert,2016-09-17,Pica hudsonia,CHAS:Bird:5405,07/26/1931,1931-07-26,1931-07-26,accepted place of collection,unverified
"North America, Canada, Alberta, Calgary Region","Pekisko Creek, 28 miles west of High River, alt 4300 ft","Pekasko [Pekisko] Cr. 28 mi W (alt) 4,300'",50.432778,-114.160556,World Geodetic System 1984,27521,m,GeoLocate,GeoLocate,Adam Glueckert,2016-09-17,Lanius ludovicianus excubitorides,CHAS:Bird:5416,07/26/1931,1931-07-26,1931-07-26,accepted place of collection,unverified
"North America, Canada, Alberta",Red Deer,"Red Deer, NW Canada",52.266667,-113.8,World Geodetic System 1984,7732,m,GeoLocate,GeoLocate,Adam Glueckert,2016-09-17,Perisoreus canadensis,CHAS:Bird:15923,01/15/1896,1896-01-15,1896-01-15,accepted place of collection,unverified
"North America, Canada, British Columbia",Banff,"Banff, British Columbia",51.166667,-115.566667,World Geodetic System 1984,3299,m,GeoLocate,GeoLocate,Adam Glueckert,2016-09-17,Dendragapus obscurus richardsonii,CHAS:Bird:18946,[no date recorded],1879-09-23,1949-12-31,accepted place of collection,unverified
"North America, Canada, British Columbia",Masset,,54.016667,-132.15,World Geodetic System 1984,8113,m,GeoLocate,GeoLocate,Adam Glueckert,2016-10-19,Corvus caurinus,CHAS:Bird:2345,05/09/1920,1920-05-09,1920-05-09,accepted place of collection,unverified
"North America, Canada, British Columbia, North Okanagan","Vernon, Okanagan","Okanagon, B.C.",50.233333,-119.366667,World Geodetic System 1984,14705,m,GeoLocate,GeoLocate,Adam Glueckert,2016-09-17,Tyrannus verticalis,CHAS:Bird:8287,Aug. 1919,1919-08-01,1919-08-30,accepted place of collection,unverified
"North America, Canada, British Columbia, North Okanagan","Vernon, Okanagan Landing","Okanagan Landing, British Columbia",50.233333,-119.366667,World Geodetic System 1984,14705,m,GeoLocate,GeoLocate,Adam Glueckert,2016-09-17,Dendragapus obscurus richardsonii,CHAS:Bird:2352,09/16/1926,1926-09-16,1926-09-16,accepted place of collection,unverified
"North America, Canada, British Columbia, North Okanagan","Vernon, Okanagan Landing",Okanagan Landing,50.233333,-119.366667,World Geodetic System 1984,14705,m,GeoLocate,GeoLocate,Adam Glueckert,2016-09-17,Megascops kennicottii macfarlani,CHAS:Bird:2357,12/27/1924,1924-12-27,1924-12-27,accepted place of collection,unverified
"North America, Canada, British Columbia, North Okanagan","Vernon, Okanagan Landing",Okanagon Landing,50.233333,-119.366667,World Geodetic System 1984,14705,m,GeoLocate,GeoLocate,Adam Glueckert,2016-09-17,Dryocopus pileatus,CHAS:Bird:4149,09/24/1913,1913-09-24,1913-09-24,accepted place of collection,unverified
"North America, Canada, British Columbia, North Okanagan","Vernon, Okanagan Landing",Okanagon Landing,50.233333,-119.366667,World Geodetic System 1984,14705,m,GeoLocate,GeoLocate,Adam Glueckert,2016-09-17,Colaptes auratus,CHAS:Bird:4156,03/21/1914,1914-03-21,1914-03-21,accepted place of collection,unverified
"North America, Canada, British Columbia, North Okanagan","Vernon, Okanagan Landing",Okanagan Landing,50.233333,-119.366667,World Geodetic System 1984,14705,m,GeoLocate,GeoLocate,Adam Glueckert,2016-09-17,Picoides arcticus,CHAS:Bird:4154,"09/05/1930 aka May 9, 1930",1930-05-09,1930-05-09,accepted place of collection,unverified
"North America, Canada, British Columbia, North Okanagan","Vernon, Okanagan Landing",Okanagan Landing,50.233333,-119.366667,World Geodetic System 1984,14705,m,GeoLocate,GeoLocate,Adam Glueckert,2016-09-17,Picoides arcticus,CHAS:Bird:4155,05/09/1930,1930-05-09,1930-05-09,accepted place of collection,unverified
"North America, Canada, British Columbia, North Okanagan","Vernon, Okanagan Landing",Okanagan Landing,50.233333,-119.366667,World Geodetic System 1984,14705,m,GeoLocate,GeoLocate,Adam Glueckert,2016-09-17,Falco mexicanus,CHAS:Bird:4148,10/29/1930,1930-10-29,1930-10-29,accepted place of collection,unverified
"North America, Canada, British Columbia, North Okanagan","Vernon, Okanagan Landing",Okanagon Landing,50.233333,-119.366667,World Geodetic System 1984,14705,m,GeoLocate,GeoLocate,Adam Glueckert,2016-09-17,Glaucidium gnoma,CHAS:Bird:2354,01/08/1924,1924-01-08,1924-01-08,accepted place of collection,unverified
"North America, Canada, British Columbia, North Okanagan","Vernon, Okanagan Landing",Okanagon Landing,50.233333,-119.366667,World Geodetic System 1984,14705,m,GeoLocate,GeoLocate,Adam Glueckert,2016-09-17,Glaucidium gnoma,CHAS:Bird:2355,01/30/1922,1922-01-30,1922-01-30,accepted place of collection,unverified
"North America, Canada, British Columbia, North Okanagan","Vernon, Okanagan Landing",Okanagan Landing,50.233333,-119.366667,World Geodetic System 1984,14705,m,GeoLocate,GeoLocate,Adam Glueckert,2016-09-17,Cypseloides niger,CHAS:Bird:4152,"06/13/1930 or June 30, 1913",1930-06-13,1930-06-30,accepted place of collection,unverified
"North America, Canada, British Columbia, North Okanagan","Vernon, Okanagan Landing",Okanagan Landing,50.233333,-119.366667,World Geodetic System 1984,14705,m,GeoLocate,GeoLocate,Adam Glueckert,2016-09-17,Cypseloides niger,CHAS:Bird:4153,06/11/1930,1930-06-11,1930-06-11,accepted place of collection,unverified
"North America, Canada, British Columbia, North Okanagan","Vernon, Okanagan Landing",Okanagan Landing,50.233333,-119.366667,World Geodetic System 1984,14705,m,GeoLocate,GeoLocate,Adam Glueckert,2016-09-17,Cyanocitta stelleri annectens,CHAS:Bird:2342,02/18/1922,1922-02-18,1922-02-18,accepted place of collection,unverified
"North America, Canada, British Columbia, North Okanagan","Vernon, Okanagan Landing",Okanagan Landing,50.233333,-119.366667,World Geodetic System 1984,14705,m,GeoLocate,GeoLocate,Adam Glueckert,2016-09-17,Cyanocitta stelleri annectens,CHAS:Bird:2343,12/20/1911,1911-12-20,1911-12-20,accepted place of collection,unverified
"North America, Canada, British Columbia, North Okanagan","Vernon, Okanagan Landing","Okanagan Landing, British Columbia",50.233333,-119.366667,World Geodetic System 1984,14705,m,GeoLocate,GeoLocate,Adam Glueckert,2016-09-17,Dendragapus obscurus richardsonii,CHAS:Bird:2353,10/12/1924,1924-10-12,1924-10-12,accepted place of collection,unverified
"North America, Canada, British Columbia, North Okanagan","Vernon, Okanagan Landing","Okanagon Landing, British Columbia",50.233333,-119.366667,World Geodetic System 1984,14705,m,GeoLocate,GeoLocate,Adam Glueckert,2016-09-17,Canachites canadensis franklinii,CHAS:Bird:5710,10/12/1931,1931-10-12,1931-10-12,accepted place of collection,unverified
"North America, Canada, British Columbia, North Okanagan","Vernon, Okanagan Landing",Okanagon Landing,50.233333,-119.366667,World Geodetic System 1984,14705,m,GeoLocate,GeoLocate,Adam Glueckert,2016-09-17,Tympanuchus phasianellus columbianus,CHAS:Bird:2351,10/13/1929,1929-10-13,1929-10-13,accepted place of collection,unverified
"North America, Canada, British Columbia, North Okanagan","Vernon, Okanagan Landing","Okanagon Landing, British Columbia",50.233333,-119.366667,World Geodetic System 1984,14705,m,GeoLocate,GeoLocate,Adam Glueckert,2016-09-17,Bonasa umbellus umbelloides,CHAS:Bird:2349,11/29/1913,1913-11-29,1913-11-29,accepted place of collection,unverified
"North America, Canada, British Columbia, North Okanagan","Vernon, Okanagan Landing","Okanagon Landing, British Columbia",50.233333,-119.366667,World Geodetic System 1984,14705,m,GeoLocate,GeoLocate,Adam Glueckert,2016-09-17,Bonasa umbellus umbelloides,CHAS:Bird:2350,09/30/1929,1929-09-30,1929-09-30,accepted place of collection,unverified
"North America, Canada, British Columbia, North Okanagan","Vernon, Okanagan Landing",Okanagan Landing,50.233333,-119.366667,World Geodetic System 1984,14705,m,GeoLocate,GeoLocate,Adam Glueckert,2016-09-17,Perisoreus canadensis capitalis,CHAS:Bird:2341,11/27/1912,1912-11-27,1912-11-27,accepted place of collection,unverified
"North America, Canada, British Columbia, North Okanagan","Vernon, Okanagan Landing",Okanagan Landing,50.233333,-119.366667,World Geodetic System 1984,14705,m,GeoLocate,GeoLocate,Adam Glueckert,2016-09-17,Pica pica,CHAS:Bird:2346,12/15/1929,1929-12-15,1929-12-15,accepted place of collection,unverified
"North America, Canada, British Columbia, North Okanagan","Vernon, Okanagan Landing",Okanagan Landing,50.233333,-119.366667,World Geodetic System 1984,14705,m,GeoLocate,GeoLocate,Adam Glueckert,2016-09-17,Pica pica,CHAS:Bird:2347,05/26/1921,1921-05-26,1921-05-26,accepted place of collection,unverified
"North America, Canada, British Columbia, North Okanagan","Vernon, Okanagan Landing",Okanagan Landing,50.233333,-119.366667,World Geodetic System 1984,14705,m,GeoLocate,GeoLocate,Adam Glueckert,2016-09-17,Nucifraga columbiana,CHAS:Bird:2344,12/20/1911,1911-12-20,1911-12-20,accepted place of collection,unverified
"North America, Canada, British Columbia, North Okanagan","Vernon, Okanagan Landing",Okanagan Landing,50.233333,-119.366667,World Geodetic System 1984,14705,m,GeoLocate,GeoLocate,Adam Glueckert,2016-09-17,Bombycilla garrula pallidiceps,CHAS:Bird:2336,03/10/1922,1922-03-10,1922-03-10,accepted place of collection,unverified
"North America, Canada, British Columbia, North Okanagan","Vernon, Okanagan Landing",Okanagan Landing,50.233333,-119.366667,World Geodetic System 1984,14705,m,GeoLocate,GeoLocate,Adam Glueckert,2016-09-17,Bombycilla garrula pallidiceps,CHAS:Bird:2337,12/30/1911,1911-12-30,1911-12-30,accepted place of collection,unverified
"North America, Canada, British Columbia, North Okanagan","Vernon, Okanagan Landing",Okanagan Landing,50.233333,-119.366667,World Geodetic System 1984,14705,m,GeoLocate,GeoLocate,Adam Glueckert,2016-09-17,Hesperiphona vespertina brooksi,CHAS:Bird:2338,02/15/1914,1914-02-15,1914-02-15,accepted place of collection,unverified
"North America, Canada, British Columbia, North Okanagan","Vernon, Okanagan Landing",Okanagan Landing,50.233333,-119.366667,World Geodetic System 1984,14705,m,GeoLocate,GeoLocate,Adam Glueckert,2016-09-17,Hesperiphona vespertina brooksi,CHAS:Bird:2339,03/28/1927,1927-03-28,1927-03-28,accepted place of collection,unverified
"North America, Canada, British Columbia, North Okanagan","Vernon, Okanagan Landing",Okanagan Landing,50.233333,-119.366667,World Geodetic System 1984,14705,m,GeoLocate,GeoLocate,Adam Glueckert,2016-09-17,Pinicola enucleator montana,CHAS:Bird:2334,12/30/1924,1925-12-30,1925-12-30,accepted place of collection,unverified
"North America, Canada, British Columbia, North Okanagan","Vernon, Okanagan Landing",Okanagan Landing,50.233333,-119.366667,World Geodetic System 1984,14705,m,GeoLocate,GeoLocate,Adam Glueckert,2016-09-17,Pinicola enucleator montana,CHAS:Bird:2335,11/07/1922,1922-11-07,1922-11-07,accepted place of collection,unverified
"North America, Canada, British Columbia, North Okanagan","Vernon, Okanagan Landing",Okanagan Landing,50.233333,-119.366667,World Geodetic System 1984,14705,m,GeoLocate,GeoLocate,Adam Glueckert,2016-09-17,Bucephala islandica,CHAS:Bird:4243,06/02/1930,1930-06-02,1930-06-02,accepted place of collection,unverified
"North America, Canada, British Columbia, North Okanagan","Vernon, Okanagan Landing","Okanagan Landing, B.C.",50.233333,-119.366667,World Geodetic System 1984,14705,m,GeoLocate,GeoLocate,Adam Glueckert,2016-09-17,Haliaeetus leucocephalus alascanus,CHAS:Bird:5845,07/22/1932,1932-07-22,1932-07-22,accepted place of collection,unverified
"North America, Canada, British Columbia, North Okanagan","Vernon, Okanagan Landing",Okanagan Landing,50.233333,-119.366667,World Geodetic System 1984,14705,m,GeoLocate,GeoLocate,Adam Glueckert,2016-09-17,Picoides arcticus,CHAS:Bird:7432,11/15/1911,1911-11-15,1911-11-15,accepted place of collection,unverified
"North America, Canada, British Columbia, North Okanagan","Vernon, Okanagan Landing",Okanagan Landing,50.233333,-119.366667,World Geodetic System 1984,14705,m,GeoLocate,GeoLocate,Adam Glueckert,2016-09-17,Melanitta perspicillata,CHAS:Bird:5688,[no date recorded],1800,2016-03-12,accepted place of collection,unverified
"North America, Canada, British Columbia, North Okanagan","Vernon, Okanagan Landing","Okanagan Landing, B.C.",50.233333,-119.366667,World Geodetic System 1984,14705,m,GeoLocate,GeoLocate,Adam Glueckert,2016-09-17,Junco hyemalis shufeldti,CHAS:Bird:7914,08/07/1920,1920-08-07,1920-08-07,accepted place of collection,unverified
"North America, Canada, British Columbia, North Okanagan","Vernon, Okanagan Landing","Okanagan Landing, B.C.",50.233333,-119.366667,World Geodetic System 1984,14705,m,GeoLocate,GeoLocate,Adam Glueckert,2016-09-17,Junco hyemalis shufeldti,CHAS:Bird:7915,08/07/1920,1920-08-07,1920-08-07,accepted place of collection,unverified
"North America, Canada, British Columbia, North Okanagan","Vernon, Okanagan Landing",Okanagan B.C.,50.233333,-119.366667,World Geodetic System 1984,14705,m,GeoLocate,GeoLocate,Adam Glueckert,2016-09-17,Sialia currucoides,CHAS:Bird:8029,07/22/1919,1919-07-22,1919-07-22,accepted place of collection,unverified
"North America, Canada, British Columbia, North Okanagan","Vernon, Okanagan Landing",Okanagan Landing,50.233333,-119.366667,World Geodetic System 1984,14705,m,GeoLocate,GeoLocate,Adam Glueckert,2016-09-17,Picoides pubescens,CHAS:Bird:7425,08/01/1919,1919-08-01,1919-08-01,accepted place of collection,unverified
"North America, Canada, British Columbia, North Okanagan","Vernon, Okanagan Landing","Okanagan Landing, B.C.",50.233333,-119.366667,World Geodetic System 1984,14705,m,GeoLocate,GeoLocate,Adam Glueckert,2016-09-17,Molothrus ater artemisiae,CHAS:Bird:8426,08/15/1919,1919-08-15,1919-08-15,accepted place of collection,unverified
"North America, Canada, British Columbia, North Okanagan","Vernon, Okanagan Landing","Okanagan Landing, B.C.",50.233333,-119.366667,World Geodetic System 1984,14705,m,GeoLocate,GeoLocate,Adam Glueckert,2016-09-17,Empidonax wrightii,CHAS:Bird:8321,08/12/1920,1920-08-12,1920-08-12,accepted place of collection,unverified
"North America, Canada, British Columbia, North Okanagan","Vernon, Okanagan Landing",Okanagan Landing,50.233333,-119.366667,World Geodetic System 1984,14705,m,GeoLocate,GeoLocate,Adam Glueckert,2016-09-17,Passerina amoena,CHAS:Bird:5351,08/28/1931,1931-08-28,1931-08-28,accepted place of collection,unverified
"North America, Canada, British Columbia, North Okanagan","Vernon, Okanagan Landing","Okanagan Landing, B.C.",50.233333,-119.366667,World Geodetic System 1984,14705,m,GeoLocate,GeoLocate,Adam Glueckert,2016-09-17,Regulus calendula grinnelli,CHAS:Bird:8379,07/31/1919,1919-07-31,1919-07-31,accepted place of collection,unverified
"North America, Canada, British Columbia, North Okanagan","Vernon, Okanagan Landing","Okanagan Landing, B.C.",50.233333,-119.366667,World Geodetic System 1984,14705,m,GeoLocate,GeoLocate,Adam Glueckert,2016-09-17,Pipilo maculatus montanus,CHAS:Bird:8260,07/04/1920,1920-07-04,1920-07-04,accepted place of collection,unverified
"North America, Canada, British Columbia, North Okanagan","Vernon, Okanagan Landing",Okanagan Landing,50.233333,-119.366667,World Geodetic System 1984,14705,m,GeoLocate,GeoLocate,Adam Glueckert,2016-09-17,Dendroica petechia,CHAS:Bird:5356,08/27/1931,1931-08-27,1931-08-27,accepted place of collection,unverified
"North America, Canada, British Columbia, North Okanagan","Vernon, Okanagan Landing",Okanagan Landing,50.233333,-119.366667,World Geodetic System 1984,14705,m,GeoLocate,GeoLocate,Adam Glueckert,2016-09-17,Dendroica coronata auduboni,CHAS:Bird:16971,07/30/1919,1919-07-30,1919-07-30,accepted place of collection,unverified
"North America, Canada, British Columbia, North Okanagan","Vernon, Okanagan Landing",Okanagan Landing,50.233333,-119.366667,World Geodetic System 1984,14705,m,GeoLocate,GeoLocate,Adam Glueckert,2016-09-17,Geothlypis trichas occidentalis,CHAS:Bird:4783,09/08/1926,1926-09-08,1926-09-08,accepted place of collection,unverified
"North America, Canada, British Columbia, North Okanagan","Vernon, Okanagan Landing",Okanagan Landing,50.233333,-119.366667,World Geodetic System 1984,14705,m,GeoLocate,GeoLocate,Adam Glueckert,2016-09-17,Geothlypis trichas,CHAS:Bird:17446,08/12/1919,1919-08-12,1919-08-12,accepted place of collection,unverified
"North America, Canada, British Columbia, North Okanagan","Vernon, Okanagan Landing",Okanagan Landing,50.233333,-119.366667,World Geodetic System 1984,14705,m,GeoLocate,GeoLocate,Adam Glueckert,2016-09-17,Euphagus cyanocephalus,CHAS:Bird:5350,09/04/1931,1931-09-04,1931-09-04,accepted place of collection,unverified
"North America, Canada, British Columbia, North Okanagan","Vernon, Okanagan Landing",Okanagan Landing,50.233333,-119.366667,World Geodetic System 1984,14705,m,GeoLocate,GeoLocate,Adam Glueckert,2016-09-17,Molothrus ater artemisiae,CHAS:Bird:5349,08/28/1931,1931-08-28,1931-08-28,accepted place of collection,unverified
"North America, Canada, British Columbia, North Okanagan","Vernon, Okanagan Landing",Okanagan Landing B.C.,50.233333,-119.366667,World Geodetic System 1984,14705,m,GeoLocate,GeoLocate,Adam Glueckert,2016-09-17,Icterus galbula,CHAS:Bird:8105,08/01/1919,1919-08-01,1919-08-01,accepted place of collection,unverified
"North America, Canada, British Columbia, North Okanagan","Vernon, Okanagan Landing",Okanagan Landing,50.233333,-119.366667,World Geodetic System 1984,14705,m,GeoLocate,GeoLocate,Adam Glueckert,2016-09-17,Sphyrapicus varius nuchalis,CHAS:Bird:5354,09/09/1931,1931-09-09,1931-09-09,accepted place of collection,unverified
"North America, Canada, British Columbia, North Okanagan","Vernon, Okanagan Landing",Okanagan Landing,50.233333,-119.366667,World Geodetic System 1984,14705,m,GeoLocate,GeoLocate,Adam Glueckert,2016-09-17,Falco sparverius sparverius,CHAS:Bird:5451,09/06/1931,1931-09-06,1931-09-06,accepted place of collection,unverified
"North America, Canada, British Columbia, North Okanagan","Vernon, Okanagan Landing",Okanagan Landing,50.233333,-119.366667,World Geodetic System 1984,14705,m,GeoLocate,GeoLocate,Adam Glueckert,2016-09-17,Tyrannus verticalis,CHAS:Bird:5345,08/28/1931,1931-08-28,1931-08-28,accepted place of collection,unverified
"North America, Canada, British Columbia, North Okanagan","Vernon, Okanagan Landing",Okanagan Landing,50.233333,-119.366667,World Geodetic System 1984,14705,m,GeoLocate,GeoLocate,Adam Glueckert,2016-09-17,Empidonax wrightii,CHAS:Bird:5353,08/17/1931,1931-08-17,1931-08-17,accepted place of collection,unverified
"North America, Canada, British Columbia, North Okanagan","Vernon, Okanagan Landing",Okanagan Landing,50.233333,-119.366667,World Geodetic System 1984,14705,m,GeoLocate,GeoLocate,Adam Glueckert,2016-09-17,Cyanocitta stelleri annectens,CHAS:Bird:5357,04/20/1931,1931-04-20,1931-04-20,accepted place of collection,unverified
"North America, Canada, British Columbia, North Okanagan","Vernon, Okanagan Landing",Okanagan Landing,50.233333,-119.366667,World Geodetic System 1984,14705,m,GeoLocate,GeoLocate,Adam Glueckert,2016-09-17,Poecile gambeli grinnelli,CHAS:Bird:4787,12/27/1929,1929-12-27,1929-12-27,accepted place of collection,unverified
"North America, Canada, British Columbia, North Okanagan","Vernon, Okanagan Landing",Okanagan Landing,50.233333,-119.366667,World Geodetic System 1984,14705,m,GeoLocate,GeoLocate,Adam Glueckert,2016-09-17,Poecile gambeli grinnelli,CHAS:Bird:4788,12/27/1929,1927-12-27,1927-12-27,accepted place of collection,unverified
"North America, Canada, British Columbia, North Okanagan","Vernon, Okanagan Landing",Okanagan Landing,50.233333,-119.366667,World Geodetic System 1984,14705,m,GeoLocate,GeoLocate,Adam Glueckert,2016-09-17,Poecile gambeli grinnelli,CHAS:Bird:4789,12/27/1929,1929-12-27,1929-12-27,accepted place of collection,unverified
"North America, Canada, British Columbia, North Okanagan","Vernon, Okanagan Landing",Okanagan Landing,50.233333,-119.366667,World Geodetic System 1984,14705,m,GeoLocate,GeoLocate,Adam Glueckert,2016-09-17,Poecile atricapilla septentrionalis,CHAS:Bird:4790,11/05/1927,1927-11-05,1927-11-05,accepted place of collection,unverified
"North America, Canada, British Columbia, North Okanagan","Vernon, Okanagan Landing",Okanagan Landing,50.233333,-119.366667,World Geodetic System 1984,14705,m,GeoLocate,GeoLocate,Adam Glueckert,2016-09-17,Poecile atricapilla septentrionalis,CHAS:Bird:4791,12/28/1929,1929-12-28,1929-12-28,accepted place of collection,unverified
"North America, Canada, British Columbia, North Okanagan","Vernon, Okanagan Landing",Okanagan Landing,50.233333,-119.366667,World Geodetic System 1984,14705,m,GeoLocate,GeoLocate,Adam Glueckert,2016-09-17,Poecile atricapilla septentrionalis,CHAS:Bird:4792,01/07/1927,1927-01-07,1927-01-07,accepted place of collection,unverified
"North America, Canada, British Columbia, North Okanagan","Vernon, Okanagan Landing",Okanagan Landing,50.233333,-119.366667,World Geodetic System 1984,14705,m,GeoLocate,GeoLocate,Adam Glueckert,2016-09-17,Poecile gambeli grinnelli,CHAS:Bird:4793,02/12/1930,1930-02-12,1930-02-12,accepted place of collection,unverified
"North America, Canada, British Columbia, North Okanagan","Vernon, Okanagan Landing",Okanagan Landing,50.233333,-119.366667,World Geodetic System 1984,14705,m,GeoLocate,GeoLocate,Adam Glueckert,2016-09-17,Poecile gambeli grinnelli,CHAS:Bird:5448,11/26/1931,1931-11-26,1931-11-26,accepted place of collection,unverified
"North America, Canada, British Columbia, North Okanagan","Vernon, Okanagan Landing",Okanagan Landing,50.233333,-119.366667,World Geodetic System 1984,14705,m,GeoLocate,GeoLocate,Adam Glueckert,2016-09-17,Poecile gambeli grinnelli,CHAS:Bird:5449,11/26/1931,1931-11-26,1931-11-26,accepted place of collection,unverified
"North America, Canada, British Columbia, North Okanagan","Vernon, Okanagan Landing",Okanagan Landing,50.233333,-119.366667,World Geodetic System 1984,14705,m,GeoLocate,GeoLocate,Adam Glueckert,2016-09-17,Sitta carolinensis aculeata,CHAS:Bird:4781,02/13/1926,1926-02-13,1926-02-13,accepted place of collection,unverified
"North America, Canada, British Columbia, North Okanagan","Vernon, Okanagan Landing",Okanagan Landing,50.233333,-119.366667,World Geodetic System 1984,14705,m,GeoLocate,GeoLocate,Adam Glueckert,2016-09-17,Troglodytes troglodytes,CHAS:Bird:5450,12/09/1931,1931-12-09,1931-12-09,accepted place of collection,unverified
"North America, Canada, British Columbia, North Okanagan","Vernon, Okanagan Landing",Okanagan Landing,50.233333,-119.366667,World Geodetic System 1984,14705,m,GeoLocate,GeoLocate,Adam Glueckert,2016-09-17,Bombycilla garrula pallidiceps,CHAS:Bird:5441,12/13/1929,1929-12-13,1929-12-13,accepted place of collection,unverified
"North America, Canada, British Columbia, North Okanagan","Vernon, Okanagan Landing",Okanagan Landing,50.233333,-119.366667,World Geodetic System 1984,14705,m,GeoLocate,GeoLocate,Adam Glueckert,2016-09-17,Bombycilla garrula pallidiceps,CHAS:Bird:5442,04/12/1928,1928-04-12,1928-04-12,accepted place of collection,unverified
"North America, Canada, British Columbia, North Okanagan","Vernon, Okanagan Landing",Okanagan Ldg. [Landing],50.233333,-119.366667,World Geodetic System 1984,14705,m,GeoLocate,GeoLocate,Adam Glueckert,2016-09-17,Regulus satrapa olivaceus,CHAS:Bird:4784,11/26/1926,1926-11-26,1926-11-26,accepted place of collection,unverified
"North America, Canada, British Columbia, North Okanagan","Vernon, Okanagan Landing",Okanagan Ldg. [Landing],50.233333,-119.366667,World Geodetic System 1984,14705,m,GeoLocate,GeoLocate,Adam Glueckert,2016-09-17,Regulus satrapa olivaceus,CHAS:Bird:4785,01/21/1926,1926-01-21,1926-01-21,accepted place of collection,unverified
"North America, Canada, British Columbia, North Okanagan","Vernon, Okanagan Landing",Okanagan Landing,50.233333,-119.366667,World Geodetic System 1984,14705,m,GeoLocate,GeoLocate,Adam Glueckert,2016-09-17,Vireo solitatius plumbeus,CHAS:Bird:4801,09/21/1929,1929-09-21,1929-09-21,accepted place of collection,unverified
"North America, Canada, British Columbia, North Okanagan","Vernon, Okanagan Landing","Okanagan Landing [near Vernon], B.C. [British Columbia]",50.233333,-119.366667,World Geodetic System 1984,14705,m,GeoLocate,GeoLocate,Adam Glueckert,2016-09-17,Vireo gilvus swainsoni,CHAS:Bird:5352,09/07/1931,1931-09-07,1931-09-07,accepted place of collection,unverified
"North America, Canada, British Columbia, North Okanagan","Vernon, Okanagan Landing",Okanagan Landing,50.233333,-119.366667,World Geodetic System 1984,14705,m,GeoLocate,GeoLocate,Adam Glueckert,2016-09-17,Carpodacus cassinii,CHAS:Bird:5445,09/10/1931,1931-09-10,1931-09-10,accepted place of collection,unverified
"North America, Canada, British Columbia, North Okanagan","Vernon, Okanagan Landing",Okanagan Landing,50.233333,-119.366667,World Geodetic System 1984,14705,m,GeoLocate,GeoLocate,Adam Glueckert,2016-09-17,Leucosticte arctoa littoralis,CHAS:Bird:2340,12/27/1915,1916-12-27,1916-12-27,accepted place of collection,unverified
"North America, Canada, British Columbia, North Okanagan","Vernon, Okanagan Landing",Okanagan Landing,50.233333,-119.366667,World Geodetic System 1984,14705,m,GeoLocate,GeoLocate,Adam Glueckert,2016-09-17,Pipilo maculatus montanus,CHAS:Bird:4786,07/21/1920,1920-07-21,1920-07-21,accepted place of collection,unverified
"North America, Canada, British Columbia, North Okanagan","Vernon, Okanagan Landing","Okanagan  Landing, B.C.",50.233333,-119.366667,World Geodetic System 1984,14705,m,GeoLocate,GeoLocate,Adam Glueckert,2016-09-17,Pipilo maculatus montanus,CHAS:Bird:7367,08/19/1919,1919-08-19,1919-08-19,accepted place of collection,unverified
"North America, Canada, British Columbia, North Okanagan","Vernon, Okanagan Landing",Okanagan Landing,50.233333,-119.366667,World Geodetic System 1984,14705,m,GeoLocate,GeoLocate,Adam Glueckert,2016-09-17,Pipilo maculatus montanus,CHAS:Bird:7368,08/08/1920,1920-08-08,1920-08-08,accepted place of collection,unverified
"North America, Canada, British Columbia, North Okanagan","Vernon, Okanagan Landing",Okanagan Landing,50.233333,-119.366667,World Geodetic System 1984,14705,m,GeoLocate,GeoLocate,Adam Glueckert,2016-09-17,Pooecetes gramineus confinis,CHAS:Bird:5444,08/18/1931,1931-08-18,1931-08-18,accepted place of collection,unverified
"North America, Canada, British Columbia, North Okanagan","Vernon, Okanagan Landing",Okanagan Landing,50.233333,-119.366667,World Geodetic System 1984,14705,m,GeoLocate,GeoLocate,Adam Glueckert,2016-09-17,Junco hyemalis shufeldti,CHAS:Bird:4802,02/01/1926,1926-02-01,1926-02-01,accepted place of collection,unverified
"North America, Canada, British Columbia, North Okanagan","Vernon, Okanagan Landing",Okanagan Landing,50.233333,-119.366667,World Geodetic System 1984,14705,m,GeoLocate,GeoLocate,Adam Glueckert,2016-09-17,Junco hyemalis shufeldti,CHAS:Bird:4803,11/20/1926,1926-11-20,1926-11-20,accepted place of collection,unverified
"North America, Canada, British Columbia, North Okanagan","Vernon, Okanagan Landing",Okanagan Landing,50.233333,-119.366667,World Geodetic System 1984,14705,m,GeoLocate,GeoLocate,Adam Glueckert,2016-09-17,Junco hyemalis shufeldti,CHAS:Bird:5446,11/25/1931,1931-11-25,1931-11-25,accepted place of collection,unverified
"North America, Canada, British Columbia, North Okanagan","Vernon, Okanagan Landing",Okanagan Landing,50.233333,-119.366667,World Geodetic System 1984,14705,m,GeoLocate,GeoLocate,Adam Glueckert,2016-09-17,Junco hyemalis shufeldti,CHAS:Bird:5447,12/11/1931,1931-12-11,1931-12-11,accepted place of collection,unverified
"North America, Canada, British Columbia, North Okanagan","Vernon, Okanagan Landing",Okanagan Landing,50.233333,-119.366667,World Geodetic System 1984,14705,m,GeoLocate,GeoLocate,Adam Glueckert,2016-09-17,Zonotrichia leucophrys gambelii,CHAS:Bird:5346,09/03/1931,1931-09-03,1931-09-03,accepted place of collection,unverified
"North America, Canada, British Columbia, North Okanagan","Vernon, Okanagan Landing",Okanagan Landing,50.233333,-119.366667,World Geodetic System 1984,14705,m,GeoLocate,GeoLocate,Adam Glueckert,2016-09-17,Zonotrichia leucophrys gambelii,CHAS:Bird:5347,09/21/1931,1931-09-21,1931-09-21,accepted place of collection,unverified
"North America, Canada, British Columbia, North Okanagan","Vernon, Okanagan Landing",Okanagan Landing,50.233333,-119.366667,World Geodetic System 1984,14705,m,GeoLocate,GeoLocate,Adam Glueckert,2016-09-17,Zonotrichia leucophrys gambelii,CHAS:Bird:5348,09/10/1931,1931-09-10,1931-09-10,accepted place of collection,unverified
"North America, Canada, British Columbia, North Okanagan","Vernon, Okanagan Landing",Okanagan Landing,50.233333,-119.366667,World Geodetic System 1984,14705,m,GeoLocate,GeoLocate,Adam Glueckert,2016-09-17,Melospiza lincolnii lincolnii,CHAS:Bird:5443,09/07/1931,1931-09-07,1931-09-07,accepted place of collection,unverified
"North America, Canada, British Columbia, North Okanagan","Vernon, Okanagan Landing",Okanagan Landing,50.233333,-119.366667,World Geodetic System 1984,14705,m,GeoLocate,GeoLocate,Adam Glueckert,2016-09-17,Melospiza melodia morphna,CHAS:Bird:4794,12/13/1930,1930-12-13,1930-12-13,accepted place of collection,unverified
"North America, Canada, British Columbia, North Okanagan","Vernon, Okanagan Lodge",Okanagan Lodge,50.233333,-119.366667,World Geodetic System 1984,14705,m,GeoLocate,GeoLocate,Adam Glueckert,2016-09-17,Molothrus ater artemisiae,CHAS:Bird:4779,05/29/1926,1926-05-29,1926-05-29,accepted place of collection,unverified
"North America, Canada, British Columbia, North Okanagan","Vernon, Okanagan Lodge",Okanagan Lodge,50.233333,-119.366667,World Geodetic System 1984,14705,m,GeoLocate,GeoLocate,Adam Glueckert,2016-09-17,Pipilo maculatus curtatus,CHAS:Bird:4780,06/13/1926,1926-06-13,1926-06-13,accepted place of collection,unverified
"North America, Canada, British Columbia",Osoyoos,,49.033333,-119.466667,World Geodetic System 1984,3880,m,GeoLocate,GeoLocate,Adam Glueckert,2016-09-30,Athene cunicularia hypugaea,CHAS:Bird:2356,04/25/1922,1922-04-25,1922-04-25,accepted place of collection,unverified
"North America, Canada, British Columbia",Penticton,,49.5,-119.583333,World Geodetic System 1984,9037,m,GeoLocate,GeoLocate,Adam Glueckert,2016-09-30,Bubo virginianus lagophorus,CHAS:Bird:4866,10/28/1930,1930-10-28,1930-10-28,accepted place of collection,unverified
"North America, Canada, British Columbia, Vancouver Island",Comox,"Comax, Vancouver B.C.",49.683333,-124.933333,World Geodetic System 1984,5943,m,GeoLocate,GeoLocate,Adam Glueckert,2016-10-19,Corvus caurinus,CHAS:Bird:5923,12/27/1932,1932-12-27,1932-12-27,accepted place of collection,unverified
"North America, Canada, British Columbia, Vancouver Island",Comox,"Comax, Vancouver B.C.",49.683333,-124.933333,World Geodetic System 1984,5943,m,GeoLocate,GeoLocate,Adam Glueckert,2016-10-19,Corvus caurinus,CHAS:Bird:5922,12/27/1932,1932-12-27,1932-12-27,accepted place of collection,unverified
"North America, Canada, British Columbia, Vancouver Island",Comox,"Comax B.C. Vancouver , ?en B.C.",49.683333,-124.933333,World Geodetic System 1984,5943,m,GeoLocate,GeoLocate,Adam Glueckert,2016-10-19,Corvus corax principalis,CHAS:Bird:5942,12/12/1932,1932-12-12,1932-12-12,accepted place of collection,unverified
"North America, Canada, British Columbia, Vancouver Island",Comox,"Comax, B.C.",49.683333,-124.933333,World Geodetic System 1984,5943,m,GeoLocate,GeoLocate,Adam Glueckert,2016-10-19,Melanitta nigra americana,CHAS:Bird:6777,02/03/1931,1931-02-03,1931-02-03,accepted place of collection,unverified
"North America, Canada, British Columbia, Vancouver Island",Comox,Cormax - B.C.,49.683333,-124.933333,World Geodetic System 1984,5943,m,GeoLocate,GeoLocate,Adam Glueckert,2016-10-19,Bucephala albeola,CHAS:Bird:5930,01/27/1933,1933-01-27,1933-01-27,accepted place of collection,unverified
"North America, Canada, Manitoba",Churchill,"Churchill, Manitoba",58.766667,-94.166667,World Geodetic System 1984,10127,m,GeoLocate,GeoLocate,Adam Glueckert,2016-10-19,Calidris minutilla,CHAS:Bird:9231,06/11/1932,1932-06-11,1932-06-11,accepted place of collection,unverified
"North America, Canada, Manitoba",Churchill,"Churchill, Manitoba, Canada",58.766667,-94.166667,World Geodetic System 1984,10127,m,GeoLocate,GeoLocate,Adam Glueckert,2016-10-19,Calidris himantopus,CHAS:Bird:9116,06/23/1937,1937-06-23,1937-06-23,accepted place of collection,unverified
"North America, Canada, Manitoba",Churchill,"Churchill, Manitoba, Canada",58.766667,-94.166667,World Geodetic System 1984,10127,m,GeoLocate,GeoLocate,Adam Glueckert,2016-10-19,Phalaropus lobatus,CHAS:Bird:9117,07/16/1937,1937-07-16,1937-07-16,accepted place of collection,unverified
"North America, Canada, New Brunswick, Charlotte County",Grand Menan,Grand Menan,44.694821,-66.809035,World Geodetic System 1984,301,m,GeoLocate,GeoLocate,Adam Glueckert,2016-12-07,Oceanodroma leucorhoa,CHAS:Bird:19153,06/12/1872,1872-06-12,1872-06-12,accepted place of collection,unverified
"North America, Canada, New Brunswick, Charlotte County",Grand Menan,Grand Menan,44.694821,-66.809035,World Geodetic System 1984,301,m,GeoLocate,GeoLocate,Adam Glueckert,2016-12-07,Oceanodroma leucorhoa,CHAS:Bird:19155,07/16/1872,1872-07-16,1872-07-16,accepted place of collection,unverified
"North America, Canada, New Brunswick, Charlotte County",Grand Menan,Grand Menan,44.694821,-66.809035,World Geodetic System 1984,301,m,GeoLocate,GeoLocate,Adam Glueckert,2016-12-07,Oceanodroma leucorhoa,CHAS:Bird:19154,07/16/1872,1872-07-16,1872-07-16,accepted place of collection,unverified
"North America, Canada, New Brunswick, Charlotte County",Grand Menan,Grand Menan,44.694821,-66.809035,World Geodetic System 1984,301,m,GeoLocate,GeoLocate,Adam Glueckert,2016-12-07,Junco hyemalis,CHAS:Bird:18390,07/18/1872,1872-07-18,1872-07-18,accepted place of collection,unverified
"North America, Canada, New Brunswick, Charlotte County",Grand Menan,Grand Menan,44.694821,-66.809035,World Geodetic System 1984,301,m,GeoLocate,GeoLocate,Adam Glueckert,2016-12-07,Dendroica striata,CHAS:Bird:17253,08/02/1872,1872-08-02,1872-08-02,accepted place of collection,unverified
"North America, Canada, New Brunswick, Charlotte County",Grand Menan,Grand Menan,44.694821,-66.809035,World Geodetic System 1984,301,m,GeoLocate,GeoLocate,Adam Glueckert,2016-12-07,Dendroica striata,CHAS:Bird:17267,08/01/1872,1872-08-01,1872-08-01,accepted place of collection,unverified
"North America, Canada, Newfoundland and Labrador",Battle Harbor,"Battle Harbor, Labrador",52.266667,-55.583333,World Geodetic System 1984,3427,m,GeoLocate,GeoLocate,Adam Glueckert,2016-12-07,Fulmarus glacialis glacialis,CHAS:Bird:7892,7/30/1932 or 7/25/1932,1932-07-25,1932-07-30,accepted place of collection,unverified
"North America, Canada, Newfoundland and Labrador",Battle Harbor,"Battle Harbor, Labrador",52.266667,-55.583333,World Geodetic System 1984,3427,m,GeoLocate,GeoLocate,Adam Glueckert,2016-12-07,Fulmarus glacialis glacialis,CHAS:Bird:7893,07/30/1932,1932-07-30,1932-07-30,accepted place of collection,unverified
"North America, Canada, Newfoundland and Labrador",Red Bay,"Red Bay, Labrador",44.80269,-81.28406,World Geodetic System 1984,960,m,GeoLocate,GeoLocate,Adam Glueckert,2016-12-07,Somateria mollissima dresseri,CHAS:Bird:6889,05/11/1927,1927-05-11,1927-05-11,accepted place of collection,unverified
"North America, Canada, Newfoundland and Labrador",Red Bay,"Red Bay, Labrador",44.80269,-81.28406,World Geodetic System 1984,960,m,GeoLocate,GeoLocate,Adam Glueckert,2016-12-07,Perisoreus canadensis nigricapillus,CHAS:Bird:2728,05/20/1927,1927-05-20,1927-05-20,accepted place of collection,unverified
"North America, Canada, Nova Scotia, Digby County",Long Island,"Long Island, Kings Co., N.S.",44.329404,-66.269414,World Geodetic System 1984,10524,m,GeoLocate,GeoLocate,Adam Glueckert,2016-12-07,Arenaria interpres,CHAS:Bird:18903,August 1899,1899-08-01,1899-08-30,accepted place of collection,unverified
"North America, Canada, Nova Scotia, Digby County",Long Island,"Long Island, Kings Co., N.S.",44.329404,-66.269414,World Geodetic System 1984,10524,m,GeoLocate,GeoLocate,Adam Glueckert,2016-12-07,Tringa melanoleuca,CHAS:Bird:18902,October 1902,1902-10-01,1902-10-30,accepted place of collection,unverified
"North America, Canada, Nova Scotia, Digby County",Long Island,"Long Island, Kings Co., N.S.",44.329404,-66.269414,World Geodetic System 1984,10524,m,GeoLocate,GeoLocate,Adam Glueckert,2016-12-07,Limosa haemastica,CHAS:Bird:18910,10/19/1899,1899-10-19,1899-10-19,accepted place of collection,unverified
"North America, Canada, Ontario",Ottawa,Ottawa Ontario,45.416667,-75.7,World Geodetic System 1984,52150,m,GeoLocate,GeoLocate,Adam Glueckert,2016-09-30,Pinicola enucleator,CHAS:Bird:1969.14.12,"""Nov. 17, 1906""",1906-11-17,1906-11-17,accepted place of collection,unverified
"North America, Canada, Ontario",Ottawa,,45.416667,-75.7,World Geodetic System 1984,52150,m,GeoLocate,GeoLocate,Adam Glueckert,2016-09-30,Perisoreus canadensis,CHAS:Bird:19048,10/15/1904,1904-10-15,1904-10-15,accepted place of collection,unverified
"North America, Canada, Ontario",Ottawa,"Ottawa, Ontario",45.416667,-75.7,World Geodetic System 1984,52150,m,GeoLocate,GeoLocate,Adam Glueckert,2016-09-30,Megaceryle alcyon,CHAS:Bird:1969.14.13,"""Oct. 7, 1907""",1907-10-07,1907-10-07,accepted place of collection,unverified
"North America, Canada, Ontario",Ottawa,"Ottawa, Ontario",45.416667,-75.7,World Geodetic System 1984,52150,m,GeoLocate,GeoLocate,Adam Glueckert,2016-09-30,Carduelis flammea,CHAS:Bird:1969.14.14,"""November 8, 1904""",1904-11-08,1904-11-08,accepted place of collection,unverified
"North America, Canada, Ontario",Ottawa,Ottawa Ontario,45.416667,-75.7,World Geodetic System 1984,52150,m,GeoLocate,GeoLocate,Adam Glueckert,2016-09-30,Loxia leucoptera,CHAS:Bird:1969.14.15,"""November 27, 1908""",1908-11-18,1908-11-18,accepted place of collection,unverified
"North America, Canada, Ontario",Ottawa,Ottawa Canada,45.416667,-75.7,World Geodetic System 1984,52150,m,GeoLocate,GeoLocate,Adam Glueckert,2016-09-30,Dendroica magnolia,CHAS:Bird:19128,"""May 27, 1907""",1907-05-27,1907-05-27,accepted place of collection,unverified
"North America, Canada, Ontario",Ottawa,"Ottawa, Ontario",45.416667,-75.7,World Geodetic System 1984,52150,m,GeoLocate,GeoLocate,Adam Glueckert,2016-09-30,Bombycilla garrula,CHAS:Bird:1969.14.16,"""March 2, 1909""",1909-03-02,1909-03-02,accepted place of collection,unverified
"North America, Canada, Ontario",Ottawa,"Ottawa, Ontario",45.416667,-75.7,World Geodetic System 1984,52150,m,GeoLocate,GeoLocate,Adam Glueckert,2016-09-30,Loxia leucoptera,CHAS:Bird:1969.14.19,"""January 15, 1922""",1922-01-15,1922-01-15,accepted place of collection,unverified
"North America, Canada, Ontario",Ottawa,"Ottawa, Ontario",45.416667,-75.7,World Geodetic System 1984,52150,m,GeoLocate,GeoLocate,Adam Glueckert,2016-09-30,Piranga rubra,CHAS:Bird:1969.14.20,"""May 30, 1906""",1906-05-30,1906-05-30,accepted place of collection,unverified
"North America, Canada, Ontario",Ottawa,,45.416667,-75.7,World Geodetic System 1984,52150,m,GeoLocate,GeoLocate,Adam Glueckert,2016-09-30,Anthus rubescens,CHAS:Bird:19143,10/07/1904,1904-10-07,1904-10-07,accepted place of collection,unverified
"North America, Canada, Ontario",Ottawa,"Ottawa, Ontario",45.416667,-75.7,World Geodetic System 1984,52150,m,GeoLocate,GeoLocate,Adam Glueckert,2016-09-30,Troglodytes aedon,CHAS:Bird:19126,"""May 2, 1906""",1906-05-02,1906-05-02,accepted place of collection,unverified
"North America, Canada, Ontario",Ottawa,"Ottawa, Ontario",45.416667,-75.7,World Geodetic System 1984,52150,m,GeoLocate,GeoLocate,Adam Glueckert,2016-09-30,Catharus ustulatus,CHAS:Bird:19144,"""May 31, 1906""",1906-05-31,1906-05-31,accepted place of collection,unverified
"North America, Canada, Ontario",Ottawa,"Ottawa, Ontario",45.416667,-75.7,World Geodetic System 1984,52150,m,GeoLocate,GeoLocate,Adam Glueckert,2016-09-30,Contopus cooperi,CHAS:Bird:1969.14.21,"""May 19, 1909""",1909-05-19,1909-05-19,accepted place of collection,unverified
"North America, Canada, Ontario",Ottawa,"Ottawa, Ontario",45.416667,-75.7,World Geodetic System 1984,52150,m,GeoLocate,GeoLocate,Adam Glueckert,2016-09-30,Porzana carolina,CHAS:Bird:1969.14.22,"May 8, 1906",1906-05-08,1906-05-08,accepted place of collection,unverified
"North America, Canada, Ontario",Ottawa,"Ottawa, Ontario",45.416667,-75.7,World Geodetic System 1984,52150,m,GeoLocate,GeoLocate,Adam Glueckert,2016-09-30,Ectopistes migratorius,CHAS:Bird:18975,[prior to 1914],1879-09-23,1914-01-01,accepted place of collection,unverified
"North America, Canada, Ontario",Ottawa,"Ottawa, Ontario",45.416667,-75.7,World Geodetic System 1984,52150,m,GeoLocate,GeoLocate,Adam Glueckert,2016-09-30,Ectopistes migratorius,CHAS:Bird:18976,[prior to 1914],1879-09-23,1914-01-01,accepted place of collection,unverified
"North America, Canada, Ontario",Ottawa,"Ottawa, Ontario",45.416667,-75.7,World Geodetic System 1984,52150,m,GeoLocate,GeoLocate,Adam Glueckert,2016-09-30,Anas crecca,CHAS:Bird:18847,"October 22, 1907",1907-10-22,1907-10-22,accepted place of collection,unverified
"North America, Canada, Ontario",Ottawa,"Ottawa, Ontario",45.416667,-75.7,World Geodetic System 1984,52150,m,GeoLocate,GeoLocate,Adam Glueckert,2016-09-30,Uria lomvia,CHAS:Bird:18823,12/20/1909,1909-12-20,1909-12-20,accepted place of collection,unverified
"North America, Canada, Ontario",Ottawa,"Ottawa, Ontario",45.416667,-75.7,World Geodetic System 1984,52150,m,GeoLocate,GeoLocate,Adam Glueckert,2016-09-30,Mergus serrator,CHAS:Bird:1969.14.24,"Nov. 6, 1908",1908-11-06,1908-11-06,accepted place of collection,unverified
"North America, Canada, Ontario",Ottawa,"Ottawa, Ontario",45.416667,-75.7,World Geodetic System 1984,52150,m,GeoLocate,GeoLocate,Adam Glueckert,2016-09-30,Lophodytes cucullatus,CHAS:Bird:1969.14.25,"April 19, 1907",1907-04-19,1907-04-19,accepted place of collection,unverified
"North America, Canada, Ontario",Ottawa,"Ottawa, Ontario",45.416667,-75.7,World Geodetic System 1984,52150,m,GeoLocate,GeoLocate,Adam Glueckert,2016-09-30,Mergus serrator,CHAS:Bird:1969.14.28,"April 10, 1916",1916-04-10,1916-04-10,accepted place of collection,unverified
"North America, Canada, Ontario",Ottawa,"Ottawa, Ontario",45.416667,-75.7,World Geodetic System 1984,52150,m,GeoLocate,GeoLocate,Adam Glueckert,2016-09-30,Asio otus,CHAS:Bird:18985,10/23/1905,1905-10-23,1905-10-23,accepted place of collection,unverified
"North America, Canada, Ontario",Ottawa,"Ottawa, Ontario",45.416667,-75.7,World Geodetic System 1984,52150,m,GeoLocate,GeoLocate,Adam Glueckert,2016-09-30,Surnia ulula caparoch,CHAS:Bird:1969.14.29,"November, 1906",1906-11-01,1906-11-30,accepted place of collection,unverified
"North America, Canada, Ontario",Ottawa,"Ottawa, Ontario",45.416667,-75.7,World Geodetic System 1984,52150,m,GeoLocate,GeoLocate,Adam Glueckert,2016-09-30,Aegolius funereus richardsoni,CHAS:Bird:1969.14.30,"February, 1907",1907-02-01,1907-02-28,accepted place of collection,unverified
"North America, Canada, Ontario",Ottawa,"Ottawa, Ontario",45.416667,-75.7,World Geodetic System 1984,52150,m,GeoLocate,GeoLocate,Adam Glueckert,2016-09-30,Canachites canadensis,CHAS:Bird:1969.14.31,[no date recorded],1879-09-23,1949-12-31,accepted place of collection,unverified
"North America, Canada, Ontario",Ottawa,"Ottawa, Ontario",45.416667,-75.7,World Geodetic System 1984,52150,m,GeoLocate,GeoLocate,Adam Glueckert,2016-09-30,Bonasa umbellus togata,CHAS:Bird:1969.14.33,"Oct. 22, 1904",1904-10-22,1904-10-22,accepted place of collection,unverified
"North America, Canada, Ontario",Ottawa,"Ottawa, Ontario",45.416667,-75.7,World Geodetic System 1984,52150,m,GeoLocate,GeoLocate,Adam Glueckert,2016-09-30,Larus argentatus,CHAS:Bird:1969.14.34,"April 2, 1909",1909-04-02,1909-04-02,accepted place of collection,unverified
"North America, Canada, Ontario",Ottawa,"Ottawa, Ontario",45.416667,-75.7,World Geodetic System 1984,52150,m,GeoLocate,GeoLocate,Adam Glueckert,2016-09-30,Aegolius acadicus,CHAS:Bird:1969.14.35,"April 11, 1907",1907-04-11,1907-04-11,accepted place of collection,unverified
"North America, Canada, Ontario",Ottawa,"Ottawa, Ontario",45.416667,-75.7,World Geodetic System 1984,52150,m,GeoLocate,GeoLocate,Adam Glueckert,2016-09-30,Strix nebulosa,CHAS:Bird:1969.14.36,"Feb. 1, 1906",1906-02-01,1906-02-01,accepted place of collection,unverified
"North America, Canada, Ontario",Ottawa,"Ottawa, Ontario",45.416667,-75.7,World Geodetic System 1984,52150,m,GeoLocate,GeoLocate,Adam Glueckert,2016-09-30,Buteo platypterus,CHAS:Bird:18992,"Sept. 11, 1908",1908-09-11,1908-09-11,accepted place of collection,unverified
"North America, Canada, Ontario",Ottawa,"Ottawa, Ontario",45.416667,-75.7,World Geodetic System 1984,52150,m,GeoLocate,GeoLocate,Adam Glueckert,2016-09-30,Buteo lineatus juvenis,CHAS:Bird:1969.14.37,"April 20, 1924",1924-04-20,1924-04-20,accepted place of collection,unverified
"North America, Canada, Ontario",Ottawa,"Ottawa, Ontario",45.416667,-75.7,World Geodetic System 1984,52150,m,GeoLocate,GeoLocate,Adam Glueckert,2016-09-30,Pandion haliaetus carolinensis,CHAS:Bird:1969.14.38,"May 24, 1924",1924-05-24,1924-05-24,accepted place of collection,unverified
"North America, Canada, Ontario",Ottawa,"Ottawa, Ontario",45.416667,-75.7,World Geodetic System 1984,52150,m,GeoLocate,GeoLocate,Adam Glueckert,2016-09-30,Accipiter striatus,CHAS:Bird:1969.14.40,"Jan. 11, 1904",1904-01-11,1904-01-11,accepted place of collection,unverified
"North America, Canada, Ontario",Ottawa,"Ottawa, Ontario",45.416667,-75.7,World Geodetic System 1984,52150,m,GeoLocate,GeoLocate,Adam Glueckert,2016-09-30,Accipiter gentilis,CHAS:Bird:1969.14.41,"Nov. 3, 1906",1906-11-03,1906-11-03,accepted place of collection,unverified
"North America, Canada, Ontario",Ottawa,"Ottawa, Ontario",45.416667,-75.7,World Geodetic System 1984,52150,m,GeoLocate,GeoLocate,Adam Glueckert,2016-09-30,Parula americana,CHAS:Bird:1969.14.42,"""May 25, 1906""",1906-05-25,1906-05-25,accepted place of collection,unverified
"North America, Canada, Ontario",Ottawa,"Ottowa, Cananda",45.416667,-75.7,World Geodetic System 1984,52150,m,GeoLocate,GeoLocate,Adam Glueckert,2016-09-30,Hesperiphona vespertina,CHAS:Bird:1969.14.43,"""February 3 1909""",1909-02-03,1909-02-03,accepted place of collection,unverified
"North America, Canada, Ontario",Ottawa,,45.416667,-75.7,World Geodetic System 1984,52150,m,GeoLocate,GeoLocate,Adam Glueckert,2016-09-30,Dendroica fusca,CHAS:Bird:19342,05/24/1909,1909-05-24,1909-05-24,accepted place of collection,unverified
"North America, Canada, Ontario",Ottawa,,45.416667,-75.7,World Geodetic System 1984,52150,m,GeoLocate,GeoLocate,Adam Glueckert,2016-09-30,Pinicola enucleator,CHAS:Bird:18055,02/27/1909,1909-02-27,1909-02-27,accepted place of collection,unverified
"North America, Canada, Ontario",Ottawa,,45.416667,-75.7,World Geodetic System 1984,52150,m,GeoLocate,GeoLocate,Adam Glueckert,2016-09-30,Pinicola enucleator,CHAS:Bird:18056,01/29/1907,1907-01-29,1907-01-29,accepted place of collection,unverified
"North America, Canada, Ontario",Ottawa,,45.416667,-75.7,World Geodetic System 1984,52150,m,GeoLocate,GeoLocate,Adam Glueckert,2016-09-30,Dendroica fusca,CHAS:Bird:17177,05/24/1909,1909-05-24,1909-05-24,accepted place of collection,unverified
"North America, Canada, Ontario",Pembroke,"Pembroke, Ontario",45.816667,-77.116667,World Geodetic System 1984,3880,m,GeoLocate,GeoLocate,Adam Glueckert,2016-12-07,Anas boschas,CHAS:Bird:1969.14.10,"Sept. 28, 1907",1907-09-28,1907-09-28,accepted place of collection,unverified
"North America, Canada, Ontario",Pembroke,"Pembroke, Ontario",45.816667,-77.116667,World Geodetic System 1984,3880,m,GeoLocate,GeoLocate,Adam Glueckert,2016-12-07,Accipiter gentilis,CHAS:Bird:1969.14.11,"Oct. 24, 1907",1907-10-24,1907-10-24,accepted place of collection,unverified
"North America, Canada, Ontario","Sioux Narrows, 30 mi NE Nester Falls",30 mi NE Nester Falls,49.368513,-93.39174,World Geodetic System 1984,10900,m,GeoLocate,GeoLocate,Adam Glueckert,2016-12-07,Perisoreus canadensis,CHAS:Bird:9983,10/09/1972,1972-10-09,1972-10-09,accepted place of collection,unverified
"North America, Canada, Ontario","Sioux Narrows, 30 mi NE Nester Falls",30 mi NE Nester Falls,49.368513,-93.39174,World Geodetic System 1984,10900,m,GeoLocate,GeoLocate,Adam Glueckert,2016-12-07,Perisoreus canadensis,CHAS:Bird:9986,10/09/1972,1972-10-09,1972-10-09,accepted place of collection,unverified
"North America, Canada, Ontario",Toronto,"Toronto, Ontario",43.666667,-79.416667,World Geodetic System 1984,28875,m,GeoLocate,GeoLocate,Adam Glueckert,2016-10-19,Numenius hudsonicus,CHAS:Bird:1969.14.23,"May, 1890",1890-05-01,1890-05-30,accepted place of collection,unverified
"North America, Canada, Ontario",Toronto,"Toronto, Ontario",43.666667,-79.416667,World Geodetic System 1984,28875,m,GeoLocate,GeoLocate,Adam Glueckert,2016-10-19,Podiceps auritus,CHAS:Bird:18835,[no date recorded],1879-09-23,1949-12-31,accepted place of collection,unverified
"North America, Canada, Ontario",Toronto,"Toronto, Ontario",43.666667,-79.416667,World Geodetic System 1984,28875,m,GeoLocate,GeoLocate,Adam Glueckert,2016-10-19,Clangula hyemalis,CHAS:Bird:1969.14.32,"Nov. 28, 1906",1906-11-28,1906-11-28,accepted place of collection,unverified
"North America, Canada, Ontario",Toronto,"Toronto, Ontario",43.666667,-79.416667,World Geodetic System 1984,28875,m,GeoLocate,GeoLocate,Adam Glueckert,2016-10-19,Falco columbarius,CHAS:Bird:1969.14.39,[no date recorded],1879-09-23,1949-12-31,accepted place of collection,unverified
"North America, Canada, Ontario",Toronto,,43.666667,-79.416667,World Geodetic System 1984,28875,m,GeoLocate,GeoLocate,Adam Glueckert,2016-10-19,Numenius phaeopus,CHAS:Bird:18916,May 1890,1890-05-01,1890-05-30,accepted place of collection,unverified
"North America, Canada, Quebec, Urban agglomeration of Montreal",Montreal,,45.5,-73.583333,World Geodetic System 1984,20582,m,GeoLocate,GeoLocate,Adam Glueckert,2016-10-19,Bombycilla cedrorum,CHAS:Bird:1965.25.1,[no date recorded],1800,2016-03-12,accepted place of collection,unverified
"North America, Canada, Quebec, Urban agglomeration of Montreal",Montreal,"Montreal, Canada",45.5,-73.583333,World Geodetic System 1984,20582,m,GeoLocate,GeoLocate,Adam Glueckert,2016-10-19,Pluvialis dominica,CHAS:Bird:15316,1870,1870-01-01,1870-12-31,accepted place of collection,unverified
"North America, Canada, Quebec, Urban agglomeration of Montreal",Montreal,,45.5,-73.583333,World Geodetic System 1984,20582,m,GeoLocate,GeoLocate,Adam Glueckert,2016-10-19,Bombycilla garrulus,CHAS:Bird:16420,02/01/1874,1874-02-01,1874-02-01,accepted place of collection,unverified
"North America, Canada, Quebec, Urban agglomeration of Montreal",Montreal,,45.5,-73.583333,World Geodetic System 1984,20582,m,GeoLocate,GeoLocate,Adam Glueckert,2016-10-19,Bombycilla garrulus,CHAS:Bird:16423,02/01/1874,1874-02-01,1874-02-01,accepted place of collection,unverified
"North America, Canada",Red River of the North,Red River basin of the North,50.3803,-96.804807,World Geodetic System 1984,8339,m,GeoLocate,GeoLocate,Adam Glueckert,2016-12-07,Tympanuchus phasianellus phasianellus,CHAS:Bird:3768.2,Sept. 1857,1857-09-01,1857-09-30,accepted place of collection,unverified
"North America, Canada",Red River of the North,Red River of the North,50.3803,-96.804807,World Geodetic System 1984,8339,m,GeoLocate,GeoLocate,Adam Glueckert,2016-12-07,Chordeiles minor,CHAS:Bird:3107,September 1859,1859-09-01,1859-09-30,accepted place of collection,unverified
"North America, Canada",Red River of the North,Red River of North,50.3803,-96.804807,World Geodetic System 1984,8339,m,GeoLocate,GeoLocate,Adam Glueckert,2016-12-07,Megascops asio naevius,CHAS:Bird:4272,1857,1857-01-01,1857-12-31,accepted place of collection,unverified
"North America, Canada",Red River of the North,Red River of the North,50.3803,-96.804807,World Geodetic System 1984,8339,m,GeoLocate,GeoLocate,Adam Glueckert,2016-12-07,Tympanuchus phasianellus phasianellus,CHAS:Bird:3768.1,September 1857,1857-09-01,1857-09-30,accepted place of collection,unverified
"North America, Canada",Red River of the North,Red River of the North,50.3803,-96.804807,World Geodetic System 1984,8339,m,GeoLocate,GeoLocate,Adam Glueckert,2016-12-07,Tympanuchus phasianellus,CHAS:Bird:9278,09/01/1857,1857-09-01,1857-09-30,accepted place of collection,unverified
"North America, Canada",Red River of the North,Red River of North,50.3803,-96.804807,World Geodetic System 1984,8339,m,GeoLocate,GeoLocate,Adam Glueckert,2016-12-07,Dendroica palmarum palmarum,CHAS:Bird:3519,September 1860s or Sept. 1857,1857-09-01,1857-09-30,accepted place of collection,unverified
"North America, Canada",Red River of the North,Red River of North,50.3803,-96.804807,World Geodetic System 1984,8339,m,GeoLocate,GeoLocate,Adam Glueckert,2016-12-07,Surnia ulula caparoch,CHAS:Bird:3752,about 1857,1857-01-01,1857-12-31,accepted place of collection,unverified
"North America, Canada",Red River of the North,R. R. of the N.,50.3803,-96.804807,World Geodetic System 1984,8339,m,GeoLocate,GeoLocate,Adam Glueckert,2016-12-07,Passerculus sandwichensis savanna,CHAS:Bird:3430,late Summer or Fall 1859,1859-06-01,1859-11-30,accepted place of collection,unverified
"North America, Canada",Red River of the North,Red River of the North,50.3803,-96.804807,World Geodetic System 1984,8339,m,GeoLocate,GeoLocate,Adam Glueckert,2016-12-07,Calcarius lapponicus,CHAS:Bird:3424,Fall 1859,1859-09-01,1859-11-30,accepted place of collection,unverified
North America,Lake Ontario,Lake Ontario,43.68576,-77.845886,World Geodetic System 1984,41381,m,GeoLocate,GeoLocate,Adam Glueckert,2016-11-16,Calidris alpina pacifica,CHAS:Bird:15382,05/01/1870,1870-05-01,1870-05-30,accepted place of collection,unverified
"North America, Mexico, Baja California, Isla de Guadalupe","Guadalupe Island, alt 3500 ft","Guadalupe Island, alt 3500 ft, L. Calif, Mex.",29.045214,-118.277544,World Geodetic System 1984,18755,m,GeoLocate,GeoLocate,Adam Glueckert,2016-09-21,Regulus calendula calendula,CHAS:Bird:8382,05/11/1906,1906-05-11,1906-05-11,accepted place of collection,unverified
"North America, Mexico, Baja California Sur",El Triunfo,lower CA (Triumfo),20.238634,-101.99153,World Geodetic System 1984,499,m,GeoLocate,GeoLocate,Adam Glueckert,2016-11-16,Melozone crissalis abigula,CHAS:Bird:7359,04/15/1887,1887-04-15,1887-04-15,accepted place of collection,unverified
"North America, Mexico, Baja California Sur",El Triunfo,"Triumfo, lower CA",20.238634,-101.99153,World Geodetic System 1984,499,m,GeoLocate,GeoLocate,Adam Glueckert,2016-11-16,Carpodacus mexicanus ruberrimus,CHAS:Bird:7965,03/23/1887,1887-03-23,1887-03-23,accepted place of collection,unverified
"North America, Mexico, Baja California Sur",El Triunfo,"lower CA, Triumfo",20.238634,-101.99153,World Geodetic System 1984,499,m,GeoLocate,GeoLocate,Adam Glueckert,2016-11-16,Passerina versicolor pulchra,CHAS:Bird:8240,04/13/1887,1887-04-13,1887-04-13,accepted place of collection,unverified
"North America, Mexico, Baja California Sur",San Jose del Cabo,"Mexico, Lower California San Jose del Cabo",23.058278,-109.70102,World Geodetic System 1984,3636,m,GeoLocate,GeoLocate,Adam Glueckert,2016-11-16,Fulica americana americana,CHAS:Bird:190,January 1860,1860-01-01,1860-01-30,accepted place of collection,unverified
"North America, Mexico, Baja California Sur",San Jose del Cabo,Mexico: Lower California San Jose,23.058278,-109.70102,World Geodetic System 1984,3636,m,GeoLocate,GeoLocate,Adam Glueckert,2016-11-16,Fulica americana americana,CHAS:Bird:1776,January 1860,1860-01-01,1860-01-30,accepted place of collection,unverified
"North America, Mexico, Baja California Sur",San Jose del Cabo,,23.058278,-109.70102,World Geodetic System 1984,3636,m,GeoLocate,GeoLocate,Adam Glueckert,2016-11-16,Geothlypis trichas,CHAS:Bird:17491,09/07/1887,1887-09-07,1887-09-07,accepted place of collection,unverified
"North America, Mexico, Baja California Sur",San Jose del Cabo,San Jose del Cabo,23.058278,-109.70102,World Geodetic System 1984,3636,m,GeoLocate,GeoLocate,Adam Glueckert,2016-11-16,Geothlypis beldingi,CHAS:Bird:19340,09/22/1887,1887-09-22,1887-09-22,accepted place of collection,unverified
"North America, Mexico, Baja California Sur",San Jose del Cabo,,23.058278,-109.70102,World Geodetic System 1984,3636,m,GeoLocate,GeoLocate,Adam Glueckert,2016-11-16,Geothlypis trichas,CHAS:Bird:17450,09/22/1887,1887-09-01,1887-09-30,accepted place of collection,unverified
"North America, Mexico, Baja California Sur",Sierra de la Laguna,"Sierra Laguna, L.C. [Baja California Sur, Mexico]",23.485324,-109.96973,World Geodetic System 1984,2627,m,GeoLocate,GeoLocate,Adam Glueckert,2016-11-16,Junco bairdi,CHAS:Bird:7921,06/19/1896,1896-06-19,1896-06-19,accepted place of collection,unverified
"North America, Mexico, Baja California Sur",Sierra de la Laguna,"Sierra Laguna, L.C. [Baja California Sur, Mexico]",23.485324,-109.96973,World Geodetic System 1984,2627,m,GeoLocate,GeoLocate,Adam Glueckert,2016-11-16,Junco bairdi,CHAS:Bird:7920,06/16/1896,1896-06-16,1896-06-16,accepted place of collection,unverified
"North America, Mexico, Baja California Sur",Sierra de la Laguna,"""Lower Cal"" [Sierra del la Laguna is a mountain range on the sourthern end of the Baja Peninsula]",23.485324,-109.96973,World Geodetic System 1984,2627,m,GeoLocate,GeoLocate,Adam Glueckert,2016-11-16,Contopus sordidulus peninsulae,CHAS:Bird:8310,05/23/1887,1887-05-23,1887-05-23,accepted place of collection,unverified
"North America, Mexico, Baja California Sur",Sierra de la Laguna,"""Lower Cal"" [Sierra del la Laguna is a mountain range on the sourthern end of the Baja Peninsula]",23.485324,-109.96973,World Geodetic System 1984,2627,m,GeoLocate,GeoLocate,Adam Glueckert,2016-11-16,Contopus sordidulus peninsulae,CHAS:Bird:8309,06/06/1887,1887-06-06,1887-06-06,accepted place of collection,unverified
"North America, Mexico, Baja California Sur",Sierra de la Laguna,Sierra de la Laguna,23.485324,-109.96973,World Geodetic System 1984,2627,m,GeoLocate,GeoLocate,Adam Glueckert,2016-11-16,Psaltriparus minimus,CHAS:Bird:7410,05/28/1887,1887-05-28,1887-05-28,accepted place of collection,unverified
"North America, Mexico, Baja California Sur",Sierra de la Laguna,Sierra de la Laguna,23.485324,-109.96973,World Geodetic System 1984,2627,m,GeoLocate,GeoLocate,Adam Glueckert,2016-11-16,Psaltriparus minimus,CHAS:Bird:7411,"06/03/1887 or Jan 3, 1887",1887-01-03,1887-06-03,accepted place of collection,unverified
"North America, Mexico, Baja California Sur",Sierra de la Laguna,"Sierra de la Laguna, L.C.",23.485324,-109.96973,World Geodetic System 1984,2627,m,GeoLocate,GeoLocate,Adam Glueckert,2016-11-16,Turdus migratorius confinis,CHAS:Bird:8013,05/05/1887,1887-05-05,1887-05-05,accepted place of collection,unverified
"North America, Mexico, Baja California Sur",Sierra de la Laguna,"Sierre de le Laguna, Lower CA",23.485324,-109.96973,World Geodetic System 1984,2627,m,GeoLocate,GeoLocate,Adam Glueckert,2016-11-16,Melanerpes formicivorus angustifrons,CHAS:Bird:8114,11/28/1887,1887-11-28,1887-11-28,accepted place of collection,unverified
"North America, Mexico, Chiapas",Paredn,,25.947115,-100.934365,World Geodetic System 1984,1067,m,GeoLocate,GeoLocate,Adam Glueckert,2016-11-16,Recurvirostra americana,CHAS:Bird:18911,11/15/1964,1964-11-15,1964-11-15,accepted place of collection,unverified
"North America, Mexico, Chiapas",Paredn,Paredon Chis. Mexico,25.947115,-100.934365,World Geodetic System 1984,1067,m,GeoLocate,GeoLocate,Adam Glueckert,2016-11-16,Aratinga canicularis,CHAS:Bird:2016.5.26,"""10-19-62""",1962-10-19,1962-10-19,accepted place of collection,unverified
"North America, Mexico, Chiapas",Paredn,(Paredon Chis) Mexico,25.947115,-100.934365,World Geodetic System 1984,1067,m,GeoLocate,GeoLocate,Adam Glueckert,2016-11-16,Sterna hirundo,CHAS:Bird:18821,10/18/1962,1962-10-18,1962-10-18,accepted place of collection,unverified
"North America, Mexico, Chihuahua, Gomez Farias",San Jos Babicora,"Babicora, Chih. Mex.",29.251972,-107.748835,World Geodetic System 1984,1086,m,GeoLocate,GeoLocate,Adam Glueckert,2016-11-16,Dendroica coronata nigrifrons,CHAS:Bird:8353,06/05/1902,1902-06-05,1902-06-05,accepted place of collection,unverified
"North America, Mexico, Chihuahua, Gomez Farias",San Jos Babicora,,29.251972,-107.748835,World Geodetic System 1984,1086,m,GeoLocate,GeoLocate,Adam Glueckert,2016-11-16,Dendroica coronata nigrifrons,CHAS:Bird:16978,06/03/1902,1902-06-03,1902-06-03,accepted place of collection,unverified
"North America, Mexico, Chihuahua, Gomez Farias",San Jos Babicora,"Babicora, Chihuahua, Mexico",29.251972,-107.748835,World Geodetic System 1984,1086,m,GeoLocate,GeoLocate,Adam Glueckert,2016-11-16,Peucedramus taeniatus,CHAS:Bird:16757,06/16/1902,1902-06-16,1902-06-16,accepted place of collection,unverified
"North America, Mexico, Chihuahua, Ocampo",Pinos Altos,"Chihuahua, Mex.",28.270149,-108.303051,World Geodetic System 1984,2112,m,GeoLocate,GeoLocate,Adam Glueckert,2016-11-16,Psaltriparus melanotis,CHAS:Bird:8395,06/30/1888,1888-06-30,1888-06-30,accepted place of collection,unverified
"North America, Mexico, Chihuahua, Ocampo",Pinos Altos,"Pinos Altos, Chihuahua, Mexico",28.270149,-108.303051,World Geodetic System 1984,2112,m,GeoLocate,GeoLocate,Adam Glueckert,2016-11-16,Peucedramus taeniatus,CHAS:Bird:16755,06/06/1888,1888-06-06,1888-06-06,accepted place of collection,unverified
"North America, Mexico, Chihuahua",Pacheco,"Chic., Pcheco Chih. Mex.",24.011379,-102.432103,World Geodetic System 1984,568,m,GeoLocate,GeoLocate,Adam Glueckert,2016-11-16,Empidonax fulvifrons pygmaeus,CHAS:Bird:8322,05/21/1921,1921-05-21,1921-05-21,accepted place of collection,unverified
"North America, Mexico, Chihuahua",Pacheco,"Mex. Chich (Pacheco), Mexico",24.011379,-102.432103,World Geodetic System 1984,568,m,GeoLocate,GeoLocate,Adam Glueckert,2016-11-16,Contopus pertinax pallidiventris,CHAS:Bird:8295,06/21/1921,1921-06-21,1921-06-21,accepted place of collection,unverified
"North America, Mexico, Chihuahua",Pacheco,Pacheco,24.011379,-102.432103,World Geodetic System 1984,568,m,GeoLocate,GeoLocate,Adam Glueckert,2016-11-16,Dendroica townsendi,CHAS:Bird:16991,05/17/1921,1921-05-17,1921-05-17,accepted place of collection,unverified
"North America, Mexico, Chihuahua",Pacheco,,24.011379,-102.432103,World Geodetic System 1984,568,m,GeoLocate,GeoLocate,Adam Glueckert,2016-11-16,Dendroica townsendi,CHAS:Bird:17001,05/17/1921,1921-05-17,1921-05-17,accepted place of collection,unverified
"North America, Mexico, Chihuahua",Pacheco,Pacheco,24.011379,-102.432103,World Geodetic System 1984,568,m,GeoLocate,GeoLocate,Adam Glueckert,2016-11-16,Dendroica graciae graciae,CHAS:Bird:17134,06/19/1921,1921-06-19,1921-06-19,accepted place of collection,unverified
"North America, Mexico, Chihuahua",Pacheco,,24.011379,-102.432103,World Geodetic System 1984,568,m,GeoLocate,GeoLocate,Adam Glueckert,2016-11-16,Dendroica graciae graciae,CHAS:Bird:17135,04/05/1921,1921-04-05,1921-04-05,accepted place of collection,unverified
"North America, Mexico, Durango","15 mi. S.W. Durango, elevation 7500 ft.","15 miles southwest Durango, elev. 7,500 ft",16.439896,-93.579867,World Geodetic System 1984,4127,m,GeoLocate,GeoLocate,Adam Glueckert,2016-12-07,Sialia mexicana bairdi,CHAS:Bird:5157,03/23/1931,1931-03-23,1931-03-23,accepted place of collection,unverified
"North America, Mexico, Durango","15 mi. S.W. Durango, elevation 7500 ft.","15 mi. S.W. Durango, elevation 7500 ft.",16.439896,-93.579867,World Geodetic System 1984,4127,m,GeoLocate,GeoLocate,Adam Glueckert,2016-12-07,Pipilo fuscus potosinus,CHAS:Bird:5155,03/23/1931,1931-03-23,1931-03-23,accepted place of collection,unverified
"North America, Mexico, Durango","20 mi. S.W. Durango, elevation 7500 ft.","20mi SW of Durango, alt. 7500'",16.400378,-93.639606,World Geodetic System 1984,4127,m,GeoLocate,GeoLocate,Adam Glueckert,2016-12-07,Buteo jamaicensis,CHAS:Bird:5163,03/20/1931,1931-03-20,1931-03-20,accepted place of collection,unverified
"North America, Mexico, Durango","30 mi. S.E. Durango, elevation 8000 ft.","30 mi. S.E. of Durango, alt. 8000ft",16.31934,-93.769382,World Geodetic System 1984,3038,m,GeoLocate,GeoLocate,Adam Glueckert,2016-12-07,Corvus corax sinuatus,CHAS:Bird:5161,03/22/1931,1931-03-22,1931-03-22,accepted place of collection,unverified
"North America, Mexico, Durango","30 mi. S.W. Durango, elevation 8000 ft.","30 miles southwest Durangeo, elevation 8000 ft",16.31934,-93.769382,World Geodetic System 1984,3038,m,GeoLocate,GeoLocate,Adam Glueckert,2016-12-07,Eumomota superciliosa,CHAS:Bird:5152,03/22/1931,1931-03-22,1931-03-22,accepted place of collection,unverified
"North America, Mexico, Durango","30 mi. S.W. Durango, elevation 8000 ft.","30mi SW of Durango, alt 8000 ft",16.31934,-93.769382,World Geodetic System 1984,3038,m,GeoLocate,GeoLocate,Adam Glueckert,2016-12-07,Bubo virginianus melancerus,CHAS:Bird:5162,03/22/1931,1931-03-22,1931-03-22,accepted place of collection,unverified
"North America, Mexico, Durango","30 mi. S.W. Durango, elevation 8000 ft.",30 miles S. West Durango; Alt. 8000',16.31934,-93.769382,World Geodetic System 1984,3038,m,GeoLocate,GeoLocate,Adam Glueckert,2016-12-07,Aphetocoma sieberi wallweberi,CHAS:Bird:5156,03/22/1931,1931-03-22,1931-03-22,accepted place of collection,unverified
"North America, Mexico, Durango","30 mi. S.W. Durango, elevation 8000 ft.","30mi SW of Durango, alt 8000 ft",16.31934,-93.769382,World Geodetic System 1984,3038,m,GeoLocate,GeoLocate,Adam Glueckert,2016-12-07,Accipiter gentilis atricapillus,CHAS:Bird:5164,03/22/1931,1931-03-22,1931-03-22,accepted place of collection,unverified
"North America, Mexico, Durango","30 mi. S.W. Durango, elevation 8000 ft.","30 mi SW of Durango, alt. 8000'",16.31934,-93.769382,World Geodetic System 1984,3038,m,GeoLocate,GeoLocate,Adam Glueckert,2016-12-07,Pipilo erythrophthalmus montanus,CHAS:Bird:5154,03/22/1931,1931-03-22,1931-03-22,accepted place of collection,unverified
"North America, Mexico, Durango","30 mi. S.W. Durango, elevation 8000 ft.","30 miles southwest of Durango, alt. 8000', Mexico",16.31934,-93.769382,World Geodetic System 1984,3038,m,GeoLocate,GeoLocate,Adam Glueckert,2016-12-07,Junco phaeonotus phaeonotus,CHAS:Bird:5151,03/22/1931,1931-03-22,1931-03-22,accepted place of collection,unverified
"North America, Mexico, Durango","30 miles S.W. of Durango, elevation 8000 ft","Durango, Mexico, 30 miles SW of Dur. Alt. 8000 ft",16.31934,-93.769382,World Geodetic System 1984,3038,m,GeoLocate,GeoLocate,Adam Glueckert,2016-12-07,Melanerpes formicivorus,CHAS:Bird:5158,03/22/1931,1931-03-22,1931-03-22,accepted place of collection,unverified
"North America, Mexico, Guerrero",Acapulco,,16.856933,-99.901496,World Geodetic System 1984,14417,m,GeoLocate,GeoLocate,Adam Glueckert,2016-09-21,Limnodromus griseus,CHAS:Bird:18905,10/10/1962,1962-10-10,1962-10-10,accepted place of collection,unverified
"North America, Mexico, Guerrero",Acapulco,,16.856933,-99.901496,World Geodetic System 1984,14417,m,GeoLocate,GeoLocate,Adam Glueckert,2016-09-21,Tringa flavipes,CHAS:Bird:18907,10/09/1962,1962-10-09,1962-10-09,accepted place of collection,unverified
"North America, Mexico, Guerrero",Acapulco,"Acapulco, Mexico",16.856933,-99.901496,World Geodetic System 1984,14417,m,GeoLocate,GeoLocate,Adam Glueckert,2016-09-21,Porphyrio martinica,CHAS:Bird:18874.1,"""11-15-64""",1964-11-15,1964-11-15,accepted place of collection,unverified
"North America, Mexico, Guerrero",Acapulco,Acapulco Gro.,16.856933,-99.901496,World Geodetic System 1984,14417,m,GeoLocate,GeoLocate,Adam Glueckert,2016-09-21,Numenius americanus,CHAS:Bird:18896,10/09/1962,1962-10-09,1962-10-09,accepted place of collection,unverified
"North America, Mexico, Guerrero",Acapulco,"Acupulco, Guenero, Mexico",16.856933,-99.901496,World Geodetic System 1984,14417,m,GeoLocate,GeoLocate,Adam Glueckert,2016-09-21,Cacicus melanicterus,CHAS:Bird:7577,02/01/1935,1935-02-01,1935-02-01,accepted place of collection,unverified
"North America, Mexico, Guerrero",Acapulco,"Acupulco, Guenero, Mexico",16.856933,-99.901496,World Geodetic System 1984,14417,m,GeoLocate,GeoLocate,Adam Glueckert,2016-09-21,Porphyrio martinica,CHAS:Bird:7574,02/01/1935,1935-02-01,1935-02-01,accepted place of collection,unverified
"North America, Mexico, Guerrero",Acapulco,"Acupulco, Guenero, Mexico",16.856933,-99.901496,World Geodetic System 1984,14417,m,GeoLocate,GeoLocate,Adam Glueckert,2016-09-21,Chloroceryle americana septentrionalis,CHAS:Bird:7575,02/01/1935,1935-02-01,1935-02-01,accepted place of collection,unverified
"North America, Mexico, Guerrero",Acapulco,"Acupulco, Guenero, Mexico",16.856933,-99.901496,World Geodetic System 1984,14417,m,GeoLocate,GeoLocate,Adam Glueckert,2016-09-21,Jacana spinosa gymnostoma,CHAS:Bird:7576,02/01/1935,1935-02-01,1935-02-01,accepted place of collection,unverified
"North America, Mexico, Guerrero",Acapulco,"Acapulco, Mex",16.856933,-99.901496,World Geodetic System 1984,14417,m,GeoLocate,GeoLocate,Adam Glueckert,2016-09-21,Cacicus melanicterus,CHAS:Bird:2016.5.28,[no date recorded],1800,2016-03-12,accepted place of collection,unverified
"North America, Mexico, Guerrero",Acapulco,,16.856933,-99.901496,World Geodetic System 1984,14417,m,GeoLocate,GeoLocate,Adam Glueckert,2016-09-21,Porphyrio martinica,CHAS:Bird:18878,11/15/1964,1964-11-15,1964-11-15,accepted place of collection,unverified
"North America, Mexico, Sonora",Alamos,"Alamos, Mex, Snora Col.",27.033333,-108.95,World Geodetic System 1984,5122,m,GeoLocate,GeoLocate,Adam Glueckert,2016-12-07,Aimophila carpalis,CHAS:Bird:7320,"03/10/1888 or Mar. 18, 1888 (Red Catalog Book Vol 1-2)",1888-03-10,1888-03-18,accepted place of collection,unverified
"North America, Mexico, Sonora",Alamos,"Alam Sonora, Mex.",27.033333,-108.95,World Geodetic System 1984,5122,m,GeoLocate,GeoLocate,Adam Glueckert,2016-12-07,Chloroceryle americana septentrionalis,CHAS:Bird:7907,02/23/1888,1888-02-23,1888-02-23,accepted place of collection,unverified
"North America, Mexico, Veracruz",Veracruz,,19.180739,-96.13405,World Geodetic System 1984,5506,m,GeoLocate,GeoLocate,Adam Glueckert,2016-10-26,Tringa flavipes,CHAS:Bird:18898,04/26/1961,1961-04-26,1961-04-26,accepted place of collection,unverified
"North America, Mexico, Yucatan",Merida,,20.976704,-89.620592,World Geodetic System 1984,14436,m,GeoLocate,GeoLocate,Adam Glueckert,2016-10-26,Crotophaga ani,CHAS:Bird:19022,02/20/1965,1965-02-20,1965-02-20,accepted place of collection,unverified
"North America, United States, Alabama, Baldwin County",Gulf Shores,"Gulf Shores, Baldwin Co., Ala",30.246036,-87.700819,World Geodetic System 1984,2881,m,GeoLocate,GeoLocate,Adam Glueckert,2016-11-18,Sterna antillarum,CHAS:Bird:9184,06/24/1932,1932-06-24,1932-06-24,accepted place of collection,unverified
"North America, United States, Alaska, Aleutian Islands",Atka Island,Atka Isl. Alaska,52.138056,-174.445278,World Geodetic System 1984,5421,m,GeoLocate,GeoLocate,Adam Glueckert,2016-11-18,Calcarius lapponicus alacensis,CHAS:Bird:8217,06/13/1911,1911-06-13,1911-06-13,accepted place of collection,unverified
"North America, United States, Alaska, Aleutian Islands",Otter Island,Otter Island,57.045833,-170.4,World Geodetic System 1984,1230,m,GeoLocate,GeoLocate,Adam Glueckert,2016-11-18,Aethia psittacula,CHAS:Bird:1560,08/07/1890,1890-08-07,1890-08-07,accepted place of collection,unverified
"North America, United States, Alaska, Aleutian Islands",Saint George Island,St. George Is. [Island] Alaska,56.583333,-169.583333,World Geodetic System 1984,1394,m,GeoLocate,GeoLocate,Adam Glueckert,2016-11-18,Leucosticte tephrocotis griseonucha,CHAS:Bird:616,8/18/(?),1800-08-18,2015-08-18,accepted place of collection,unverified
"North America, United States, Alaska, Aleutian Islands",Sand Point,Sand Point Alaska,55.339722,-160.497222,World Geodetic System 1984,5955,m,GeoLocate,GeoLocate,Adam Glueckert,2016-11-18,Melospiza melodia sanaka,CHAS:Bird:7956,10/30/1901,1901-10-30,1901-10-30,accepted place of collection,unverified
"North America, United States, Alaska, Aleutian Islands","St Paul Island, Bering Sea",St Paul Island,57.175987,-170.282171,World Geodetic System 1984,2177,m,GeoLocate,GeoLocate,Adam Glueckert,2016-11-18,Aethia pusilla,CHAS:Bird:202,7/18/1910,1910-07-18,1910-07-18,accepted place of collection,unverified
"North America, United States, Alaska, Aleutian Islands","St Paul Island, Bering Sea",St Paul Island,57.175987,-170.282171,World Geodetic System 1984,2177,m,GeoLocate,GeoLocate,Adam Glueckert,2016-11-18,Aethia pusilla,CHAS:Bird:1559,06/25/1895,1895-06-25,1895-06-25,accepted place of collection,unverified
"North America, United States, Alaska, Aleutian Islands","St Paul Island, Bering Sea","St Paul Island, Bering Sea",57.175987,-170.282171,World Geodetic System 1984,2177,m,GeoLocate,GeoLocate,Adam Glueckert,2016-11-18,Leucosticte arctoa,CHAS:Bird:18059,07/12/1890,1890-07-12,1890-07-12,accepted place of collection,unverified
"North America, United States, Alaska, Aleutian Islands","St Paul Island, Bering Sea","St Paul Island, Bering Sea",57.175987,-170.282171,World Geodetic System 1984,2177,m,GeoLocate,GeoLocate,Adam Glueckert,2016-11-18,Leucosticte tephrocotis griseonucha,CHAS:Bird:18072,07/13/1890,1890-07-13,1890-07-13,accepted place of collection,unverified
"North America, United States, Alaska, Alexander Archipelago, Prince of Wales Island",Forrester Island,Forrester Island,54.803056,-133.527222,World Geodetic System 1984,5421,m,GeoLocate,GeoLocate,Adam Glueckert,2016-09-23,Podiceps grisegena holbollii,CHAS:Bird:4419,06/09/1920,1920-06-09,1920-06-09,accepted place of collection,unverified
"North America, United States, Alaska, Alexander Archipelago, Prince of Wales Island",Forrester Island,Forrester Island,54.803056,-133.527222,World Geodetic System 1984,5421,m,GeoLocate,GeoLocate,Adam Glueckert,2016-09-23,Oceanodroma leucorhoa beali,CHAS:Bird:4501,06/24/1920,1920-06-24,1920-06-24,accepted place of collection,unverified
"North America, United States, Alaska, Alexander Archipelago, Prince of Wales Island",Forrester Island,Forrester Island,54.803056,-133.527222,World Geodetic System 1984,5421,m,GeoLocate,GeoLocate,Adam Glueckert,2016-09-23,Oceanodroma furcata,CHAS:Bird:4502,06/10/1914,1914-06-10,1914-06-10,accepted place of collection,unverified
"North America, United States, Alaska, Juneau Quad",Juneau,,58.301944,-134.419722,World Geodetic System 1984,88205,m,GeoLocate,GeoLocate,Adam Glueckert,2016-10-05,Corvus corax principalis,CHAS:Bird:4474,01/20/1921,1921-01-20,1921-01-20,accepted place of collection,unverified
"North America, United States, Alaska, Juneau Quad",Juneau,,58.301944,-134.419722,World Geodetic System 1984,88205,m,GeoLocate,GeoLocate,Adam Glueckert,2016-10-05,Calidris ptilocnemis couesi,CHAS:Bird:4873,03/25/1920,1920-03-25,1920-03-25,accepted place of collection,unverified
"North America, United States, Alaska, Juneau Quad",Juneau,,58.301944,-134.419722,World Geodetic System 1984,88205,m,GeoLocate,GeoLocate,Adam Glueckert,2016-10-05,Calidris ptilocnemis couesi,CHAS:Bird:4872,03/25/1920,1920-03-25,1920-03-25,accepted place of collection,unverified
"North America, United States, Alaska, Juneau Quad",Juneau,,58.301944,-134.419722,World Geodetic System 1984,88205,m,GeoLocate,GeoLocate,Adam Glueckert,2016-10-05,Melanitta perspicillata,CHAS:Bird:4761,02/01/1920,1920-02-01,1920-02-01,accepted place of collection,unverified
"North America, United States, Alaska, Kenai Quad",Homer,Homer Alaska,59.6425,-151.548333,World Geodetic System 1984,1957,m,GeoLocate,GeoLocate,Adam Glueckert,2016-11-18,Pinicola enucleator flammula,CHAS:Bird:7978,09/26/1901,1901-09-26,1901-09-26,accepted place of collection,unverified
"North America, United States, Alaska, Kodiak Quad, Kodiak Island",Kodiak Island,"Alaska, Kodiak Island",57.396111,-153.483333,World Geodetic System 1984,23022,m,GeoLocate,GeoLocate,Adam Glueckert,2016-10-26,Aquila chrysaetos canadensis,CHAS:Bird:9739,1947,1947-01-01,1948-12-31,accepted place of collection,unverified
"North America, United States, Alaska, Nome Quad",at shore of Wales,at shore of Wales,65.609167,-168.0875,World Geodetic System 1984,4321,m,GeoLocate,GeoLocate,Adam Glueckert,2016-10-19,Somateria fischeri,CHAS:Bird:5838,05/29/1932,1932-05-29,1932-05-29,accepted place of collection,unverified
"North America, United States, Alaska, Nome Quad",Cape Prince of Wales,Cape Prince of Wales,65.599084,-168.081632,World Geodetic System 1984,1527,m,GeoLocate,GeoLocate,Adam Glueckert,2016-11-18,Calcarius lapponicus alacensis,CHAS:Bird:1933,06/12/1928,1928-06-12,1928-06-12,accepted place of collection,unverified
"North America, United States, Alaska, Nome Quad",Cape Prince of Wales,Cape Prince of Wales,65.599084,-168.081632,World Geodetic System 1984,1527,m,GeoLocate,GeoLocate,Adam Glueckert,2016-11-18,Somateria fischeri,CHAS:Bird:7117,6/21/1934,1934-06-21,1934-06-21,accepted place of collection,unverified
"North America, United States, Alaska, Nome Quad",Diomede Island,Diomede Island,65.767684,-168.987706,World Geodetic System 1984,8157,m,,GeoLocate,Adam Glueckert,2016-09-17,Aethia pusilla,CHAS:Bird:1939,06/20/1928,1928-06-20,1928-06-20,accepted place of collection,unverified
"North America, United States, Alaska, Nome Quad",Diomede Island,Diomede Island,65.767684,-168.987706,World Geodetic System 1984,8157,m,GeoLocate,GeoLocate,Adam Glueckert,2016-09-30,Aethia cristatella,CHAS:Bird:1934,06/20/1928,1928-06-20,1928-06-20,accepted place of collection,unverified
"North America, United States, Alaska, Nome Quad",Diomede Island,Diomede Island,65.767684,-168.987706,World Geodetic System 1984,8157,m,GeoLocate,GeoLocate,Adam Glueckert,2016-09-30,Aethia cristatella,CHAS:Bird:1935,06/20/1928,1928-06-20,1928-06-20,accepted place of collection,unverified
"North America, United States, Alaska, Nome Quad",Diomede Island,Diomede Island,65.767684,-168.987706,World Geodetic System 1984,8157,m,GeoLocate,GeoLocate,Adam Glueckert,2016-09-30,Aethia cristatella,CHAS:Bird:1936,06/20/1928,1928-06-20,1928-06-20,accepted place of collection,unverified
"North America, United States, Alaska, Nome Quad",Diomede Island,Diomede Island,65.767684,-168.987706,World Geodetic System 1984,8157,m,GeoLocate,GeoLocate,Adam Glueckert,2016-09-30,Aethia cristatella,CHAS:Bird:1937,06/20/1928,1928-06-20,1928-06-20,accepted place of collection,unverified
"North America, United States, Alaska, Nome Quad",King Island,King Island,64.975,-168.059722,World Geodetic System 1984,2704,m,GeoLocate,GeoLocate,Adam Glueckert,2016-10-19,Aethia psittacula,CHAS:Bird:5843,07/25/1931,1931-07-25,1931-07-25,accepted place of collection,unverified
"North America, United States, Alaska, Nome Quad",King Island,King Island,64.975,-168.059722,World Geodetic System 1984,2704,m,GeoLocate,GeoLocate,Adam Glueckert,2016-09-30,Oenanthe oenanthe oenanthe,CHAS:Bird:5820,05/26/1931,1931-05-26,1931-05-26,accepted place of collection,unverified
"North America, United States, Alaska, Nome Quad",King Island,King Island,64.975,-168.059722,World Geodetic System 1984,2704,m,GeoLocate,GeoLocate,Adam Glueckert,2016-09-30,Oenanthe oenanthe oenanthe,CHAS:Bird:5821,05/27/1931,1931-05-27,1931-05-27,accepted place of collection,unverified
"North America, United States, Alaska, Nome Quad",King Island,King Island,64.975,-168.059722,World Geodetic System 1984,2704,m,GeoLocate,GeoLocate,Adam Glueckert,2016-09-30,Oenanthe oenanthe oenanthe,CHAS:Bird:5822,05/25/1931,1931-05-25,1931-05-25,accepted place of collection,unverified
"North America, United States, Alaska, Nome Quad",King Island,King Island,64.975,-168.059722,World Geodetic System 1984,2704,m,GeoLocate,GeoLocate,Adam Glueckert,2016-09-30,Oenanthe oenanthe oenanthe,CHAS:Bird:5823,05/26/1931,1931-05-26,1931-05-26,accepted place of collection,unverified
"North America, United States, Alaska, Nome Quad",King Island,"King Island, Alas.",64.975,-168.059722,World Geodetic System 1984,2704,m,GeoLocate,GeoLocate,Adam Glueckert,2016-10-19,Oenanthe oenanthe oenanthe,CHAS:Bird:5867,05/25/1931,1931-05-25,1931-05-25,accepted place of collection,unverified
"North America, United States, Alaska, Nome Quad",King Island,King Island,64.975,-168.059722,World Geodetic System 1984,2704,m,GeoLocate,GeoLocate,Adam Glueckert,2016-09-30,Plectrophenax nivalis,CHAS:Bird:5815,5/25/1931; 5/2/1931,1931-05-02,1931-05-02,accepted place of collection,unverified
"North America, United States, Alaska, Nome Quad",King Island,King Island,64.975,-168.059722,World Geodetic System 1984,2704,m,GeoLocate,GeoLocate,Adam Glueckert,2016-09-30,Plectrophenax nivalis nivalis,CHAS:Bird:5816,05/25/1931,1931-05-25,1931-05-25,accepted place of collection,unverified
"North America, United States, Alaska, Nome Quad",King Island,King Island,64.975,-168.059722,World Geodetic System 1984,2704,m,GeoLocate,GeoLocate,Adam Glueckert,2016-09-30,Plectrophenax nivalis,CHAS:Bird:5817,5/25/1931; 5/1/1931,1931-05-01,1931-05-01,accepted place of collection,unverified
"North America, United States, Alaska, Nome Quad",King Island,King Island,64.975,-168.059722,World Geodetic System 1984,2704,m,GeoLocate,GeoLocate,Adam Glueckert,2016-09-30,Anas formosa,CHAS:Bird:5833,5/23/1931; 5/25/1931,1931-05-25,1931-05-25,accepted place of collection,unverified
"North America, United States, Alaska, Nome Quad",King Island,King Island,64.975,-168.059722,World Geodetic System 1984,2704,m,GeoLocate,GeoLocate,Adam Glueckert,2016-09-30,Anas formosa,CHAS:Bird:5834,5/25/1931; 5/23/1931,1931-05-23,1931-05-23,accepted place of collection,unverified
"North America, United States, Alaska, Nome Quad",King Island,King Island,64.975,-168.059722,World Geodetic System 1984,2704,m,GeoLocate,GeoLocate,Adam Glueckert,2016-09-30,Histrionicus histrionicus,CHAS:Bird:5835,05/27/1931,1931-05-27,1931-05-27,accepted place of collection,unverified
"North America, United States, Alaska, Nome Quad",Little Diomede Island,Little Diomede Island,65.7581,-168.952,World Geodetic System 1984,3774,m,,GeoLocate,Adam Glueckert,2016-09-17,Aethia pusilla,CHAS:Bird:1966,06/20/1928,1928-06-20,1928-06-20,accepted place of collection,unverified
"North America, United States, Alaska, Nome Quad",Little Diomede Island,Little Diomede Island,65.7581,-168.952,World Geodetic System 1984,3774,m,GeoLocate,GeoLocate,Adam Glueckert,2016-09-30,Aethia cristatella,CHAS:Bird:1938,06/20/1928,1928-06-20,1928-06-20,accepted place of collection,unverified
"North America, United States, Alaska, Nome Quad",Little Diomede Island,Little Diomede Island,65.7581,-168.952,World Geodetic System 1984,3774,m,GeoLocate,GeoLocate,Adam Glueckert,2016-09-30,Aethia cristatella,CHAS:Bird:1959,06/20/1928,1928-06-20,1928-06-20,accepted place of collection,unverified
"North America, United States, Alaska, Nome Quad",Little Diomede Island,Little Diomede Island,65.7581,-168.952,World Geodetic System 1984,3774,m,GeoLocate,GeoLocate,Adam Glueckert,2016-09-30,Aethia cristatella,CHAS:Bird:1960,06/20/1928,1928-06-20,1928-06-20,accepted place of collection,unverified
"North America, United States, Alaska, Nome Quad",Little Diomede Island,Little Diomede Island,65.7581,-168.952,World Geodetic System 1984,3774,m,GeoLocate,GeoLocate,Adam Glueckert,2016-09-30,Aethia cristatella,CHAS:Bird:1961,06/20/1928,1928-06-20,1928-06-20,accepted place of collection,unverified
"North America, United States, Alaska, Nome Quad",Little Diomede Island,Little Diomede Island,65.7581,-168.952,World Geodetic System 1984,3774,m,GeoLocate,GeoLocate,Adam Glueckert,2016-09-30,Aethia cristatella,CHAS:Bird:1964,06/20/1928,1928-06-20,1928-06-20,accepted place of collection,unverified
"North America, United States, Alaska, Nome Quad",Little Diomede Island,Little Diomede Island,65.7581,-168.952,World Geodetic System 1984,3774,m,GeoLocate,GeoLocate,Adam Glueckert,2016-09-30,Aethia cristatella,CHAS:Bird:1962,06/20/1928,1928-06-20,1928-06-20,accepted place of collection,unverified
"North America, United States, Alaska, Nome Quad",Little Diomede Island,Little Diomede Island,65.7581,-168.952,World Geodetic System 1984,3774,m,GeoLocate,GeoLocate,Adam Glueckert,2016-09-30,Aethia cristatella,CHAS:Bird:1963,06/20/1928,1928-06-20,1928-06-20,accepted place of collection,unverified
"North America, United States, Alaska, Nome Quad",Little Diomede Island,Little Diomede Island,65.7581,-168.952,World Geodetic System 1984,3774,m,GeoLocate,GeoLocate,Adam Glueckert,2016-09-30,Aethia cristatella,CHAS:Bird:1965,06/20/1928,1928-06-20,1928-06-20,accepted place of collection,unverified
"North America, United States, Alaska, Nome Quad",Nome,,65.609167,-168.0875,World Geodetic System 1984,4321,m,GeoLocate,GeoLocate,Adam Glueckert,2016-09-21,Calcarius lapponicus alacensis,CHAS:Bird:4613,06/24/1921,1921-06-24,1921-06-24,accepted place of collection,unverified
"North America, United States, Alaska, Nome Quad",Teller,"Teller, Alaska",65.263611,-166.360833,World Geodetic System 1984,4073,m,GeoLocate,GeoLocate,Adam Glueckert,2016-11-18,Asio flammeus flammeus,CHAS:Bird:5860,05/29/1932,1932-05-29,1932-05-29,accepted place of collection,unverified
"North America, United States, Alaska, Nome Quad",Wales,,65.609167,-168.0875,World Geodetic System 1984,4321,m,GeoLocate,GeoLocate,Adam Glueckert,2016-09-21,Somateria spectabilis,CHAS:Bird:1649,05/20/1922,1922-05-20,1922-05-20,accepted place of collection,unverified
"North America, United States, Alaska, Nome Quad",Wales,,65.609167,-168.0875,World Geodetic System 1984,4321,m,GeoLocate,GeoLocate,Adam Glueckert,2016-09-21,Catharus minimus aliciae,CHAS:Bird:4851,06/09/1922,1922-06-09,1922-06-09,accepted place of collection,unverified
"North America, United States, Alaska, Nome Quad",Wales,,65.609167,-168.0875,World Geodetic System 1984,4321,m,GeoLocate,GeoLocate,Adam Glueckert,2016-09-21,Catharus minimus aliciae,CHAS:Bird:4850,06/09/1922,1922-06-09,1922-06-09,accepted place of collection,unverified
"North America, United States, Alaska, Nome Quad",Wales,,65.609167,-168.0875,World Geodetic System 1984,4321,m,GeoLocate,GeoLocate,Adam Glueckert,2016-09-21,Plectrophenax nivalis nivalis,CHAS:Bird:4639,05/11/1922,1922-05-11,1922-05-11,accepted place of collection,unverified
"North America, United States, Alaska, Nome Quad",Wales,,65.609167,-168.0875,World Geodetic System 1984,4321,m,GeoLocate,GeoLocate,Adam Glueckert,2016-09-21,Calcarius lapponicus alacensis,CHAS:Bird:4612,06/05/1922,1922-06-05,1922-06-05,accepted place of collection,unverified
"North America, United States, Alaska, Nome Quad",Wales,,65.609167,-168.0875,World Geodetic System 1984,4321,m,GeoLocate,GeoLocate,Adam Glueckert,2016-09-21,Lagopus lagopus alba,CHAS:Bird:5143,05/31/1922,1922-05-31,1922-05-31,accepted place of collection,unverified
"North America, United States, Alaska, Nome Quad",Wales,,65.609167,-168.0875,World Geodetic System 1984,4321,m,GeoLocate,GeoLocate,Adam Glueckert,2016-09-21,Stercorarius longicaudus,CHAS:Bird:5136,06/08/1922,1922-06-08,1922-06-08,accepted place of collection,unverified
"North America, United States, Alaska, Nome Quad",Wales,,65.609167,-168.0875,World Geodetic System 1984,4321,m,GeoLocate,GeoLocate,Adam Glueckert,2016-09-21,Phalaropus fulicarius,CHAS:Bird:5148,06/11/1922,1922-06-11,1922-06-11,accepted place of collection,unverified
"North America, United States, Alaska, Nome Quad",Wales,,65.609167,-168.0875,World Geodetic System 1984,4321,m,GeoLocate,GeoLocate,Adam Glueckert,2016-09-21,Catharus minimus aliciae,CHAS:Bird:4852,06/11/1922,1922-06-11,1922-06-11,accepted place of collection,unverified
"North America, United States, Alaska, Nome Quad",Wales,,65.609167,-168.0875,World Geodetic System 1984,4321,m,GeoLocate,GeoLocate,Adam Glueckert,2016-09-21,Catharus minimus,CHAS:Bird:4845,06/09/1922,1922-06-09,1922-06-09,accepted place of collection,unverified
"North America, United States, Alaska, Nome Quad",Wales,"Wales, Alaska",65.609167,-168.0875,World Geodetic System 1984,4321,m,GeoLocate,GeoLocate,Adam Glueckert,2016-10-19,Calidris mauri,CHAS:Bird:5904,"06/16/1932 or June 26, 1932",1932-06-16,1932-06-26,accepted place of collection,unverified
"North America, United States, Alaska, Nome Quad",Wales,"Wales, Alaska",65.609167,-168.0875,World Geodetic System 1984,4321,m,GeoLocate,GeoLocate,Adam Glueckert,2016-10-19,Calidris mauri,CHAS:Bird:5903,06/23/1932,1932-06-23,1932-06-23,accepted place of collection,unverified
"North America, United States, Alaska, Nome Quad",Wales,"Wales, Alaska",65.609167,-168.0875,World Geodetic System 1984,4321,m,GeoLocate,GeoLocate,Adam Glueckert,2016-09-21,Calidris mauri,CHAS:Bird:5866,06/26/1932,1932-06-26,1932-06-26,accepted place of collection,unverified
"North America, United States, Alaska, Nome Quad",Wales,,65.609167,-168.0875,World Geodetic System 1984,4321,m,GeoLocate,GeoLocate,Adam Glueckert,2016-09-21,Phalaropus fulicarius,CHAS:Bird:2619,06/14/1929,1929-06-14,1929-06-14,accepted place of collection,unverified
"North America, United States, Alaska, Nome Quad",Wales,,65.609167,-168.0875,World Geodetic System 1984,4321,m,GeoLocate,GeoLocate,Adam Glueckert,2016-09-21,Phalaropus fulicarius,CHAS:Bird:2618,06/01/1929,1929-06-01,1929-06-01,accepted place of collection,unverified
"North America, United States, Alaska, Nome Quad",Wales,,65.609167,-168.0875,World Geodetic System 1984,4321,m,GeoLocate,GeoLocate,Adam Glueckert,2016-09-21,Phalaropus fulicarius,CHAS:Bird:2621,06/06/1929,1929-06-06,1929-06-06,accepted place of collection,unverified
"North America, United States, Alaska, Nome Quad",Wales,,65.609167,-168.0875,World Geodetic System 1984,4321,m,GeoLocate,GeoLocate,Adam Glueckert,2016-09-21,Calidris alpina pacifica,CHAS:Bird:2254,06/22/1929,1929-06-22,1929-06-22,accepted place of collection,unverified
"North America, United States, Alaska, Nome Quad",Wales,,65.609167,-168.0875,World Geodetic System 1984,4321,m,GeoLocate,GeoLocate,Adam Glueckert,2016-09-21,Calidris ptilocnemis,CHAS:Bird:2255,06/15/1929,1929-06-15,1929-06-15,accepted place of collection,unverified
"North America, United States, Alaska, Nome Quad",Wales,,65.609167,-168.0875,World Geodetic System 1984,4321,m,GeoLocate,GeoLocate,Adam Glueckert,2016-09-21,Calidris mauri,CHAS:Bird:2596,06/27/1929,1929-06-27,1929-06-27,accepted place of collection,unverified
"North America, United States, Alaska, Nome Quad",Wales,,65.609167,-168.0875,World Geodetic System 1984,4321,m,GeoLocate,GeoLocate,Adam Glueckert,2016-09-21,Calidris mauri,CHAS:Bird:2562,06/22/1929,1929-06-22,1929-06-22,accepted place of collection,unverified
"North America, United States, Alaska, Nome Quad",Wales,,65.609167,-168.0875,World Geodetic System 1984,4321,m,GeoLocate,GeoLocate,Adam Glueckert,2016-09-21,Calidris mauri,CHAS:Bird:2260,06/22/1929,1929-06-22,1929-06-22,accepted place of collection,unverified
"North America, United States, Alaska, Nome Quad",Wales,,65.609167,-168.0875,World Geodetic System 1984,4321,m,GeoLocate,GeoLocate,Adam Glueckert,2016-09-21,Calidris mauri,CHAS:Bird:2261,06/24/1929,1929-06-24,1929-06-24,accepted place of collection,unverified
"North America, United States, Alaska, Nome Quad",Wales,,65.609167,-168.0875,World Geodetic System 1984,4321,m,GeoLocate,GeoLocate,Adam Glueckert,2016-09-21,Calidris mauri,CHAS:Bird:2595,06/27/1929,1929-06-27,1929-06-27,accepted place of collection,unverified
"North America, United States, Alaska, Nome Quad",Wales,,65.609167,-168.0875,World Geodetic System 1984,4321,m,GeoLocate,GeoLocate,Adam Glueckert,2016-09-21,Calidris mauri,CHAS:Bird:2230,06/05/1929,1929-06-05,1929-06-05,accepted place of collection,unverified
"North America, United States, Alaska, Nome Quad",Wales,,65.609167,-168.0875,World Geodetic System 1984,4321,m,GeoLocate,GeoLocate,Adam Glueckert,2016-09-21,Calidris mauri,CHAS:Bird:2231,06/25/1929,1929-06-25,1929-06-25,accepted place of collection,unverified
"North America, United States, Alaska, Nome Quad",Wales,,65.609167,-168.0875,World Geodetic System 1984,4321,m,GeoLocate,GeoLocate,Adam Glueckert,2016-09-21,Stercorarius parasiticus,CHAS:Bird:2602,06/24/1929,1929-06-24,1929-06-24,accepted place of collection,unverified
"North America, United States, Alaska, Nome Quad",Wales,,65.609167,-168.0875,World Geodetic System 1984,4321,m,GeoLocate,GeoLocate,Adam Glueckert,2016-09-21,Calidris mauri,CHAS:Bird:1932,06/12/1928,1928-06-12,1928-06-12,accepted place of collection,unverified
"North America, United States, Alaska, Nome Quad",Wales,,65.609167,-168.0875,World Geodetic System 1984,4321,m,GeoLocate,GeoLocate,Adam Glueckert,2016-09-21,Sterna paradisaea,CHAS:Bird:19285,06/05/1929,1929-06-05,1929-06-05,accepted place of collection,unverified
"North America, United States, Alaska, Nome Quad",Wales,,65.609167,-168.0875,World Geodetic System 1984,4321,m,GeoLocate,GeoLocate,Adam Glueckert,2016-09-21,Agelaius phoeniceus arctolegus,CHAS:Bird:2239,06/06/1929,1929-06-06,1929-06-06,accepted place of collection,unverified
"North America, United States, Alaska, Nome Quad",Wales,Alaska: Wales,65.609167,-168.0875,World Geodetic System 1984,4321,m,GeoLocate,GeoLocate,Adam Glueckert,2016-09-21,Charadrius morinellus,CHAS:Bird:2237,06/15/1924,1924-06-15,1924-06-15,accepted place of collection,unverified
"North America, United States, Alaska, Nome Quad",Wales,Alaska: Wales,65.609167,-168.0875,World Geodetic System 1984,4321,m,GeoLocate,GeoLocate,Adam Glueckert,2016-09-21,Charadrius morinellus,CHAS:Bird:2238,06/19/1929,1929-06-19,1929-06-19,accepted place of collection,unverified
"North America, United States, Alaska, Nome Quad",Wales,Alaska: Wales,65.609167,-168.0875,World Geodetic System 1984,4321,m,GeoLocate,GeoLocate,Adam Glueckert,2016-09-21,Pluvialis dominica fulva,CHAS:Bird:2244,05/31/1929,1929-05-31,1929-05-31,accepted place of collection,unverified
"North America, United States, Alaska, Nome Quad",Wales,Alaska: Wales,65.609167,-168.0875,World Geodetic System 1984,4321,m,GeoLocate,GeoLocate,Adam Glueckert,2016-09-21,Pluvialis dominica,CHAS:Bird:2245,06/01/1929,1929-06-01,1929-06-01,accepted place of collection,unverified
"North America, United States, Alaska, Nome Quad",Wales,Alaska: Wales,65.609167,-168.0875,World Geodetic System 1984,4321,m,GeoLocate,GeoLocate,Adam Glueckert,2016-09-21,Pluvialis dominica,CHAS:Bird:2246,06/01/1929,1929-06-01,1929-06-01,accepted place of collection,unverified
"North America, United States, Alaska, Nome Quad",Wales,Alaska: Wales,65.609167,-168.0875,World Geodetic System 1984,4321,m,GeoLocate,GeoLocate,Adam Glueckert,2016-09-21,Pluvialis dominica,CHAS:Bird:2247,06/03/1929,1929-06-03,1929-06-03,accepted place of collection,unverified
"North America, United States, Alaska, Nome Quad",Wales,,65.609167,-168.0875,World Geodetic System 1984,4321,m,GeoLocate,GeoLocate,Adam Glueckert,2016-09-21,Limosa lapponica baueri,CHAS:Bird:1967,06/24/1928,1928-06-24,1928-06-24,accepted place of collection,unverified
"North America, United States, Alaska, Nome Quad",Wales,,65.609167,-168.0875,World Geodetic System 1984,4321,m,GeoLocate,GeoLocate,Adam Glueckert,2016-09-21,Limosa lapponica baueri,CHAS:Bird:2233,06/02/1929,1929-06-02,1929-06-02,accepted place of collection,unverified
"North America, United States, Alaska, Nome Quad",Wales,,65.609167,-168.0875,World Geodetic System 1984,4321,m,GeoLocate,GeoLocate,Adam Glueckert,2016-09-21,Calidris ptilocnemis,CHAS:Bird:2214,06/10/1929,1929-06-10,1929-06-10,accepted place of collection,unverified
"North America, United States, Alaska, Nome Quad",Wales,,65.609167,-168.0875,World Geodetic System 1984,4321,m,GeoLocate,GeoLocate,Adam Glueckert,2016-09-21,Calidris pusilla,CHAS:Bird:2052,06/12/1928,1928-06-12,1928-06-12,accepted place of collection,unverified
"North America, United States, Alaska, Nome Quad",Wales,,65.609167,-168.0875,World Geodetic System 1984,4321,m,GeoLocate,GeoLocate,Adam Glueckert,2016-09-21,Calidris mauri,CHAS:Bird:2232,06/08/1929,1929-06-08,1929-06-08,accepted place of collection,unverified
"North America, United States, Alaska, Nome Quad",Wales,,65.609167,-168.0875,World Geodetic System 1984,4321,m,GeoLocate,GeoLocate,Adam Glueckert,2016-09-21,Calidris mauri,CHAS:Bird:2259,06/20/1929,1929-06-20,1929-06-20,accepted place of collection,unverified
"North America, United States, Alaska, Nome Quad",Wales,,65.609167,-168.0875,World Geodetic System 1984,4321,m,GeoLocate,GeoLocate,Adam Glueckert,2016-09-21,Calidris mauri,CHAS:Bird:2597,06/11/1929,1929-06-11,1929-06-11,accepted place of collection,unverified
"North America, United States, Alaska, Nome Quad",Wales,,65.609167,-168.0875,World Geodetic System 1984,4321,m,GeoLocate,GeoLocate,Adam Glueckert,2016-09-21,Calidris mauri,CHAS:Bird:2598,05/30/1929,1929-05-30,1929-05-30,accepted place of collection,unverified
"North America, United States, Alaska, Nome Quad",Wales,,65.609167,-168.0875,World Geodetic System 1984,4321,m,GeoLocate,GeoLocate,Adam Glueckert,2016-09-21,Calidris alpina sakhalina,CHAS:Bird:1940,06/20/1928,1928-06-20,1928-06-20,accepted place of collection,unverified
"North America, United States, Alaska, Nome Quad",Wales,,65.609167,-168.0875,World Geodetic System 1984,4321,m,GeoLocate,GeoLocate,Adam Glueckert,2016-09-21,Calidris alpina pacifica,CHAS:Bird:2593,06/24/1921,1921-06-24,1921-06-24,accepted place of collection,unverified
"North America, United States, Alaska, Nome Quad",Wales,,65.609167,-168.0875,World Geodetic System 1984,4321,m,GeoLocate,GeoLocate,Adam Glueckert,2016-09-21,Calidris melanotos,CHAS:Bird:2049,05/26/1928,1928-05-26,1928-05-26,accepted place of collection,unverified
"North America, United States, Alaska, Nome Quad",Wales,,65.609167,-168.0875,World Geodetic System 1984,4321,m,GeoLocate,GeoLocate,Adam Glueckert,2016-09-21,Calidris melanotos,CHAS:Bird:2213,06/14/1929,1929-06-14,1929-06-14,accepted place of collection,unverified
"North America, United States, Alaska, Nome Quad",Wales,,65.609167,-168.0875,World Geodetic System 1984,4321,m,GeoLocate,GeoLocate,Adam Glueckert,2016-09-21,Limnodromus scolopaceus,CHAS:Bird:2234,06/01/1929,1929-06-01,1929-06-01,accepted place of collection,unverified
"North America, United States, Alaska, Nome Quad",Wales,,65.609167,-168.0875,World Geodetic System 1984,4321,m,GeoLocate,GeoLocate,Adam Glueckert,2016-09-21,Limnodromus scolopaceus,CHAS:Bird:2235,06/04/1929,1929-06-04,1929-06-04,accepted place of collection,unverified
"North America, United States, Alaska, Nome Quad",Wales,,65.609167,-168.0875,World Geodetic System 1984,4321,m,GeoLocate,GeoLocate,Adam Glueckert,2016-09-21,Phalaropus fulicarius,CHAS:Bird:2221,06/03/1929,1929-06-03,1929-06-03,accepted place of collection,unverified
"North America, United States, Alaska, Nome Quad",Wales,,65.609167,-168.0875,World Geodetic System 1984,4321,m,GeoLocate,GeoLocate,Adam Glueckert,2016-09-21,Phalaropus fulicarius,CHAS:Bird:2222,06/05/1929,1929-06-05,1929-06-05,accepted place of collection,unverified
"North America, United States, Alaska, Nome Quad",Wales,,65.609167,-168.0875,World Geodetic System 1984,4321,m,GeoLocate,GeoLocate,Adam Glueckert,2016-09-21,Phalaropus fulicarius,CHAS:Bird:2223,06/10/1929,1929-06-10,1929-06-10,accepted place of collection,unverified
"North America, United States, Alaska, Nome Quad",Wales,,65.609167,-168.0875,World Geodetic System 1984,4321,m,GeoLocate,GeoLocate,Adam Glueckert,2016-09-21,Phalaropus fulicarius,CHAS:Bird:2224,06/11/1929,1929-06-11,1929-06-11,accepted place of collection,unverified
"North America, United States, Alaska, Nome Quad",Wales,,65.609167,-168.0875,World Geodetic System 1984,4321,m,GeoLocate,GeoLocate,Adam Glueckert,2016-09-21,Phalaropus fulicarius,CHAS:Bird:2225,06/05/1929,1929-06-05,1929-06-05,accepted place of collection,unverified
"North America, United States, Alaska, Nome Quad",Wales,,65.609167,-168.0875,World Geodetic System 1984,4321,m,GeoLocate,GeoLocate,Adam Glueckert,2016-09-21,Phalaropus fulicarius,CHAS:Bird:2226,06/08/1929,1929-06-08,1929-06-08,accepted place of collection,unverified
"North America, United States, Alaska, Nome Quad",Wales,,65.609167,-168.0875,World Geodetic System 1984,4321,m,GeoLocate,GeoLocate,Adam Glueckert,2016-09-21,Phalaropus lobatus,CHAS:Bird:2050,06/01/1928,1928-06-01,1928-06-01,accepted place of collection,unverified
"North America, United States, Alaska, Nome Quad",Wales,,65.609167,-168.0875,World Geodetic System 1984,4321,m,GeoLocate,GeoLocate,Adam Glueckert,2016-09-21,Phalaropus lobatus,CHAS:Bird:2051,06/01/1928,1928-06-01,1928-06-01,accepted place of collection,unverified
"North America, United States, Alaska, Nome Quad",Wales,,65.609167,-168.0875,World Geodetic System 1984,4321,m,GeoLocate,GeoLocate,Adam Glueckert,2016-09-21,Phalaropus lobatus,CHAS:Bird:2219,06/06/1929,1929-06-06,1929-06-06,accepted place of collection,unverified
"North America, United States, Alaska, Nome Quad",Wales,,65.609167,-168.0875,World Geodetic System 1984,4321,m,GeoLocate,GeoLocate,Adam Glueckert,2016-09-21,Phalaropus lobatus,CHAS:Bird:2220,06/12/1929,1929-06-12,1929-06-12,accepted place of collection,unverified
"North America, United States, Alaska, Nome Quad",Wales,,65.609167,-168.0875,World Geodetic System 1984,4321,m,GeoLocate,GeoLocate,Adam Glueckert,2016-09-21,Phalaropus lobatus,CHAS:Bird:2256,06/14/1929,1929-06-14,1929-06-14,accepted place of collection,unverified
"North America, United States, Alaska, Nome Quad",Wales,,65.609167,-168.0875,World Geodetic System 1984,4321,m,GeoLocate,GeoLocate,Adam Glueckert,2016-09-21,Phalaropus lobatus,CHAS:Bird:2257,06/17/1929,1929-06-17,1929-06-17,accepted place of collection,unverified
"North America, United States, Alaska, Nome Quad",Wales,,65.609167,-168.0875,World Geodetic System 1984,4321,m,GeoLocate,GeoLocate,Adam Glueckert,2016-09-21,Phalaropus lobatus,CHAS:Bird:2622,06/17/1929,1929-06-17,1929-06-17,accepted place of collection,unverified
"North America, United States, Alaska, Nome Quad",Wales,,65.609167,-168.0875,World Geodetic System 1984,4321,m,GeoLocate,GeoLocate,Adam Glueckert,2016-09-21,Phalaropus lobatus,CHAS:Bird:2623,06/10/1929,1929-06-10,1929-06-10,accepted place of collection,unverified
"North America, United States, Alaska, Nome Quad",Wales,,65.609167,-168.0875,World Geodetic System 1984,4321,m,GeoLocate,GeoLocate,Adam Glueckert,2016-09-21,Gallinago delicata,CHAS:Bird:2243,06/04/1929,1929-06-04,1929-06-04,accepted place of collection,unverified
"North America, United States, Alaska, Nome Quad",Wales,,65.609167,-168.0875,World Geodetic System 1984,4321,m,GeoLocate,GeoLocate,Adam Glueckert,2016-09-21,Xema sabini,CHAS:Bird:2617,06/11/1929,1929-06-11,1929-06-11,accepted place of collection,unverified
"North America, United States, Alaska, Nome Quad",Wales,,65.609167,-168.0875,World Geodetic System 1984,4321,m,GeoLocate,GeoLocate,Adam Glueckert,2016-09-21,Stercorarius longicaudus,CHAS:Bird:2262,06/11/1929,1929-06-11,1929-06-11,accepted place of collection,unverified
"North America, United States, Alaska, Nome Quad",Wales,,65.609167,-168.0875,World Geodetic System 1984,4321,m,GeoLocate,GeoLocate,Adam Glueckert,2016-09-21,Stercorarius pomarinus,CHAS:Bird:2263,06/11/1929,1929-06-11,1929-06-11,accepted place of collection,unverified
"North America, United States, Alaska, Nome Quad",Wales,,65.609167,-168.0875,World Geodetic System 1984,4321,m,GeoLocate,GeoLocate,Adam Glueckert,2016-09-21,Stercorarius pomarinus,CHAS:Bird:2601,06/11/1929,1929-06-11,1929-06-11,accepted place of collection,unverified
"North America, United States, Alaska, Nome Quad",Wales,,65.609167,-168.0875,World Geodetic System 1984,4321,m,GeoLocate,GeoLocate,Adam Glueckert,2016-09-21,Sterna paradisaea,CHAS:Bird:2210,06/05/1929,1929-06-05,1929-06-05,accepted place of collection,unverified
"North America, United States, Alaska, Nome Quad",Wales,,65.609167,-168.0875,World Geodetic System 1984,4321,m,GeoLocate,GeoLocate,Adam Glueckert,2016-09-21,Sterna paradisaea,CHAS:Bird:2211,06/04/1929,1929-06-04,1929-06-04,accepted place of collection,unverified
"North America, United States, Alaska, Nome Quad",Wales,,65.609167,-168.0875,World Geodetic System 1984,4321,m,GeoLocate,GeoLocate,Adam Glueckert,2016-09-21,Uria lomvia arra,CHAS:Bird:2190,06/05/1929,1929-06-05,1929-06-05,accepted place of collection,unverified
"North America, United States, Alaska, Nome Quad",Wales,,65.609167,-168.0875,World Geodetic System 1984,4321,m,GeoLocate,GeoLocate,Adam Glueckert,2016-09-21,Uria lomvia arra,CHAS:Bird:2191,06/05/1929,1929-06-05,1929-06-05,accepted place of collection,unverified
"North America, United States, Alaska, Nome Quad",Wales,,65.609167,-168.0875,World Geodetic System 1984,4321,m,GeoLocate,GeoLocate,Adam Glueckert,2016-09-21,Uria lomvia arra,CHAS:Bird:2189,05/30/1929,1929-05-30,1929-05-30,accepted place of collection,unverified
"North America, United States, Alaska, Nome Quad",Wales,,65.609167,-168.0875,World Geodetic System 1984,4321,m,GeoLocate,GeoLocate,Adam Glueckert,2016-09-21,Aethia pusilla,CHAS:Bird:2215,06/04/1929,1929-06-04,1929-06-04,accepted place of collection,unverified
"North America, United States, Alaska, Nome Quad",Wales,,65.609167,-168.0875,World Geodetic System 1984,4321,m,GeoLocate,GeoLocate,Adam Glueckert,2016-09-21,Aethia cristatella,CHAS:Bird:2192,06/01/1928 or 1929,1928-06-01,1930-12-31,accepted place of collection,unverified
"North America, United States, Alaska, Nome Quad",Wales,,65.609167,-168.0875,World Geodetic System 1984,4321,m,GeoLocate,GeoLocate,Adam Glueckert,2016-09-21,Cepphus columba,CHAS:Bird:2229,05/30/1929,1929-05-30,1929-05-30,accepted place of collection,unverified
"North America, United States, Alaska, Nome Quad",Wales,,65.609167,-168.0875,World Geodetic System 1984,4321,m,GeoLocate,GeoLocate,Adam Glueckert,2016-09-21,Tachycineta bicolor,CHAS:Bird:2025,07/30/1928,1928-07-30,1928-07-30,accepted place of collection,unverified
"North America, United States, Alaska, Nome Quad",Wales,,65.609167,-168.0875,World Geodetic System 1984,4321,m,GeoLocate,GeoLocate,Adam Glueckert,2016-09-21,Progne subis subis,CHAS:Bird:2240,06/03/1929,1929-06-03,1929-06-03,accepted place of collection,unverified
"North America, United States, Alaska, Nome Quad",Wales,,65.609167,-168.0875,World Geodetic System 1984,4321,m,GeoLocate,GeoLocate,Adam Glueckert,2016-09-21,Lagopus muta,CHAS:Bird:1968,05/28/1928,1928-05-28,1928-05-28,accepted place of collection,unverified
"North America, United States, Alaska, Nome Quad",Wales,,65.609167,-168.0875,World Geodetic System 1984,4321,m,GeoLocate,GeoLocate,Adam Glueckert,2016-09-21,Motacilla flava,CHAS:Bird:2599,06/17/1929,1929-06-17,1929-06-17,accepted place of collection,unverified
"North America, United States, Alaska, Nome Quad",Wales,,65.609167,-168.0875,World Geodetic System 1984,4321,m,GeoLocate,GeoLocate,Adam Glueckert,2016-09-21,Motacilla flava,CHAS:Bird:2630,06/17/1929,1929-06-17,1929-06-17,accepted place of collection,unverified
"North America, United States, Alaska, Nome Quad",Wales,Alaska: Wales,65.609167,-168.0875,World Geodetic System 1984,4321,m,GeoLocate,GeoLocate,Adam Glueckert,2016-09-21,Carduelis hornemanni,CHAS:Bird:2242,06/28/1929,1929-06-28,1929-06-28,accepted place of collection,unverified
"North America, United States, Alaska, Nome Quad",Wales,,65.609167,-168.0875,World Geodetic System 1984,4321,m,GeoLocate,GeoLocate,Adam Glueckert,2016-09-21,Calcarius lapponicus alacensis,CHAS:Bird:2079,06/12/1928,1928-06-12,1928-06-12,accepted place of collection,unverified
"North America, United States, Alaska, Nome Quad",Wales,,65.609167,-168.0875,World Geodetic System 1984,4321,m,GeoLocate,GeoLocate,Adam Glueckert,2016-09-21,Calcarius lapponicus alacensis,CHAS:Bird:2216,06/13/1929,1929-06-13,1929-06-13,accepted place of collection,unverified
"North America, United States, Alaska, Nome Quad",Wales,,65.609167,-168.0875,World Geodetic System 1984,4321,m,GeoLocate,GeoLocate,Adam Glueckert,2016-09-21,Clangula hyemalis,CHAS:Bird:2017,06/19/1928,1928-06-19,1928-06-19,accepted place of collection,unverified
"North America, United States, Alaska, Nome Quad",Wales,,65.609167,-168.0875,World Geodetic System 1984,4321,m,GeoLocate,GeoLocate,Adam Glueckert,2016-09-21,Clangula hyemalis,CHAS:Bird:2027,05/28/1928,1928-05-28,1928-05-28,accepted place of collection,unverified
"North America, United States, Alaska, Nome Quad",Wales,,65.609167,-168.0875,World Geodetic System 1984,4321,m,GeoLocate,GeoLocate,Adam Glueckert,2016-09-21,Clangula hyemalis,CHAS:Bird:2028,05/12/1928,1928-05-12,1928-05-12,accepted place of collection,unverified
"North America, United States, Alaska, Nome Quad",Wales,,65.609167,-168.0875,World Geodetic System 1984,4321,m,GeoLocate,GeoLocate,Adam Glueckert,2016-09-21,Clangula hyemalis,CHAS:Bird:2197,06/11/1929,1929-06-11,1929-06-11,accepted place of collection,unverified
"North America, United States, Alaska, Nome Quad",Wales,,65.609167,-168.0875,World Geodetic System 1984,4321,m,GeoLocate,GeoLocate,Adam Glueckert,2016-09-21,Clangula hyemalis,CHAS:Bird:2307,05/31/1929,1929-05-31,1929-05-31,accepted place of collection,unverified
"North America, United States, Alaska, Nome Quad",Wales,,65.609167,-168.0875,World Geodetic System 1984,4321,m,GeoLocate,GeoLocate,Adam Glueckert,2016-09-21,Clangula hyemalis,CHAS:Bird:1951,05/15/1928,1928-05-15,1928-05-15,accepted place of collection,unverified
"North America, United States, Alaska, Nome Quad",Wales,,65.609167,-168.0875,World Geodetic System 1984,4321,m,GeoLocate,GeoLocate,Adam Glueckert,2016-09-21,Clangula hyemalis,CHAS:Bird:1955,06/30/1928,1928-06-30,1928-06-30,accepted place of collection,unverified
"North America, United States, Alaska, Nome Quad",Wales,,65.609167,-168.0875,World Geodetic System 1984,4321,m,GeoLocate,GeoLocate,Adam Glueckert,2016-09-21,Clangula hyemalis,CHAS:Bird:2193,06/08/1929,1929-06-08,1929-06-08,accepted place of collection,unverified
"North America, United States, Alaska, Nome Quad",Wales,,65.609167,-168.0875,World Geodetic System 1984,4321,m,GeoLocate,GeoLocate,Adam Glueckert,2016-09-21,Clangula hyemalis,CHAS:Bird:2194,06/17/1929,1929-06-17,1929-06-17,accepted place of collection,unverified
"North America, United States, Alaska, Nome Quad",Wales,,65.609167,-168.0875,World Geodetic System 1984,4321,m,GeoLocate,GeoLocate,Adam Glueckert,2016-09-21,Clangula hyemalis,CHAS:Bird:2195,05/30/1929,1929-05-30,1929-05-30,accepted place of collection,unverified
"North America, United States, Alaska, Nome Quad",Wales,,65.609167,-168.0875,World Geodetic System 1984,4321,m,GeoLocate,GeoLocate,Adam Glueckert,2016-09-21,Clangula hyemalis,CHAS:Bird:2196,05/31/1929,1929-05-31,1929-05-31,accepted place of collection,unverified
"North America, United States, Alaska, Nome Quad",Wales,,65.609167,-168.0875,World Geodetic System 1984,4321,m,GeoLocate,GeoLocate,Adam Glueckert,2016-09-21,Clangula hyemalis,CHAS:Bird:2308,05/30/1929,1929-05-30,1929-05-30,accepted place of collection,unverified
"North America, United States, Alaska, Nome Quad",Wales,,65.609167,-168.0875,World Geodetic System 1984,4321,m,GeoLocate,GeoLocate,Adam Glueckert,2016-09-21,Clangula hyemalis,CHAS:Bird:2309,06/06/1929,1929-06-06,1929-06-06,accepted place of collection,unverified
"North America, United States, Alaska, Nome Quad",Wales,,65.609167,-168.0875,World Geodetic System 1984,4321,m,GeoLocate,GeoLocate,Adam Glueckert,2016-09-21,Gavia arctica viriduglaris,CHAS:Bird:2228,06/24/1929,1929-06-24,1929-06-24,accepted place of collection,unverified
"North America, United States, Alaska, Nome Quad",Wales,,65.609167,-168.0875,World Geodetic System 1984,4321,m,GeoLocate,GeoLocate,Adam Glueckert,2016-09-21,Gavia stellata,CHAS:Bird:2312,06/03/1929,1929-06-03,1929-06-03,accepted place of collection,unverified
"North America, United States, Alaska, Nome Quad",Wales,,65.609167,-168.0875,World Geodetic System 1984,4321,m,GeoLocate,GeoLocate,Adam Glueckert,2016-09-21,Gavia stellata,CHAS:Bird:2605,06/26/1929,1929-06-26,1929-06-26,accepted place of collection,unverified
"North America, United States, Alaska, Nome Quad",Wales,,65.609167,-168.0875,World Geodetic System 1984,4321,m,GeoLocate,GeoLocate,Adam Glueckert,2016-09-21,Gavia pacifica,CHAS:Bird:2607,06/15/1929,1929-06-15,1929-06-15,accepted place of collection,unverified
"North America, United States, Alaska, Nome Quad",Wales,,65.609167,-168.0875,World Geodetic System 1984,4321,m,GeoLocate,GeoLocate,Adam Glueckert,2016-09-21,Gavia pacifica,CHAS:Bird:2311,06/11/1929,1929-06-11,1929-06-11,accepted place of collection,unverified
"North America, United States, Alaska, Nome Quad",Wales,,65.609167,-168.0875,World Geodetic System 1984,4321,m,GeoLocate,GeoLocate,Adam Glueckert,2016-09-21,Gavia pacifica,CHAS:Bird:2606,06/11/1929,1929-06-11,1929-06-11,accepted place of collection,unverified
"North America, United States, Alaska, Nome Quad",Wales,,65.609167,-168.0875,World Geodetic System 1984,4321,m,GeoLocate,GeoLocate,Adam Glueckert,2016-09-21,Gavia pacifica,CHAS:Bird:2608,06/18/1929,1929-06-18,1929-06-18,accepted place of collection,unverified
"North America, United States, Alaska, Nome Quad",Wales,,65.609167,-168.0875,World Geodetic System 1984,4321,m,GeoLocate,GeoLocate,Adam Glueckert,2016-09-21,Gavia pacifica,CHAS:Bird:2609,06/18/1929,1929-06-18,1929-06-18,accepted place of collection,unverified
"North America, United States, Alaska, Nome Quad",Wales,,65.609167,-168.0875,World Geodetic System 1984,4321,m,GeoLocate,GeoLocate,Adam Glueckert,2016-09-21,Gavia adamsii,CHAS:Bird:2610,06/03/1929,1929-06-03,1929-06-03,accepted place of collection,unverified
"North America, United States, Alaska, Nome Quad",Wales,,65.609167,-168.0875,World Geodetic System 1984,4321,m,GeoLocate,GeoLocate,Adam Glueckert,2016-09-21,Gavia adamsii,CHAS:Bird:2611,06/23/1929,1929-06-23,1929-06-23,accepted place of collection,unverified
"North America, United States, Alaska, Nome Quad",Wales,,65.609167,-168.0875,World Geodetic System 1984,4321,m,GeoLocate,GeoLocate,Adam Glueckert,2016-09-21,Gavia stellata,CHAS:Bird:2313,06/06/1929,1929-06-06,1929-06-06,accepted place of collection,unverified
"North America, United States, Alaska, Nome Quad",Wales,,65.609167,-168.0875,World Geodetic System 1984,4321,m,GeoLocate,GeoLocate,Adam Glueckert,2016-09-21,Gavia stellata,CHAS:Bird:2604,06/11/1929,1929-06-11,1929-06-11,accepted place of collection,unverified
"North America, United States, Alaska, Nome Quad",Wales,,65.609167,-168.0875,World Geodetic System 1984,4321,m,GeoLocate,GeoLocate,Adam Glueckert,2016-09-21,Fulmarus glacialis rodgersii,CHAS:Bird:2265.1,05/30/1929,1929-05-30,1929-05-30,accepted place of collection,unverified
"North America, United States, Alaska, Nome Quad",Wales,,65.609167,-168.0875,World Geodetic System 1984,4321,m,GeoLocate,GeoLocate,Adam Glueckert,2016-09-21,Sterna paradisaea,CHAS:Bird:2212,06/05/1929,1929-06-05,1929-06-05,accepted place of collection,unverified
"North America, United States, Alaska, Nome Quad",Wales,,65.609167,-168.0875,World Geodetic System 1984,4321,m,GeoLocate,GeoLocate,Adam Glueckert,2016-09-21,Calidris mauri,CHAS:Bird:2594,06/19/1929,1929-06-19,1929-06-19,accepted place of collection,unverified
"North America, United States, Alaska, Nome Quad",Wales,,65.609167,-168.0875,World Geodetic System 1984,4321,m,GeoLocate,GeoLocate,Adam Glueckert,2016-09-21,Phalaropus fulicarius,CHAS:Bird:2620,06/05/1924,1924-06-05,1924-06-05,accepted place of collection,unverified
"North America, United States, Alaska, Nome Quad",Wales,,65.609167,-168.0875,World Geodetic System 1984,4321,m,GeoLocate,GeoLocate,Adam Glueckert,2016-09-21,Mergus serrator,CHAS:Bird:2019,06/12/1928,1928-06-12,1928-06-12,accepted place of collection,unverified
"North America, United States, Alaska, Nome Quad",Wales,,65.609167,-168.0875,World Geodetic System 1984,4321,m,GeoLocate,GeoLocate,Adam Glueckert,2016-09-21,Mergus serrator,CHAS:Bird:2279,06/18/1929,1929-06-18,1929-06-18,accepted place of collection,unverified
"North America, United States, Alaska, Nome Quad",Wales,,65.609167,-168.0875,World Geodetic System 1984,4321,m,GeoLocate,GeoLocate,Adam Glueckert,2016-09-21,Mergus serrator,CHAS:Bird:2280,06/18/1929,1929-06-18,1929-06-18,accepted place of collection,unverified
"North America, United States, Alaska, Nome Quad",Wales,,65.609167,-168.0875,World Geodetic System 1984,4321,m,GeoLocate,GeoLocate,Adam Glueckert,2016-09-21,Calidris pusilla,CHAS:Bird:5167,06/21/1926,1926-06-21,1926-06-21,accepted place of collection,unverified
"North America, United States, Alaska, Nome Quad",Wales,"Wales, Alas.",65.609167,-168.0875,World Geodetic System 1984,4321,m,GeoLocate,GeoLocate,Adam Glueckert,2016-09-21,Stercorarius longicaudus,CHAS:Bird:5658,6/29/1931,1931-06-29,1931-06-29,accepted place of collection,unverified
"North America, United States, Alaska, Nome Quad",Wales,"Wales, Alas.",65.609167,-168.0875,World Geodetic System 1984,4321,m,GeoLocate,GeoLocate,Adam Glueckert,2016-09-21,Grus canadensis,CHAS:Bird:5655,06/03/1929,1929-06-03,1929-06-03,accepted place of collection,unverified
"North America, United States, Alaska, Nome Quad",Wales,Alaska: Wales,65.609167,-168.0875,World Geodetic System 1984,4321,m,GeoLocate,GeoLocate,Adam Glueckert,2016-09-21,Pluvialis dominica,CHAS:Bird:5266,06/06/1926,1926-06-06,1926-06-06,accepted place of collection,unverified
"North America, United States, Alaska, Nome Quad",Wales,,65.609167,-168.0875,World Geodetic System 1984,4321,m,GeoLocate,GeoLocate,Adam Glueckert,2016-09-21,Limosa lapponica baueri,CHAS:Bird:4915,06/28/1926,1926-06-28,1926-06-28,accepted place of collection,unverified
"North America, United States, Alaska, Nome Quad",Wales,,65.609167,-168.0875,World Geodetic System 1984,4321,m,GeoLocate,GeoLocate,Adam Glueckert,2016-09-21,Eremophila alpestris articola,CHAS:Bird:2241,06/06/1929,1929-06-06,1929-06-06,accepted place of collection,unverified
"North America, United States, Alaska, Nome Quad",Wales,,65.609167,-168.0875,World Geodetic System 1984,4321,m,GeoLocate,GeoLocate,Adam Glueckert,2016-09-21,Calcarius lapponicus alacensis,CHAS:Bird:2217,05/30/1929,1929-05-30,1929-05-30,accepted place of collection,unverified
"North America, United States, Alaska, Nome Quad",Wales,,65.609167,-168.0875,World Geodetic System 1984,4321,m,GeoLocate,GeoLocate,Adam Glueckert,2016-09-21,Calcarius lapponicus alacensis,CHAS:Bird:2218,06/07/1929,1929-06-07,1929-06-07,accepted place of collection,unverified
"North America, United States, Alaska, Nome Quad",Wales,,65.609167,-168.0875,World Geodetic System 1984,4321,m,GeoLocate,GeoLocate,Adam Glueckert,2016-09-21,Calcarius lapponicus alacensis,CHAS:Bird:2258,06/05/1929,1929-06-05,1929-06-05,accepted place of collection,unverified
"North America, United States, Alaska, Nome Quad",Wales,,65.609167,-168.0875,World Geodetic System 1984,4321,m,GeoLocate,GeoLocate,Adam Glueckert,2016-09-21,Melanitta nigra americana,CHAS:Bird:1949,06/24/1928,1928-06-24,1928-06-24,accepted place of collection,unverified
"North America, United States, Alaska, Nome Quad",Wales,,65.609167,-168.0875,World Geodetic System 1984,4321,m,GeoLocate,GeoLocate,Adam Glueckert,2016-09-21,Melanitta nigra americana,CHAS:Bird:2018,06/24/1928,1928-06-24,1928-06-24,accepted place of collection,unverified
"North America, United States, Alaska, Nome Quad",Wales,,65.609167,-168.0875,World Geodetic System 1984,4321,m,GeoLocate,GeoLocate,Adam Glueckert,2016-09-21,Polysticta stelleri,CHAS:Bird:2205,06/04/1929,1929-06-04,1929-06-04,accepted place of collection,unverified
"North America, United States, Alaska, Nome Quad",Wales,,65.609167,-168.0875,World Geodetic System 1984,4321,m,GeoLocate,GeoLocate,Adam Glueckert,2016-09-21,Polysticta stelleri,CHAS:Bird:2207,06/03/1929,1929-06-03,1929-06-03,accepted place of collection,unverified
"North America, United States, Alaska, Nome Quad",Wales,,65.609167,-168.0875,World Geodetic System 1984,4321,m,GeoLocate,GeoLocate,Adam Glueckert,2016-09-21,Polysticta stelleri,CHAS:Bird:2209,06/18/1929,1929-06-18,1929-06-18,accepted place of collection,unverified
"North America, United States, Alaska, Nome Quad",Wales,,65.609167,-168.0875,World Geodetic System 1984,4321,m,GeoLocate,GeoLocate,Adam Glueckert,2016-09-21,Histrionicus histrionicus,CHAS:Bird:2399,06/03/1929,1929-06-03,1929-06-03,accepted place of collection,unverified
"North America, United States, Alaska, Nome Quad",Wales,,65.609167,-168.0875,World Geodetic System 1984,4321,m,GeoLocate,GeoLocate,Adam Glueckert,2016-09-21,Polysticta stelleri,CHAS:Bird:3110,05/30/1929,1929-05-30,1929-05-30,accepted place of collection,unverified
"North America, United States, Alaska, Nome Quad",Wales,,65.609167,-168.0875,World Geodetic System 1984,4321,m,GeoLocate,GeoLocate,Adam Glueckert,2016-09-21,Somateria mollissima,CHAS:Bird:1950,06/19/1928,1928-06-19,1928-06-19,accepted place of collection,unverified
"North America, United States, Alaska, Nome Quad",Wales,,65.609167,-168.0875,World Geodetic System 1984,4321,m,GeoLocate,GeoLocate,Adam Glueckert,2016-09-21,Somateria mollissima,CHAS:Bird:2008,07/21/1928,1928-07-21,1928-07-21,accepted place of collection,unverified
"North America, United States, Alaska, Nome Quad",Wales,,65.609167,-168.0875,World Geodetic System 1984,4321,m,GeoLocate,GeoLocate,Adam Glueckert,2016-09-21,Polysticta stelleri,CHAS:Bird:2203,06/03/1929,1929-06-03,1929-06-03,accepted place of collection,unverified
"North America, United States, Alaska, Nome Quad",Wales,,65.609167,-168.0875,World Geodetic System 1984,4321,m,GeoLocate,GeoLocate,Adam Glueckert,2016-09-21,Polysticta stelleri,CHAS:Bird:2204,06/03/1929,1929-06-03,1929-06-03,accepted place of collection,unverified
"North America, United States, Alaska, Nome Quad",Wales,,65.609167,-168.0875,World Geodetic System 1984,4321,m,GeoLocate,GeoLocate,Adam Glueckert,2016-09-21,Somateria mollissima,CHAS:Bird:2723,"05/30/1929 or Mar. 20, 1929",1929-03-30,1929-05-30,accepted place of collection,unverified
"North America, United States, Alaska, Nome Quad",Wales,,65.609167,-168.0875,World Geodetic System 1984,4321,m,GeoLocate,GeoLocate,Adam Glueckert,2016-09-21,Somateria mollissima,CHAS:Bird:3116,05/30/1929,1929-05-30,1929-05-30,accepted place of collection,unverified
"North America, United States, Alaska, Nome Quad",Wales,,65.609167,-168.0875,World Geodetic System 1984,4321,m,GeoLocate,GeoLocate,Adam Glueckert,2016-09-21,Somateria mollissima,CHAS:Bird:2030,06/01/1928,1928-06-01,1928-06-01,accepted place of collection,unverified
"North America, United States, Alaska, Nome Quad",Wales,,65.609167,-168.0875,World Geodetic System 1984,4321,m,GeoLocate,GeoLocate,Adam Glueckert,2016-09-21,Somateria mollissima,CHAS:Bird:2032,06/30/1928,1928-06-30,1928-06-30,accepted place of collection,unverified
"North America, United States, Alaska, Nome Quad",Wales,,65.609167,-168.0875,World Geodetic System 1984,4321,m,GeoLocate,GeoLocate,Adam Glueckert,2016-09-21,Somateria spectabilis,CHAS:Bird:2033,05/15/1928,1928-05-15,1928-05-15,accepted place of collection,unverified
"North America, United States, Alaska, Nome Quad",Wales,,65.609167,-168.0875,World Geodetic System 1984,4321,m,GeoLocate,GeoLocate,Adam Glueckert,2016-09-21,Somateria mollissima,CHAS:Bird:2275,05/30/1929,1929-05-30,1929-05-30,accepted place of collection,unverified
"North America, United States, Alaska, Nome Quad",Wales,,65.609167,-168.0875,World Geodetic System 1984,4321,m,GeoLocate,GeoLocate,Adam Glueckert,2016-09-21,Somateria mollissima,CHAS:Bird:3298,05/30/1929,1929-05-30,1929-05-30,accepted place of collection,unverified
"North America, United States, Alaska, Nome Quad",Wales,,65.609167,-168.0875,World Geodetic System 1984,4321,m,GeoLocate,GeoLocate,Adam Glueckert,2016-09-21,Polysticta stelleri,CHAS:Bird:2003,06/21/1928,1928-06-21,1928-06-21,accepted place of collection,unverified
"North America, United States, Alaska, Nome Quad",Wales,,65.609167,-168.0875,World Geodetic System 1984,4321,m,GeoLocate,GeoLocate,Adam Glueckert,2016-09-21,Polysticta stelleri,CHAS:Bird:2034,06/05/1928,1928-06-05,1928-06-05,accepted place of collection,unverified
"North America, United States, Alaska, Nome Quad",Wales,,65.609167,-168.0875,World Geodetic System 1984,4321,m,GeoLocate,GeoLocate,Adam Glueckert,2016-09-21,Polysticta stelleri,CHAS:Bird:2198,06/10/1929,1929-06-10,1929-06-10,accepted place of collection,unverified
"North America, United States, Alaska, Nome Quad",Wales,,65.609167,-168.0875,World Geodetic System 1984,4321,m,GeoLocate,GeoLocate,Adam Glueckert,2016-09-21,Polysticta stelleri,CHAS:Bird:2200,06/11/1929,1929-06-11,1929-06-11,accepted place of collection,unverified
"North America, United States, Alaska, Nome Quad",Wales,,65.609167,-168.0875,World Geodetic System 1984,4321,m,GeoLocate,GeoLocate,Adam Glueckert,2016-09-21,Polysticta stelleri,CHAS:Bird:2201,06/11/1929,1929-06-11,1929-06-11,accepted place of collection,unverified
"North America, United States, Alaska, Nome Quad",Wales,,65.609167,-168.0875,World Geodetic System 1984,4321,m,GeoLocate,GeoLocate,Adam Glueckert,2016-09-21,Polysticta stelleri,CHAS:Bird:2202,06/11/1929,1929-06-11,1929-06-11,accepted place of collection,unverified
"North America, United States, Alaska, Nome Quad",Wales,,65.609167,-168.0875,World Geodetic System 1984,4321,m,GeoLocate,GeoLocate,Adam Glueckert,2016-09-21,Anas acuta,CHAS:Bird:2026,06/24/1928,1928-06-24,1928-06-24,accepted place of collection,unverified
"North America, United States, Alaska, Nome Quad",Wales,,65.609167,-168.0875,World Geodetic System 1984,4321,m,GeoLocate,GeoLocate,Adam Glueckert,2016-09-21,Anas acuta,CHAS:Bird:2736,"06/02/1929 or June 21, 1929",1929-06-02,1929-06-21,accepted place of collection,unverified
"North America, United States, Alaska, Nome Quad",Wales,,65.609167,-168.0875,World Geodetic System 1984,4321,m,GeoLocate,GeoLocate,Adam Glueckert,2016-09-21,Anas acuta,CHAS:Bird:2737,06/01/1929,1929-06-01,1929-06-01,accepted place of collection,unverified
"North America, United States, Alaska, Nome Quad",Wales,,65.609167,-168.0875,World Geodetic System 1984,4321,m,GeoLocate,GeoLocate,Adam Glueckert,2016-09-21,Anas acuta,CHAS:Bird:2740,06/14/1929,1929-06-14,1929-06-14,accepted place of collection,unverified
"North America, United States, Alaska, Nome Quad",Wales,,65.609167,-168.0875,World Geodetic System 1984,4321,m,GeoLocate,GeoLocate,Adam Glueckert,2016-09-21,Anas acuta,CHAS:Bird:2738,"06/11/1929 or June 1, 1929",1929-06-01,1929-06-11,accepted place of collection,unverified
"North America, United States, Alaska, Nome Quad",Wales,,65.609167,-168.0875,World Geodetic System 1984,4321,m,GeoLocate,GeoLocate,Adam Glueckert,2016-09-21,Anas acuta,CHAS:Bird:2739,05/30/1929,1929-05-30,1929-05-30,accepted place of collection,unverified
"North America, United States, Alaska, Nome Quad",Wales,,65.609167,-168.0875,World Geodetic System 1984,4321,m,GeoLocate,GeoLocate,Adam Glueckert,2016-09-21,Anas acuta,CHAS:Bird:2741,06/11/1929,1929-06-11,1929-06-11,accepted place of collection,unverified
"North America, United States, Alaska, Nome Quad",Wales,,65.609167,-168.0875,World Geodetic System 1984,4321,m,GeoLocate,GeoLocate,Adam Glueckert,2016-09-21,Branta bernicla nigricans,CHAS:Bird:2616,06/13/1929,1929-06-13,1929-06-13,accepted place of collection,unverified
"North America, United States, Alaska, Nome Quad",Wales,,65.609167,-168.0875,World Geodetic System 1984,4321,m,GeoLocate,GeoLocate,Adam Glueckert,2016-09-21,Chen caerulescens,CHAS:Bird:2274,05/26/1929,1929-05-26,1929-05-26,accepted place of collection,unverified
"North America, United States, Alaska, Nome Quad",Wales,,65.609167,-168.0875,World Geodetic System 1984,4321,m,GeoLocate,GeoLocate,Adam Glueckert,2016-09-21,Somateria spectabilis,CHAS:Bird:2020,05/15/1928,1928-05-15,1928-05-15,accepted place of collection,unverified
"North America, United States, Alaska, Nome Quad",Wales,,65.609167,-168.0875,World Geodetic System 1984,4321,m,GeoLocate,GeoLocate,Adam Glueckert,2016-09-21,Aythya marila,CHAS:Bird:2289,06/25/1929,1929-06-25,1929-06-25,accepted place of collection,unverified
"North America, United States, Alaska, Nome Quad",Wales,,65.609167,-168.0875,World Geodetic System 1984,4321,m,GeoLocate,GeoLocate,Adam Glueckert,2016-09-21,Bucephala clangula americana,CHAS:Bird:2398,06/01/1929,1929-06-01,1929-06-01,accepted place of collection,unverified
"North America, United States, Alaska, Nome Quad",Wales,,65.609167,-168.0875,World Geodetic System 1984,4321,m,GeoLocate,GeoLocate,Adam Glueckert,2016-09-21,Branta bernicla nigricans,CHAS:Bird:1953,06/24/1928,1928-06-24,1928-06-24,accepted place of collection,unverified
"North America, United States, Alaska, Nome Quad",Wales,,65.609167,-168.0875,World Geodetic System 1984,4321,m,GeoLocate,GeoLocate,Adam Glueckert,2016-09-21,Branta bernicla nigricans,CHAS:Bird:2613,06/11/1929,1929-06-11,1929-06-11,accepted place of collection,unverified
"North America, United States, Alaska, Nome Quad",Wales,,65.609167,-168.0875,World Geodetic System 1984,4321,m,GeoLocate,GeoLocate,Adam Glueckert,2016-09-21,Branta bernicla nigricans,CHAS:Bird:2614,06/11/1929,1929-06-11,1929-06-11,accepted place of collection,unverified
"North America, United States, Alaska, Nome Quad",Wales,,65.609167,-168.0875,World Geodetic System 1984,4321,m,GeoLocate,GeoLocate,Adam Glueckert,2016-09-21,Branta bernicla nigricans,CHAS:Bird:2615,06/11/1929,1929-06-11,1929-06-11,accepted place of collection,unverified
"North America, United States, Alaska, Nome Quad",Wales,,65.609167,-168.0875,World Geodetic System 1984,4321,m,GeoLocate,GeoLocate,Adam Glueckert,2016-09-21,Polysticta stelleri,CHAS:Bird:2206,05/30/1929,1929-05-30,1929-05-30,accepted place of collection,unverified
"North America, United States, Alaska, Nome Quad",Wales,,65.609167,-168.0875,World Geodetic System 1984,4321,m,GeoLocate,GeoLocate,Adam Glueckert,2016-09-21,Polysticta stelleri,CHAS:Bird:2208,06/11/1929,1929-06-11,1929-06-11,accepted place of collection,unverified
"North America, United States, Alaska, Nome Quad",Wales,"Wales, Alaska",65.609167,-168.0875,World Geodetic System 1984,4321,m,GeoLocate,GeoLocate,Adam Glueckert,2016-10-19,Calidris ptilocnemis,CHAS:Bird:5785,06/13/1932,1932-06-13,1932-06-13,accepted place of collection,unverified
"North America, United States, Alaska, Nome Quad",Wales,"Wales, Alaska",65.609167,-168.0875,World Geodetic System 1984,4321,m,GeoLocate,GeoLocate,Adam Glueckert,2016-09-21,Calidris bairdii,CHAS:Bird:5809,06/11/1932,1932-06-11,1932-06-11,accepted place of collection,unverified
"North America, United States, Alaska, Nome Quad",Wales,on tundra,65.609167,-168.0875,World Geodetic System 1984,4321,m,GeoLocate,GeoLocate,Adam Glueckert,2016-09-21,Calidris melanotos,CHAS:Bird:7112,06/18/1934,1934-06-18,1934-06-18,accepted place of collection,unverified
"North America, United States, Alaska, Nome Quad",Wales,"Wales, Alaska",65.609167,-168.0875,World Geodetic System 1984,4321,m,GeoLocate,GeoLocate,Adam Glueckert,2016-09-21,Calidris alpina sakhalina,CHAS:Bird:5810,06/14/1932,1932-06-14,1932-06-14,accepted place of collection,unverified
"North America, United States, Alaska, Nome Quad",Wales,"Wales, Alaska",65.609167,-168.0875,World Geodetic System 1984,4321,m,GeoLocate,GeoLocate,Adam Glueckert,2016-09-21,Phalaropus fulicarius,CHAS:Bird:1934.4191.1,06/12/1931,1931-06-12,1931-06-12,accepted place of collection,unverified
"North America, United States, Alaska, Nome Quad",Wales,"Wales, Alaska",65.609167,-168.0875,World Geodetic System 1984,4321,m,GeoLocate,GeoLocate,Adam Glueckert,2016-09-21,Phalaropus fulicarius,CHAS:Bird:6367,06/26/1933,1933-06-26,1933-06-26,accepted place of collection,unverified
"North America, United States, Alaska, Nome Quad",Wales,"Wales, Alaska",65.609167,-168.0875,World Geodetic System 1984,4321,m,GeoLocate,GeoLocate,Adam Glueckert,2016-09-21,Calidris ptilocnemis,CHAS:Bird:5811,06/10/1932,1932-06-10,1932-06-10,accepted place of collection,unverified
"North America, United States, Alaska, Nome Quad",Wales,"Wales, Alaska",65.609167,-168.0875,World Geodetic System 1984,4321,m,GeoLocate,GeoLocate,Adam Glueckert,2016-09-21,Calidris mauri,CHAS:Bird:6362,06/07/1933,1933-06-07,1933-06-07,accepted place of collection,unverified
"North America, United States, Alaska, Nome Quad",Wales,"Wales, Alaska",65.609167,-168.0875,World Geodetic System 1984,4321,m,GeoLocate,GeoLocate,Adam Glueckert,2016-09-21,Calidris alpina sakhalina,CHAS:Bird:5812,06/10/1932,1932-06-10,1932-06-10,accepted place of collection,unverified
"North America, United States, Alaska, Nome Quad",Wales,"Wales, Alaska",65.609167,-168.0875,World Geodetic System 1984,4321,m,GeoLocate,GeoLocate,Adam Glueckert,2016-09-21,Phalaropus fulicarius,CHAS:Bird:6365,06/27/1933,1933-06-27,1933-06-27,accepted place of collection,unverified
"North America, United States, Alaska, Nome Quad",Wales,"Wales, Alaska",65.609167,-168.0875,World Geodetic System 1984,4321,m,GeoLocate,GeoLocate,Adam Glueckert,2016-09-21,Calidris melanotos,CHAS:Bird:7111,06/12/1934,1934-06-12,1934-06-12,accepted place of collection,unverified
"North America, United States, Alaska, Nome Quad",Wales,"Wales, Alaska",65.609167,-168.0875,World Geodetic System 1984,4321,m,GeoLocate,GeoLocate,Adam Glueckert,2016-09-21,Phalaropus fulicarius,CHAS:Bird:6366,06/27/1933,1933-06-27,1933-06-27,accepted place of collection,unverified
"North America, United States, Alaska, Nome Quad",Wales,"Wales, Alaska",65.609167,-168.0875,World Geodetic System 1984,4321,m,GeoLocate,GeoLocate,Adam Glueckert,2016-09-21,Lagopus lagopus alascensis,CHAS:Bird:6350,06/30/1933,1933-06-30,1933-06-30,accepted place of collection,unverified
"North America, United States, Alaska, Nome Quad",Wales,"Wales, Alaska",65.609167,-168.0875,World Geodetic System 1984,4321,m,GeoLocate,GeoLocate,Adam Glueckert,2016-09-21,Calidris alpina sakhalina,CHAS:Bird:5813,06/10/1932,1932-06-10,1932-06-10,accepted place of collection,unverified
"North America, United States, Alaska, Nome Quad",Wales,"Wales, Alaska",65.609167,-168.0875,World Geodetic System 1984,4321,m,GeoLocate,GeoLocate,Adam Glueckert,2016-09-21,Calidris mauri,CHAS:Bird:7116,06/18/1934,1934-06-18,1934-06-18,accepted place of collection,unverified
"North America, United States, Alaska, Nome Quad",Wales,"Wales, Alaska",65.609167,-168.0875,World Geodetic System 1984,4321,m,GeoLocate,GeoLocate,Adam Glueckert,2016-09-21,Calidris mauri,CHAS:Bird:5808,06/06/1932,1932-06-06,1932-06-06,accepted place of collection,unverified
"North America, United States, Alaska, Nome Quad",Wales,"Wales, Alaska",65.609167,-168.0875,World Geodetic System 1984,4321,m,GeoLocate,GeoLocate,Adam Glueckert,2016-09-21,Calidris mauri,CHAS:Bird:7115,06/11/1934,1934-06-11,1934-06-11,accepted place of collection,unverified
"North America, United States, Alaska, Nome Quad",Wales,"Wales, Alaska",65.609167,-168.0875,World Geodetic System 1984,4321,m,GeoLocate,GeoLocate,Adam Glueckert,2016-09-21,Calidris alpina sakhalina,CHAS:Bird:6368,06/23/1933,1933-06-23,1933-06-23,accepted place of collection,unverified
"North America, United States, Alaska, Nome Quad",Wales,"Wales, Alaska",65.609167,-168.0875,World Geodetic System 1984,4321,m,GeoLocate,GeoLocate,Adam Glueckert,2016-09-21,Calidris mauri,CHAS:Bird:6364,06/24/1933,1933-06-24,1933-06-24,accepted place of collection,unverified
"North America, United States, Alaska, Nome Quad",Wales,"Wales, Alaska",65.609167,-168.0875,World Geodetic System 1984,4321,m,GeoLocate,GeoLocate,Adam Glueckert,2016-09-21,Calidris melanotos,CHAS:Bird:7110,06/12/1934,1934-06-12,1934-06-12,accepted place of collection,unverified
"North America, United States, Alaska, Nome Quad",Wales,"Wales, Alaska",65.609167,-168.0875,World Geodetic System 1984,4321,m,GeoLocate,GeoLocate,Adam Glueckert,2016-09-21,Arenaria interpres morinella,CHAS:Bird:6353,06/29/1933,1933-06-29,1933-06-29,accepted place of collection,unverified
"North America, United States, Alaska, Nome Quad",Wales,"Wales, Alaska",65.609167,-168.0875,World Geodetic System 1984,4321,m,GeoLocate,GeoLocate,Adam Glueckert,2016-09-21,Calidris bairdii,CHAS:Bird:7113,06/10/1934,1934-06-10,1934-06-10,accepted place of collection,unverified
"North America, United States, Alaska, Nome Quad",Wales,"Wales, Alaska",65.609167,-168.0875,World Geodetic System 1984,4321,m,GeoLocate,GeoLocate,Adam Glueckert,2016-09-21,Calidris ruficollis,CHAS:Bird:6363,06/24/1933,1933-06-24,1933-06-24,accepted place of collection,unverified
"North America, United States, Alaska, Nome Quad",Wales,up hills among the rock,65.609167,-168.0875,World Geodetic System 1984,4321,m,GeoLocate,GeoLocate,Adam Glueckert,2016-10-19,Carduelis flammea,CHAS:Bird:7129,06/18/1934,1934-06-18,1934-06-18,accepted place of collection,unverified
"North America, United States, Alaska, Nome Quad",Wales,"Wales, Alaska",65.609167,-168.0875,World Geodetic System 1984,4321,m,GeoLocate,GeoLocate,Adam Glueckert,2016-09-21,Gavia arctica viriduglaris,CHAS:Bird:7124,06/25/1934,1934-06-25,1934-06-25,accepted place of collection,unverified
"North America, United States, Alaska, Nome Quad",Wales,"Wales, Alaska",65.609167,-168.0875,World Geodetic System 1984,4321,m,GeoLocate,GeoLocate,Adam Glueckert,2016-09-21,Calidris mauri,CHAS:Bird:6354,06/23/1933,1933-06-23,1933-06-23,accepted place of collection,unverified
"North America, United States, Alaska, Nome Quad",Wales,"Wales, Alaska",65.609167,-168.0875,World Geodetic System 1984,4321,m,GeoLocate,GeoLocate,Adam Glueckert,2016-09-21,Calidris mauri,CHAS:Bird:6355,06/24/1933,1933-06-24,1933-06-24,accepted place of collection,unverified
"North America, United States, Alaska, Nome Quad",Wales,"Wales, Alaska",65.609167,-168.0875,World Geodetic System 1984,4321,m,GeoLocate,GeoLocate,Adam Glueckert,2016-09-21,Calidris mauri,CHAS:Bird:6356,06/27/1933,1933-06-27,1933-06-27,accepted place of collection,unverified
"North America, United States, Alaska, Nome Quad",Wales,"Wales, Alaska",65.609167,-168.0875,World Geodetic System 1984,4321,m,GeoLocate,GeoLocate,Adam Glueckert,2016-09-21,Calidris bairdii,CHAS:Bird:6357,06/23/1933,1933-06-23,1933-06-23,accepted place of collection,unverified
"North America, United States, Alaska, Nome Quad",Wales,"Wales, Alaska",65.609167,-168.0875,World Geodetic System 1984,4321,m,GeoLocate,GeoLocate,Adam Glueckert,2016-09-21,Plectrophenax nivalis nivalis,CHAS:Bird:6358,06/26/1933,1933-06-26,1933-06-26,accepted place of collection,unverified
"North America, United States, Alaska, Nome Quad",Wales,,65.609167,-168.0875,World Geodetic System 1984,4321,m,GeoLocate,GeoLocate,Adam Glueckert,2016-09-21,Clangula hyemalis,CHAS:Bird:5193,07/03/1931,1931-07-03,1931-07-03,accepted place of collection,unverified
"North America, United States, Alaska, Nome Quad",Wales,,65.609167,-168.0875,World Geodetic System 1984,4321,m,GeoLocate,GeoLocate,Adam Glueckert,2016-09-21,Calcarius lapponicus alacensis,CHAS:Bird:5200,06/17/1931,1931-06-17,1931-06-17,accepted place of collection,unverified
"North America, United States, Alaska, Nome Quad",Wales,,65.609167,-168.0875,World Geodetic System 1984,4321,m,GeoLocate,GeoLocate,Adam Glueckert,2016-09-21,Phalaropus fulicarius,CHAS:Bird:5268,06/24/1931,1931-06-24,1931-06-24,accepted place of collection,unverified
"North America, United States, Alaska, Nome Quad",Wales,,65.609167,-168.0875,World Geodetic System 1984,4321,m,GeoLocate,GeoLocate,Adam Glueckert,2016-09-21,Stercorarius longicaudus,CHAS:Bird:5199,06/23/1931,1931-06-23,1931-06-23,accepted place of collection,unverified
"North America, United States, Alaska, Nome Quad",Wales,"Wales, Alaska",65.609167,-168.0875,World Geodetic System 1984,4321,m,GeoLocate,GeoLocate,Adam Glueckert,2016-09-21,Phalaropus fulicarius,CHAS:Bird:5863,06/24/1932,1932-06-24,1932-06-24,accepted place of collection,unverified
"North America, United States, Alaska, Nome Quad",Wales,,65.609167,-168.0875,World Geodetic System 1984,4321,m,GeoLocate,GeoLocate,Adam Glueckert,2016-09-21,Somateria mollissima,CHAS:Bird:5244,06/28/1931,1931-06-28,1931-06-28,accepted place of collection,unverified
"North America, United States, Alaska, Nome Quad",Wales,"Wales, Alaska",65.609167,-168.0875,World Geodetic System 1984,4321,m,GeoLocate,GeoLocate,Adam Glueckert,2016-09-21,Gavia stellata,CHAS:Bird:5900,07/08/1932,1932-07-08,1932-07-08,accepted place of collection,unverified
"North America, United States, Alaska, Nome Quad",Wales,"Wales, Alaska",65.609167,-168.0875,World Geodetic System 1984,4321,m,GeoLocate,GeoLocate,Adam Glueckert,2016-09-21,Stercorarius longicaudus,CHAS:Bird:5861,06/26/1932,1932-06-26,1932-06-26,accepted place of collection,unverified
"North America, United States, Alaska, Nome Quad",Wales,"Wales, Alaska",65.609167,-168.0875,World Geodetic System 1984,4321,m,GeoLocate,GeoLocate,Adam Glueckert,2016-09-21,Calidris bairdii,CHAS:Bird:5868,06/26/1932,1932-06-26,1932-06-26,accepted place of collection,unverified
"North America, United States, Alaska, Nome Quad",Wales,,65.609167,-168.0875,World Geodetic System 1984,4321,m,GeoLocate,GeoLocate,Adam Glueckert,2016-09-21,Gavia arctica viriduglaris,CHAS:Bird:5191,06/29/1931,1931-06-29,1931-06-29,accepted place of collection,unverified
"North America, United States, Alaska, Nome Quad",Wales,,65.609167,-168.0875,World Geodetic System 1984,4321,m,GeoLocate,GeoLocate,Adam Glueckert,2016-09-21,Calidris alpina pacifica,CHAS:Bird:5203,06/23/1931,1931-06-23,1931-06-23,accepted place of collection,unverified
"North America, United States, Alaska, Nome Quad",Wales,"Wales, Alaska",65.609167,-168.0875,World Geodetic System 1984,4321,m,GeoLocate,GeoLocate,Adam Glueckert,2016-09-21,Calidris alpina sakhalina,CHAS:Bird:5862,06/10/1932,1932-06-10,1932-06-10,accepted place of collection,unverified
"North America, United States, Alaska, Nome Quad",Wales,"Wales, Alaska",65.609167,-168.0875,World Geodetic System 1984,4321,m,GeoLocate,GeoLocate,Adam Glueckert,2016-09-21,Somateria spectabilis,CHAS:Bird:5926,05/24/1932,1932-05-24,1932-05-24,accepted place of collection,unverified
"North America, United States, Alaska, Nome Quad",Wales,Alaska: Wales,65.609167,-168.0875,World Geodetic System 1984,4321,m,GeoLocate,GeoLocate,Adam Glueckert,2016-09-21,Charadrius morinellus,CHAS:Bird:5123,06/06/1931,1931-06-06,1931-06-06,accepted place of collection,unverified
"North America, United States, Alaska, Nome Quad",Wales,"Wales, Alaska",65.609167,-168.0875,World Geodetic System 1984,4321,m,GeoLocate,GeoLocate,Adam Glueckert,2016-09-21,Calidris ptilocnemis,CHAS:Bird:5865,06/20/1932,1932-06-20,1932-06-20,accepted place of collection,unverified
"North America, United States, Alaska, Nome Quad",Wales,,65.609167,-168.0875,World Geodetic System 1984,4321,m,GeoLocate,GeoLocate,Adam Glueckert,2016-09-21,Calidris mauri,CHAS:Bird:5202,06/25/1931,1931-06-25,1931-06-25,accepted place of collection,unverified
"North America, United States, Alaska, Nome Quad",Wales,,65.609167,-168.0875,World Geodetic System 1984,4321,m,GeoLocate,GeoLocate,Adam Glueckert,2016-09-21,Calidris mauri,CHAS:Bird:5270,06/25/1931,1931-06-25,1931-06-25,accepted place of collection,unverified
"North America, United States, Alaska, Nome Quad",Wales,,65.609167,-168.0875,World Geodetic System 1984,4321,m,GeoLocate,GeoLocate,Adam Glueckert,2016-09-21,Calidris mauri,CHAS:Bird:5311,06/17/1931,1931-06-17,1931-06-17,accepted place of collection,unverified
"North America, United States, Alaska, Nome Quad",Wales,,65.609167,-168.0875,World Geodetic System 1984,4321,m,GeoLocate,GeoLocate,Adam Glueckert,2016-09-21,Calidris alpina sakhalina,CHAS:Bird:5204,06/23/1931,1931-06-23,1931-06-23,accepted place of collection,unverified
"North America, United States, Alaska, Nome Quad",Wales,,65.609167,-168.0875,World Geodetic System 1984,4321,m,GeoLocate,GeoLocate,Adam Glueckert,2016-09-21,Phalaropus fulicarius,CHAS:Bird:5205,06/24/1931,1931-06-24,1931-06-24,accepted place of collection,unverified
"North America, United States, Alaska, Nome Quad",Wales,,65.609167,-168.0875,World Geodetic System 1984,4321,m,GeoLocate,GeoLocate,Adam Glueckert,2016-09-21,Phalaropus fulicarius,CHAS:Bird:5206,06/17/1931,1931-06-17,1931-06-17,accepted place of collection,unverified
"North America, United States, Alaska, Nome Quad",Wales,,65.609167,-168.0875,World Geodetic System 1984,4321,m,GeoLocate,GeoLocate,Adam Glueckert,2016-09-21,Phalaropus fulicarius,CHAS:Bird:5262,06/24/1931,1931-06-24,1931-06-24,accepted place of collection,unverified
"North America, United States, Alaska, Nome Quad",Wales,,65.609167,-168.0875,World Geodetic System 1984,4321,m,GeoLocate,GeoLocate,Adam Glueckert,2016-09-21,Phalaropus lobatus,CHAS:Bird:5265,06/17/1931,1931-06-17,1931-06-17,accepted place of collection,unverified
"North America, United States, Alaska, Nome Quad",Wales,"Wales, Alaska",65.609167,-168.0875,World Geodetic System 1984,4321,m,GeoLocate,GeoLocate,Adam Glueckert,2016-09-21,Junco hyemalis hyemalis,CHAS:Bird:5818,05/30/1932,1932-05-30,1932-05-30,accepted place of collection,unverified
"North America, United States, Alaska, Nome Quad",Wales,"Wales, Alaska",65.609167,-168.0875,World Geodetic System 1984,4321,m,GeoLocate,GeoLocate,Adam Glueckert,2016-09-21,Plectrophenax nivalis nivalis,CHAS:Bird:5864,06/22/1932,1932-06-22,1932-06-22,accepted place of collection,unverified
"North America, United States, Alaska, Nome Quad",Wales,,65.609167,-168.0875,World Geodetic System 1984,4321,m,GeoLocate,GeoLocate,Adam Glueckert,2016-09-21,Polysticta stelleri,CHAS:Bird:5197,06/03/1931,1931-06-03,1931-06-03,accepted place of collection,unverified
"North America, United States, Alaska, Nome Quad",Wales,,65.609167,-168.0875,World Geodetic System 1984,4321,m,GeoLocate,GeoLocate,Adam Glueckert,2016-09-21,Histrionicus histrionicus pacificus,CHAS:Bird:5247,05/30/1931,1931-05-30,1931-05-30,accepted place of collection,unverified
"North America, United States, Alaska, Nome Quad",Wales,,65.609167,-168.0875,World Geodetic System 1984,4321,m,GeoLocate,GeoLocate,Adam Glueckert,2016-09-21,Polysticta stelleri,CHAS:Bird:5248,06/19/1931,1931-06-19,1931-06-19,accepted place of collection,unverified
"North America, United States, Alaska, Nome Quad",Wales,,65.609167,-168.0875,World Geodetic System 1984,4321,m,GeoLocate,GeoLocate,Adam Glueckert,2016-09-21,Chen canagica,CHAS:Bird:5250,06/28/1931,1931-06-28,1931-06-28,accepted place of collection,unverified
"North America, United States, Alaska, Nome Quad",Wales,,65.609167,-168.0875,World Geodetic System 1984,4321,m,GeoLocate,GeoLocate,Adam Glueckert,2016-09-21,Chen canagica,CHAS:Bird:5194,06/28/1931,1931-06-28,1931-06-28,accepted place of collection,unverified
"North America, United States, Alaska, Nome Quad",Wales,,65.609167,-168.0875,World Geodetic System 1984,4321,m,GeoLocate,GeoLocate,Adam Glueckert,2016-09-21,Gavia arctica viriduglaris,CHAS:Bird:5192,06/23/1931,1931-06-23,1931-06-23,accepted place of collection,unverified
"North America, United States, Alaska, Nome Quad",Wales,,65.609167,-168.0875,World Geodetic System 1984,4321,m,GeoLocate,GeoLocate,Adam Glueckert,2016-09-21,Anas acuta,CHAS:Bird:5198,07/01/1931,1931-07-01,1931-07-01,accepted place of collection,unverified
"North America, United States, Alaska, Nome Quad",Wales,,65.609167,-168.0875,World Geodetic System 1984,4321,m,GeoLocate,GeoLocate,Adam Glueckert,2016-09-21,Somateria fischeri,CHAS:Bird:5195,06/03/1931,1931-06-03,1931-06-03,accepted place of collection,unverified
"North America, United States, Alaska, Nome Quad",Wales,,65.609167,-168.0875,World Geodetic System 1984,4321,m,GeoLocate,GeoLocate,Adam Glueckert,2016-09-21,Somateria fischeri,CHAS:Bird:5196,05/23/1931,1931-05-23,1931-05-23,accepted place of collection,unverified
"North America, United States, Alaska, Nome Quad",Wales,"Woles, Alaska",65.609167,-168.0875,World Geodetic System 1984,4321,m,GeoLocate,GeoLocate,Adam Glueckert,2016-09-21,Phalaropus fulicarius,CHAS:Bird:6186,06/06/1932,1932-06-06,1932-06-06,accepted place of collection,unverified
"North America, United States, Alaska, Nome Quad",Wales,"Wales, Alaska",65.609167,-168.0875,World Geodetic System 1984,4321,m,GeoLocate,GeoLocate,Adam Glueckert,2016-09-21,Pluvialis fulva,CHAS:Bird:6351,07/07/1933,1933-07-07,1933-07-07,accepted place of collection,unverified
"North America, United States, Alaska, Nome Quad",Wales,,65.609167,-168.0875,World Geodetic System 1984,4321,m,GeoLocate,GeoLocate,Adam Glueckert,2016-09-21,Somateria fischeri,CHAS:Bird:19317,06/21/1934,1934-06-21,1934-06-21,accepted place of collection,unverified
"North America, United States, Alaska, Nome Quad",Wales,,65.609167,-168.0875,World Geodetic System 1984,4321,m,GeoLocate,GeoLocate,Adam Glueckert,2016-09-21,Chen canagica,CHAS:Bird:1952,06/23/1928,1928-06-23,1928-06-23,accepted place of collection,unverified
"North America, United States, Alaska, Nome Quad","Wales, Mint River",Mint River,65.743766,-167.49777,World Geodetic System 1984,1080,m,GeoLocate,GeoLocate,Adam Glueckert,2016-12-07,Lagopus muta,CHAS:Bird:5142,07/03/1924,1924-07-03,1924-07-03,accepted place of collection,unverified
"North America, United States, Alaska, Nome Quad","Wales, Mint River",Mint River,65.743766,-167.49777,World Geodetic System 1984,1080,m,GeoLocate,GeoLocate,Adam Glueckert,2016-12-07,Limosa lapponica baueri,CHAS:Bird:4914,06/28/1926,1926-06-28,1926-06-28,accepted place of collection,unverified
"North America, United States, Alaska, Nome Quad","Wales, Mint River",Mint River,65.743766,-167.49777,World Geodetic System 1984,1080,m,GeoLocate,GeoLocate,Adam Glueckert,2016-12-07,Lagopus lagopus alba,CHAS:Bird:5145,06/26/1926,1926-06-26,1926-06-26,accepted place of collection,unverified
"North America, United States, Alaska, Nome Quad","Wales, Mint River","Mint River, Alaska",65.743766,-167.49777,World Geodetic System 1984,1080,m,GeoLocate,GeoLocate,Adam Glueckert,2016-12-07,Calidris melanotos,CHAS:Bird:6369,07/01/1933,1933-07-01,1933-07-01,accepted place of collection,unverified
"North America, United States, Alaska, Nome Quad","Wales, Mint River","Mint River, Alaska",65.743766,-167.49777,World Geodetic System 1984,1080,m,GeoLocate,GeoLocate,Adam Glueckert,2016-12-07,Phalaropus lobatus,CHAS:Bird:6352,06/29/1933,1933-06-29,1933-06-29,accepted place of collection,unverified
"North America, United States, Alaska, Nome Quad","Wales, Mint River","Mint River, Alaska",65.743766,-167.49777,World Geodetic System 1984,1080,m,GeoLocate,GeoLocate,Adam Glueckert,2016-12-07,Pluvialis fulva,CHAS:Bird:6370,07/03/1933,1933-07-03,1933-07-03,accepted place of collection,unverified
"North America, United States, Alaska, Nome Quad","Wales, Mint River","Mint River, Alaska, Wales",65.743766,-167.49777,World Geodetic System 1984,1080,m,GeoLocate,GeoLocate,Adam Glueckert,2016-12-07,Numenius hudsonicus,CHAS:Bird:5840,07/11/1932,1932-07-11,1932-07-11,accepted place of collection,unverified
"North America, United States, Alaska, Nome Quad","Wales, Mint River","Wales, Alaska (Mint River)",65.743766,-167.49777,World Geodetic System 1984,1080,m,GeoLocate,GeoLocate,Adam Glueckert,2016-12-07,Gavia adamsii,CHAS:Bird:7125,06/25/1934,1934-06-25,1934-06-25,accepted place of collection,unverified
"North America, United States, Alaska, Nome Quad","Wales, Mint River","Wales, Alaska (Mint River)",65.743766,-167.49777,World Geodetic System 1984,1080,m,GeoLocate,GeoLocate,Adam Glueckert,2016-12-07,Philacti canagica,CHAS:Bird:7118,6/24/1934,1934-06-24,1934-06-24,accepted place of collection,unverified
"North America, United States, Alaska, Nome Quad","Wales, Mint River","Wales, Alaska (Mint River)",65.743766,-167.49777,World Geodetic System 1984,1080,m,GeoLocate,GeoLocate,Adam Glueckert,2016-12-07,Philacti canagica,CHAS:Bird:7121,6/24/1934,1934-06-24,1934-06-24,accepted place of collection,unverified
"North America, United States, Alaska, Nome Quad","Wales, Mint River","Wales, Alaska (Mint River)",65.743766,-167.49777,World Geodetic System 1984,1080,m,GeoLocate,GeoLocate,Adam Glueckert,2016-12-07,Philacti canagica,CHAS:Bird:7122,6/25/1934,1934-06-25,1934-06-25,accepted place of collection,unverified
"North America, United States, Alaska, Nome Quad",Wales at Coast,"Alaska, Wales at Coast",65.609167,-168.0875,World Geodetic System 1984,4321,m,GeoLocate,GeoLocate,Adam Glueckert,2016-10-19,Gavia pacifica,CHAS:Bird:9053,7/6/1935 and 7/3/1935,1935-07-06,1935-07-06,accepted place of collection,unverified
"North America, United States, Alaska",North Slope Borough,,71.290556,-156.788611,World Geodetic System 1984,8125,m,GeoLocate,GeoLocate,Adam Glueckert,2016-09-21,Oenanthe oenanthe oenanthe,CHAS:Bird:5119,05/27/1926,1926-05-27,1926-05-27,accepted place of collection,unverified
"North America, United States, Alaska","North Slope Borough, 10 miles east of Barrow","10 mi E Barrow, Alaska",71.289441,-156.346411,World Geodetic System 1984,2971,m,GeoLocate,GeoLocate,Adam Glueckert,2016-11-09,Anas acuta,CHAS:Bird:9441,06/26/1942,1942-06-26,1942-06-26,accepted place of collection,unverified
"North America, United States, Alaska","North Slope Borough, 10 miles east of Barrow","10 miles east of Barrow, Alaska",71.289441,-156.346411,World Geodetic System 1984,2971,m,GeoLocate,GeoLocate,Adam Glueckert,2016-11-09,Pluvialis dominica,CHAS:Bird:5520,06/27/1926,1926-06-27,1926-06-27,accepted place of collection,unverified
"North America, United States, Alaska","North Slope Borough, 10 miles east of Barrow","10 miles east of Barrow, Alaska",71.289441,-156.346411,World Geodetic System 1984,2971,m,GeoLocate,GeoLocate,Adam Glueckert,2016-11-09,Pluvialis dominica,CHAS:Bird:5521,07/03/1926,1926-07-03,1926-07-03,accepted place of collection,unverified
"North America, United States, Alaska","North Slope Borough, 10 miles east of Barrow","10 miles east of Barrow, Alaska",71.289441,-156.346411,World Geodetic System 1984,2971,m,GeoLocate,GeoLocate,Adam Glueckert,2016-11-09,Pluvialis dominica,CHAS:Bird:5108,07/02/1926,1926-07-02,1926-07-02,accepted place of collection,unverified
"North America, United States, Alaska","North Slope Borough, 11 miles east of Barrow","11 miles east of Barrow, Alaska",71.289881,-156.302809,World Geodetic System 1984,2971,m,GeoLocate,GeoLocate,Adam Glueckert,2016-11-09,Pluvialis dominica,CHAS:Bird:5524,06/27/1926,1926-06-27,1926-06-27,accepted place of collection,unverified
"North America, United States, Alaska","North Slope Borough, 250 miles east of Barrow, arctic coast","250 miles east of Barrow, Arctic Coast",70.068498,-146.567206,World Geodetic System 1984,31283,m,GeoLocate,GeoLocate,Adam Glueckert,2016-11-09,Corvus corax principalis,CHAS:Bird:6685,07/10/1932,1932-07-10,1932-07-10,accepted place of collection,unverified
"North America, United States, Alaska","North Slope Borough, 250 miles east of Barrow, arctic coast","250 mi E Barrow, arctic coast",70.068498,-146.567206,World Geodetic System 1984,31283,m,GeoLocate,GeoLocate,Adam Glueckert,2016-11-09,Melanitta perspicillata,CHAS:Bird:6686,07/01/1933,1933-07-01,1933-07-01,accepted place of collection,unverified
"North America, United States, Alaska","North Slope Borough, 250 miles east of Barrow, arctic coast",250 miles east of Barrow,70.068498,-146.567206,World Geodetic System 1984,31283,m,GeoLocate,GeoLocate,Adam Glueckert,2016-11-09,Lagopus muta,CHAS:Bird:6469,05/21/1933,1933-05-21,1933-05-21,accepted place of collection,unverified
"North America, United States, Alaska","North Slope Borough, 250 miles east of Barrow, arctic coast",250 miles east of Barrow,70.068498,-146.567206,World Geodetic System 1984,31283,m,GeoLocate,GeoLocate,Adam Glueckert,2016-11-09,Lagopus muta,CHAS:Bird:6470,05/21/1933,1933-05-21,1933-05-21,accepted place of collection,unverified
"North America, United States, Alaska","North Slope Borough, 250 miles east of Barrow, arctic coast","250 miles east of Barrow, Arctic Coast",70.068498,-146.567206,World Geodetic System 1984,31283,m,GeoLocate,GeoLocate,Adam Glueckert,2016-11-09,Lagopus lagopus alba,CHAS:Bird:6474,07/08/1933,1933-07-08,1933-07-08,accepted place of collection,unverified
"North America, United States, Alaska","North Slope Borough, 250 miles east of Barrow, Collinson Point","Collinson Pt, 250 mi E Barrow, Arctic coast",70.068498,-146.567206,World Geodetic System 1984,31283,m,GeoLocate,GeoLocate,Adam Glueckert,2016-11-09,Mergus serrator,CHAS:Bird:6931.2,[transcribed directly into formatted date fields],1933-07-11,1933-07-11,accepted place of collection,unverified
"North America, United States, Alaska","North Slope Borough, Barrow","Barrow, Alaska",71.290556,-156.788611,World Geodetic System 1984,8125,m,GeoLocate,GeoLocate,Adam Glueckert,2016-09-21,Aethia cristatella,CHAS:Bird:9430,07/02/1942,1942-07-02,1942-07-02,accepted place of collection,unverified
"North America, United States, Alaska","North Slope Borough, Barrow","Barrow, Alaska",71.290556,-156.788611,World Geodetic System 1984,8125,m,GeoLocate,GeoLocate,Adam Glueckert,2016-09-21,Aethia cristatella,CHAS:Bird:9431,07/02/1942,1942-07-02,1942-07-02,accepted place of collection,unverified
"North America, United States, Alaska","North Slope Borough, Barrow","Barrow, Alaska",71.290556,-156.788611,World Geodetic System 1984,8125,m,GeoLocate,GeoLocate,Adam Glueckert,2016-09-21,Calidris alpina sakhalina,CHAS:Bird:9435,06/18/1942,1942-06-18,1942-06-18,accepted place of collection,unverified
"North America, United States, Alaska","North Slope Borough, Barrow","Barrow, Alaska",71.290556,-156.788611,World Geodetic System 1984,8125,m,GeoLocate,GeoLocate,Adam Glueckert,2016-09-21,Calidris melanotos,CHAS:Bird:9437,06/19/1942,1942-06-19,1942-06-19,accepted place of collection,unverified
"North America, United States, Alaska","North Slope Borough, Barrow","Barrow, Alaska",71.290556,-156.788611,World Geodetic System 1984,8125,m,GeoLocate,GeoLocate,Adam Glueckert,2016-09-21,Calidris fuscicollis,CHAS:Bird:9438,06/20/1942,1942-06-20,1942-06-20,accepted place of collection,unverified
"North America, United States, Alaska","North Slope Borough, Barrow","Barrow, Alaska",71.290556,-156.788611,World Geodetic System 1984,8125,m,GeoLocate,GeoLocate,Adam Glueckert,2016-09-21,Calidris bairdii,CHAS:Bird:9454,06/22/1942,1942-06-22,1942-06-22,accepted place of collection,unverified
"North America, United States, Alaska","North Slope Borough, Barrow","Barrow, Alaska",71.290556,-156.788611,World Geodetic System 1984,8125,m,GeoLocate,GeoLocate,Adam Glueckert,2016-09-21,Calidris alpina sakhalina,CHAS:Bird:9434,06/18/1942,1942-06-18,1942-06-18,accepted place of collection,unverified
"North America, United States, Alaska","North Slope Borough, Barrow","Barrow, Alaska",71.290556,-156.788611,World Geodetic System 1984,8125,m,GeoLocate,GeoLocate,Adam Glueckert,2016-09-21,Phalaropus fulicarius,CHAS:Bird:9449,06/18/1942,1942-06-18,1942-06-18,accepted place of collection,unverified
"North America, United States, Alaska","North Slope Borough, Barrow","Barrow, Alaska",71.290556,-156.788611,World Geodetic System 1984,8125,m,GeoLocate,GeoLocate,Adam Glueckert,2016-09-21,Phalaropus fulicarius,CHAS:Bird:9450,06/18/1942,1942-06-18,1942-06-18,accepted place of collection,unverified
"North America, United States, Alaska","North Slope Borough, Barrow","Barrow, Alaska",71.290556,-156.788611,World Geodetic System 1984,8125,m,GeoLocate,GeoLocate,Adam Glueckert,2016-09-21,Lagopus lagopus alascensis,CHAS:Bird:9439,07/01/1942,1942-07-01,1942-07-01,accepted place of collection,unverified
"North America, United States, Alaska","North Slope Borough, Barrow","Barrow, Alaska",71.290556,-156.788611,World Geodetic System 1984,8125,m,GeoLocate,GeoLocate,Adam Glueckert,2016-09-21,Xema sabini,CHAS:Bird:5516,06/27/1926,1926-06-27,1926-06-27,accepted place of collection,unverified
"North America, United States, Alaska","North Slope Borough, Barrow",,71.290556,-156.788611,World Geodetic System 1984,8125,m,GeoLocate,GeoLocate,Adam Glueckert,2016-09-21,Calidris pusilla,CHAS:Bird:4218,07/03/1930,1930-07-03,1930-07-03,accepted place of collection,unverified
"North America, United States, Alaska","North Slope Borough, Barrow","Barrow, Alaska",71.290556,-156.788611,World Geodetic System 1984,8125,m,GeoLocate,GeoLocate,Adam Glueckert,2016-09-21,Limnodromus scolopaceus,CHAS:Bird:7068,"06/26/1926 or June 25, 1926",1926-06-25,1926-06-26,accepted place of collection,unverified
"North America, United States, Alaska","North Slope Borough, Barrow",,71.290556,-156.788611,World Geodetic System 1984,8125,m,GeoLocate,GeoLocate,Adam Glueckert,2016-09-21,Calidris melanotos,CHAS:Bird:2626,06/22/1929,1929-06-22,1929-06-22,accepted place of collection,unverified
"North America, United States, Alaska","North Slope Borough, Barrow",,71.290556,-156.788611,World Geodetic System 1984,8125,m,GeoLocate,GeoLocate,Adam Glueckert,2016-09-21,Calidris pusilla,CHAS:Bird:2567,06/15/1929,1929-06-15,1929-06-15,accepted place of collection,unverified
"North America, United States, Alaska","North Slope Borough, Barrow",,71.290556,-156.788611,World Geodetic System 1984,8125,m,GeoLocate,GeoLocate,Adam Glueckert,2016-09-21,Calidris alpina pacifica,CHAS:Bird:2253,06/15/1929,1929-06-15,1929-06-15,accepted place of collection,unverified
"North America, United States, Alaska","North Slope Borough, Barrow","Barrow, Alaska",71.290556,-156.788611,World Geodetic System 1984,8125,m,GeoLocate,GeoLocate,Adam Glueckert,2016-09-21,Phalaropus fulicarius,CHAS:Bird:5517,06/25/1926,1926-06-25,1926-06-25,accepted place of collection,unverified
"North America, United States, Alaska","North Slope Borough, Barrow","Barrow, Alaska",71.290556,-156.788611,World Geodetic System 1984,8125,m,GeoLocate,GeoLocate,Adam Glueckert,2016-09-21,Calidris alpina sakhalina,CHAS:Bird:5518,06/28/1926,1926-06-28,1926-06-28,accepted place of collection,unverified
"North America, United States, Alaska","North Slope Borough, Barrow","Barrow, Alaska",71.290556,-156.788611,World Geodetic System 1984,8125,m,GeoLocate,GeoLocate,Adam Glueckert,2016-09-21,Calidris alpina sakhalina,CHAS:Bird:5519,06/28/1926,1926-06-28,1926-06-28,accepted place of collection,unverified
"North America, United States, Alaska","North Slope Borough, Barrow",,71.290556,-156.788611,World Geodetic System 1984,8125,m,GeoLocate,GeoLocate,Adam Glueckert,2016-09-21,Calidris alpina pacifica,CHAS:Bird:2625,06/15/1929,1929-06-15,1929-06-15,accepted place of collection,unverified
"North America, United States, Alaska","North Slope Borough, Barrow",,71.290556,-156.788611,World Geodetic System 1984,8125,m,GeoLocate,GeoLocate,Adam Glueckert,2016-09-21,Cepphus mandti,CHAS:Bird:19288,03/06/1929,1929-03-06,1929-03-06,accepted place of collection,unverified
"North America, United States, Alaska","North Slope Borough, Barrow","Barrow, Alaska",71.290556,-156.788611,World Geodetic System 1984,8125,m,GeoLocate,GeoLocate,Adam Glueckert,2016-09-21,Arenaria interpres morinella,CHAS:Bird:5844,06/17/1932,1932-06-17,1932-06-17,accepted place of collection,unverified
"North America, United States, Alaska","North Slope Borough, Barrow","Barrow, Alaska",71.290556,-156.788611,World Geodetic System 1984,8125,m,GeoLocate,GeoLocate,Adam Glueckert,2016-09-21,Pluvialis dominica,CHAS:Bird:5525,06/01/1926,1926-06-01,1926-06-01,accepted place of collection,unverified
"North America, United States, Alaska","North Slope Borough, Barrow","Barrow, Alaska",71.290556,-156.788611,World Geodetic System 1984,8125,m,GeoLocate,GeoLocate,Adam Glueckert,2016-09-21,Pluvialis dominica,CHAS:Bird:5526,07/01/1926,1926-07-01,1926-07-01,accepted place of collection,unverified
"North America, United States, Alaska","North Slope Borough, Barrow","Barrow, Alaska",71.290556,-156.788611,World Geodetic System 1984,8125,m,GeoLocate,GeoLocate,Adam Glueckert,2016-09-21,Pluvialis dominica,CHAS:Bird:5523,07/01/1926,1926-07-01,1926-07-01,accepted place of collection,unverified
"North America, United States, Alaska","North Slope Borough, Barrow",,71.290556,-156.788611,World Geodetic System 1984,8125,m,GeoLocate,GeoLocate,Adam Glueckert,2016-09-21,Gavia stellata,CHAS:Bird:2657,"""7/3/27""",1927-07-03,1927-07-03,accepted place of collection,unverified
"North America, United States, Alaska","North Slope Borough, Barrow",Barrow Alaska,71.290556,-156.788611,World Geodetic System 1984,8125,m,GeoLocate,GeoLocate,Adam Glueckert,2016-09-21,Stercorarius parasiticus,CHAS:Bird:8477,06/07/1930,1930-06-07,1930-06-07,accepted place of collection,unverified
"North America, United States, Alaska","North Slope Borough, Barrow",,71.290556,-156.788611,World Geodetic System 1984,8125,m,GeoLocate,GeoLocate,Adam Glueckert,2016-09-21,Rissa tridactyla pollicaris,CHAS:Bird:2681,09/09/1929,1929-09-09,1929-09-09,accepted place of collection,unverified
"North America, United States, Alaska","North Slope Borough, Barrow",,71.290556,-156.788611,World Geodetic System 1984,8125,m,GeoLocate,GeoLocate,Adam Glueckert,2016-09-21,Rissa tridactyla pollicaris,CHAS:Bird:2682,09/07/1929,1929-09-07,1929-09-07,accepted place of collection,unverified
"North America, United States, Alaska","North Slope Borough, Barrow","Barrow, Alaska",71.290556,-156.788611,World Geodetic System 1984,8125,m,GeoLocate,GeoLocate,Adam Glueckert,2016-09-21,Phalaropus lobatus,CHAS:Bird:5675,1931,1931-01-01,1932-12-31,accepted place of collection,unverified
"North America, United States, Alaska","North Slope Borough, Barrow",,71.290556,-156.788611,World Geodetic System 1984,8125,m,GeoLocate,GeoLocate,Adam Glueckert,2016-09-21,Larus hyperboreus,CHAS:Bird:2095,09/11/1928,1928-09-11,1928-09-11,accepted place of collection,unverified
"North America, United States, Alaska","North Slope Borough, Barrow",,71.290556,-156.788611,World Geodetic System 1984,8125,m,GeoLocate,GeoLocate,Adam Glueckert,2016-09-21,Larus hyperboreus,CHAS:Bird:2102,09/11/1928,1928-09-11,1928-09-11,accepted place of collection,unverified
"North America, United States, Alaska","North Slope Borough, Barrow",,71.290556,-156.788611,World Geodetic System 1984,8125,m,GeoLocate,GeoLocate,Adam Glueckert,2016-09-21,Larus hyperboreus,CHAS:Bird:2389,09/30/1929,1929-09-30,1929-09-30,accepted place of collection,unverified
"North America, United States, Alaska","North Slope Borough, Barrow",,71.290556,-156.788611,World Geodetic System 1984,8125,m,GeoLocate,GeoLocate,Adam Glueckert,2016-09-21,Larus hyperboreus,CHAS:Bird:2391,09/07/1929,1929-09-07,1929-09-07,accepted place of collection,unverified
"North America, United States, Alaska","North Slope Borough, Barrow",,71.290556,-156.788611,World Geodetic System 1984,8125,m,GeoLocate,GeoLocate,Adam Glueckert,2016-09-21,Larus hyperboreus,CHAS:Bird:2716,09/09/1929,1929-09-09,1929-09-09,accepted place of collection,unverified
"North America, United States, Alaska","North Slope Borough, Barrow","Barrow, Alaska",71.290556,-156.788611,World Geodetic System 1984,8125,m,GeoLocate,GeoLocate,Adam Glueckert,2016-09-21,Larus hyperboreus,CHAS:Bird:5530,09/25/1931,1931-09-25,1931-09-25,accepted place of collection,unverified
"North America, United States, Alaska","North Slope Borough, Barrow","Barrow, Alaska",71.290556,-156.788611,World Geodetic System 1984,8125,m,GeoLocate,GeoLocate,Adam Glueckert,2016-09-21,Larus hyperboreus,CHAS:Bird:5531,9/23/1931; 9/25/1931,1931-09-23,1931-09-25,accepted place of collection,unverified
"North America, United States, Alaska","North Slope Borough, Barrow","Barrow, Alaska",71.290556,-156.788611,World Geodetic System 1984,8125,m,GeoLocate,GeoLocate,Adam Glueckert,2016-09-21,Larus hyperboreus,CHAS:Bird:5640,09/23/1931,1931-09-23,1931-09-23,accepted place of collection,unverified
"North America, United States, Alaska","North Slope Borough, Barrow","Barrow, Alaska",71.290556,-156.788611,World Geodetic System 1984,8125,m,GeoLocate,GeoLocate,Adam Glueckert,2016-09-21,Larus hyperboreus,CHAS:Bird:5651,09/17/1931,1931-09-17,1931-09-17,accepted place of collection,unverified
"North America, United States, Alaska","North Slope Borough, Barrow","Barrow, Alaska",71.290556,-156.788611,World Geodetic System 1984,8125,m,GeoLocate,GeoLocate,Adam Glueckert,2016-09-21,Larus hyperboreus,CHAS:Bird:5661,09/21/1931,1931-09-21,1931-09-21,accepted place of collection,unverified
"North America, United States, Alaska","North Slope Borough, Barrow",,71.290556,-156.788611,World Geodetic System 1984,8125,m,GeoLocate,GeoLocate,Adam Glueckert,2016-09-21,Larus hyperboreus,CHAS:Bird:2395,09/07/1929,1929-09-07,1929-09-07,accepted place of collection,unverified
"North America, United States, Alaska","North Slope Borough, Barrow",,71.290556,-156.788611,World Geodetic System 1984,8125,m,GeoLocate,GeoLocate,Adam Glueckert,2016-09-21,Larus hyperboreus,CHAS:Bird:2396,09/20/1929,1929-09-20,1929-09-20,accepted place of collection,unverified
"North America, United States, Alaska","North Slope Borough, Barrow",,71.290556,-156.788611,World Geodetic System 1984,8125,m,GeoLocate,GeoLocate,Adam Glueckert,2016-09-21,Larus hyperboreus,CHAS:Bird:2717,09/09/1929,1929-09-09,1929-09-09,accepted place of collection,unverified
"North America, United States, Alaska","North Slope Borough, Barrow",,71.290556,-156.788611,World Geodetic System 1984,8125,m,GeoLocate,GeoLocate,Adam Glueckert,2016-09-21,Larus hyperboreus,CHAS:Bird:2718,09/09/1929,1929-09-09,1929-09-09,accepted place of collection,unverified
"North America, United States, Alaska","North Slope Borough, Barrow",,71.290556,-156.788611,World Geodetic System 1984,8125,m,GeoLocate,GeoLocate,Adam Glueckert,2016-09-21,Larus hyperboreus,CHAS:Bird:2719,09/09/1929,1929-09-09,1929-09-09,accepted place of collection,unverified
"North America, United States, Alaska","North Slope Borough, Barrow","Barrow, Alaska",71.290556,-156.788611,World Geodetic System 1984,8125,m,GeoLocate,GeoLocate,Adam Glueckert,2016-09-21,Larus hyperboreus,CHAS:Bird:5641,09/18/1931,1931-09-18,1931-09-18,accepted place of collection,unverified
"North America, United States, Alaska","North Slope Borough, Barrow","Barrow, Alaska",71.290556,-156.788611,World Geodetic System 1984,8125,m,GeoLocate,GeoLocate,Adam Glueckert,2016-09-21,Larus hyperboreus,CHAS:Bird:5642,09/25/1931,1931-09-25,1931-09-25,accepted place of collection,unverified
"North America, United States, Alaska","North Slope Borough, Barrow","Barrow, Alaska",71.290556,-156.788611,World Geodetic System 1984,8125,m,GeoLocate,GeoLocate,Adam Glueckert,2016-09-21,Larus hyperboreus,CHAS:Bird:5659,09/19/1931,1931-09-19,1931-09-19,accepted place of collection,unverified
"North America, United States, Alaska","North Slope Borough, Barrow",,71.290556,-156.788611,World Geodetic System 1984,8125,m,GeoLocate,GeoLocate,Adam Glueckert,2016-09-21,Larus hyperboreus,CHAS:Bird:2072,09/26/1928,1928-09-26,1928-09-26,accepted place of collection,unverified
"North America, United States, Alaska","North Slope Borough, Barrow",,71.290556,-156.788611,World Geodetic System 1984,8125,m,GeoLocate,GeoLocate,Adam Glueckert,2016-09-21,Larus hyperboreus,CHAS:Bird:2086,09/11/1928,1928-09-11,1928-09-11,accepted place of collection,unverified
"North America, United States, Alaska","North Slope Borough, Barrow",,71.290556,-156.788611,World Geodetic System 1984,8125,m,GeoLocate,GeoLocate,Adam Glueckert,2016-09-21,Larus hyperboreus,CHAS:Bird:2382,09/20/1929,1929-09-20,1929-09-20,accepted place of collection,unverified
"North America, United States, Alaska","North Slope Borough, Barrow",,71.290556,-156.788611,World Geodetic System 1984,8125,m,GeoLocate,GeoLocate,Adam Glueckert,2016-09-21,Larus hyperboreus,CHAS:Bird:2390,09/17/1929,1929-09-17,1929-09-17,accepted place of collection,unverified
"North America, United States, Alaska","North Slope Borough, Barrow",,71.290556,-156.788611,World Geodetic System 1984,8125,m,GeoLocate,GeoLocate,Adam Glueckert,2016-09-21,Larus hyperboreus,CHAS:Bird:2394,09/17/1929,1929-09-17,1929-09-17,accepted place of collection,unverified
"North America, United States, Alaska","North Slope Borough, Barrow","Barrow, Alaska",71.290556,-156.788611,World Geodetic System 1984,8125,m,GeoLocate,GeoLocate,Adam Glueckert,2016-09-21,Larus hyperboreus,CHAS:Bird:5652,09/23/1931,1931-09-23,1931-09-23,accepted place of collection,unverified
"North America, United States, Alaska","North Slope Borough, Barrow","Barrow, Alaska",71.290556,-156.788611,World Geodetic System 1984,8125,m,GeoLocate,GeoLocate,Adam Glueckert,2016-09-21,Larus hyperboreus,CHAS:Bird:5693,09/17/1931,1931-09-17,1931-09-17,accepted place of collection,unverified
"North America, United States, Alaska","North Slope Borough, Barrow",,71.290556,-156.788611,World Geodetic System 1984,8125,m,GeoLocate,GeoLocate,Adam Glueckert,2016-09-21,Larus thayeri,CHAS:Bird:2045,09/26/1928,1928-09-26,1928-09-26,accepted place of collection,unverified
"North America, United States, Alaska","North Slope Borough, Barrow",,71.290556,-156.788611,World Geodetic System 1984,8125,m,GeoLocate,GeoLocate,Adam Glueckert,2016-09-21,Larus thayeri,CHAS:Bird:2386,10/07/1929,1929-10-07,1929-10-07,accepted place of collection,unverified
"North America, United States, Alaska","North Slope Borough, Barrow",,71.290556,-156.788611,World Geodetic System 1984,8125,m,GeoLocate,GeoLocate,Adam Glueckert,2016-09-21,Larus hyperboreus,CHAS:Bird:2392,09/20/1929,1929-09-20,1929-09-20,accepted place of collection,unverified
"North America, United States, Alaska","North Slope Borough, Barrow",,71.290556,-156.788611,World Geodetic System 1984,8125,m,GeoLocate,GeoLocate,Adam Glueckert,2016-09-21,Larus hyperboreus,CHAS:Bird:2393,09/07/1929,1929-09-07,1929-09-07,accepted place of collection,unverified
"North America, United States, Alaska","North Slope Borough, Barrow","Barrow, Alaska",71.290556,-156.788611,World Geodetic System 1984,8125,m,GeoLocate,GeoLocate,Adam Glueckert,2016-09-21,Larus hyperboreus,CHAS:Bird:5643,09/25/1931,1931-09-25,1931-09-25,accepted place of collection,unverified
"North America, United States, Alaska","North Slope Borough, Barrow","Barrow, Alaska",71.290556,-156.788611,World Geodetic System 1984,8125,m,GeoLocate,GeoLocate,Adam Glueckert,2016-09-21,Larus hyperboreus,CHAS:Bird:5653,09/25/1931,1931-09-25,1931-09-25,accepted place of collection,unverified
"North America, United States, Alaska","North Slope Borough, Barrow","Barrow, Alaska",71.290556,-156.788611,World Geodetic System 1984,8125,m,GeoLocate,GeoLocate,Adam Glueckert,2016-09-21,Larus hyperboreus,CHAS:Bird:5660,09/22/1931,1931-09-22,1931-09-22,accepted place of collection,unverified
"North America, United States, Alaska","North Slope Borough, Barrow",,71.290556,-156.788611,World Geodetic System 1984,8125,m,GeoLocate,GeoLocate,Adam Glueckert,2016-09-21,Larus thayeri,CHAS:Bird:2087,09/11/1928,1928-09-11,1928-09-11,accepted place of collection,unverified
"North America, United States, Alaska","North Slope Borough, Barrow",,71.290556,-156.788611,World Geodetic System 1984,8125,m,GeoLocate,GeoLocate,Adam Glueckert,2016-09-21,Larus thayeri,CHAS:Bird:2088,09/11/1928,1928-09-11,1928-09-11,accepted place of collection,unverified
"North America, United States, Alaska","North Slope Borough, Barrow",,71.290556,-156.788611,World Geodetic System 1984,8125,m,GeoLocate,GeoLocate,Adam Glueckert,2016-09-21,Larus thayeri,CHAS:Bird:2384,10/15/1929,1929-10-15,1929-10-15,accepted place of collection,unverified
"North America, United States, Alaska","North Slope Borough, Barrow",,71.290556,-156.788611,World Geodetic System 1984,8125,m,GeoLocate,GeoLocate,Adam Glueckert,2016-09-21,Larus thayeri,CHAS:Bird:2385,10/14/1929,1929-10-14,1929-10-14,accepted place of collection,unverified
"North America, United States, Alaska","North Slope Borough, Barrow",,71.290556,-156.788611,World Geodetic System 1984,8125,m,GeoLocate,GeoLocate,Adam Glueckert,2016-09-21,Larus thayeri,CHAS:Bird:2387,09/18/1929,1929-09-18,1929-09-18,accepted place of collection,unverified
"North America, United States, Alaska","North Slope Borough, Barrow",,71.290556,-156.788611,World Geodetic System 1984,8125,m,GeoLocate,GeoLocate,Adam Glueckert,2016-09-21,Larus thayeri,CHAS:Bird:2388,10/10/1929,1929-10-10,1929-10-10,accepted place of collection,unverified
"North America, United States, Alaska","North Slope Borough, Barrow",,71.290556,-156.788611,World Geodetic System 1984,8125,m,GeoLocate,GeoLocate,Adam Glueckert,2016-09-21,Euphagus carolinus,CHAS:Bird:2401,09/29/1929,1929-09-29,1929-09-29,accepted place of collection,unverified
"North America, United States, Alaska","North Slope Borough, Barrow","Barrow, Alaska",71.290556,-156.788611,World Geodetic System 1984,8125,m,GeoLocate,GeoLocate,Adam Glueckert,2016-09-21,Euphagus carolinus,CHAS:Bird:5842,05/24/1932,1932-05-24,1932-05-24,accepted place of collection,unverified
"North America, United States, Alaska","North Slope Borough, Barrow","Barrow, Alaska",71.290556,-156.788611,World Geodetic System 1984,8125,m,GeoLocate,GeoLocate,Adam Glueckert,2016-09-21,Nyctea scandiaca,CHAS:Bird:5662,06/19/1931,1931-06-19,1931-06-19,accepted place of collection,unverified
"North America, United States, Alaska","North Slope Borough, Barrow","Barrow, Alaska",71.290556,-156.788611,World Geodetic System 1984,8125,m,GeoLocate,GeoLocate,Adam Glueckert,2016-09-21,Nyctea scandiaca,CHAS:Bird:5663,07/27/1931,1931-07-27,1931-07-27,accepted place of collection,unverified
"North America, United States, Alaska","North Slope Borough, Barrow","Barrow, Alaska",71.290556,-156.788611,World Geodetic System 1984,8125,m,GeoLocate,GeoLocate,Adam Glueckert,2016-09-21,Nyctea scandiaca,CHAS:Bird:5691,06/19/1931,1931-06-19,1931-06-19,accepted place of collection,unverified
"North America, United States, Alaska","North Slope Borough, Barrow",Barrow Alaska,71.290556,-156.788611,World Geodetic System 1984,8125,m,GeoLocate,GeoLocate,Adam Glueckert,2016-09-21,Falco sparverius sparverius,CHAS:Bird:7863,05/25/1935,1935-05-25,1935-05-25,accepted place of collection,unverified
"North America, United States, Alaska","North Slope Borough, Barrow","Barrow, Alaska",71.290556,-156.788611,World Geodetic System 1984,8125,m,GeoLocate,GeoLocate,Adam Glueckert,2016-09-21,Falco peregrinus tundrius,CHAS:Bird:5841,07/21/1932,1932-07-21,1932-07-21,accepted place of collection,unverified
"North America, United States, Alaska","North Slope Borough, Barrow",Alaska: Barrow,71.290556,-156.788611,World Geodetic System 1984,8125,m,GeoLocate,GeoLocate,Adam Glueckert,2016-10-15,Pluvialis dominica,CHAS:Bird:2250,07/05/1929,1929-07-05,1929-07-05,accepted place of collection,unverified
"North America, United States, Alaska","North Slope Borough, Barrow",Alaska: Barrow,71.290556,-156.788611,World Geodetic System 1984,8125,m,GeoLocate,GeoLocate,Adam Glueckert,2016-09-21,Pluvialis dominica,CHAS:Bird:2248,07/05/1929,1929-07-05,1929-07-05,accepted place of collection,unverified
"North America, United States, Alaska","North Slope Borough, Barrow",Alaska: Barrow,71.290556,-156.788611,World Geodetic System 1984,8125,m,GeoLocate,GeoLocate,Adam Glueckert,2016-09-21,Pluvialis dominica,CHAS:Bird:2249,06/11/1929,1929-06-11,1929-06-11,accepted place of collection,unverified
"North America, United States, Alaska","North Slope Borough, Barrow",Alaska: Barrow,71.290556,-156.788611,World Geodetic System 1984,8125,m,GeoLocate,GeoLocate,Adam Glueckert,2016-09-21,Pluvialis dominica,CHAS:Bird:2627,07/07/1929,1929-07-07,1929-07-07,accepted place of collection,unverified
"North America, United States, Alaska","North Slope Borough, Barrow",Alaska: Barrow,71.290556,-156.788611,World Geodetic System 1984,8125,m,GeoLocate,GeoLocate,Adam Glueckert,2016-09-21,Pluvialis dominica,CHAS:Bird:5330,06/21/1931,1931-06-21,1931-06-21,accepted place of collection,unverified
"North America, United States, Alaska","North Slope Borough, Barrow",Alaska: Barrow,71.290556,-156.788611,World Geodetic System 1984,8125,m,GeoLocate,GeoLocate,Adam Glueckert,2016-09-21,Pluvialis squatarola,CHAS:Bird:2266,06/01/1929,1929-06-01,1929-06-01,accepted place of collection,unverified
"North America, United States, Alaska","North Slope Borough, Barrow",Alaska: Barrow,71.290556,-156.788611,World Geodetic System 1984,8125,m,GeoLocate,GeoLocate,Adam Glueckert,2016-09-21,Pluvialis dominica,CHAS:Bird:2292,07/04/1929,1929-07-04,1929-07-04,accepted place of collection,unverified
"North America, United States, Alaska","North Slope Borough, Barrow","Barrow, Alaska",71.290556,-156.788611,World Geodetic System 1984,8125,m,GeoLocate,GeoLocate,Adam Glueckert,2016-09-21,Limosa lapponica baueri,CHAS:Bird:6385,08/19/1933,1933-08-19,1933-08-19,accepted place of collection,unverified
"North America, United States, Alaska","North Slope Borough, Barrow","Barrow, Alaska",71.290556,-156.788611,World Geodetic System 1984,8125,m,GeoLocate,GeoLocate,Adam Glueckert,2016-09-21,Limosa lapponica baueri,CHAS:Bird:6386,08/19/1933,1933-08-19,1933-08-19,accepted place of collection,unverified
"North America, United States, Alaska","North Slope Borough, Barrow",,71.290556,-156.788611,World Geodetic System 1984,8125,m,GeoLocate,GeoLocate,Adam Glueckert,2016-09-21,Calidris pusilla,CHAS:Bird:2296,06/15/1929,1929-06-15,1929-06-15,accepted place of collection,unverified
"North America, United States, Alaska","North Slope Borough, Barrow",,71.290556,-156.788611,World Geodetic System 1984,8125,m,GeoLocate,GeoLocate,Adam Glueckert,2016-09-21,Calidris pusilla,CHAS:Bird:2568,06/15/1929,1929-06-15,1929-06-15,accepted place of collection,unverified
"North America, United States, Alaska","North Slope Borough, Barrow",,71.290556,-156.788611,World Geodetic System 1984,8125,m,GeoLocate,GeoLocate,Adam Glueckert,2016-09-21,Calidris bairdii,CHAS:Bird:2294,06/26/1929,1929-06-26,1929-06-26,accepted place of collection,unverified
"North America, United States, Alaska","North Slope Borough, Barrow",,71.290556,-156.788611,World Geodetic System 1984,8125,m,GeoLocate,GeoLocate,Adam Glueckert,2016-09-21,Calidris bairdii,CHAS:Bird:2295,06/23/1929,1929-06-23,1929-06-23,accepted place of collection,unverified
"North America, United States, Alaska","North Slope Borough, Barrow",,71.290556,-156.788611,World Geodetic System 1984,8125,m,GeoLocate,GeoLocate,Adam Glueckert,2016-09-21,Calidris alba,CHAS:Bird:2402,09/05/1929,1929-09-05,1929-09-05,accepted place of collection,unverified
"North America, United States, Alaska","North Slope Borough, Barrow",,71.290556,-156.788611,World Geodetic System 1984,8125,m,GeoLocate,GeoLocate,Adam Glueckert,2016-09-21,Calidris alba,CHAS:Bird:2403,09/07/1929,1929-09-07,1929-09-07,accepted place of collection,unverified
"North America, United States, Alaska","North Slope Borough, Barrow",,71.290556,-156.788611,World Geodetic System 1984,8125,m,GeoLocate,GeoLocate,Adam Glueckert,2016-09-21,Calidris bairdii,CHAS:Bird:2569,06/18/1929,1929-06-18,1929-06-18,accepted place of collection,unverified
"North America, United States, Alaska","North Slope Borough, Barrow",,71.290556,-156.788611,World Geodetic System 1984,8125,m,GeoLocate,GeoLocate,Adam Glueckert,2016-09-21,Calidris bairdii,CHAS:Bird:2570,06/23/1929,1929-06-23,1929-06-23,accepted place of collection,unverified
"North America, United States, Alaska","North Slope Borough, Barrow",,71.290556,-156.788611,World Geodetic System 1984,8125,m,GeoLocate,GeoLocate,Adam Glueckert,2016-09-21,Calidris bairdii,CHAS:Bird:2571,06/25/1929,1929-06-25,1929-06-25,accepted place of collection,unverified
"North America, United States, Alaska","North Slope Borough, Barrow",,71.290556,-156.788611,World Geodetic System 1984,8125,m,GeoLocate,GeoLocate,Adam Glueckert,2016-09-21,Calidris bairdii,CHAS:Bird:2572,07/08/1929,1929-07-08,1929-07-08,accepted place of collection,unverified
"North America, United States, Alaska","North Slope Borough, Barrow",,71.290556,-156.788611,World Geodetic System 1984,8125,m,GeoLocate,GeoLocate,Adam Glueckert,2016-09-21,Calidris bairdii,CHAS:Bird:2624,06/24/1929,1929-06-24,1929-06-24,accepted place of collection,unverified
"North America, United States, Alaska","North Slope Borough, Barrow",,71.290556,-156.788611,World Geodetic System 1984,8125,m,GeoLocate,GeoLocate,Adam Glueckert,2016-09-21,Calidris bairdii,CHAS:Bird:4209,07/10/1930,1930-07-10,1930-07-10,accepted place of collection,unverified
"North America, United States, Alaska","North Slope Borough, Barrow","Barrow, Alaska",71.290556,-156.788611,World Geodetic System 1984,8125,m,GeoLocate,GeoLocate,Adam Glueckert,2016-09-21,Calidris bairdii,CHAS:Bird:5488,06/24/1931,1931-06-24,1931-06-24,accepted place of collection,unverified
"North America, United States, Alaska","North Slope Borough, Barrow","Barrow, Alaska",71.290556,-156.788611,World Geodetic System 1984,8125,m,GeoLocate,GeoLocate,Adam Glueckert,2016-09-21,Calidris bairdii,CHAS:Bird:5510,06/25/1931,1931-06-25,1931-06-25,accepted place of collection,unverified
"North America, United States, Alaska","North Slope Borough, Barrow","Barrow, Alaska",71.290556,-156.788611,World Geodetic System 1984,8125,m,GeoLocate,GeoLocate,Adam Glueckert,2016-09-21,Calidris bairdii,CHAS:Bird:5511,06/01/1931,1931-06-01,1931-06-01,accepted place of collection,unverified
"North America, United States, Alaska","North Slope Borough, Barrow","Barrow, Alaska",71.290556,-156.788611,World Geodetic System 1984,8125,m,GeoLocate,GeoLocate,Adam Glueckert,2016-09-21,Calidris bairdii,CHAS:Bird:6465,07/20/1933,1933-07-20,1933-07-20,accepted place of collection,unverified
"North America, United States, Alaska","North Slope Borough, Barrow","Barrow, Alaska",71.290556,-156.788611,World Geodetic System 1984,8125,m,GeoLocate,GeoLocate,Adam Glueckert,2016-09-21,Calidris bairdii,CHAS:Bird:6475,07/20/1933,1933-07-20,1933-07-20,accepted place of collection,unverified
"North America, United States, Alaska","North Slope Borough, Barrow",,71.290556,-156.788611,World Geodetic System 1984,8125,m,GeoLocate,GeoLocate,Adam Glueckert,2016-09-21,Calidris alpina pacifica,CHAS:Bird:2251,06/18/1929,1929-06-18,1929-06-18,accepted place of collection,unverified
"North America, United States, Alaska","North Slope Borough, Barrow",,71.290556,-156.788611,World Geodetic System 1984,8125,m,GeoLocate,GeoLocate,Adam Glueckert,2016-09-21,Calidris alpina pacifica,CHAS:Bird:2252,05/31/1929,1929-05-31,1929-05-31,accepted place of collection,unverified
"North America, United States, Alaska","North Slope Borough, Barrow",,71.290556,-156.788611,World Geodetic System 1984,8125,m,GeoLocate,GeoLocate,Adam Glueckert,2016-09-21,Calidris alpina pacifica,CHAS:Bird:2413,09/05/1929,1929-09-05,1929-09-05,accepted place of collection,unverified
"North America, United States, Alaska","North Slope Borough, Barrow",,71.290556,-156.788611,World Geodetic System 1984,8125,m,GeoLocate,GeoLocate,Adam Glueckert,2016-09-21,Calidris alpina pacifica,CHAS:Bird:2414,09/05/1929,1929-09-05,1929-09-05,accepted place of collection,unverified
"North America, United States, Alaska","North Slope Borough, Barrow",,71.290556,-156.788611,World Geodetic System 1984,8125,m,GeoLocate,GeoLocate,Adam Glueckert,2016-09-21,Calidris alpina pacifica,CHAS:Bird:2415,09/05/1929,1929-09-05,1929-09-05,accepted place of collection,unverified
"North America, United States, Alaska","North Slope Borough, Barrow","Barrow, Alaska",71.290556,-156.788611,World Geodetic System 1984,8125,m,GeoLocate,GeoLocate,Adam Glueckert,2016-09-21,Calidris alpina sakhalina,CHAS:Bird:5427,06/22/1931,1931-06-22,1931-06-22,accepted place of collection,unverified
"North America, United States, Alaska","North Slope Borough, Barrow","Barrow, Alaska",71.290556,-156.788611,World Geodetic System 1984,8125,m,GeoLocate,GeoLocate,Adam Glueckert,2016-09-21,Calidris alpina sakhalina,CHAS:Bird:5477,06/20/1931,1931-06-20,1931-06-20,accepted place of collection,unverified
"North America, United States, Alaska","North Slope Borough, Barrow","Barrow, Alaska",71.290556,-156.788611,World Geodetic System 1984,8125,m,GeoLocate,GeoLocate,Adam Glueckert,2016-09-21,Calidris melanotos,CHAS:Bird:5481,06/23/1931,1931-06-23,1931-06-23,accepted place of collection,unverified
"North America, United States, Alaska","North Slope Borough, Barrow","Barrow, Alaska",71.290556,-156.788611,World Geodetic System 1984,8125,m,GeoLocate,GeoLocate,Adam Glueckert,2016-09-21,Calidris melanotos,CHAS:Bird:5482,06/26/1931,1931-06-26,1931-06-26,accepted place of collection,unverified
"North America, United States, Alaska","North Slope Borough, Barrow","Barrow, Alaska",71.290556,-156.788611,World Geodetic System 1984,8125,m,GeoLocate,GeoLocate,Adam Glueckert,2016-09-21,Calidris melanotos,CHAS:Bird:5487,06/25/1931,1931-06-25,1931-06-25,accepted place of collection,unverified
"North America, United States, Alaska","North Slope Borough, Barrow","Barrow, Alaska",71.290556,-156.788611,World Geodetic System 1984,8125,m,GeoLocate,GeoLocate,Adam Glueckert,2016-09-21,Calidris melanotos,CHAS:Bird:5690,06/19/1931,1931-06-19,1931-06-19,accepted place of collection,unverified
"North America, United States, Alaska","North Slope Borough, Barrow","Barrow, Alaska",71.290556,-156.788611,World Geodetic System 1984,8125,m,GeoLocate,GeoLocate,Adam Glueckert,2016-09-21,Calidris melanotos,CHAS:Bird:9241,06/24/1931,1931-06-24,1931-06-24,accepted place of collection,unverified
"North America, United States, Alaska","North Slope Borough, Barrow",,71.290556,-156.788611,World Geodetic System 1984,8125,m,GeoLocate,GeoLocate,Adam Glueckert,2016-09-21,Calidris melanotos,CHAS:Bird:2293,06/17/1929,1929-06-17,1929-06-17,accepted place of collection,unverified
"North America, United States, Alaska","North Slope Borough, Barrow",,71.290556,-156.788611,World Geodetic System 1984,8125,m,GeoLocate,GeoLocate,Adam Glueckert,2016-09-21,Calidris melanotos,CHAS:Bird:2404,08/28/1929,1929-08-28,1929-08-28,accepted place of collection,unverified
"North America, United States, Alaska","North Slope Borough, Barrow",,71.290556,-156.788611,World Geodetic System 1984,8125,m,GeoLocate,GeoLocate,Adam Glueckert,2016-09-21,Calidris melanotos,CHAS:Bird:2405,08/28/1929,1929-08-28,1929-08-28,accepted place of collection,unverified
"North America, United States, Alaska","North Slope Borough, Barrow",,71.290556,-156.788611,World Geodetic System 1984,8125,m,GeoLocate,GeoLocate,Adam Glueckert,2016-09-21,Calidris melanotos,CHAS:Bird:2564,06/24/1929,1929-06-24,1929-06-24,accepted place of collection,unverified
"North America, United States, Alaska","North Slope Borough, Barrow",,71.290556,-156.788611,World Geodetic System 1984,8125,m,GeoLocate,GeoLocate,Adam Glueckert,2016-09-21,Calidris melanotos,CHAS:Bird:19289,06/23/1929,1929-06-23,1929-06-23,accepted place of collection,unverified
"North America, United States, Alaska","North Slope Borough, Barrow",,71.290556,-156.788611,World Geodetic System 1984,8125,m,GeoLocate,GeoLocate,Adam Glueckert,2016-09-21,Calidris melanotos,CHAS:Bird:19304,06/26/1931,1931-06-26,1931-06-26,accepted place of collection,unverified
"North America, United States, Alaska","North Slope Borough, Barrow",,71.290556,-156.788611,World Geodetic System 1984,8125,m,GeoLocate,GeoLocate,Adam Glueckert,2016-09-21,Calidris canutus rufus,CHAS:Bird:2566,06/25/1929,1929-06-25,1929-06-25,accepted place of collection,unverified
"North America, United States, Alaska","North Slope Borough, Barrow",,71.290556,-156.788611,World Geodetic System 1984,8125,m,GeoLocate,GeoLocate,Adam Glueckert,2016-09-21,Limnodromus scolopaceus,CHAS:Bird:2047,08/29/1928,1928-08-29,1928-08-29,accepted place of collection,unverified
"North America, United States, Alaska","North Slope Borough, Barrow",,71.290556,-156.788611,World Geodetic System 1984,8125,m,GeoLocate,GeoLocate,Adam Glueckert,2016-09-21,Limnodromus scolopaceus,CHAS:Bird:2048,08/29/1928,1928-08-29,1928-08-29,accepted place of collection,unverified
"North America, United States, Alaska","North Slope Borough, Barrow",,71.290556,-156.788611,World Geodetic System 1984,8125,m,GeoLocate,GeoLocate,Adam Glueckert,2016-09-21,Limnodromus scolopaceus,CHAS:Bird:2074,08/29/1928,1928-08-29,1928-08-29,accepted place of collection,unverified
"North America, United States, Alaska","North Slope Borough, Barrow",,71.290556,-156.788611,World Geodetic System 1984,8125,m,GeoLocate,GeoLocate,Adam Glueckert,2016-09-21,Limnodromus scolopaceus,CHAS:Bird:2406,08/28/1929,1929-08-28,1929-08-28,accepted place of collection,unverified
"North America, United States, Alaska","North Slope Borough, Barrow",,71.290556,-156.788611,World Geodetic System 1984,8125,m,GeoLocate,GeoLocate,Adam Glueckert,2016-09-21,Limnodromus scolopaceus,CHAS:Bird:2407,08/28/1929,1929-08-28,1929-08-28,accepted place of collection,unverified
"North America, United States, Alaska","North Slope Borough, Barrow",,71.290556,-156.788611,World Geodetic System 1984,8125,m,GeoLocate,GeoLocate,Adam Glueckert,2016-09-21,Limnodromus scolopaceus,CHAS:Bird:2408,08/28/1929,1929-08-28,1929-08-28,accepted place of collection,unverified
"North America, United States, Alaska","North Slope Borough, Barrow",,71.290556,-156.788611,World Geodetic System 1984,8125,m,GeoLocate,GeoLocate,Adam Glueckert,2016-09-21,Limnodromus scolopaceus,CHAS:Bird:2409,08/28/1929,1929-08-28,1929-08-28,accepted place of collection,unverified
"North America, United States, Alaska","North Slope Borough, Barrow",,71.290556,-156.788611,World Geodetic System 1984,8125,m,GeoLocate,GeoLocate,Adam Glueckert,2016-09-21,Limnodromus scolopaceus,CHAS:Bird:2410,08/28/1929,1929-08-28,1929-08-28,accepted place of collection,unverified
"North America, United States, Alaska","North Slope Borough, Barrow",,71.290556,-156.788611,World Geodetic System 1984,8125,m,GeoLocate,GeoLocate,Adam Glueckert,2016-09-21,Limnodromus scolopaceus,CHAS:Bird:2411,08/28/1929,1929-08-28,1929-08-28,accepted place of collection,unverified
"North America, United States, Alaska","North Slope Borough, Barrow","Barrow, Alaska",71.290556,-156.788611,World Geodetic System 1984,8125,m,GeoLocate,GeoLocate,Adam Glueckert,2016-09-21,Limnodromus scolopaceus,CHAS:Bird:5473,06/15/1931,1931-06-15,1931-06-15,accepted place of collection,unverified
"North America, United States, Alaska","North Slope Borough, Barrow","Barrow, Alaska",71.290556,-156.788611,World Geodetic System 1984,8125,m,GeoLocate,GeoLocate,Adam Glueckert,2016-09-21,Phalaropus fulicarius,CHAS:Bird:5425,06/18/1931,1931-06-18,1931-06-18,accepted place of collection,unverified
"North America, United States, Alaska","North Slope Borough, Barrow","Barrow, Alaska",71.290556,-156.788611,World Geodetic System 1984,8125,m,GeoLocate,GeoLocate,Adam Glueckert,2016-09-21,Phalaropus fulicarius,CHAS:Bird:5426,06/25/1931,1931-06-25,1931-06-25,accepted place of collection,unverified
"North America, United States, Alaska","North Slope Borough, Barrow","Barrow, Alaska",71.290556,-156.788611,World Geodetic System 1984,8125,m,GeoLocate,GeoLocate,Adam Glueckert,2016-09-21,Phalaropus fulicarius,CHAS:Bird:5486,06/20/1931,1931-06-20,1931-06-20,accepted place of collection,unverified
"North America, United States, Alaska","North Slope Borough, Barrow","Barrow, Alaska",71.290556,-156.788611,World Geodetic System 1984,8125,m,GeoLocate,GeoLocate,Adam Glueckert,2016-09-21,Phalaropus fulicarius,CHAS:Bird:6461,07/16/1933,1933-07-16,1933-07-16,accepted place of collection,unverified
"North America, United States, Alaska","North Slope Borough, Barrow","Barrow, Alaska",71.290556,-156.788611,World Geodetic System 1984,8125,m,GeoLocate,GeoLocate,Adam Glueckert,2016-09-21,Phalaropus fulicarius,CHAS:Bird:6462,07/16/1933,1933-07-16,1933-07-16,accepted place of collection,unverified
"North America, United States, Alaska","North Slope Borough, Barrow","Barrow, Alaska",71.290556,-156.788611,World Geodetic System 1984,8125,m,GeoLocate,GeoLocate,Adam Glueckert,2016-09-21,Phalaropus fulicarius,CHAS:Bird:6463,07/16/1933,1933-07-16,1933-07-16,accepted place of collection,unverified
"North America, United States, Alaska","North Slope Borough, Barrow","Barrow, Alaska",71.290556,-156.788611,World Geodetic System 1984,8125,m,GeoLocate,GeoLocate,Adam Glueckert,2016-09-21,Phalaropus fulicarius,CHAS:Bird:6481,06/27/1933,1933-06-27,1933-06-27,accepted place of collection,unverified
"North America, United States, Alaska","North Slope Borough, Barrow",Barrow Alaska,71.290556,-156.788611,World Geodetic System 1984,8125,m,GeoLocate,GeoLocate,Adam Glueckert,2016-09-21,Phalaropus fulicarius,CHAS:Bird:7883,06/27/1935,1935-06-27,1935-06-27,accepted place of collection,unverified
"North America, United States, Alaska","North Slope Borough, Barrow",Alaska: Barrow,71.290556,-156.788611,World Geodetic System 1984,8125,m,GeoLocate,GeoLocate,Adam Glueckert,2016-09-21,Arenaria interpres morinella,CHAS:Bird:2412,09/05/1929,1929-09-05,1929-09-05,accepted place of collection,unverified
"North America, United States, Alaska","North Slope Borough, Barrow",Alaska: Barrow,71.290556,-156.788611,World Geodetic System 1984,8125,m,GeoLocate,GeoLocate,Adam Glueckert,2016-09-21,Arenaria interpres morinella,CHAS:Bird:2628,06/17/1929,1929-06-17,1929-06-17,accepted place of collection,unverified
"North America, United States, Alaska","North Slope Borough, Barrow",Alaska: Barrow,71.290556,-156.788611,World Geodetic System 1984,8125,m,GeoLocate,GeoLocate,Adam Glueckert,2016-09-21,Arenaria interpres morinella,CHAS:Bird:2629,06/01/1929,1929-06-01,1929-06-01,accepted place of collection,unverified
"North America, United States, Alaska","North Slope Borough, Barrow","Barrow, Alaska",71.290556,-156.788611,World Geodetic System 1984,8125,m,GeoLocate,GeoLocate,Adam Glueckert,2016-09-21,Arenaria interpres morinella,CHAS:Bird:5483,07/02/1931,1931-07-02,1931-07-02,accepted place of collection,unverified
"North America, United States, Alaska","North Slope Borough, Barrow","Barrow, Alaska",71.290556,-156.788611,World Geodetic System 1984,8125,m,GeoLocate,GeoLocate,Adam Glueckert,2016-09-21,Arenaria interpres morinella,CHAS:Bird:5664,06/25/1931,1931-06-25,1931-06-25,accepted place of collection,unverified
"North America, United States, Alaska","North Slope Borough, Barrow","Barrow, Alaska",71.290556,-156.788611,World Geodetic System 1984,8125,m,GeoLocate,GeoLocate,Adam Glueckert,2016-09-21,Arenaria interpres morinella,CHAS:Bird:5689,8/1/1931,1931-08-01,1931-08-01,accepted place of collection,unverified
"North America, United States, Alaska","North Slope Borough, Barrow",,71.290556,-156.788611,World Geodetic System 1984,8125,m,GeoLocate,GeoLocate,Adam Glueckert,2016-09-21,Pagophila eburnea,CHAS:Bird:2060,09/26/1928,1928-09-26,1928-09-26,accepted place of collection,unverified
"North America, United States, Alaska","North Slope Borough, Barrow","Barrow, Alaska",71.290556,-156.788611,World Geodetic System 1984,8125,m,GeoLocate,GeoLocate,Adam Glueckert,2016-09-21,Pagophila eburnea,CHAS:Bird:5462,9/4/1931; 9/21/1931,1931-09-21,1931-09-21,accepted place of collection,unverified
"North America, United States, Alaska","North Slope Borough, Barrow","Barrow, Alaska",71.290556,-156.788611,World Geodetic System 1984,8125,m,GeoLocate,GeoLocate,Adam Glueckert,2016-09-21,Pagophila eburnea,CHAS:Bird:5505,09/25/1931,1931-09-25,1931-09-25,accepted place of collection,unverified
"North America, United States, Alaska","North Slope Borough, Barrow","Barrow, Alaska",71.290556,-156.788611,World Geodetic System 1984,8125,m,GeoLocate,GeoLocate,Adam Glueckert,2016-09-21,Pagophila eburnea,CHAS:Bird:5506,09/21/1931,1931-09-21,1931-09-21,accepted place of collection,unverified
"North America, United States, Alaska","North Slope Borough, Barrow","Barrow, Alaska",71.290556,-156.788611,World Geodetic System 1984,8125,m,GeoLocate,GeoLocate,Adam Glueckert,2016-09-21,Pagophila eburnea,CHAS:Bird:5507,10/03/1931,1931-10-03,1931-10-03,accepted place of collection,unverified
"North America, United States, Alaska","North Slope Borough, Barrow","Barrow, Alaska",71.290556,-156.788611,World Geodetic System 1984,8125,m,GeoLocate,GeoLocate,Adam Glueckert,2016-09-21,Pagophila eburnea,CHAS:Bird:6374,10/28/1932,1932-10-28,1932-10-28,accepted place of collection,unverified
"North America, United States, Alaska","North Slope Borough, Barrow","Barrow, Alaska",71.290556,-156.788611,World Geodetic System 1984,8125,m,GeoLocate,GeoLocate,Adam Glueckert,2016-09-21,Pagophila eburnea,CHAS:Bird:6375,10/28/1932,1932-10-28,1932-10-28,accepted place of collection,unverified
"North America, United States, Alaska","North Slope Borough, Barrow",,71.290556,-156.788611,World Geodetic System 1984,8125,m,GeoLocate,GeoLocate,Adam Glueckert,2016-09-21,Pagophila eburnea,CHAS:Bird:2364,10/02/1929,1929-10-02,1929-10-02,accepted place of collection,unverified
"North America, United States, Alaska","North Slope Borough, Barrow",,71.290556,-156.788611,World Geodetic System 1984,8125,m,GeoLocate,GeoLocate,Adam Glueckert,2016-09-21,Pagophila eburnea,CHAS:Bird:2365,10/07/1929,1929-10-07,1929-10-07,accepted place of collection,unverified
"North America, United States, Alaska","North Slope Borough, Barrow",,71.290556,-156.788611,World Geodetic System 1984,8125,m,GeoLocate,GeoLocate,Adam Glueckert,2016-09-21,Pagophila eburnea,CHAS:Bird:2366,10/11/1929,1929-10-11,1929-10-11,accepted place of collection,unverified
"North America, United States, Alaska","North Slope Borough, Barrow","Barrow, Alaska",71.290556,-156.788611,World Geodetic System 1984,8125,m,GeoLocate,GeoLocate,Adam Glueckert,2016-09-21,Pagophila eburnea,CHAS:Bird:5497,09/24/1931,1931-09-24,1931-09-24,accepted place of collection,unverified
"North America, United States, Alaska","North Slope Borough, Barrow","Barrow, Alaska",71.290556,-156.788611,World Geodetic System 1984,8125,m,GeoLocate,GeoLocate,Adam Glueckert,2016-09-21,Pagophila eburnea,CHAS:Bird:6376,10/28/1932,1932-10-28,1932-10-28,accepted place of collection,unverified
"North America, United States, Alaska","North Slope Borough, Barrow","Barrow, Alaska",71.290556,-156.788611,World Geodetic System 1984,8125,m,GeoLocate,GeoLocate,Adam Glueckert,2016-09-21,Pagophila eburnea,CHAS:Bird:6377,10/29/1932,1932-10-29,1932-10-29,accepted place of collection,unverified
"North America, United States, Alaska","North Slope Borough, Barrow","Barrow, Alaska",71.290556,-156.788611,World Geodetic System 1984,8125,m,GeoLocate,GeoLocate,Adam Glueckert,2016-09-21,Pagophila eburnea,CHAS:Bird:6455,10/29/1932,1932-10-29,1932-10-29,accepted place of collection,unverified
"North America, United States, Alaska","North Slope Borough, Barrow","Barrow, Alaska",71.290556,-156.788611,World Geodetic System 1984,8125,m,GeoLocate,GeoLocate,Adam Glueckert,2016-09-21,Pagophila eburnea,CHAS:Bird:5503,09/24/1931,1931-09-24,1931-09-24,accepted place of collection,unverified
"North America, United States, Alaska","North Slope Borough, Barrow",,71.290556,-156.788611,World Geodetic System 1984,8125,m,GeoLocate,GeoLocate,Adam Glueckert,2016-09-21,Rissa tridactyla pollicaris,CHAS:Bird:2043,09/19/1928,1928-09-19,1928-09-19,accepted place of collection,unverified
"North America, United States, Alaska","North Slope Borough, Barrow",,71.290556,-156.788611,World Geodetic System 1984,8125,m,GeoLocate,GeoLocate,Adam Glueckert,2016-09-21,Rissa tridactyla pollicaris,CHAS:Bird:2371,09/07/1929,1929-09-07,1929-09-07,accepted place of collection,unverified
"North America, United States, Alaska","North Slope Borough, Barrow",,71.290556,-156.788611,World Geodetic System 1984,8125,m,GeoLocate,GeoLocate,Adam Glueckert,2016-09-21,Rissa tridactyla pollicaris,CHAS:Bird:2372,09/01/1929,1929-09-01,1929-09-01,accepted place of collection,unverified
"North America, United States, Alaska","North Slope Borough, Barrow",,71.290556,-156.788611,World Geodetic System 1984,8125,m,GeoLocate,GeoLocate,Adam Glueckert,2016-09-21,Rissa tridactyla pollicaris,CHAS:Bird:2722,09/07/1929,1929-09-07,1929-09-07,accepted place of collection,unverified
"North America, United States, Alaska","North Slope Borough, Barrow","Barrow, Alaska",71.290556,-156.788611,World Geodetic System 1984,8125,m,GeoLocate,GeoLocate,Adam Glueckert,2016-09-21,Rissa tridactyla pollicaris,CHAS:Bird:5492,09/18/1931,1931-09-18,1931-09-18,accepted place of collection,unverified
"North America, United States, Alaska","North Slope Borough, Barrow",,71.290556,-156.788611,World Geodetic System 1984,8125,m,GeoLocate,GeoLocate,Adam Glueckert,2016-09-21,Rissa tridactyla pollicaris,CHAS:Bird:2057,09/12/1928,1928-09-12,1928-09-12,accepted place of collection,unverified
"North America, United States, Alaska","North Slope Borough, Barrow",,71.290556,-156.788611,World Geodetic System 1984,8125,m,GeoLocate,GeoLocate,Adam Glueckert,2016-09-21,Rissa tridactyla pollicaris,CHAS:Bird:2720,10/07/1929,1929-10-07,1929-10-07,accepted place of collection,unverified
"North America, United States, Alaska","North Slope Borough, Barrow",,71.290556,-156.788611,World Geodetic System 1984,8125,m,GeoLocate,GeoLocate,Adam Glueckert,2016-09-21,Rissa tridactyla pollicaris,CHAS:Bird:2721,09/08/1929,1929-09-08,1929-09-08,accepted place of collection,unverified
"North America, United States, Alaska","North Slope Borough, Barrow","Barrow, Alaska",71.290556,-156.788611,World Geodetic System 1984,8125,m,GeoLocate,GeoLocate,Adam Glueckert,2016-09-21,Rissa tridactyla pollicaris,CHAS:Bird:5474,09/23/1931,1931-09-23,1931-09-23,accepted place of collection,unverified
"North America, United States, Alaska","North Slope Borough, Barrow",,71.290556,-156.788611,World Geodetic System 1984,8125,m,GeoLocate,GeoLocate,Adam Glueckert,2016-09-21,Rhodostethia rosea,CHAS:Bird:2037,09/28/1928,1928-09-28,1928-09-28,accepted place of collection,unverified
"North America, United States, Alaska","North Slope Borough, Barrow",,71.290556,-156.788611,World Geodetic System 1984,8125,m,GeoLocate,GeoLocate,Adam Glueckert,2016-09-21,Rhodostethia rosea,CHAS:Bird:2039,09/25/1928,1928-09-25,1928-09-25,accepted place of collection,unverified
"North America, United States, Alaska","North Slope Borough, Barrow",,71.290556,-156.788611,World Geodetic System 1984,8125,m,GeoLocate,GeoLocate,Adam Glueckert,2016-09-21,Rhodostethia rosea,CHAS:Bird:2041,09/28/1928,1928-09-28,1928-09-28,accepted place of collection,unverified
"North America, United States, Alaska","North Slope Borough, Barrow",,71.290556,-156.788611,World Geodetic System 1984,8125,m,GeoLocate,GeoLocate,Adam Glueckert,2016-09-21,Rhodostethia rosea,CHAS:Bird:2042,09/25/1928,1928-09-25,1928-09-25,accepted place of collection,unverified
"North America, United States, Alaska","North Slope Borough, Barrow",,71.290556,-156.788611,World Geodetic System 1984,8125,m,GeoLocate,GeoLocate,Adam Glueckert,2016-09-21,Rhodostethia rosea,CHAS:Bird:2064,09/28/1928,1928-09-28,1928-09-28,accepted place of collection,unverified
"North America, United States, Alaska","North Slope Borough, Barrow",,71.290556,-156.788611,World Geodetic System 1984,8125,m,GeoLocate,GeoLocate,Adam Glueckert,2016-09-21,Rhodostethia rosea,CHAS:Bird:2066,09/28/1928,1928-09-28,1928-09-28,accepted place of collection,unverified
"North America, United States, Alaska","North Slope Borough, Barrow",,71.290556,-156.788611,World Geodetic System 1984,8125,m,GeoLocate,GeoLocate,Adam Glueckert,2016-09-21,Rhodostethia rosea,CHAS:Bird:2067,09/25/1928,1928-09-25,1928-09-25,accepted place of collection,unverified
"North America, United States, Alaska","North Slope Borough, Barrow",,71.290556,-156.788611,World Geodetic System 1984,8125,m,GeoLocate,GeoLocate,Adam Glueckert,2016-09-21,Rhodostethia rosea,CHAS:Bird:2068,09/28/1928,1928-09-28,1928-09-28,accepted place of collection,unverified
"North America, United States, Alaska","North Slope Borough, Barrow",,71.290556,-156.788611,World Geodetic System 1984,8125,m,GeoLocate,GeoLocate,Adam Glueckert,2016-09-21,Rhodostethia rosea,CHAS:Bird:2376,10/07/1929,1929-10-07,1929-10-07,accepted place of collection,unverified
"North America, United States, Alaska","North Slope Borough, Barrow",,71.290556,-156.788611,World Geodetic System 1984,8125,m,GeoLocate,GeoLocate,Adam Glueckert,2016-09-21,Rhodostethia rosea,CHAS:Bird:2424,10/04/1929,1929-10-04,1929-10-04,accepted place of collection,unverified
"North America, United States, Alaska","North Slope Borough, Barrow","Barrow, Alaska",71.290556,-156.788611,World Geodetic System 1984,8125,m,GeoLocate,GeoLocate,Adam Glueckert,2016-09-21,Rhodostethia rosea,CHAS:Bird:5467,09/21/1931,1931-09-21,1931-09-21,accepted place of collection,unverified
"North America, United States, Alaska","North Slope Borough, Barrow","Barrow, Alaska",71.290556,-156.788611,World Geodetic System 1984,8125,m,GeoLocate,GeoLocate,Adam Glueckert,2016-09-21,Rhodostethia rosea,CHAS:Bird:5468,09/21/1931,1931-09-21,1931-09-21,accepted place of collection,unverified
"North America, United States, Alaska","North Slope Borough, Barrow","Barrow, Alaska",71.290556,-156.788611,World Geodetic System 1984,8125,m,GeoLocate,GeoLocate,Adam Glueckert,2016-09-21,Rhodostethia rosea,CHAS:Bird:5485,9/25/1931 or 9/21/1931,1931-09-21,1931-09-25,accepted place of collection,unverified
"North America, United States, Alaska","North Slope Borough, Barrow","Barrow, Alaska",71.290556,-156.788611,World Geodetic System 1984,8125,m,GeoLocate,GeoLocate,Adam Glueckert,2016-09-21,Rhodostethia rosea,CHAS:Bird:5490,09/21/1931,1931-09-21,1931-09-21,accepted place of collection,unverified
"North America, United States, Alaska","North Slope Borough, Barrow","Barrow, Alaska",71.290556,-156.788611,World Geodetic System 1984,8125,m,GeoLocate,GeoLocate,Adam Glueckert,2016-09-21,Rhodostethia rosea,CHAS:Bird:6378,10/16/1932,1932-10-16,1932-10-16,accepted place of collection,unverified
"North America, United States, Alaska","North Slope Borough, Barrow","Barrow, Alaska",71.290556,-156.788611,World Geodetic System 1984,8125,m,GeoLocate,GeoLocate,Adam Glueckert,2016-09-21,Rhodostethia rosea,CHAS:Bird:6379,10/16/1932,1932-10-16,1932-10-16,accepted place of collection,unverified
"North America, United States, Alaska","North Slope Borough, Barrow","Barrow, Alaska",71.290556,-156.788611,World Geodetic System 1984,8125,m,GeoLocate,GeoLocate,Adam Glueckert,2016-09-21,Rhodostethia rosea,CHAS:Bird:6380,10/16/1932,1932-10-16,1932-10-16,accepted place of collection,unverified
"North America, United States, Alaska","North Slope Borough, Barrow","Barrow, Alaska",71.290556,-156.788611,World Geodetic System 1984,8125,m,GeoLocate,GeoLocate,Adam Glueckert,2016-09-21,Rhodostethia rosea,CHAS:Bird:6381,10/16/1932,1932-10-16,1932-10-16,accepted place of collection,unverified
"North America, United States, Alaska","North Slope Borough, Barrow","Barrow, Alaska",71.290556,-156.788611,World Geodetic System 1984,8125,m,GeoLocate,GeoLocate,Adam Glueckert,2016-09-21,Rhodostethia rosea,CHAS:Bird:6382,10/16/1932,1932-10-16,1932-10-16,accepted place of collection,unverified
"North America, United States, Alaska","North Slope Borough, Barrow","Barrow, Alaska",71.290556,-156.788611,World Geodetic System 1984,8125,m,GeoLocate,GeoLocate,Adam Glueckert,2016-09-21,Rhodostethia rosea,CHAS:Bird:6459,10/16/1932,1932-10-16,1932-10-16,accepted place of collection,unverified
"North America, United States, Alaska","North Slope Borough, Barrow","Barrow, Alaska",71.290556,-156.788611,World Geodetic System 1984,8125,m,GeoLocate,GeoLocate,Adam Glueckert,2016-09-21,Rhodostethia rosea,CHAS:Bird:6472,10/16/1932,1932-10-16,1932-10-16,accepted place of collection,unverified
"North America, United States, Alaska","North Slope Borough, Barrow",,71.290556,-156.788611,World Geodetic System 1984,8125,m,GeoLocate,GeoLocate,Adam Glueckert,2016-09-21,Rhodostethia rosea,CHAS:Bird:2062,09/25/1928,1928-09-25,1928-09-25,accepted place of collection,unverified
"North America, United States, Alaska","North Slope Borough, Barrow",,71.290556,-156.788611,World Geodetic System 1984,8125,m,GeoLocate,GeoLocate,Adam Glueckert,2016-09-21,Rhodostethia rosea,CHAS:Bird:2070,09/25/1928,1928-09-25,1928-09-25,accepted place of collection,unverified
"North America, United States, Alaska","North Slope Borough, Barrow",,71.290556,-156.788611,World Geodetic System 1984,8125,m,GeoLocate,GeoLocate,Adam Glueckert,2016-09-21,Rhodostethia rosea,CHAS:Bird:2373,10/04/1929,1929-10-04,1929-10-04,accepted place of collection,unverified
"North America, United States, Alaska","North Slope Borough, Barrow",,71.290556,-156.788611,World Geodetic System 1984,8125,m,GeoLocate,GeoLocate,Adam Glueckert,2016-09-21,Rhodostethia rosea,CHAS:Bird:2375,10/04/1929,1929-10-04,1929-10-04,accepted place of collection,unverified
"North America, United States, Alaska","North Slope Borough, Barrow",,71.290556,-156.788611,World Geodetic System 1984,8125,m,GeoLocate,GeoLocate,Adam Glueckert,2016-09-21,Rhodostethia rosea,CHAS:Bird:2377,10/08/1929,1929-10-08,1929-10-08,accepted place of collection,unverified
"North America, United States, Alaska","North Slope Borough, Barrow","Barrow, Alaska",71.290556,-156.788611,World Geodetic System 1984,8125,m,GeoLocate,GeoLocate,Adam Glueckert,2016-09-21,Rhodostethia rosea,CHAS:Bird:5464,09/21/1931,1931-09-21,1931-09-21,accepted place of collection,unverified
"North America, United States, Alaska","North Slope Borough, Barrow","Barrow, Alaska",71.290556,-156.788611,World Geodetic System 1984,8125,m,GeoLocate,GeoLocate,Adam Glueckert,2016-09-21,Rhodostethia rosea,CHAS:Bird:5465,09/21/1931,1931-09-21,1931-09-21,accepted place of collection,unverified
"North America, United States, Alaska","North Slope Borough, Barrow","Barrow, Alaska",71.290556,-156.788611,World Geodetic System 1984,8125,m,GeoLocate,GeoLocate,Adam Glueckert,2016-09-21,Rhodostethia rosea,CHAS:Bird:5466,09/19/1931,1931-09-19,1931-09-19,accepted place of collection,unverified
"North America, United States, Alaska","North Slope Borough, Barrow","Barrow, Alaska",71.290556,-156.788611,World Geodetic System 1984,8125,m,GeoLocate,GeoLocate,Adam Glueckert,2016-09-21,Rhodostethia rosea,CHAS:Bird:5470,09/21/1931,1931-09-21,1931-09-21,accepted place of collection,unverified
"North America, United States, Alaska","North Slope Borough, Barrow","Barrow, Alaska",71.290556,-156.788611,World Geodetic System 1984,8125,m,GeoLocate,GeoLocate,Adam Glueckert,2016-09-21,Rhodostethia rosea,CHAS:Bird:5471,09/21/1931,1931-09-21,1931-09-21,accepted place of collection,unverified
"North America, United States, Alaska","North Slope Borough, Barrow","Barrow, Alaska",71.290556,-156.788611,World Geodetic System 1984,8125,m,GeoLocate,GeoLocate,Adam Glueckert,2016-09-21,Rhodostethia rosea,CHAS:Bird:5484,09/21/1931,1931-09-21,1931-09-21,accepted place of collection,unverified
"North America, United States, Alaska","North Slope Borough, Barrow","Barrow, Alaska",71.290556,-156.788611,World Geodetic System 1984,8125,m,GeoLocate,GeoLocate,Adam Glueckert,2016-09-21,Rhodostethia rosea,CHAS:Bird:5498,09/25/1931,1931-09-25,1931-09-25,accepted place of collection,unverified
"North America, United States, Alaska","North Slope Borough, Barrow","Barrow, Alaska",71.290556,-156.788611,World Geodetic System 1984,8125,m,GeoLocate,GeoLocate,Adam Glueckert,2016-09-21,Rhodostethia rosea,CHAS:Bird:5499,09/21/1931,1931-09-21,1931-09-21,accepted place of collection,unverified
"North America, United States, Alaska","North Slope Borough, Barrow","Barrow, Alaska",71.290556,-156.788611,World Geodetic System 1984,8125,m,GeoLocate,GeoLocate,Adam Glueckert,2016-09-21,Rhodostethia rosea,CHAS:Bird:5500,09/21/1931,1931-09-21,1931-09-21,accepted place of collection,unverified
"North America, United States, Alaska","North Slope Borough, Barrow","Barrow, Alaska",71.290556,-156.788611,World Geodetic System 1984,8125,m,GeoLocate,GeoLocate,Adam Glueckert,2016-09-21,Rhodostethia rosea,CHAS:Bird:5501,09/25/1931,1931-09-25,1931-09-25,accepted place of collection,unverified
"North America, United States, Alaska","North Slope Borough, Barrow","Barrow, Alaska",71.290556,-156.788611,World Geodetic System 1984,8125,m,GeoLocate,GeoLocate,Adam Glueckert,2016-09-21,Rhodostethia rosea,CHAS:Bird:5502,09/21/1931,1931-09-21,1931-09-21,accepted place of collection,unverified
"North America, United States, Alaska","North Slope Borough, Barrow","Barrow, Alaska",71.290556,-156.788611,World Geodetic System 1984,8125,m,GeoLocate,GeoLocate,Adam Glueckert,2016-09-21,Rhodostethia rosea,CHAS:Bird:6458,10/16/1932,1932-10-16,1932-10-16,accepted place of collection,unverified
"North America, United States, Alaska","North Slope Borough, Barrow","Barrow, Alaska",71.290556,-156.788611,World Geodetic System 1984,8125,m,GeoLocate,GeoLocate,Adam Glueckert,2016-09-21,Rhodostethia rosea,CHAS:Bird:6471,10/16/1932,1932-10-16,1932-10-16,accepted place of collection,unverified
"North America, United States, Alaska","North Slope Borough, Barrow","Barrow, Alaska",71.290556,-156.788611,World Geodetic System 1984,8125,m,GeoLocate,GeoLocate,Adam Glueckert,2016-09-21,Rhodostethia rosea,CHAS:Bird:6473,10/16/1932,1932-10-16,1932-10-16,accepted place of collection,unverified
"North America, United States, Alaska","North Slope Borough, Barrow",,71.290556,-156.788611,World Geodetic System 1984,8125,m,GeoLocate,GeoLocate,Adam Glueckert,2016-09-21,Rhodostethia rosea,CHAS:Bird:2069,09/25/1928,1928-09-25,1928-09-25,accepted place of collection,unverified
"North America, United States, Alaska","North Slope Borough, Barrow",,71.290556,-156.788611,World Geodetic System 1984,8125,m,GeoLocate,GeoLocate,Adam Glueckert,2016-09-21,Xema sabini,CHAS:Bird:2071,09/05/1928,1928-09-05,1928-09-05,accepted place of collection,unverified
"North America, United States, Alaska","North Slope Borough, Barrow","Barrow, Alaska",71.290556,-156.788611,World Geodetic System 1984,8125,m,GeoLocate,GeoLocate,Adam Glueckert,2016-09-21,Rhodostethia rosea,CHAS:Bird:5469,09/21/1931,1931-09-21,1931-09-21,accepted place of collection,unverified
"North America, United States, Alaska","North Slope Borough, Barrow","Barrow, Alaska",71.290556,-156.788611,World Geodetic System 1984,8125,m,GeoLocate,GeoLocate,Adam Glueckert,2016-09-21,Rhodostethia rosea,CHAS:Bird:5472,09/21/1931,1931-09-21,1931-09-21,accepted place of collection,unverified
"North America, United States, Alaska","North Slope Borough, Barrow","Barrow, Alaska",71.290556,-156.788611,World Geodetic System 1984,8125,m,GeoLocate,GeoLocate,Adam Glueckert,2016-09-21,Rhodostethia rosea,CHAS:Bird:5491,09/21/1931,1931-09-21,1931-09-21,accepted place of collection,unverified
"North America, United States, Alaska","North Slope Borough, Barrow","Barrow, Alaska",71.290556,-156.788611,World Geodetic System 1984,8125,m,GeoLocate,GeoLocate,Adam Glueckert,2016-09-21,Xema sabini,CHAS:Bird:5538,07/02/1931,1931-07-02,1931-07-02,accepted place of collection,unverified
"North America, United States, Alaska","North Slope Borough, Barrow","Barrow, Alaska",71.290556,-156.788611,World Geodetic System 1984,8125,m,GeoLocate,GeoLocate,Adam Glueckert,2016-09-21,Xema sabini,CHAS:Bird:5539,07/02/1931,1931-07-02,1931-07-02,accepted place of collection,unverified
"North America, United States, Alaska","North Slope Borough, Barrow","Barrow, Alaska",71.290556,-156.788611,World Geodetic System 1984,8125,m,GeoLocate,GeoLocate,Adam Glueckert,2016-09-21,Xema sabini,CHAS:Bird:5540,07/03/1931,1931-07-03,1931-07-03,accepted place of collection,unverified
"North America, United States, Alaska","North Slope Borough, Barrow",,71.290556,-156.788611,World Geodetic System 1984,8125,m,GeoLocate,GeoLocate,Adam Glueckert,2016-09-21,Stercorarius parasiticus,CHAS:Bird:2264,06/22/1929,1929-06-22,1929-06-22,accepted place of collection,unverified
"North America, United States, Alaska","North Slope Borough, Barrow",,71.290556,-156.788611,World Geodetic System 1984,8125,m,GeoLocate,GeoLocate,Adam Glueckert,2016-09-21,Stercorarius parasiticus,CHAS:Bird:2603,06/26/1929,1929-06-26,1929-06-26,accepted place of collection,unverified
"North America, United States, Alaska","North Slope Borough, Barrow",,71.290556,-156.788611,World Geodetic System 1984,8125,m,GeoLocate,GeoLocate,Adam Glueckert,2016-09-21,Stercorarius parasiticus,CHAS:Bird:4205,07/04/1930,1930-07-04,1930-07-04,accepted place of collection,unverified
"North America, United States, Alaska","North Slope Borough, Barrow",,71.290556,-156.788611,World Geodetic System 1984,8125,m,GeoLocate,GeoLocate,Adam Glueckert,2016-09-21,Stercorarius pomarinus,CHAS:Bird:2044,09/03/1928,1928-09-03,1928-09-03,accepted place of collection,unverified
"North America, United States, Alaska","North Slope Borough, Barrow","Barrow, Alaska",71.290556,-156.788611,World Geodetic System 1984,8125,m,GeoLocate,GeoLocate,Adam Glueckert,2016-09-21,Stercorarius pomarinus,CHAS:Bird:5493,06/25/1931,1931-06-25,1931-06-25,accepted place of collection,unverified
"North America, United States, Alaska","North Slope Borough, Barrow","Barrow, Alaska",71.290556,-156.788611,World Geodetic System 1984,8125,m,GeoLocate,GeoLocate,Adam Glueckert,2016-09-21,Stercorarius pomarinus,CHAS:Bird:5494,06/25/1931,1931-06-25,1931-06-25,accepted place of collection,unverified
"North America, United States, Alaska","North Slope Borough, Barrow","Barrow, Alaska",71.290556,-156.788611,World Geodetic System 1984,8125,m,GeoLocate,GeoLocate,Adam Glueckert,2016-09-21,Stercorarius pomarinus,CHAS:Bird:5495,06/23/1931,1931-06-23,1931-06-23,accepted place of collection,unverified
"North America, United States, Alaska","North Slope Borough, Barrow",,71.290556,-156.788611,World Geodetic System 1984,8125,m,GeoLocate,GeoLocate,Adam Glueckert,2016-09-21,Sterna paradisaea,CHAS:Bird:2035,09/12/1928,1928-09-12,1928-09-12,accepted place of collection,unverified
"North America, United States, Alaska","North Slope Borough, Barrow",,71.290556,-156.788611,World Geodetic System 1984,8125,m,GeoLocate,GeoLocate,Adam Glueckert,2016-09-21,Sterna paradisaea,CHAS:Bird:2073,09/12/1928,1928-09-12,1928-09-12,accepted place of collection,unverified
"North America, United States, Alaska","North Slope Borough, Barrow","Barrow, Alaska",71.290556,-156.788611,World Geodetic System 1984,8125,m,GeoLocate,GeoLocate,Adam Glueckert,2016-09-21,Sterna paradisaea,CHAS:Bird:5428,06/25/1931,1931-06-25,1931-06-25,accepted place of collection,unverified
"North America, United States, Alaska","North Slope Borough, Barrow",,71.290556,-156.788611,World Geodetic System 1984,8125,m,GeoLocate,GeoLocate,Adam Glueckert,2016-09-21,Uria lomvia arra,CHAS:Bird:2363,05/24/1929,1929-05-24,1929-05-24,accepted place of collection,unverified
"North America, United States, Alaska","North Slope Borough, Barrow",,71.290556,-156.788611,World Geodetic System 1984,8125,m,GeoLocate,GeoLocate,Adam Glueckert,2016-09-21,Uria lomvia arra,CHAS:Bird:2383,10/08/1929,1929-10-08,1929-10-08,accepted place of collection,unverified
"North America, United States, Alaska","North Slope Borough, Barrow","Barrow, Alaska",71.290556,-156.788611,World Geodetic System 1984,8125,m,GeoLocate,GeoLocate,Adam Glueckert,2016-09-21,Uria lomvia arra,CHAS:Bird:5512,9/25/1931; 9/26/1931,1931-09-26,1931-09-26,accepted place of collection,unverified
"North America, United States, Alaska","North Slope Borough, Barrow","Barrow, Alaska",71.290556,-156.788611,World Geodetic System 1984,8125,m,GeoLocate,GeoLocate,Adam Glueckert,2016-09-21,Uria lomvia arra,CHAS:Bird:5534,09/25/1931,1931-09-25,1931-09-25,accepted place of collection,unverified
"North America, United States, Alaska","North Slope Borough, Barrow","Barrow, Alaska",71.290556,-156.788611,World Geodetic System 1984,8125,m,GeoLocate,GeoLocate,Adam Glueckert,2016-09-21,Aethia pusilla,CHAS:Bird:5478,09/25/1931,1931-09-25,1931-09-25,accepted place of collection,unverified
"North America, United States, Alaska","North Slope Borough, Barrow","Barrow, Alaska",71.290556,-156.788611,World Geodetic System 1984,8125,m,GeoLocate,GeoLocate,Adam Glueckert,2016-09-21,Aethia pusilla,CHAS:Bird:5541,9/30/1931; 9/03/1931,1931-09-03,1931-09-03,accepted place of collection,unverified
"North America, United States, Alaska","North Slope Borough, Barrow","Barrow, Alaska",71.290556,-156.788611,World Geodetic System 1984,8125,m,GeoLocate,GeoLocate,Adam Glueckert,2016-09-21,Aethia pusilla,CHAS:Bird:5542,09/30/1931,1931-09-30,1931-09-30,accepted place of collection,unverified
"North America, United States, Alaska","North Slope Borough, Barrow",Barrow Alaska,71.290556,-156.788611,World Geodetic System 1984,8125,m,GeoLocate,GeoLocate,Adam Glueckert,2016-09-21,Alle alle,CHAS:Bird:7864,07/13/1935,1935-07-13,1935-07-13,accepted place of collection,unverified
"North America, United States, Alaska","North Slope Borough, Barrow",Barrow Alaska,71.290556,-156.788611,World Geodetic System 1984,8125,m,GeoLocate,GeoLocate,Adam Glueckert,2016-09-21,Aethia pusilla,CHAS:Bird:7868,07/13/1935,1935-07-13,1935-07-13,accepted place of collection,unverified
"North America, United States, Alaska","North Slope Borough, Barrow",,71.290556,-156.788611,World Geodetic System 1984,8125,m,GeoLocate,GeoLocate,Adam Glueckert,2016-09-21,Aethia cristatella,CHAS:Bird:2286,06/22/1929,1929-06-22,1929-06-22,accepted place of collection,unverified
"North America, United States, Alaska","North Slope Borough, Barrow",,71.290556,-156.788611,World Geodetic System 1984,8125,m,GeoLocate,GeoLocate,Adam Glueckert,2016-09-21,Aethia cristatella,CHAS:Bird:2416,09/13/1929,1929-09-13,1929-09-13,accepted place of collection,unverified
"North America, United States, Alaska","North Slope Borough, Barrow",,71.290556,-156.788611,World Geodetic System 1984,8125,m,GeoLocate,GeoLocate,Adam Glueckert,2016-09-21,Aethia cristatella,CHAS:Bird:2600,06/22/1929,1929-06-22,1929-06-22,accepted place of collection,unverified
"North America, United States, Alaska","North Slope Borough, Barrow",,71.290556,-156.788611,World Geodetic System 1984,8125,m,GeoLocate,GeoLocate,Adam Glueckert,2016-09-21,Aethia cristatella,CHAS:Bird:2631,06/22/1929,1929-06-22,1929-06-22,accepted place of collection,unverified
"North America, United States, Alaska","North Slope Borough, Barrow","Barrow, Alaska",71.290556,-156.788611,World Geodetic System 1984,8125,m,GeoLocate,GeoLocate,Adam Glueckert,2016-09-21,Aethia cristatella,CHAS:Bird:5489,09/22/1931,1931-09-22,1931-09-22,accepted place of collection,unverified
"North America, United States, Alaska","North Slope Borough, Barrow","Barrow, Alaska",71.290556,-156.788611,World Geodetic System 1984,8125,m,GeoLocate,GeoLocate,Adam Glueckert,2016-09-21,Aethia cristatella,CHAS:Bird:6478,10/06/1932,1932-10-06,1932-10-06,accepted place of collection,unverified
"North America, United States, Alaska","North Slope Borough, Barrow","Barrow, Alaska",71.290556,-156.788611,World Geodetic System 1984,8125,m,GeoLocate,GeoLocate,Adam Glueckert,2016-09-21,Aethia cristatella,CHAS:Bird:6479,10/06/1932,1932-10-06,1932-10-06,accepted place of collection,unverified
"North America, United States, Alaska","North Slope Borough, Barrow",Barrow Alaska,71.290556,-156.788611,World Geodetic System 1984,8125,m,GeoLocate,GeoLocate,Adam Glueckert,2016-09-21,Aethia cristatella,CHAS:Bird:7867,07/13/1935,1935-07-13,1935-07-13,accepted place of collection,unverified
"North America, United States, Alaska","North Slope Borough, Barrow",,71.290556,-156.788611,World Geodetic System 1984,8125,m,GeoLocate,GeoLocate,Adam Glueckert,2016-09-21,Brachyramphus brevirostris,CHAS:Bird:2378,09/26/1929,1929-09-26,1929-09-26,accepted place of collection,unverified
"North America, United States, Alaska","North Slope Borough, Barrow",,71.290556,-156.788611,World Geodetic System 1984,8125,m,GeoLocate,GeoLocate,Adam Glueckert,2016-09-21,Brachyramphus brevirostris,CHAS:Bird:2379,09/26/1929,1929-09-26,1929-09-26,accepted place of collection,unverified
"North America, United States, Alaska","North Slope Borough, Barrow",,71.290556,-156.788611,World Geodetic System 1984,8125,m,GeoLocate,GeoLocate,Adam Glueckert,2016-09-21,Brachyramphus brevirostris,CHAS:Bird:2380,09/26/1929,1929-09-26,1929-09-26,accepted place of collection,unverified
"North America, United States, Alaska","North Slope Borough, Barrow",,71.290556,-156.788611,World Geodetic System 1984,8125,m,GeoLocate,GeoLocate,Adam Glueckert,2016-09-21,Brachyramphus brevirostris,CHAS:Bird:2381,09/26/1929,1929-09-26,1929-09-26,accepted place of collection,unverified
"North America, United States, Alaska","North Slope Borough, Barrow",,71.290556,-156.788611,World Geodetic System 1984,8125,m,GeoLocate,GeoLocate,Adam Glueckert,2016-09-21,Cepphus grylle mandtii,CHAS:Bird:2053,10/02/1928,1928-10-02,1928-10-02,accepted place of collection,unverified
"North America, United States, Alaska","North Slope Borough, Barrow",,71.290556,-156.788611,World Geodetic System 1984,8125,m,GeoLocate,GeoLocate,Adam Glueckert,2016-09-21,Cepphus mandti,CHAS:Bird:2076,"09/13/1928 or Sept. 30, 1928",1928-09-13,1928-09-30,accepted place of collection,unverified
"North America, United States, Alaska","North Slope Borough, Barrow",,71.290556,-156.788611,World Geodetic System 1984,8125,m,GeoLocate,GeoLocate,Adam Glueckert,2016-09-21,Cepphus mandti,CHAS:Bird:2276,06/19/1929,1929-06-19,1929-06-19,accepted place of collection,unverified
"North America, United States, Alaska","North Slope Borough, Barrow",,71.290556,-156.788611,World Geodetic System 1984,8125,m,GeoLocate,GeoLocate,Adam Glueckert,2016-09-21,Cepphus mandti,CHAS:Bird:2277,03/06/1929,1929-03-06,1929-03-06,accepted place of collection,unverified
"North America, United States, Alaska","North Slope Borough, Barrow",,71.290556,-156.788611,World Geodetic System 1984,8125,m,GeoLocate,GeoLocate,Adam Glueckert,2016-09-21,Cepphus mandti,CHAS:Bird:2285,06/19/1929,1929-06-19,1929-06-19,accepted place of collection,unverified
"North America, United States, Alaska","North Slope Borough, Barrow",,71.290556,-156.788611,World Geodetic System 1984,8125,m,GeoLocate,GeoLocate,Adam Glueckert,2016-09-21,Cepphus mandti,CHAS:Bird:2291,06/19/1929,1929-06-19,1929-06-19,accepted place of collection,unverified
"North America, United States, Alaska","North Slope Borough, Barrow",,71.290556,-156.788611,World Geodetic System 1984,8125,m,GeoLocate,GeoLocate,Adam Glueckert,2016-09-21,Cepphus mandti,CHAS:Bird:2304,03/06/1929,1929-03-06,1929-03-06,accepted place of collection,unverified
"North America, United States, Alaska","North Slope Borough, Barrow",,71.290556,-156.788611,World Geodetic System 1984,8125,m,GeoLocate,GeoLocate,Adam Glueckert,2016-09-21,Cepphus mandti,CHAS:Bird:2305,03/25/1929,1929-03-25,1929-03-25,accepted place of collection,unverified
"North America, United States, Alaska","North Slope Borough, Barrow",,71.290556,-156.788611,World Geodetic System 1984,8125,m,GeoLocate,GeoLocate,Adam Glueckert,2016-09-21,Cepphus grylle mandtii,CHAS:Bird:2306,05/02/1929,1929-05-02,1929-05-02,accepted place of collection,unverified
"North America, United States, Alaska","North Slope Borough, Barrow",,71.290556,-156.788611,World Geodetic System 1984,8125,m,GeoLocate,GeoLocate,Adam Glueckert,2016-09-21,Riparia riparia ijimae,CHAS:Bird:2100,09/15/1928,1928-09-15,1928-09-15,accepted place of collection,unverified
"North America, United States, Alaska","North Slope Borough, Barrow",,71.290556,-156.788611,World Geodetic System 1984,8125,m,GeoLocate,GeoLocate,Adam Glueckert,2016-09-21,Tachycineta bicolor,CHAS:Bird:2400,08/26/1929,1929-08-26,1929-08-26,accepted place of collection,unverified
"North America, United States, Alaska","North Slope Borough, Barrow",,71.290556,-156.788611,World Geodetic System 1984,8125,m,GeoLocate,GeoLocate,Adam Glueckert,2016-09-21,Oenanthe oenanthe oenanthe,CHAS:Bird:2573,05/21/1929,1929-05-21,1929-05-21,accepted place of collection,unverified
"North America, United States, Alaska","North Slope Borough, Barrow",,71.290556,-156.788611,World Geodetic System 1984,8125,m,GeoLocate,GeoLocate,Adam Glueckert,2016-09-21,Oenanthe oenanthe oenanthe,CHAS:Bird:2574,05/24/1929,1929-05-24,1929-05-24,accepted place of collection,unverified
"North America, United States, Alaska","North Slope Borough, Barrow",Barrow Alaska,71.290556,-156.788611,World Geodetic System 1984,8125,m,GeoLocate,GeoLocate,Adam Glueckert,2016-09-21,Oenanthe oenanthe oenanthe,CHAS:Bird:7869,06/06/1935,1935-06-06,1935-06-06,accepted place of collection,unverified
"North America, United States, Alaska","North Slope Borough, Barrow","Barrow, Alaska",71.290556,-156.788611,World Geodetic System 1984,8125,m,GeoLocate,GeoLocate,Adam Glueckert,2016-09-21,Motacilla flava,CHAS:Bird:6480,July 1933,1933-07-01,1933-07-30,accepted place of collection,unverified
"North America, United States, Alaska","North Slope Borough, Barrow",Barrow Alaska,71.290556,-156.788611,World Geodetic System 1984,8125,m,GeoLocate,GeoLocate,Adam Glueckert,2016-10-15,Motacilla tschutschensis alascensis,CHAS:Bird:7886,06/24/1935,1935-06-24,1935-06-24,accepted place of collection,unverified
"North America, United States, Alaska","North Slope Borough, Barrow","Barrow, Alaska",71.290556,-156.788611,World Geodetic System 1984,8125,m,GeoLocate,GeoLocate,Adam Glueckert,2016-09-21,Spizella arborea ochracae,CHAS:Bird:5793,06/09/1932,1932-06-09,1932-06-09,accepted place of collection,unverified
"North America, United States, Alaska","North Slope Borough, Barrow","Barrow, Alaska",71.290556,-156.788611,World Geodetic System 1984,8125,m,GeoLocate,GeoLocate,Adam Glueckert,2016-09-21,Spizella arborea ochracae,CHAS:Bird:5794,06/09/1932,1932-06-09,1932-06-09,accepted place of collection,unverified
"North America, United States, Alaska","North Slope Borough, Barrow","Barrow, Alaska",71.290556,-156.788611,World Geodetic System 1984,8125,m,GeoLocate,GeoLocate,Adam Glueckert,2016-09-21,Zonotrichia leucophrys gambelii,CHAS:Bird:5803,06/09/1932,1932-06-09,1932-06-09,accepted place of collection,unverified
"North America, United States, Alaska","North Slope Borough, Barrow",,71.290556,-156.788611,World Geodetic System 1984,8125,m,GeoLocate,GeoLocate,Adam Glueckert,2016-09-21,Gavia stellata,CHAS:Bird:2267,06/20/1929,1929-06-20,1929-06-20,accepted place of collection,unverified
"North America, United States, Alaska","North Slope Borough, Barrow","Barrow, Alaska",71.290556,-156.788611,World Geodetic System 1984,8125,m,GeoLocate,GeoLocate,Adam Glueckert,2016-09-21,Gavia stellata,CHAS:Bird:6477,07/25/1933,1933-07-25,1933-07-25,accepted place of collection,unverified
"North America, United States, Alaska","North Slope Borough, Barrow",,71.290556,-156.788611,World Geodetic System 1984,8125,m,GeoLocate,GeoLocate,Adam Glueckert,2016-09-21,Gavia pacifica,CHAS:Bird:2089,09/17/1928,1928-09-17,1928-09-17,accepted place of collection,unverified
"North America, United States, Alaska","North Slope Borough, Barrow",,71.290556,-156.788611,World Geodetic System 1984,8125,m,GeoLocate,GeoLocate,Adam Glueckert,2016-09-21,Gavia pacifica,CHAS:Bird:2370,10/07/1929,1929-10-07,1929-10-07,accepted place of collection,unverified
"North America, United States, Alaska","North Slope Borough, Barrow","Barrow, Alaska",71.290556,-156.788611,World Geodetic System 1984,8125,m,GeoLocate,GeoLocate,Adam Glueckert,2016-09-21,Gavia pacifica,CHAS:Bird:5535,09/28/1931,1931-09-28,1931-09-28,accepted place of collection,unverified
"North America, United States, Alaska","North Slope Borough, Barrow","Barrow, Alaska",71.290556,-156.788611,World Geodetic System 1984,8125,m,GeoLocate,GeoLocate,Adam Glueckert,2016-09-21,Gavia stellata,CHAS:Bird:5543,09/23/1931,1931-09-23,1931-09-23,accepted place of collection,unverified
"North America, United States, Alaska","North Slope Borough, Barrow","Barrow, Alaska",71.290556,-156.788611,World Geodetic System 1984,8125,m,GeoLocate,GeoLocate,Adam Glueckert,2016-09-21,Gavia pacifica,CHAS:Bird:5544,09/19/1931,1931-09-19,1931-09-19,accepted place of collection,unverified
"North America, United States, Alaska","North Slope Borough, Barrow","Barrow, Alaska",71.290556,-156.788611,World Geodetic System 1984,8125,m,GeoLocate,GeoLocate,Adam Glueckert,2016-09-21,Gavia adamsii,CHAS:Bird:5528,09/26/1931,1931-09-26,1931-09-26,accepted place of collection,unverified
"North America, United States, Alaska","North Slope Borough, Barrow","Barrow, Alaska",71.290556,-156.788611,World Geodetic System 1984,8125,m,GeoLocate,GeoLocate,Adam Glueckert,2016-09-21,Gavia adamsii,CHAS:Bird:5529,09/30/1931,1931-09-30,1931-09-30,accepted place of collection,unverified
"North America, United States, Alaska","North Slope Borough, Barrow","Barrow, Alas.",71.290556,-156.788611,World Geodetic System 1984,8125,m,GeoLocate,GeoLocate,Adam Glueckert,2016-09-21,Gavia adamsii,CHAS:Bird:5947,07/05/1931,1931-07-05,1931-07-05,accepted place of collection,unverified
"North America, United States, Alaska","North Slope Borough, Barrow",,71.290556,-156.788611,World Geodetic System 1984,8125,m,GeoLocate,GeoLocate,Adam Glueckert,2016-09-21,Gavia stellata,CHAS:Bird:2090,Sept 1928,1928-09-01,1928-09-30,accepted place of collection,unverified
"North America, United States, Alaska","North Slope Borough, Barrow",,71.290556,-156.788611,World Geodetic System 1984,8125,m,GeoLocate,GeoLocate,Adam Glueckert,2016-09-21,Gavia stellata,CHAS:Bird:5537,09/29/1931,1931-09-29,1931-09-29,accepted place of collection,unverified
"North America, United States, Alaska","North Slope Borough, Barrow","Barrow, Alaska",71.290556,-156.788611,World Geodetic System 1984,8125,m,GeoLocate,GeoLocate,Adam Glueckert,2016-09-21,Gavia stellata,CHAS:Bird:5536,09/25/1931,1931-09-25,1931-09-25,accepted place of collection,unverified
"North America, United States, Alaska","North Slope Borough, Barrow","Barrow, Alaska",71.290556,-156.788611,World Geodetic System 1984,8125,m,GeoLocate,GeoLocate,Adam Glueckert,2016-09-21,Gavia stellata,CHAS:Bird:5648,07/09/1931,1931-07-09,1931-07-09,accepted place of collection,unverified
"North America, United States, Alaska","North Slope Borough, Barrow",,71.290556,-156.788611,World Geodetic System 1984,8125,m,GeoLocate,GeoLocate,Adam Glueckert,2016-09-21,Uria lomvia arra,CHAS:Bird:2268,06/04/1929,1929-06-04,1929-06-04,accepted place of collection,unverified
"North America, United States, Alaska","North Slope Borough, Barrow",,71.290556,-156.788611,World Geodetic System 1984,8125,m,GeoLocate,GeoLocate,Adam Glueckert,2016-09-21,Rhodostethia rosea,CHAS:Bird:2374,10/04/1929,1929-10-04,1929-10-04,accepted place of collection,unverified
"North America, United States, Alaska","North Slope Borough, Barrow",,71.290556,-156.788611,World Geodetic System 1984,8125,m,GeoLocate,GeoLocate,Adam Glueckert,2016-09-21,Rhodostethia rosea,CHAS:Bird:2417,10/03/1929,1929-10-03,1929-10-03,accepted place of collection,unverified
"North America, United States, Alaska","North Slope Borough, Barrow",,71.290556,-156.788611,World Geodetic System 1984,8125,m,GeoLocate,GeoLocate,Adam Glueckert,2016-09-21,Rhodostethia rosea,CHAS:Bird:2418,10/08/1929,1929-10-08,1929-10-08,accepted place of collection,unverified
"North America, United States, Alaska","North Slope Borough, Barrow",,71.290556,-156.788611,World Geodetic System 1984,8125,m,GeoLocate,GeoLocate,Adam Glueckert,2016-09-21,Rhodostethia rosea,CHAS:Bird:2419,10/04/1929,1929-10-04,1929-10-04,accepted place of collection,unverified
"North America, United States, Alaska","North Slope Borough, Barrow",,71.290556,-156.788611,World Geodetic System 1984,8125,m,GeoLocate,GeoLocate,Adam Glueckert,2016-09-21,Rhodostethia rosea,CHAS:Bird:2420,10/03/1929,1929-10-03,1929-10-03,accepted place of collection,unverified
"North America, United States, Alaska","North Slope Borough, Barrow",,71.290556,-156.788611,World Geodetic System 1984,8125,m,GeoLocate,GeoLocate,Adam Glueckert,2016-09-21,Rhodostethia rosea,CHAS:Bird:2421,10/04/1929,1929-10-04,1929-10-04,accepted place of collection,unverified
"North America, United States, Alaska","North Slope Borough, Barrow",,71.290556,-156.788611,World Geodetic System 1984,8125,m,GeoLocate,GeoLocate,Adam Glueckert,2016-09-21,Rhodostethia rosea,CHAS:Bird:2422,10/04/1929,1929-10-04,1929-10-04,accepted place of collection,unverified
"North America, United States, Alaska","North Slope Borough, Barrow",,71.290556,-156.788611,World Geodetic System 1984,8125,m,GeoLocate,GeoLocate,Adam Glueckert,2016-09-21,Rhodostethia rosea,CHAS:Bird:2423,10/04/1929,1929-10-04,1929-10-04,accepted place of collection,unverified
"North America, United States, Alaska","North Slope Borough, Barrow",,71.290556,-156.788611,World Geodetic System 1984,8125,m,GeoLocate,GeoLocate,Adam Glueckert,2016-09-21,Calidris melanotos,CHAS:Bird:2563,06/23/1929,1929-06-23,1929-06-23,accepted place of collection,unverified
"North America, United States, Alaska","North Slope Borough, Barrow",,71.290556,-156.788611,World Geodetic System 1984,8125,m,GeoLocate,GeoLocate,Adam Glueckert,2016-09-21,Calidris melanotos,CHAS:Bird:2565,06/14/1929,1929-06-14,1929-06-14,accepted place of collection,unverified
"North America, United States, Alaska","North Slope Borough, Barrow",,71.290556,-156.788611,World Geodetic System 1984,8125,m,GeoLocate,GeoLocate,Adam Glueckert,2016-09-21,Cepphus grylle mandtii,CHAS:Bird:2590,03/06/1929,1929-03-06,1929-03-06,accepted place of collection,unverified
"North America, United States, Alaska","North Slope Borough, Barrow",,71.290556,-156.788611,World Geodetic System 1984,8125,m,GeoLocate,GeoLocate,Adam Glueckert,2016-09-21,Gavia stellata,CHAS:Bird:2651,07/03/1927,1927-07-03,1927-07-03,accepted place of collection,unverified
"North America, United States, Alaska","North Slope Borough, Barrow",,71.290556,-156.788611,World Geodetic System 1984,8125,m,GeoLocate,GeoLocate,Adam Glueckert,2016-09-21,Larus hyperboreus,CHAS:Bird:2715,09/09/1929,1929-09-09,1929-09-09,accepted place of collection,unverified
"North America, United States, Alaska","North Slope Borough, Barrow","Barrow, Alaska",71.290556,-156.788611,World Geodetic System 1984,8125,m,GeoLocate,GeoLocate,Adam Glueckert,2016-09-21,Rhodostethia rosea,CHAS:Bird:5463,09/21/1931,1931-09-21,1931-09-21,accepted place of collection,unverified
"North America, United States, Alaska","North Slope Borough, Barrow","Barrow, Alaska",71.290556,-156.788611,World Geodetic System 1984,8125,m,GeoLocate,GeoLocate,Adam Glueckert,2016-09-21,Phalaropus fulicaria,CHAS:Bird:6464,07/16/1933,1933-07-16,1933-07-16,accepted place of collection,unverified
"North America, United States, Alaska","North Slope Borough, Barrow","Barrow, Alaska",71.290556,-156.788611,World Geodetic System 1984,8125,m,GeoLocate,GeoLocate,Adam Glueckert,2016-09-21,Pisobia bairdii,CHAS:Bird:6476,07/20/1933,1933-07-20,1933-07-20,accepted place of collection,unverified
"North America, United States, Alaska","North Slope Borough, Barrow",Barrow Alaska,71.290556,-156.788611,World Geodetic System 1984,8125,m,GeoLocate,GeoLocate,Adam Glueckert,2016-09-21,Eremophila alpestris,CHAS:Bird:7884,08/01/1934,1934-08-01,1934-08-01,accepted place of collection,unverified
"North America, United States, Alaska","North Slope Borough, Barrow",,71.290556,-156.788611,World Geodetic System 1984,8125,m,GeoLocate,GeoLocate,Adam Glueckert,2016-09-21,Calidris melanotos,CHAS:Bird:19287,06/14/1926,1926-06-14,1926-06-14,accepted place of collection,unverified
"North America, United States, Alaska","North Slope Borough, Barrow",,71.290556,-156.788611,World Geodetic System 1984,8125,m,GeoLocate,GeoLocate,Adam Glueckert,2016-09-21,Xema sabini,CHAS:Bird:19302,08/13/1931,1931-08-13,1931-08-13,accepted place of collection,unverified
"North America, United States, Alaska","North Slope Borough, Barrow",,71.290556,-156.788611,World Geodetic System 1984,8125,m,GeoLocate,GeoLocate,Adam Glueckert,2016-09-21,Aethia pusilla,CHAS:Bird:19305,09/30/1931,1931-09-30,1931-09-30,accepted place of collection,unverified
"North America, United States, Alaska","North Slope Borough, Barrow","Barrow, Alaska",71.290556,-156.788611,World Geodetic System 1984,8125,m,GeoLocate,GeoLocate,Adam Glueckert,2016-10-15,Xema sabini,CHAS:Bird:5932,06/20/1931,1931-06-20,1931-06-20,accepted place of collection,unverified
"North America, United States, Alaska","North Slope Borough, Barrow","Barrow, Alaska",71.290556,-156.788611,World Geodetic System 1984,8125,m,GeoLocate,GeoLocate,Adam Glueckert,2016-10-15,Aethia cristatella,CHAS:Bird:5924,"May, 1931",1931-05-01,1931-05-30,accepted place of collection,unverified
"North America, United States, Alaska","North Slope Borough, Barrow",Barrow Alaska,71.290556,-156.788611,World Geodetic System 1984,8125,m,GeoLocate,GeoLocate,Adam Glueckert,2016-10-15,Plectrophenax nivalis nivalis,CHAS:Bird:7885,05/10/1935,1935-05-10,1935-05-10,accepted place of collection,unverified
"North America, United States, Alaska","North Slope Borough, Barrow","Barrow, Alaska",71.290556,-156.788611,World Geodetic System 1984,8125,m,GeoLocate,GeoLocate,Adam Glueckert,2016-09-21,Pagophila eburnea,CHAS:Bird:9445,05/19/1942,1942-05-19,1942-05-19,accepted place of collection,unverified
"North America, United States, Alaska","North Slope Borough, Barrow","Barrow, Alaska",71.290556,-156.788611,World Geodetic System 1984,8125,m,GeoLocate,GeoLocate,Adam Glueckert,2016-09-21,Pagophila eburnea,CHAS:Bird:9446,"05/08/1942 or Nov. 18, 1943",1942-05-08,1943-11-18,accepted place of collection,unverified
"North America, United States, Alaska","North Slope Borough, Barrow","Barrow, Alaska",71.290556,-156.788611,World Geodetic System 1984,8125,m,GeoLocate,GeoLocate,Adam Glueckert,2016-09-21,Rissa tridactyla pollicaris,CHAS:Bird:9442,07/01/1942,1942-07-01,1942-07-01,accepted place of collection,unverified
"North America, United States, Alaska","North Slope Borough, Barrow","Barrow, Alaska",71.290556,-156.788611,World Geodetic System 1984,8125,m,GeoLocate,GeoLocate,Adam Glueckert,2016-09-21,Rissa tridactyla pollicaris,CHAS:Bird:9443,07/03/1942,1942-07-03,1942-07-03,accepted place of collection,unverified
"North America, United States, Alaska","North Slope Borough, Barrow","Barrow, Alaska",71.290556,-156.788611,World Geodetic System 1984,8125,m,GeoLocate,GeoLocate,Adam Glueckert,2016-09-21,Sayornis saya,CHAS:Bird:5805,05/27/1932,1932-05-27,1932-05-27,accepted place of collection,unverified
"North America, United States, Alaska","North Slope Borough, Barrow",,71.290556,-156.788611,World Geodetic System 1984,8125,m,GeoLocate,GeoLocate,Adam Glueckert,2016-09-21,Turdus migratorius migratorius,CHAS:Bird:5238,05/30/1931,1931-05-30,1931-05-30,accepted place of collection,unverified
"North America, United States, Alaska","North Slope Borough, Barrow",,71.290556,-156.788611,World Geodetic System 1984,8125,m,GeoLocate,GeoLocate,Adam Glueckert,2016-09-21,Melanitta perspicillata,CHAS:Bird:5258,Summer 1931,1931-06-01,1931-08-31,accepted place of collection,unverified
"North America, United States, Alaska","North Slope Borough, Barrow",,71.290556,-156.788611,World Geodetic System 1984,8125,m,GeoLocate,GeoLocate,Adam Glueckert,2016-09-21,Clangula hyemalis,CHAS:Bird:2046,09/10/1928,1928-09-10,1928-09-10,accepted place of collection,unverified
"North America, United States, Alaska","North Slope Borough, Barrow",,71.290556,-156.788611,World Geodetic System 1984,8125,m,GeoLocate,GeoLocate,Adam Glueckert,2016-09-21,Clangula hyemalis,CHAS:Bird:2075,"09/30/1928 or Sept. 13, 1928",1928-09-13,1928-09-30,accepted place of collection,unverified
"North America, United States, Alaska","North Slope Borough, Barrow",,71.290556,-156.788611,World Geodetic System 1984,8125,m,GeoLocate,GeoLocate,Adam Glueckert,2016-09-21,Clangula hyemalis,CHAS:Bird:2272,06/04/1929,1929-06-04,1929-06-04,accepted place of collection,unverified
"North America, United States, Alaska","North Slope Borough, Barrow",,71.290556,-156.788611,World Geodetic System 1984,8125,m,GeoLocate,GeoLocate,Adam Glueckert,2016-09-21,Clangula hyemalis,CHAS:Bird:4720,06/04/1930,1930-06-04,1930-06-04,accepted place of collection,unverified
"North America, United States, Alaska","North Slope Borough, Barrow",,71.290556,-156.788611,World Geodetic System 1984,8125,m,GeoLocate,GeoLocate,Adam Glueckert,2016-09-21,Clangula hyemalis,CHAS:Bird:4721,06/04/1930,1930-06-04,1930-06-04,accepted place of collection,unverified
"North America, United States, Alaska","North Slope Borough, Barrow",,71.290556,-156.788611,World Geodetic System 1984,8125,m,GeoLocate,GeoLocate,Adam Glueckert,2016-09-21,Clangula hyemalis,CHAS:Bird:4732,06/17/1930,1930-06-17,1930-06-17,accepted place of collection,unverified
"North America, United States, Alaska","North Slope Borough, Barrow",,71.290556,-156.788611,World Geodetic System 1984,8125,m,GeoLocate,GeoLocate,Adam Glueckert,2016-09-21,Polysticta stelleri,CHAS:Bird:4723,06/20/1930,1930-06-20,1930-06-20,accepted place of collection,unverified
"North America, United States, Alaska","North Slope Borough, Barrow",,71.290556,-156.788611,World Geodetic System 1984,8125,m,GeoLocate,GeoLocate,Adam Glueckert,2016-09-21,Polysticta stelleri,CHAS:Bird:4724,06/20/1930,1930-06-20,1930-06-20,accepted place of collection,unverified
"North America, United States, Alaska","North Slope Borough, Barrow",,71.290556,-156.788611,World Geodetic System 1984,8125,m,GeoLocate,GeoLocate,Adam Glueckert,2016-09-21,Polysticta stelleri,CHAS:Bird:4744,06/28/1930,1930-06-28,1930-06-28,accepted place of collection,unverified
"North America, United States, Alaska","North Slope Borough, Barrow",,71.290556,-156.788611,World Geodetic System 1984,8125,m,GeoLocate,GeoLocate,Adam Glueckert,2016-09-21,Polysticta stelleri,CHAS:Bird:4756,06/28/1909,1909-06-28,1909-06-28,accepted place of collection,unverified
"North America, United States, Alaska","North Slope Borough, Barrow",,71.290556,-156.788611,World Geodetic System 1984,8125,m,GeoLocate,GeoLocate,Adam Glueckert,2016-09-21,Polysticta stelleri,CHAS:Bird:4770,06/24/1930,1930-06-24,1930-06-24,accepted place of collection,unverified
"North America, United States, Alaska","North Slope Borough, Barrow",,71.290556,-156.788611,World Geodetic System 1984,8125,m,GeoLocate,GeoLocate,Adam Glueckert,2016-09-21,Polysticta stelleri,CHAS:Bird:5377,06/20/1931,1931-06-20,1931-06-20,accepted place of collection,unverified
"North America, United States, Alaska","North Slope Borough, Barrow",,71.290556,-156.788611,World Geodetic System 1984,8125,m,GeoLocate,GeoLocate,Adam Glueckert,2016-09-21,Polysticta stelleri,CHAS:Bird:5378,06/12/1931,1931-06-12,1931-06-12,accepted place of collection,unverified
"North America, United States, Alaska","North Slope Borough, Barrow",,71.290556,-156.788611,World Geodetic System 1984,8125,m,GeoLocate,GeoLocate,Adam Glueckert,2016-09-21,Polysticta stelleri,CHAS:Bird:2271,06/04/1929,1929-06-04,1929-06-04,accepted place of collection,unverified
"North America, United States, Alaska","North Slope Borough, Barrow",,71.290556,-156.788611,World Geodetic System 1984,8125,m,GeoLocate,GeoLocate,Adam Glueckert,2016-09-21,Polysticta stelleri,CHAS:Bird:4722,06/28/1930,1930-06-28,1930-06-28,accepted place of collection,unverified
"North America, United States, Alaska","North Slope Borough, Barrow",,71.290556,-156.788611,World Geodetic System 1984,8125,m,GeoLocate,GeoLocate,Adam Glueckert,2016-09-21,Polysticta stelleri,CHAS:Bird:4745,06/28/1930,1930-06-28,1930-06-28,accepted place of collection,unverified
"North America, United States, Alaska","North Slope Borough, Barrow",,71.290556,-156.788611,World Geodetic System 1984,8125,m,GeoLocate,GeoLocate,Adam Glueckert,2016-09-21,Polysticta stelleri,CHAS:Bird:4771,06/20/1930,1930-06-20,1930-06-20,accepted place of collection,unverified
"North America, United States, Alaska","North Slope Borough, Barrow",,71.290556,-156.788611,World Geodetic System 1984,8125,m,GeoLocate,GeoLocate,Adam Glueckert,2016-09-21,Polysticta stelleri,CHAS:Bird:4772,06/20/1930,1930-06-20,1930-06-20,accepted place of collection,unverified
"North America, United States, Alaska","North Slope Borough, Barrow",,71.290556,-156.788611,World Geodetic System 1984,8125,m,GeoLocate,GeoLocate,Adam Glueckert,2016-09-21,Somateria spectabilis,CHAS:Bird:2281,05/25/1929,1929-05-25,1929-05-25,accepted place of collection,unverified
"North America, United States, Alaska","North Slope Borough, Barrow",,71.290556,-156.788611,World Geodetic System 1984,8125,m,GeoLocate,GeoLocate,Adam Glueckert,2016-09-21,Somateria mollissima,CHAS:Bird:2284,06/04/1929,1929-06-04,1929-06-04,accepted place of collection,unverified
"North America, United States, Alaska","North Slope Borough, Barrow","Barrow, Alaska",71.290556,-156.788611,World Geodetic System 1984,8125,m,GeoLocate,GeoLocate,Adam Glueckert,2016-10-15,Chen caerulescens,CHAS:Bird:5927,06/17/1932,1932-06-17,1932-06-17,accepted place of collection,unverified
"North America, United States, Alaska","North Slope Borough, Barrow",,71.290556,-156.788611,World Geodetic System 1984,8125,m,GeoLocate,GeoLocate,Adam Glueckert,2016-09-21,Anser albifrons,CHAS:Bird:2273,06/04/1929,1929-06-04,1929-06-04,accepted place of collection,unverified
"North America, United States, Alaska","North Slope Borough, Barrow",,71.290556,-156.788611,World Geodetic System 1984,8125,m,GeoLocate,GeoLocate,Adam Glueckert,2016-09-21,Anser albifrons albifrons,CHAS:Bird:2278,05/28/1929,1929-05-28,1929-05-28,accepted place of collection,unverified
"North America, United States, Alaska","North Slope Borough, Barrow",,71.290556,-156.788611,World Geodetic System 1984,8125,m,GeoLocate,GeoLocate,Adam Glueckert,2016-09-21,Anser albifrons albifrons,CHAS:Bird:4868,06/05/1930,1930-06-05,1930-06-05,accepted place of collection,unverified
"North America, United States, Alaska","North Slope Borough, Barrow",,71.290556,-156.788611,World Geodetic System 1984,8125,m,GeoLocate,GeoLocate,Adam Glueckert,2016-09-21,Anser albifrons albifrons,CHAS:Bird:5335,06/15/1931,1931-06-15,1931-06-15,accepted place of collection,unverified
"North America, United States, Alaska","North Slope Borough, Barrow",,71.290556,-156.788611,World Geodetic System 1984,8125,m,GeoLocate,GeoLocate,Adam Glueckert,2016-09-21,Anser albifrons albifrons,CHAS:Bird:4867,06/11/1930,1930-06-11,1930-06-11,accepted place of collection,unverified
"North America, United States, Alaska","North Slope Borough, Barrow",,71.290556,-156.788611,World Geodetic System 1984,8125,m,GeoLocate,GeoLocate,Adam Glueckert,2016-09-21,Anas acuta,CHAS:Bird:2744,08/27/1929,1929-08-27,1929-08-27,accepted place of collection,unverified
"North America, United States, Alaska","North Slope Borough, Barrow",,71.290556,-156.788611,World Geodetic System 1984,8125,m,GeoLocate,GeoLocate,Adam Glueckert,2016-09-21,Anas acuta tzitzihoa,CHAS:Bird:4767,06/09/1930,1930-06-09,1930-06-09,accepted place of collection,unverified
"North America, United States, Alaska","North Slope Borough, Barrow",,71.290556,-156.788611,World Geodetic System 1984,8125,m,GeoLocate,GeoLocate,Adam Glueckert,2016-09-21,Anas acuta,CHAS:Bird:2743,09/01/1929,1929-09-01,1929-09-01,accepted place of collection,unverified
"North America, United States, Alaska","North Slope Borough, Barrow",,71.290556,-156.788611,World Geodetic System 1984,8125,m,GeoLocate,GeoLocate,Adam Glueckert,2016-09-21,Anas acuta,CHAS:Bird:2745,06/08/1929,1929-06-08,1929-06-08,accepted place of collection,unverified
"North America, United States, Alaska","North Slope Borough, Barrow",,71.290556,-156.788611,World Geodetic System 1984,8125,m,GeoLocate,GeoLocate,Adam Glueckert,2016-09-21,Anas acuta tzitzihoa,CHAS:Bird:4757,06/07/1930,1930-06-07,1930-06-07,accepted place of collection,unverified
"North America, United States, Alaska","North Slope Borough, Barrow",,71.290556,-156.788611,World Geodetic System 1984,8125,m,GeoLocate,GeoLocate,Adam Glueckert,2016-09-21,Anas acuta,CHAS:Bird:5242,06/25/1931,1931-06-25,1931-06-25,accepted place of collection,unverified
"North America, United States, Alaska","North Slope Borough, Barrow",,71.290556,-156.788611,World Geodetic System 1984,8125,m,GeoLocate,GeoLocate,Adam Glueckert,2016-09-21,Branta bernicla nigricans,CHAS:Bird:4776,06/05/1930,1930-06-05,1930-06-05,accepted place of collection,unverified
"North America, United States, Alaska","North Slope Borough, Barrow",,71.290556,-156.788611,World Geodetic System 1984,8125,m,GeoLocate,GeoLocate,Adam Glueckert,2016-09-21,Chen caerulescens,CHAS:Bird:2290,06/06/1929,1929-06-06,1929-06-06,accepted place of collection,unverified
"North America, United States, Alaska","North Slope Borough, Barrow",,71.290556,-156.788611,World Geodetic System 1984,8125,m,GeoLocate,GeoLocate,Adam Glueckert,2016-09-21,Chen caerulescens,CHAS:Bird:2310,06/06/1929,1929-06-06,1929-06-06,accepted place of collection,unverified
"North America, United States, Alaska","North Slope Borough, Barrow",,71.290556,-156.788611,World Geodetic System 1984,8125,m,GeoLocate,GeoLocate,Adam Glueckert,2016-09-21,Somateria spectabilis,CHAS:Bird:4407,05/23/1930,1930-05-23,1930-05-23,accepted place of collection,unverified
"North America, United States, Alaska","North Slope Borough, Barrow",,71.290556,-156.788611,World Geodetic System 1984,8125,m,GeoLocate,GeoLocate,Adam Glueckert,2016-09-21,Somateria spectabilis,CHAS:Bird:5379,07/15/1931,1931-07-15,1931-07-15,accepted place of collection,unverified
"North America, United States, Alaska","North Slope Borough, Barrow","Barrow, Alaska",71.290556,-156.788611,World Geodetic System 1984,8125,m,GeoLocate,GeoLocate,Adam Glueckert,2016-09-21,Somateria spectabilis,CHAS:Bird:5646,06/25/1930,1930-06-25,1930-06-25,accepted place of collection,unverified
"North America, United States, Alaska","North Slope Borough, Barrow",,71.290556,-156.788611,World Geodetic System 1984,8125,m,GeoLocate,GeoLocate,Adam Glueckert,2016-09-21,Somateria spectabilis,CHAS:Bird:2021,09/13/1928,1928-09-13,1928-09-13,accepted place of collection,unverified
"North America, United States, Alaska","North Slope Borough, Barrow",,71.290556,-156.788611,World Geodetic System 1984,8125,m,GeoLocate,GeoLocate,Adam Glueckert,2016-09-21,Somateria fischeri,CHAS:Bird:2269,06/04/1929,1929-06-04,1929-06-04,accepted place of collection,unverified
"North America, United States, Alaska","North Slope Borough, Barrow",,71.290556,-156.788611,World Geodetic System 1984,8125,m,GeoLocate,GeoLocate,Adam Glueckert,2016-09-21,Somateria spectabilis,CHAS:Bird:2282,05/22/1929,1929-05-22,1929-05-22,accepted place of collection,unverified
"North America, United States, Alaska","North Slope Borough, Barrow",,71.290556,-156.788611,World Geodetic System 1984,8125,m,GeoLocate,GeoLocate,Adam Glueckert,2016-09-21,Somateria fischeri,CHAS:Bird:2283,6/4/1929,1929-06-04,1929-06-04,accepted place of collection,unverified
"North America, United States, Alaska","North Slope Borough, Barrow",,71.290556,-156.788611,World Geodetic System 1984,8125,m,GeoLocate,GeoLocate,Adam Glueckert,2016-09-21,Somateria spectabilis,CHAS:Bird:2331,05/14/1929,1929-05-14,1929-05-14,accepted place of collection,unverified
"North America, United States, Alaska","North Slope Borough, Barrow",,71.290556,-156.788611,World Geodetic System 1984,8125,m,GeoLocate,GeoLocate,Adam Glueckert,2016-09-21,Somateria fischeri,CHAS:Bird:4726,06/27/1930,1930-06-27,1930-06-27,accepted place of collection,unverified
"North America, United States, Alaska","North Slope Borough, Barrow",,71.290556,-156.788611,World Geodetic System 1984,8125,m,GeoLocate,GeoLocate,Adam Glueckert,2016-09-21,Somateria mollissima,CHAS:Bird:4741,06/02/1930,1930-06-02,1930-06-02,accepted place of collection,unverified
"North America, United States, Alaska","North Slope Borough, Barrow",,71.290556,-156.788611,World Geodetic System 1984,8125,m,GeoLocate,GeoLocate,Adam Glueckert,2016-09-21,Somateria fischeri,CHAS:Bird:5376,06/18/1931,1931-06-18,1931-06-18,accepted place of collection,unverified
"North America, United States, Alaska","North Slope Borough, Barrow","Barrow, Alaska",71.290556,-156.788611,World Geodetic System 1984,8125,m,GeoLocate,GeoLocate,Adam Glueckert,2016-09-21,Somateria spectabilis,CHAS:Bird:5461,09/22/1931,1931-09-22,1931-09-22,accepted place of collection,unverified
"North America, United States, Alaska","North Slope Borough, Barrow","Barrow, Alaska",71.290556,-156.788611,World Geodetic System 1984,8125,m,GeoLocate,GeoLocate,Adam Glueckert,2016-09-21,Somateria fischeri,CHAS:Bird:5545,07/02/1931,1931-07-02,1931-07-02,accepted place of collection,unverified
"North America, United States, Alaska","North Slope Borough, Barrow",,71.290556,-156.788611,World Geodetic System 1984,8125,m,GeoLocate,GeoLocate,Adam Glueckert,2016-09-21,Somateria fischeri,CHAS:Bird:2022,09/18/1928,1928-09-18,1928-09-18,accepted place of collection,unverified
"North America, United States, Alaska","North Slope Borough, Barrow",,71.290556,-156.788611,World Geodetic System 1984,8125,m,GeoLocate,GeoLocate,Adam Glueckert,2016-09-21,Somateria fischeri,CHAS:Bird:2270,06/04/1929,1929-06-04,1929-06-04,accepted place of collection,unverified
"North America, United States, Alaska","North Slope Borough, Barrow",,71.290556,-156.788611,World Geodetic System 1984,8125,m,GeoLocate,GeoLocate,Adam Glueckert,2016-09-21,Somateria fischeri,CHAS:Bird:2330,06/04/1929,1929-06-04,1929-06-04,accepted place of collection,unverified
"North America, United States, Alaska","North Slope Borough, Barrow",,71.290556,-156.788611,World Geodetic System 1984,8125,m,GeoLocate,GeoLocate,Adam Glueckert,2016-09-21,Somateria fischeri,CHAS:Bird:2612,06/22/1929,1929-06-22,1929-06-22,accepted place of collection,unverified
"North America, United States, Alaska","North Slope Borough, Barrow",,71.290556,-156.788611,World Geodetic System 1984,8125,m,GeoLocate,GeoLocate,Adam Glueckert,2016-09-21,Somateria fischeri,CHAS:Bird:4774,06/27/1930,1930-06-27,1930-06-27,accepted place of collection,unverified
"North America, United States, Alaska","North Slope Borough, Barrow",,71.290556,-156.788611,World Geodetic System 1984,8125,m,GeoLocate,GeoLocate,Adam Glueckert,2016-09-21,Somateria fischeri,CHAS:Bird:4775,06/07/1930,1930-06-07,1930-06-07,accepted place of collection,unverified
"North America, United States, Alaska","North Slope Borough, Barrow",,71.290556,-156.788611,World Geodetic System 1984,8125,m,GeoLocate,GeoLocate,Adam Glueckert,2016-09-21,Somateria fischeri,CHAS:Bird:5381,06/30/1931,1931-06-30,1931-06-30,accepted place of collection,unverified
"North America, United States, Alaska","North Slope Borough, Barrow","Barrow, Alaska",71.290556,-156.788611,World Geodetic System 1984,8125,m,GeoLocate,GeoLocate,Adam Glueckert,2016-09-21,Somateria fischeri,CHAS:Bird:5532,07/02/1931,1931-07-02,1931-07-02,accepted place of collection,unverified
"North America, United States, Alaska","North Slope Borough, Barrow","Barrow, Alaska",71.290556,-156.788611,World Geodetic System 1984,8125,m,GeoLocate,GeoLocate,Adam Glueckert,2016-09-21,Somateria fischeri,CHAS:Bird:5901,"07/29/1932 or July 27, 1932",1932-07-27,1932-07-29,accepted place of collection,unverified
"North America, United States, Alaska","North Slope Borough, Barrow","Barrow, Alaska",71.290556,-156.788611,World Geodetic System 1984,8125,m,GeoLocate,GeoLocate,Adam Glueckert,2016-09-21,Somateria fischeri,CHAS:Bird:5902,"07/29/1932 or July 27, 1932",1932-07-27,1932-07-29,accepted place of collection,unverified
"North America, United States, Alaska","North Slope Borough, Barrow",,71.290556,-156.788611,World Geodetic System 1984,8125,m,GeoLocate,GeoLocate,Adam Glueckert,2016-09-30,Mergus serrator,CHAS:Bird:4730,06/05/1930,1930-06-05,1930-06-05,accepted place of collection,unverified
"North America, United States, Alaska","North Slope Borough, Barrow",,71.290556,-156.788611,World Geodetic System 1984,8125,m,GeoLocate,GeoLocate,Adam Glueckert,2016-09-30,Mergus serrator,CHAS:Bird:4769,06/05/1930,1930-06-05,1930-06-05,accepted place of collection,unverified
"North America, United States, Alaska","North Slope Borough, Barrow",,71.290556,-156.788611,World Geodetic System 1984,8125,m,GeoLocate,GeoLocate,Adam Glueckert,2016-09-30,Polysticta stelleri,CHAS:Bird:4725,06/20/1930,1930-06-20,1930-06-20,accepted place of collection,unverified
"North America, United States, Alaska","North Slope Borough, Barrow",,71.290556,-156.788611,World Geodetic System 1984,8125,m,GeoLocate,GeoLocate,Adam Glueckert,2016-09-21,Somateria fischeri,CHAS:Bird:19282,06/04/1929,1929-06-04,1929-06-04,accepted place of collection,unverified
"North America, United States, Alaska","North Slope Borough, Barrow",,71.290556,-156.788611,World Geodetic System 1984,8125,m,GeoLocate,GeoLocate,Adam Glueckert,2016-09-21,Sialia currucoides,CHAS:Bird:4400,06/05/1930,1930-06-05,1930-06-05,accepted place of collection,unverified
"North America, United States, Alaska","North Slope Borough, Barrow",,71.290556,-156.788611,World Geodetic System 1984,8125,m,GeoLocate,GeoLocate,Adam Glueckert,2016-09-21,Calidris pusilla,CHAS:Bird:5309,07/03/1930,1930-07-03,1930-07-03,accepted place of collection,unverified
"North America, United States, Alaska","North Slope Borough, Barrow",Alaska: Barrow,71.290556,-156.788611,World Geodetic System 1984,8125,m,GeoLocate,GeoLocate,Adam Glueckert,2016-09-21,Pluvialis dominica dominica,CHAS:Bird:4758,07/05/1930,1930-07-05,1930-07-05,accepted place of collection,unverified
"North America, United States, Alaska","North Slope Borough, Barrow",,71.290556,-156.788611,World Geodetic System 1984,8125,m,GeoLocate,GeoLocate,Adam Glueckert,2016-09-21,Stercorarius parasiticus,CHAS:Bird:5338,June 1931,1931-06-01,1931-06-30,accepted place of collection,unverified
"North America, United States, Alaska","North Slope Borough, Barrow",,71.290556,-156.788611,World Geodetic System 1984,8125,m,GeoLocate,GeoLocate,Adam Glueckert,2016-09-21,Calidris bairdii,CHAS:Bird:5269,07/01/1926,1926-07-01,1926-07-01,accepted place of collection,unverified
"North America, United States, Alaska","North Slope Borough, Barrow",,71.290556,-156.788611,World Geodetic System 1984,8125,m,GeoLocate,GeoLocate,Adam Glueckert,2016-09-21,Calidris bairdii,CHAS:Bird:5308,07/02/1926,1926-07-02,1926-07-02,accepted place of collection,unverified
"North America, United States, Alaska","North Slope Borough, Barrow",Alaska: Barrow,71.290556,-156.788611,World Geodetic System 1984,8125,m,GeoLocate,GeoLocate,Adam Glueckert,2016-09-21,Arenaria interpres morinella,CHAS:Bird:5333,[transcribed directly into formatted date fields],1931-06-01,1931-06-30,accepted place of collection,unverified
"North America, United States, Alaska","North Slope Borough, Barrow",Alaska: Barrow,71.290556,-156.788611,World Geodetic System 1984,8125,m,GeoLocate,GeoLocate,Adam Glueckert,2016-09-21,Arenaria interpres morinella,CHAS:Bird:5332,06/1931,1931-06-01,1931-06-30,accepted place of collection,unverified
"North America, United States, Alaska","North Slope Borough, Barrow",Alaska: Barrow,71.290556,-156.788611,World Geodetic System 1984,8125,m,GeoLocate,GeoLocate,Adam Glueckert,2016-09-21,Pluvialis dominica,CHAS:Bird:5112,06/25/1925,1926-06-01,1926-06-30,accepted place of collection,unverified
"North America, United States, Alaska","North Slope Borough, Barrow",Alaska: Barrow,71.290556,-156.788611,World Geodetic System 1984,8125,m,GeoLocate,GeoLocate,Adam Glueckert,2016-09-21,Pluvialis dominica,CHAS:Bird:5113,06/26/1926,1926-06-26,1926-06-26,accepted place of collection,unverified
"North America, United States, Alaska","North Slope Borough, Barrow",Alaska: Barrow,71.290556,-156.788611,World Geodetic System 1984,8125,m,GeoLocate,GeoLocate,Adam Glueckert,2016-09-21,Pluvialis dominica,CHAS:Bird:5109,06/26/1926,1926-06-26,1926-06-26,accepted place of collection,unverified
"North America, United States, Alaska","North Slope Borough, Barrow",Alaska: Barrow,71.290556,-156.788611,World Geodetic System 1984,8125,m,GeoLocate,GeoLocate,Adam Glueckert,2016-09-21,Pluvialis dominica,CHAS:Bird:5110,06/26/1926,1926-06-26,1926-06-26,accepted place of collection,unverified
"North America, United States, Alaska","North Slope Borough, Barrow",Alaska: Barrow,71.290556,-156.788611,World Geodetic System 1984,8125,m,GeoLocate,GeoLocate,Adam Glueckert,2016-09-21,Pluvialis dominica,CHAS:Bird:5111,06/26/1926,1926-06-26,1926-06-26,accepted place of collection,unverified
"North America, United States, Alaska","North Slope Borough, Barrow",Alaska: Barrow,71.290556,-156.788611,World Geodetic System 1984,8125,m,GeoLocate,GeoLocate,Adam Glueckert,2016-09-21,Pluvialis dominica,CHAS:Bird:5114,06/26/1926,1926-06-26,1926-06-26,accepted place of collection,unverified
"North America, United States, Alaska","North Slope Borough, Barrow",Alaska: Barrow,71.290556,-156.788611,World Geodetic System 1984,8125,m,GeoLocate,GeoLocate,Adam Glueckert,2016-09-30,Pluvialis dominica,CHAS:Bird:5116,06/27/1926,1926-06-27,1926-06-27,accepted place of collection,unverified
"North America, United States, Alaska","North Slope Borough, Barrow",Alaska: Barrow,71.290556,-156.788611,World Geodetic System 1984,8125,m,GeoLocate,GeoLocate,Adam Glueckert,2016-09-30,Pluvialis dominica,CHAS:Bird:5115,07/01/1926,1926-07-01,1926-07-01,accepted place of collection,unverified
"North America, United States, Alaska","North Slope Borough, Barrow",,71.290556,-156.788611,World Geodetic System 1984,8125,m,GeoLocate,GeoLocate,Adam Glueckert,2016-09-21,Stercorarius pomarinus,CHAS:Bird:4740,6/20/1930,1930-06-20,1930-06-20,accepted place of collection,unverified
"North America, United States, Alaska","North Slope Borough, Barrow",,71.290556,-156.788611,World Geodetic System 1984,8125,m,GeoLocate,GeoLocate,Adam Glueckert,2016-09-21,Limnodromus scolopaceus,CHAS:Bird:5257,06/13/1931,1931-06-13,1931-06-13,accepted place of collection,unverified
"North America, United States, Alaska","North Slope Borough, Barrow",,71.290556,-156.788611,World Geodetic System 1984,8125,m,GeoLocate,GeoLocate,Adam Glueckert,2016-09-21,Tryngites subruficollis,CHAS:Bird:5253,06/1930,1930-06-01,1930-06-30,accepted place of collection,unverified
"North America, United States, Alaska","North Slope Borough, Barrow",,71.290556,-156.788611,World Geodetic System 1984,8125,m,GeoLocate,GeoLocate,Adam Glueckert,2016-09-21,Larus hyperboreus,CHAS:Bird:4750,05/24/1936,1936-05-24,1936-05-24,accepted place of collection,unverified
"North America, United States, Alaska","North Slope Borough, Barrow",,71.290556,-156.788611,World Geodetic System 1984,8125,m,GeoLocate,GeoLocate,Adam Glueckert,2016-09-21,Larus hyperboreus,CHAS:Bird:3114,09/09/1929,1929-09-09,1929-09-09,accepted place of collection,unverified
"North America, United States, Alaska","North Slope Borough, Barrow",,71.290556,-156.788611,World Geodetic System 1984,8125,m,GeoLocate,GeoLocate,Adam Glueckert,2016-09-21,Larus hyperboreus,CHAS:Bird:4763,05/26/1930,1930-05-26,1930-05-26,accepted place of collection,unverified
"North America, United States, Alaska","North Slope Borough, Barrow",,71.290556,-156.788611,World Geodetic System 1984,8125,m,GeoLocate,GeoLocate,Adam Glueckert,2016-09-21,Larus hyperboreus,CHAS:Bird:5243,06/24/1931,1931-06-24,1931-06-24,accepted place of collection,unverified
"North America, United States, Alaska","North Slope Borough, Barrow",,71.290556,-156.788611,World Geodetic System 1984,8125,m,GeoLocate,GeoLocate,Adam Glueckert,2016-09-21,Larus hyperboreus,CHAS:Bird:3112,09/07/1929,1929-09-07,1929-09-07,accepted place of collection,unverified
"North America, United States, Alaska","North Slope Borough, Barrow",,71.290556,-156.788611,World Geodetic System 1984,8125,m,GeoLocate,GeoLocate,Adam Glueckert,2016-09-21,Larus hyperboreus,CHAS:Bird:3113,09/07/1929,1929-09-07,1929-09-07,accepted place of collection,unverified
"North America, United States, Alaska","North Slope Borough, Barrow",,71.290556,-156.788611,World Geodetic System 1984,8125,m,GeoLocate,GeoLocate,Adam Glueckert,2016-09-21,Larus hyperboreus,CHAS:Bird:3117,09/20/1929,1929-09-20,1929-09-20,accepted place of collection,unverified
"North America, United States, Alaska","North Slope Borough, Barrow",,71.290556,-156.788611,World Geodetic System 1984,8125,m,GeoLocate,GeoLocate,Adam Glueckert,2016-09-21,Larus hyperboreus,CHAS:Bird:4742,05/29/1930,1930-05-29,1930-05-29,accepted place of collection,unverified
"North America, United States, Alaska","North Slope Borough, Barrow",,71.290556,-156.788611,World Geodetic System 1984,8125,m,GeoLocate,GeoLocate,Adam Glueckert,2016-09-21,Larus thayeri,CHAS:Bird:3115,09/18/1929,1929-09-18,1929-09-18,accepted place of collection,unverified
"North America, United States, Alaska","North Slope Borough, Barrow",,71.290556,-156.788611,World Geodetic System 1984,8125,m,GeoLocate,GeoLocate,Adam Glueckert,2016-09-21,Asio flammeus,CHAS:Bird:4731,06/12/1930,1930-06-12,1930-06-12,accepted place of collection,unverified
"North America, United States, Alaska","North Slope Borough, Barrow",,71.290556,-156.788611,World Geodetic System 1984,8125,m,GeoLocate,GeoLocate,Adam Glueckert,2016-09-21,Asio flammeus,CHAS:Bird:4755,06/09/1930,1930-06-09,1930-06-09,accepted place of collection,unverified
"North America, United States, Alaska","North Slope Borough, Barrow",,71.290556,-156.788611,World Geodetic System 1984,8125,m,GeoLocate,GeoLocate,Adam Glueckert,2016-09-21,Asio flammeus flammeus,CHAS:Bird:4865,10/05/1929,1929-10-05,1929-10-05,accepted place of collection,unverified
"North America, United States, Alaska","North Slope Borough, Barrow",,71.290556,-156.788611,World Geodetic System 1984,8125,m,GeoLocate,GeoLocate,Adam Glueckert,2016-09-21,Falco rusticolis obsoletus,CHAS:Bird:5249,08/10/1931,1931-08-10,1931-08-10,accepted place of collection,unverified
"North America, United States, Alaska","North Slope Borough, Barrow",Alaska: Barrow,71.290556,-156.788611,World Geodetic System 1984,8125,m,GeoLocate,GeoLocate,Adam Glueckert,2016-09-21,Pluvialis dominica,CHAS:Bird:4699,07/05/1930,1930-07-05,1930-07-05,accepted place of collection,unverified
"North America, United States, Alaska","North Slope Borough, Barrow",Alaska: Barrow,71.290556,-156.788611,World Geodetic System 1984,8125,m,GeoLocate,GeoLocate,Adam Glueckert,2016-09-21,Pluvialis dominica,CHAS:Bird:5326,06/26/1931,1926-06-26,1926-06-26,accepted place of collection,unverified
"North America, United States, Alaska","North Slope Borough, Barrow",Alaska: Barrow,71.290556,-156.788611,World Geodetic System 1984,8125,m,GeoLocate,GeoLocate,Adam Glueckert,2016-09-21,Pluvialis dominica,CHAS:Bird:4684,07/05/1930,1930-07-05,1930-07-05,accepted place of collection,unverified
"North America, United States, Alaska","North Slope Borough, Barrow",Alaska: Barrow,71.290556,-156.788611,World Geodetic System 1984,8125,m,GeoLocate,GeoLocate,Adam Glueckert,2016-09-21,Pluvialis dominica,CHAS:Bird:4685,07/05/1930,1930-07-05,1930-07-05,accepted place of collection,unverified
"North America, United States, Alaska","North Slope Borough, Barrow",Alaska: Barrow,71.290556,-156.788611,World Geodetic System 1984,8125,m,GeoLocate,GeoLocate,Adam Glueckert,2016-09-21,Pluvialis dominica,CHAS:Bird:4688,07/05/1930,1930-07-05,1930-07-05,accepted place of collection,unverified
"North America, United States, Alaska","North Slope Borough, Barrow",Alaska: Barrow,71.290556,-156.788611,World Geodetic System 1984,8125,m,GeoLocate,GeoLocate,Adam Glueckert,2016-09-21,Pluvialis dominica,CHAS:Bird:5327,07/03/1931,1931-07-03,1931-07-03,accepted place of collection,unverified
"North America, United States, Alaska","North Slope Borough, Barrow",,71.290556,-156.788611,World Geodetic System 1984,8125,m,GeoLocate,GeoLocate,Adam Glueckert,2016-09-21,Limosa lapponica baueri,CHAS:Bird:5263,06/05/1931,1931-06-05,1931-06-05,accepted place of collection,unverified
"North America, United States, Alaska","North Slope Borough, Barrow",,71.290556,-156.788611,World Geodetic System 1984,8125,m,GeoLocate,GeoLocate,Adam Glueckert,2016-09-21,Limosa lapponica baueri,CHAS:Bird:5264,07/15/1931,1931-07-15,1931-07-15,accepted place of collection,unverified
"North America, United States, Alaska","North Slope Borough, Barrow",,71.290556,-156.788611,World Geodetic System 1984,8125,m,GeoLocate,GeoLocate,Adam Glueckert,2016-09-21,Tryngites subruficollis,CHAS:Bird:5271,06/20/1931,1931-06-20,1931-06-20,accepted place of collection,unverified
"North America, United States, Alaska","North Slope Borough, Barrow",,71.290556,-156.788611,World Geodetic System 1984,8125,m,GeoLocate,GeoLocate,Adam Glueckert,2016-09-21,Calidris pusilla,CHAS:Bird:4691,06/18/1930,1930-06-18,1930-06-18,accepted place of collection,unverified
"North America, United States, Alaska","North Slope Borough, Barrow",,71.290556,-156.788611,World Geodetic System 1984,8125,m,GeoLocate,GeoLocate,Adam Glueckert,2016-09-21,Calidris pusilla,CHAS:Bird:4692,06/19/1930,1930-06-19,1930-06-19,accepted place of collection,unverified
"North America, United States, Alaska","North Slope Borough, Barrow",,71.290556,-156.788611,World Geodetic System 1984,8125,m,GeoLocate,GeoLocate,Adam Glueckert,2016-09-21,Calidris bairdii,CHAS:Bird:4401,07/03/1930,1930-07-03,1930-07-03,accepted place of collection,unverified
"North America, United States, Alaska","North Slope Borough, Barrow",,71.290556,-156.788611,World Geodetic System 1984,8125,m,GeoLocate,GeoLocate,Adam Glueckert,2016-09-21,Calidris bairdii,CHAS:Bird:4689,07/01/1930,1930-07-01,1930-07-01,accepted place of collection,unverified
"North America, United States, Alaska","North Slope Borough, Barrow",,71.290556,-156.788611,World Geodetic System 1984,8125,m,GeoLocate,GeoLocate,Adam Glueckert,2016-09-21,Calidris bairdii,CHAS:Bird:4690,07/01/1930,1930-07-01,1930-07-01,accepted place of collection,unverified
"North America, United States, Alaska","North Slope Borough, Barrow",,71.290556,-156.788611,World Geodetic System 1984,8125,m,GeoLocate,GeoLocate,Adam Glueckert,2016-09-21,Calidris bairdii,CHAS:Bird:4694,07/03/1930,1930-07-03,1930-07-03,accepted place of collection,unverified
"North America, United States, Alaska","North Slope Borough, Barrow",,71.290556,-156.788611,World Geodetic System 1984,8125,m,GeoLocate,GeoLocate,Adam Glueckert,2016-09-21,Calidris bairdii,CHAS:Bird:4764,07/05/1930,1930-07-05,1930-07-05,accepted place of collection,unverified
"North America, United States, Alaska","North Slope Borough, Barrow",,71.290556,-156.788611,World Geodetic System 1984,8125,m,GeoLocate,GeoLocate,Adam Glueckert,2016-09-21,Calidris melanotos,CHAS:Bird:4687,07/05/1930,1930-07-05,1930-07-05,accepted place of collection,unverified
"North America, United States, Alaska","North Slope Borough, Barrow",,71.290556,-156.788611,World Geodetic System 1984,8125,m,GeoLocate,GeoLocate,Adam Glueckert,2016-09-21,Calidris alpina sakhalina,CHAS:Bird:4752,07/03/1930,1930-07-03,1930-07-03,accepted place of collection,unverified
"North America, United States, Alaska","North Slope Borough, Barrow",,71.290556,-156.788611,World Geodetic System 1984,8125,m,GeoLocate,GeoLocate,Adam Glueckert,2016-09-21,Calidris melanotos,CHAS:Bird:4753,07/03/1930,1930-07-03,1930-07-03,accepted place of collection,unverified
"North America, United States, Alaska","North Slope Borough, Barrow",,71.290556,-156.788611,World Geodetic System 1984,8125,m,GeoLocate,GeoLocate,Adam Glueckert,2016-09-21,Calidris melanotos,CHAS:Bird:5374,06/18/1931,1931-06-18,1931-06-18,accepted place of collection,unverified
"North America, United States, Alaska","North Slope Borough, Barrow",,71.290556,-156.788611,World Geodetic System 1984,8125,m,GeoLocate,GeoLocate,Adam Glueckert,2016-09-21,Calidris alpina sakhalina,CHAS:Bird:5388,06/15/1931,1931-06-15,1931-06-15,accepted place of collection,unverified
"North America, United States, Alaska","North Slope Borough, Barrow",,71.290556,-156.788611,World Geodetic System 1984,8125,m,GeoLocate,GeoLocate,Adam Glueckert,2016-09-21,Calidris melanotos,CHAS:Bird:4686,07/05/1930,1930-07-05,1930-07-05,accepted place of collection,unverified
"North America, United States, Alaska","North Slope Borough, Barrow",,71.290556,-156.788611,World Geodetic System 1984,8125,m,GeoLocate,GeoLocate,Adam Glueckert,2016-09-21,Calidris melanotos,CHAS:Bird:4754,05/30/1930,1930-05-30,1930-05-30,accepted place of collection,unverified
"North America, United States, Alaska","North Slope Borough, Barrow",,71.290556,-156.788611,World Geodetic System 1984,8125,m,GeoLocate,GeoLocate,Adam Glueckert,2016-09-21,Calidris melanotos,CHAS:Bird:4759,05/29/1930,1930-05-29,1930-05-29,accepted place of collection,unverified
"North America, United States, Alaska","North Slope Borough, Barrow",,71.290556,-156.788611,World Geodetic System 1984,8125,m,GeoLocate,GeoLocate,Adam Glueckert,2016-09-21,Calidris canutus rufus,CHAS:Bird:5256,06/18/1931,1931-06-18,1931-06-18,accepted place of collection,unverified
"North America, United States, Alaska","North Slope Borough, Barrow",,71.290556,-156.788611,World Geodetic System 1984,8125,m,GeoLocate,GeoLocate,Adam Glueckert,2016-09-21,Phalaropus lobatus,CHAS:Bird:4693,07/03/1930,1930-07-03,1930-07-03,accepted place of collection,unverified
"North America, United States, Alaska","North Slope Borough, Barrow",Alaska: Barrow,71.290556,-156.788611,World Geodetic System 1984,8125,m,GeoLocate,GeoLocate,Adam Glueckert,2016-09-21,Arenaria interpres morinella,CHAS:Bird:4682,07/05/1930,1930-07-05,1930-07-05,accepted place of collection,unverified
"North America, United States, Alaska","North Slope Borough, Barrow",Alaska: Barrow,71.290556,-156.788611,World Geodetic System 1984,8125,m,GeoLocate,GeoLocate,Adam Glueckert,2016-09-21,Arenaria interpres morinella,CHAS:Bird:4683,07/05/1930,1930-07-05,1930-07-05,accepted place of collection,unverified
"North America, United States, Alaska","North Slope Borough, Barrow",,71.290556,-156.788611,World Geodetic System 1984,8125,m,GeoLocate,GeoLocate,Adam Glueckert,2016-09-21,Pagophila eburnea,CHAS:Bird:4678,05/26/1930,1930-05-26,1930-05-26,accepted place of collection,unverified
"North America, United States, Alaska","North Slope Borough, Barrow",,71.290556,-156.788611,World Geodetic System 1984,8125,m,GeoLocate,GeoLocate,Adam Glueckert,2016-09-21,Pagophila eburnea,CHAS:Bird:4384,05/24/1930,1930-05-24,1930-05-24,accepted place of collection,unverified
"North America, United States, Alaska","North Slope Borough, Barrow",,71.290556,-156.788611,World Geodetic System 1984,8125,m,GeoLocate,GeoLocate,Adam Glueckert,2016-09-21,Pagophila eburnea,CHAS:Bird:4676,05/26/1930,1930-05-26,1930-05-26,accepted place of collection,unverified
"North America, United States, Alaska","North Slope Borough, Barrow",,71.290556,-156.788611,World Geodetic System 1984,8125,m,GeoLocate,GeoLocate,Adam Glueckert,2016-09-21,Pagophila eburnea,CHAS:Bird:4383,05/26/1930,1930-05-26,1930-05-26,accepted place of collection,unverified
"North America, United States, Alaska","North Slope Borough, Barrow",,71.290556,-156.788611,World Geodetic System 1984,8125,m,GeoLocate,GeoLocate,Adam Glueckert,2016-09-21,Pagophila eburnea,CHAS:Bird:4677,05/24/1930,1930-05-24,1930-05-24,accepted place of collection,unverified
"North America, United States, Alaska","North Slope Borough, Barrow",,71.290556,-156.788611,World Geodetic System 1984,8125,m,GeoLocate,GeoLocate,Adam Glueckert,2016-09-21,Rissa tridactyla pollicaris,CHAS:Bird:4751,05/27/1930,1930-05-27,1930-05-27,accepted place of collection,unverified
"North America, United States, Alaska","North Slope Borough, Barrow",,71.290556,-156.788611,World Geodetic System 1984,8125,m,GeoLocate,GeoLocate,Adam Glueckert,2016-09-21,Rissa tridactyla pollicaris,CHAS:Bird:4760,05/27/1930,1930-05-27,1930-05-27,accepted place of collection,unverified
"North America, United States, Alaska","North Slope Borough, Barrow",,71.290556,-156.788611,World Geodetic System 1984,8125,m,GeoLocate,GeoLocate,Adam Glueckert,2016-09-21,Rissa tridactyla pollicaris,CHAS:Bird:3109,09/12/1929,1929-09-12,1929-09-12,accepted place of collection,unverified
"North America, United States, Alaska","North Slope Borough, Barrow",,71.290556,-156.788611,World Geodetic System 1984,8125,m,GeoLocate,GeoLocate,Adam Glueckert,2016-09-21,Rissa tridactyla pollicaris,CHAS:Bird:4743,05/27/1930,1930-05-27,1930-05-27,accepted place of collection,unverified
"North America, United States, Alaska","North Slope Borough, Barrow",,71.290556,-156.788611,World Geodetic System 1984,8125,m,GeoLocate,GeoLocate,Adam Glueckert,2016-09-21,Rhodostethia rosea,CHAS:Bird:3108,10/04/1929,1929-10-04,1929-10-04,accepted place of collection,unverified
"North America, United States, Alaska","North Slope Borough, Barrow",,71.290556,-156.788611,World Geodetic System 1984,8125,m,GeoLocate,GeoLocate,Adam Glueckert,2016-09-21,Xema sabini,CHAS:Bird:4733,06/28/1930,1930-06-28,1930-06-28,accepted place of collection,unverified
"North America, United States, Alaska","North Slope Borough, Barrow",,71.290556,-156.788611,World Geodetic System 1984,8125,m,GeoLocate,GeoLocate,Adam Glueckert,2016-09-21,Xema sabini,CHAS:Bird:4734,06/28/1930,1930-06-28,1930-06-28,accepted place of collection,unverified
"North America, United States, Alaska","North Slope Borough, Barrow",,71.290556,-156.788611,World Geodetic System 1984,8125,m,GeoLocate,GeoLocate,Adam Glueckert,2016-09-21,Xema sabini,CHAS:Bird:4748,06/28/1930,1930-06-28,1930-06-28,accepted place of collection,unverified
"North America, United States, Alaska","North Slope Borough, Barrow",,71.290556,-156.788611,World Geodetic System 1984,8125,m,GeoLocate,GeoLocate,Adam Glueckert,2016-09-21,Xema sabini,CHAS:Bird:4749,05/28/1930,1930-05-28,1930-05-28,accepted place of collection,unverified
"North America, United States, Alaska","North Slope Borough, Barrow",,71.290556,-156.788611,World Geodetic System 1984,8125,m,GeoLocate,GeoLocate,Adam Glueckert,2016-09-21,Xema sabini,CHAS:Bird:5239,08/10/1931,1931-08-10,1931-08-10,accepted place of collection,unverified
"North America, United States, Alaska","North Slope Borough, Barrow",,71.290556,-156.788611,World Geodetic System 1984,8125,m,GeoLocate,GeoLocate,Adam Glueckert,2016-09-21,Xema sabini,CHAS:Bird:5359,06/19/1931,1931-06-19,1931-06-19,accepted place of collection,unverified
"North America, United States, Alaska","North Slope Borough, Barrow",,71.290556,-156.788611,World Geodetic System 1984,8125,m,GeoLocate,GeoLocate,Adam Glueckert,2016-09-21,Xema sabini,CHAS:Bird:5365,06/28/1931,1931-06-28,1931-06-28,accepted place of collection,unverified
"North America, United States, Alaska","North Slope Borough, Barrow",,71.290556,-156.788611,World Geodetic System 1984,8125,m,GeoLocate,GeoLocate,Adam Glueckert,2016-09-21,Xema sabini,CHAS:Bird:5366,06/1931,1931-06-01,1931-06-30,accepted place of collection,unverified
"North America, United States, Alaska","North Slope Borough, Barrow",,71.290556,-156.788611,World Geodetic System 1984,8125,m,GeoLocate,GeoLocate,Adam Glueckert,2016-09-21,Xema sabini,CHAS:Bird:5367,06/19/1931,1931-06-19,1931-06-19,accepted place of collection,unverified
"North America, United States, Alaska","North Slope Borough, Barrow",,71.290556,-156.788611,World Geodetic System 1984,8125,m,GeoLocate,GeoLocate,Adam Glueckert,2016-09-21,Xema sabini,CHAS:Bird:4747,06/28/1930,1930-06-28,1930-06-28,accepted place of collection,unverified
"North America, United States, Alaska","North Slope Borough, Barrow",,71.290556,-156.788611,World Geodetic System 1984,8125,m,GeoLocate,GeoLocate,Adam Glueckert,2016-09-21,Xema sabini,CHAS:Bird:5267,08/10/1931,1931-08-10,1931-08-10,accepted place of collection,unverified
"North America, United States, Alaska","North Slope Borough, Barrow",,71.290556,-156.788611,World Geodetic System 1984,8125,m,GeoLocate,GeoLocate,Adam Glueckert,2016-09-21,Xema sabini,CHAS:Bird:5368,06/20/1931,1931-06-20,1931-06-20,accepted place of collection,unverified
"North America, United States, Alaska","North Slope Borough, Barrow",,71.290556,-156.788611,World Geodetic System 1984,8125,m,GeoLocate,GeoLocate,Adam Glueckert,2016-09-21,Stercorarius longicaudus,CHAS:Bird:5371,06/23/1931,1931-06-23,1931-06-23,accepted place of collection,unverified
"North America, United States, Alaska","North Slope Borough, Barrow",,71.290556,-156.788611,World Geodetic System 1984,8125,m,GeoLocate,GeoLocate,Adam Glueckert,2016-09-21,Stercorarius pomarinus,CHAS:Bird:4746,06/13/1930,1930-06-13,1930-06-13,accepted place of collection,unverified
"North America, United States, Alaska","North Slope Borough, Barrow",,71.290556,-156.788611,World Geodetic System 1984,8125,m,GeoLocate,GeoLocate,Adam Glueckert,2016-09-21,Stercorarius pomarinus,CHAS:Bird:5337,06/22/1931,1931-06-22,1931-06-22,accepted place of collection,unverified
"North America, United States, Alaska","North Slope Borough, Barrow",,71.290556,-156.788611,World Geodetic System 1984,8125,m,GeoLocate,GeoLocate,Adam Glueckert,2016-09-21,Sterna paradisaea,CHAS:Bird:5334,08/16/1931,1931-08-16,1931-08-16,accepted place of collection,unverified
"North America, United States, Alaska","North Slope Borough, Barrow",,71.290556,-156.788611,World Geodetic System 1984,8125,m,GeoLocate,GeoLocate,Adam Glueckert,2016-09-21,Sterna paradisaea,CHAS:Bird:5370,06/25/1931,1931-06-25,1931-06-25,accepted place of collection,unverified
"North America, United States, Alaska","North Slope Borough, Barrow",,71.290556,-156.788611,World Geodetic System 1984,8125,m,GeoLocate,GeoLocate,Adam Glueckert,2016-09-21,Aethia cristatella,CHAS:Bird:5236,06/19/1931,1931-06-19,1931-06-19,accepted place of collection,unverified
"North America, United States, Alaska","North Slope Borough, Barrow",,71.290556,-156.788611,World Geodetic System 1984,8125,m,GeoLocate,GeoLocate,Adam Glueckert,2016-09-21,Tyrannus tyrannus,CHAS:Bird:5255,06/17/1931,1931-06-17,1931-06-17,accepted place of collection,unverified
"North America, United States, Alaska","North Slope Borough, Barrow",,71.290556,-156.788611,World Geodetic System 1984,8125,m,GeoLocate,GeoLocate,Adam Glueckert,2016-09-21,Hirundo rustica gutturalis,CHAS:Bird:5254,07/1931,1931-07-01,1931-07-30,accepted place of collection,unverified
"North America, United States, Alaska","North Slope Borough, Barrow",,71.290556,-156.788611,World Geodetic System 1984,8125,m,GeoLocate,GeoLocate,Adam Glueckert,2016-09-21,Oenanthe oenanthe oenanthe,CHAS:Bird:4402,05/24/1930,1930-05-24,1930-05-24,accepted place of collection,unverified
"North America, United States, Alaska","North Slope Borough, Barrow","Barrow, Alaska",71.290556,-156.788611,World Geodetic System 1984,8125,m,GeoLocate,GeoLocate,Adam Glueckert,2016-09-21,Phylloscopus borealis,CHAS:Bird:5827,6/9/1932; 7/9/1932,1932-07-09,1932-07-09,accepted place of collection,unverified
"North America, United States, Alaska","North Slope Borough, Barrow",,71.290556,-156.788611,World Geodetic System 1984,8125,m,GeoLocate,GeoLocate,Adam Glueckert,2016-09-21,Carduelis hornemanni,CHAS:Bird:5275,06/1931,1931-06-01,1931-06-30,accepted place of collection,unverified
"North America, United States, Alaska","North Slope Borough, Barrow",,71.290556,-156.788611,World Geodetic System 1984,8125,m,GeoLocate,GeoLocate,Adam Glueckert,2016-09-21,Carduelis hornemanni,CHAS:Bird:5386,06/1931,1931-06-01,1931-06-30,accepted place of collection,unverified
"North America, United States, Alaska","North Slope Borough, Barrow",,71.290556,-156.788611,World Geodetic System 1984,8125,m,GeoLocate,GeoLocate,Adam Glueckert,2016-09-21,Junco hyemalis hyemalis,CHAS:Bird:5415,06/01/1931,1931-06-01,1931-06-01,accepted place of collection,unverified
"North America, United States, Alaska","North Slope Borough, Barrow",,71.290556,-156.788611,World Geodetic System 1984,8125,m,GeoLocate,GeoLocate,Adam Glueckert,2016-09-21,Calcarius lapponicus alacensis,CHAS:Bird:5272,06/20/1931,1931-06-20,1931-06-20,accepted place of collection,unverified
"North America, United States, Alaska","North Slope Borough, Barrow",,71.290556,-156.788611,World Geodetic System 1984,8125,m,GeoLocate,GeoLocate,Adam Glueckert,2016-09-21,Calcarius lapponicus alacensis,CHAS:Bird:5273,06/1931,1931-06-01,1931-06-30,accepted place of collection,unverified
"North America, United States, Alaska","North Slope Borough, Barrow",,71.290556,-156.788611,World Geodetic System 1984,8125,m,GeoLocate,GeoLocate,Adam Glueckert,2016-09-21,Calcarius lapponicus alacensis,CHAS:Bird:5274,06/1931,1931-06-01,1931-06-30,accepted place of collection,unverified
"North America, United States, Alaska","North Slope Borough, Barrow",,71.290556,-156.788611,World Geodetic System 1984,8125,m,GeoLocate,GeoLocate,Adam Glueckert,2016-09-21,Gavia pacifica,CHAS:Bird:5290,09/17/1930,1930-09-17,1930-09-17,accepted place of collection,unverified
"North America, United States, Alaska","North Slope Borough, Barrow",,71.290556,-156.788611,World Geodetic System 1984,8125,m,GeoLocate,GeoLocate,Adam Glueckert,2016-09-21,Puffinus tenuirostris,CHAS:Bird:4727,11/09/1929,1929-11-09,1929-11-09,accepted place of collection,unverified
"North America, United States, Alaska","North Slope Borough, Barrow",,71.290556,-156.788611,World Geodetic System 1984,8125,m,GeoLocate,GeoLocate,Adam Glueckert,2016-09-21,Puffinus tenuirostris,CHAS:Bird:4728,12/10/1929,1929-12-10,1929-12-10,accepted place of collection,unverified
"North America, United States, Alaska","North Slope Borough, Barrow",,71.290556,-156.788611,World Geodetic System 1984,8125,m,GeoLocate,GeoLocate,Adam Glueckert,2016-09-21,Puffinus tenuirostris,CHAS:Bird:4729,11/9/1929,1929-11-09,1929-11-09,accepted place of collection,unverified
"North America, United States, Alaska","North Slope Borough, Barrow",,71.290556,-156.788611,World Geodetic System 1984,8125,m,GeoLocate,GeoLocate,Adam Glueckert,2016-09-21,Podiceps auritus,CHAS:Bird:5235,05/15/1931,1931-05-15,1931-05-15,accepted place of collection,unverified
"North America, United States, Alaska","North Slope Borough, Barrow",,71.290556,-156.788611,World Geodetic System 1984,8125,m,GeoLocate,GeoLocate,Adam Glueckert,2016-09-21,Somateria fischeri,CHAS:Bird:4388,06/10/1930,1930-06-10,1930-06-10,accepted place of collection,unverified
"North America, United States, Alaska","North Slope Borough, Barrow",,71.290556,-156.788611,World Geodetic System 1984,8125,m,GeoLocate,GeoLocate,Adam Glueckert,2016-09-21,Anas acuta tzitzihoa,CHAS:Bird:4768,06/10/1930,1930-06-10,1930-06-10,accepted place of collection,unverified
"North America, United States, Alaska","North Slope Borough, Barrow",,71.290556,-156.788611,World Geodetic System 1984,8125,m,GeoLocate,GeoLocate,Adam Glueckert,2016-09-21,Larus sabini,CHAS:Bird:4773,06/28/1930,1930-06-28,1930-06-28,accepted place of collection,unverified
"North America, United States, Alaska","North Slope Borough, Barrow",,71.290556,-156.788611,World Geodetic System 1984,8125,m,GeoLocate,GeoLocate,Adam Glueckert,2016-09-21,Somateria mollissima v-nigrum,CHAS:Bird:4777,06/02/1930,1930-06-02,1930-06-02,accepted place of collection,unverified
"North America, United States, Alaska","North Slope Borough, Barrow",,71.290556,-156.788611,World Geodetic System 1984,8125,m,GeoLocate,GeoLocate,Adam Glueckert,2016-09-21,Xema sabini,CHAS:Bird:5260,08/13/1928,1928-08-13,1928-08-13,accepted place of collection,unverified
"North America, United States, Alaska","North Slope Borough, Barrow",,71.290556,-156.788611,World Geodetic System 1984,8125,m,GeoLocate,GeoLocate,Adam Glueckert,2016-09-21,Pluvialis dominica dominica,CHAS:Bird:5331,06/25/1931,1931-06-25,1931-06-25,accepted place of collection,unverified
"North America, United States, Alaska","North Slope Borough, Barrow","Barrow, Alaska",71.290556,-156.788611,World Geodetic System 1984,8125,m,GeoLocate,GeoLocate,Adam Glueckert,2016-09-21,Pagophila alba,CHAS:Bird:5404.2,09/25/1931,1931-09-25,1931-09-25,accepted place of collection,unverified
"North America, United States, Alaska","North Slope Borough, Barrow","Barrow, Alaska",71.290556,-156.788611,World Geodetic System 1984,8125,m,GeoLocate,GeoLocate,Adam Glueckert,2016-09-21,Polysticta stelleri,CHAS:Bird:5423,06/19/1931,1931-06-19,1931-06-19,accepted place of collection,unverified
"North America, United States, Alaska","North Slope Borough, Barrow","Barrow, Alaska",71.290556,-156.788611,World Geodetic System 1984,8125,m,GeoLocate,GeoLocate,Adam Glueckert,2016-09-21,Polysticta stelleri,CHAS:Bird:5424,06/20/1931,1931-06-20,1931-06-20,accepted place of collection,unverified
"North America, United States, Alaska","North Slope Borough, Barrow","Barrow, Alaska",71.290556,-156.788611,World Geodetic System 1984,8125,m,GeoLocate,GeoLocate,Adam Glueckert,2016-09-21,Arctonetta fischeri,CHAS:Bird:5460,06/25/1931,1931-06-25,1931-06-25,accepted place of collection,unverified
"North America, United States, Alaska","North Slope Borough, Barrow","Barrow, Alaska",71.290556,-156.788611,World Geodetic System 1984,8125,m,GeoLocate,GeoLocate,Adam Glueckert,2016-09-21,Calidris bairdii,CHAS:Bird:5671,06/21/1931,1931-06-21,1931-06-21,accepted place of collection,unverified
"North America, United States, Alaska","North Slope Borough, Barrow","Barrow, Alaska",71.290556,-156.788611,World Geodetic System 1984,8125,m,GeoLocate,GeoLocate,Adam Glueckert,2016-09-21,Calidris alpina,CHAS:Bird:5672,06/31/1931,1931-06-30,1931-06-30,accepted place of collection,unverified
"North America, United States, Alaska","North Slope Borough, Barrow","Barrow, Alaska",71.290556,-156.788611,World Geodetic System 1984,8125,m,GeoLocate,GeoLocate,Adam Glueckert,2016-09-21,Phalaropus fulicarius,CHAS:Bird:5674,"""1931""",1931-01-01,1932-12-31,accepted place of collection,unverified
"North America, United States, Alaska","North Slope Borough, Barrow","Barrow, Alaska",71.290556,-156.788611,World Geodetic System 1984,8125,m,GeoLocate,GeoLocate,Adam Glueckert,2016-09-21,Pisobia melanotos,CHAS:Bird:9243,06/26/1931,1931-06-26,1931-06-26,accepted place of collection,unverified
"North America, United States, Alaska","North Slope Borough, Barrow","Barrow, Alaska",71.290556,-156.788611,World Geodetic System 1984,8125,m,GeoLocate,GeoLocate,Adam Glueckert,2016-09-21,Rissa tridactyla pollicaris,CHAS:Bird:5533,07/06/1931,1931-07-06,1931-07-06,accepted place of collection,unverified
"North America, United States, Alaska","North Slope Borough, Barrow","Barrow, Alaska",71.290556,-156.788611,World Geodetic System 1984,8125,m,GeoLocate,GeoLocate,Adam Glueckert,2016-09-21,Stercorarius pomarinus,CHAS:Bird:5459,06/13/1931,1931-06-13,1931-06-13,accepted place of collection,unverified
"North America, United States, Alaska","North Slope Borough, Barrow",,71.290556,-156.788611,World Geodetic System 1984,8125,m,GeoLocate,GeoLocate,Adam Glueckert,2016-09-21,Polysticta stelleri,CHAS:Bird:5934.2,[transcribed directly into formatted date fields],1931-06-20,1931-06-20,accepted place of collection,unverified
"North America, United States, Alaska","North Slope Borough, Barrow","Barrow, Alaska",71.290556,-156.788611,World Geodetic System 1984,8125,m,GeoLocate,GeoLocate,Adam Glueckert,2016-09-21,Anas acuta,CHAS:Bird:5645,06/09/1931,1931-06-09,1931-06-09,accepted place of collection,unverified
"North America, United States, Alaska","North Slope Borough, Barrow","Barrow, Alaska",71.290556,-156.788611,World Geodetic System 1984,8125,m,GeoLocate,GeoLocate,Adam Glueckert,2016-09-21,Anas acuta,CHAS:Bird:5649,08/27/1931,1931-08-27,1931-08-27,accepted place of collection,unverified
"North America, United States, Alaska","North Slope Borough, Barrow",,71.290556,-156.788611,World Geodetic System 1984,8125,m,GeoLocate,GeoLocate,Adam Glueckert,2016-09-21,Polysticta stelleri,CHAS:Bird:19310,06/20/1931,1931-06-20,1931-06-20,accepted place of collection,unverified
"North America, United States, Alaska","North Slope Borough, Barrow","Barrow, Alaska",71.290556,-156.788611,World Geodetic System 1984,8125,m,GeoLocate,GeoLocate,Adam Glueckert,2016-09-21,Larus hyperboreus,CHAS:Bird:5552,6/1/1931; 6/9/1931,1931-06-09,1931-06-09,accepted place of collection,unverified
"North America, United States, Alaska","North Slope Borough, Barrow","Barrow, Alaska",71.290556,-156.788611,World Geodetic System 1984,8125,m,GeoLocate,GeoLocate,Adam Glueckert,2016-09-21,Rissa tridactyla pollicaris,CHAS:Bird:5547,08/04/1931,1931-08-04,1931-08-04,accepted place of collection,unverified
"North America, United States, Alaska","North Slope Borough, Barrow","Barrow, Alaska",71.290556,-156.788611,World Geodetic System 1984,8125,m,GeoLocate,GeoLocate,Adam Glueckert,2016-09-21,Rissa tridactyla pollicaris,CHAS:Bird:5548,08/04/1931,1931-08-04,1931-08-04,accepted place of collection,unverified
"North America, United States, Alaska","North Slope Borough, Barrow","Barrow, Alaska",71.290556,-156.788611,World Geodetic System 1984,8125,m,GeoLocate,GeoLocate,Adam Glueckert,2016-09-21,Rissa tridactyla pollicaris,CHAS:Bird:5549,7/6/1931; 8/4/1931,1931-08-04,1931-08-04,accepted place of collection,unverified
"North America, United States, Alaska","North Slope Borough, Barrow","Barrow, Alaska",71.290556,-156.788611,World Geodetic System 1984,8125,m,GeoLocate,GeoLocate,Adam Glueckert,2016-09-21,Stercorarius pomarinus,CHAS:Bird:5458,06/13/1931,1931-06-13,1931-06-13,accepted place of collection,unverified
"North America, United States, Alaska","North Slope Borough, Barrow","Barrow, Alaska",71.290556,-156.788611,World Geodetic System 1984,8125,m,GeoLocate,GeoLocate,Adam Glueckert,2016-09-21,Stercorarius pomarinus,CHAS:Bird:5951,06/10/1931,1931-06-10,1931-06-10,accepted place of collection,unverified
"North America, United States, Alaska","North Slope Borough, Barrow","Barrow, Alaska",71.290556,-156.788611,World Geodetic System 1984,8125,m,GeoLocate,GeoLocate,Adam Glueckert,2016-09-21,Clangula hyemalis,CHAS:Bird:5950,06/13/1931,1931-06-13,1931-06-13,accepted place of collection,unverified
"North America, United States, Alaska","North Slope Borough, Barrow","Barrow, Alaska",71.290556,-156.788611,World Geodetic System 1984,8125,m,GeoLocate,GeoLocate,Adam Glueckert,2016-09-21,Polysticta stelleri,CHAS:Bird:5647,06/19/1931,1931-06-19,1931-06-19,accepted place of collection,unverified
"North America, United States, Alaska","North Slope Borough, Barrow","Barrow, Alaska",71.290556,-156.788611,World Geodetic System 1984,8125,m,GeoLocate,GeoLocate,Adam Glueckert,2016-09-21,Somateria spectabilis,CHAS:Bird:5952,05/15/1931,1931-05-15,1931-05-15,accepted place of collection,unverified
"North America, United States, Alaska","North Slope Borough, Barrow","Barrow, Alaska",71.290556,-156.788611,World Geodetic System 1984,8125,m,GeoLocate,GeoLocate,Adam Glueckert,2016-09-21,Anas acuta,CHAS:Bird:5551,6/23/1931; 6/9/1931,1931-06-09,1931-06-09,accepted place of collection,unverified
"North America, United States, Alaska","North Slope Borough, Barrow","Barrow, Alaska",71.290556,-156.788611,World Geodetic System 1984,8125,m,GeoLocate,GeoLocate,Adam Glueckert,2016-09-21,Anas acuta,CHAS:Bird:5644,06/09/1931,1931-06-09,1931-06-09,accepted place of collection,unverified
"North America, United States, Alaska","North Slope Borough, Barrow","Barrow, Alaska",71.290556,-156.788611,World Geodetic System 1984,8125,m,GeoLocate,GeoLocate,Adam Glueckert,2016-09-21,Dafila acuta tzitzihoa,CHAS:Bird:5650,08/27/1931,1931-08-27,1931-08-27,accepted place of collection,unverified
"North America, United States, Alaska","North Slope Borough, Barrow","Barrow, Alaska",71.290556,-156.788611,World Geodetic System 1984,8125,m,GeoLocate,GeoLocate,Adam Glueckert,2016-09-21,Nyctea scandiaca,CHAS:Bird:6689,06/02/1931,1931-06-02,1931-06-02,accepted place of collection,unverified
"North America, United States, Alaska","North Slope Borough, Barrow","Barrow, Alaska",71.290556,-156.788611,World Geodetic System 1984,8125,m,GeoLocate,GeoLocate,Adam Glueckert,2016-09-21,Calidris melanotos,CHAS:Bird:9436,06/20/1942,1942-06-20,1942-06-20,accepted place of collection,unverified
"North America, United States, Alaska","North Slope Borough, Barrow","Barrow, Alaska",71.290556,-156.788611,World Geodetic System 1984,8125,m,GeoLocate,GeoLocate,Adam Glueckert,2016-09-21,Calcarius lapponicus alacensis,CHAS:Bird:9453,06/19/1942,1942-06-19,1942-06-19,accepted place of collection,unverified
"North America, United States, Alaska","North Slope Borough, Barrow",,71.290556,-156.788611,World Geodetic System 1984,8125,m,GeoLocate,GeoLocate,Adam Glueckert,2016-09-21,Cygnus columbianus,CHAS:Bird:5291,04/05/1931,1931-04-05,1931-04-05,accepted place of collection,unverified
"North America, United States, Alaska","North Slope Borough, Barrow",,71.290556,-156.788611,World Geodetic System 1984,8125,m,GeoLocate,GeoLocate,Adam Glueckert,2016-09-21,Xema sabini,CHAS:Bird:5369,07/02/1931,1931-07-02,1931-07-02,accepted place of collection,unverified
"North America, United States, Alaska","North Slope Borough, Barrow",,71.290556,-156.788611,World Geodetic System 1984,8125,m,GeoLocate,GeoLocate,Adam Glueckert,2016-09-21,Branta bernicla nigricans,CHAS:Bird:5385,06/10/1931,1931-06-10,1931-06-10,accepted place of collection,unverified
"North America, United States, Alaska","North Slope Borough, Barrow",,71.290556,-156.788611,World Geodetic System 1984,8125,m,GeoLocate,GeoLocate,Adam Glueckert,2016-09-21,Somateria fischeri,CHAS:Bird:5375,06/22/1931,1931-06-22,1931-06-22,accepted place of collection,unverified
"North America, United States, Alaska","North Slope Borough, Barrow","Barrow, Alaska",71.290556,-156.788611,World Geodetic System 1984,8125,m,GeoLocate,GeoLocate,Adam Glueckert,2016-09-21,Larus hyperboreus,CHAS:Bird:5949,8/10/1931,1931-08-10,1931-08-10,accepted place of collection,unverified
"North America, United States, Alaska","North Slope Borough, Barrow","Barrow, Alaska",71.290556,-156.788611,World Geodetic System 1984,8125,m,GeoLocate,GeoLocate,Adam Glueckert,2016-09-21,Sterna paradisaea,CHAS:Bird:5933,08/15/1931,1931-08-15,1931-08-15,accepted place of collection,unverified
"North America, United States, Alaska","North Slope Borough, Barrow",,71.290556,-156.788611,World Geodetic System 1984,8125,m,GeoLocate,GeoLocate,Adam Glueckert,2016-09-21,Clangula hyemalis,CHAS:Bird:19309,07/09/1931,1931-07-09,1931-07-09,accepted place of collection,unverified
"North America, United States, Alaska","North Slope Borough, Barrow","Barrow, Alaska",71.290556,-156.788611,World Geodetic System 1984,8125,m,GeoLocate,GeoLocate,Adam Glueckert,2016-09-21,Catharus guttatus,CHAS:Bird:6293,5/25/1933,1933-05-25,1933-05-25,accepted place of collection,unverified
"North America, United States, Alaska","North Slope Borough, Barrow","Barrow, Alaska",71.290556,-156.788611,World Geodetic System 1984,8125,m,GeoLocate,GeoLocate,Adam Glueckert,2016-09-21,Larus brachyrhynchus,CHAS:Bird:6300,"July 1933 or Sept. 15, 1934",1933-07-01,1934-09-15,accepted place of collection,unverified
"North America, United States, Alaska","North Slope Borough, Barrow",,71.290556,-156.788611,World Geodetic System 1984,8125,m,GeoLocate,GeoLocate,Adam Glueckert,2016-12-14,Clangula hyemalis,CHAS:Bird:5934.3,[transcribed directly into formatted date fields],1931-07-09,1931-07-09,accepted place of collection,unverified
"North America, United States, Alaska","North Slope Borough, Meade River",Meade River,69.55019,-157.958191,World Geodetic System 1984,1907,m,GeoLocate,GeoLocate,Adam Glueckert,2016-12-14,Stercorarius longicaudus,CHAS:Bird:5848,6/20/1932; 6/30/1932,1932-06-30,1932-06-30,accepted place of collection,unverified
"North America, United States, Alaska","North Slope Borough, Meade River",Meade River,69.55019,-157.958191,World Geodetic System 1984,1907,m,GeoLocate,GeoLocate,Adam Glueckert,2016-12-14,Anthus rubescens,CHAS:Bird:5804,06/20/1932,1932-06-20,1932-06-20,accepted place of collection,unverified
"North America, United States, Alaska","North Slope Borough, Meade River",Meade River,69.55019,-157.958191,World Geodetic System 1984,1907,m,GeoLocate,GeoLocate,Adam Glueckert,2016-12-14,Limosa lapponica,CHAS:Bird:5839,06/24/1932,1932-06-24,1932-06-24,accepted place of collection,unverified
"North America, United States, Alaska","North Slope Borough, Meade River",Meade River,69.55019,-157.958191,World Geodetic System 1984,1907,m,GeoLocate,GeoLocate,Adam Glueckert,2016-12-14,Motacilla flava,CHAS:Bird:5824,June 1932,1932-06-01,1932-06-30,accepted place of collection,unverified
"North America, United States, Alaska","North Slope Borough, Meade River",Meade River,69.55019,-157.958191,World Geodetic System 1984,1907,m,GeoLocate,GeoLocate,Adam Glueckert,2016-12-14,Motacilla flava,CHAS:Bird:5825,06/17/1932,1932-06-17,1932-06-17,accepted place of collection,unverified
"North America, United States, Alaska","North Slope Borough, Meade River",Meade River,69.55019,-157.958191,World Geodetic System 1984,1907,m,GeoLocate,GeoLocate,Adam Glueckert,2016-12-14,Motacilla flava,CHAS:Bird:5826,June 1932,1932-06-01,1932-06-30,accepted place of collection,unverified
"North America, United States, Alaska","North Slope Borough, Meade River",Meade River,69.55019,-157.958191,World Geodetic System 1984,1907,m,GeoLocate,GeoLocate,Adam Glueckert,2016-12-14,Carduelis hornemanni,CHAS:Bird:5797,06/17/1932,1932-06-17,1932-06-17,accepted place of collection,unverified
"North America, United States, Alaska","North Slope Borough, Meade River",Meade River,69.55019,-157.958191,World Geodetic System 1984,1907,m,GeoLocate,GeoLocate,Adam Glueckert,2016-12-14,Carduelis hornemanni,CHAS:Bird:5798,06/14/1932,1932-06-14,1932-06-14,accepted place of collection,unverified
"North America, United States, Alaska","North Slope Borough, Meade River",Meade River,69.55019,-157.958191,World Geodetic System 1984,1907,m,GeoLocate,GeoLocate,Adam Glueckert,2016-12-14,Carduelis hornemanni,CHAS:Bird:5799,06/14/1932,1932-06-14,1932-06-14,accepted place of collection,unverified
"North America, United States, Alaska","North Slope Borough, Meade River",Meade River,69.55019,-157.958191,World Geodetic System 1984,1907,m,GeoLocate,GeoLocate,Adam Glueckert,2016-12-14,Carduelis hornemanni,CHAS:Bird:5800,06/17/1932,1932-06-17,1932-06-17,accepted place of collection,unverified
"North America, United States, Alaska","North Slope Borough, Meade River",Meade River,69.55019,-157.958191,World Geodetic System 1984,1907,m,GeoLocate,GeoLocate,Adam Glueckert,2016-12-14,Passerculus sandwichensis alaudinus,CHAS:Bird:5802,06/15/1932,1932-06-15,1932-06-15,accepted place of collection,unverified
"North America, United States, Alaska","North Slope Borough, Meade River",Meade River,69.55019,-157.958191,World Geodetic System 1984,1907,m,GeoLocate,GeoLocate,Adam Glueckert,2016-12-14,Passerculus sandwichensis,CHAS:Bird:19307,06/18/1932,1932-06-18,1932-06-18,accepted place of collection,unverified
"North America, United States, Alaska","North Slope Borough, Meade River",Meade River,69.55019,-157.958191,World Geodetic System 1984,1907,m,GeoLocate,GeoLocate,Adam Glueckert,2016-12-14,Carduelis hornemanni,CHAS:Bird:5795,6/1/1932,1932-06-01,1932-06-30,accepted place of collection,unverified
"North America, United States, Alaska","North Slope Borough, Meade River",Meade River,69.55019,-157.958191,World Geodetic System 1984,1907,m,GeoLocate,GeoLocate,Adam Glueckert,2016-12-14,Carduelis hornemanni,CHAS:Bird:5796,06/14/1932,1932-06-14,1932-06-14,accepted place of collection,unverified
"North America, United States, Alaska","North Slope Borough, Meade River",Meade River,69.55019,-157.958191,World Geodetic System 1984,1907,m,GeoLocate,GeoLocate,Adam Glueckert,2016-12-14,Luscinia svecica,CHAS:Bird:5791,06/18/1932,1932-06-18,1932-06-18,accepted place of collection,unverified
"North America, United States, Alaska","North Slope Borough, Meade River",Meade River,69.55019,-157.958191,World Geodetic System 1984,1907,m,GeoLocate,GeoLocate,Adam Glueckert,2016-12-14,Luscinia svecica,CHAS:Bird:5792,06/18/1932,1932-06-18,1932-06-18,accepted place of collection,unverified
"North America, United States, Alaska","North Slope Borough, near Barrow","near Barrow, Alaska",71.290556,-156.788611,World Geodetic System 1984,10000,m,GeoLocate,GeoLocate,Adam Glueckert,2016-10-15,Tryngites subruficollis,CHAS:Bird:9432,06/22/1942,1942-06-22,1942-06-22,accepted place of collection,unverified
"North America, United States, Alaska","North Slope Borough, near Barrow","near Barrow, Alaska",71.290556,-156.788611,World Geodetic System 1984,10000,m,GeoLocate,GeoLocate,Adam Glueckert,2016-10-15,Tryngites subruficollis,CHAS:Bird:9433,06/26/1942,1942-06-26,1942-06-26,accepted place of collection,unverified
"North America, United States, Alaska","North Slope Borough, near Barrow","near Barrow, Alaska",71.290556,-156.788611,World Geodetic System 1984,10000,m,GeoLocate,GeoLocate,Adam Glueckert,2016-10-15,Plectrophenax nivalis nivalis,CHAS:Bird:9452,06/22/1942,1942-06-22,1942-06-22,accepted place of collection,unverified
"North America, United States, Alaska","North Slope Borough, near Barrow","near Barrow, Alaska",71.290556,-156.788611,World Geodetic System 1984,10000,m,GeoLocate,GeoLocate,Adam Glueckert,2016-10-15,Pluvialis dominica,CHAS:Bird:5522,07/04/1926,1926-07-04,1926-07-04,accepted place of collection,unverified
"North America, United States, Alaska","North Slope Borough, Point Barrow",Point Barrow,71.290556,-156.788611,World Geodetic System 1984,8125,m,GeoLocate,GeoLocate,Adam Glueckert,2016-09-21,Carduelis hornemanni,CHAS:Bird:5120,06/22/1926,1926-06-22,1926-06-22,accepted place of collection,unverified
"North America, United States, Alaska","North Slope Borough, Point Barrow",Point Barrow,71.290556,-156.788611,World Geodetic System 1984,8125,m,GeoLocate,GeoLocate,Adam Glueckert,2016-09-21,Carduelis hornemanni,CHAS:Bird:5121,06/20/1932,1932-06-20,1932-06-20,accepted place of collection,unverified
"North America, United States, Alaska","North Slope Borough, Wainwright",,70.6375,-160.029167,World Geodetic System 1984,844,m,GeoLocate,GeoLocate,Adam Glueckert,2016-09-21,Calcarius lapponicus alacensis,CHAS:Bird:4609,08/21/1921,1921-08-21,1921-08-21,accepted place of collection,unverified
"North America, United States, Alaska","North Slope Borough, Wainwright",,70.6375,-160.029167,World Geodetic System 1984,844,m,GeoLocate,GeoLocate,Adam Glueckert,2016-09-21,Lagopus lagopus alba,CHAS:Bird:5144,09/21/1921,1921-09-21,1921-09-21,accepted place of collection,unverified
"North America, United States, Alaska","North Slope Borough, Wainwright",,70.6375,-160.029167,World Geodetic System 1984,844,m,GeoLocate,GeoLocate,Adam Glueckert,2016-09-21,Lagopus lagopus alba,CHAS:Bird:5138,09/21/1921,1921-09-21,1921-09-21,accepted place of collection,unverified
"North America, United States, Alaska","North Slope Borough, Wainwright","Wainwright, Alaska",70.6375,-160.029167,World Geodetic System 1984,844,m,GeoLocate,GeoLocate,Adam Glueckert,2016-09-21,Somateria spectabilis,CHAS:Bird:902,May 1922,1922-05-01,1922-05-30,accepted place of collection,unverified
"North America, United States, Alaska","North Slope Borough, Wainwright","Wainwright, Alaska",70.6375,-160.029167,World Geodetic System 1984,844,m,GeoLocate,GeoLocate,Adam Glueckert,2016-09-21,Somateria spectabilis,CHAS:Bird:903,May 1922,1922-05-01,1922-05-30,accepted place of collection,unverified
"North America, United States, Alaska","North Slope Borough, Wainwright",,70.6375,-160.029167,World Geodetic System 1984,844,m,GeoLocate,GeoLocate,Adam Glueckert,2016-09-21,Calcarius lapponicus alacensis,CHAS:Bird:4610,06/19/1922,1922-06-19,1922-06-19,accepted place of collection,unverified
"North America, United States, Alaska","North Slope Borough, Wainwright",,70.6375,-160.029167,World Geodetic System 1984,844,m,GeoLocate,GeoLocate,Adam Glueckert,2016-09-21,Calcarius lapponicus alacensis,CHAS:Bird:4611,06/23/1922,1922-06-23,1922-06-23,accepted place of collection,unverified
"North America, United States, Alaska","North Slope Borough, Wainwright",,70.6375,-160.029167,World Geodetic System 1984,844,m,GeoLocate,GeoLocate,Adam Glueckert,2016-09-21,Phalaropus fulicarius,CHAS:Bird:5149,07/01/1925,1925-07-01,1925-07-01,accepted place of collection,unverified
"North America, United States, Arizona, Cochise County",Chiricahua Mountains,"Chiricahua Mts., Ariz. Cochise Co.",31.929812,-109.382285,World Geodetic System 1984,6480,m,GeoLocate,GeoLocate,Adam Glueckert,2016-11-18,Baeolophus wollweberi annexus,CHAS:Bird:8366,09/24/1908,1908-09-24,1908-09-24,accepted place of collection,unverified
"North America, United States, Arizona, Cochise County",Chiricahua Mountains,"Chiricahua Mountains, Arizona",31.929812,-109.382285,World Geodetic System 1984,6480,m,GeoLocate,GeoLocate,Adam Glueckert,2016-11-18,Junco phaeonotus palliatus,CHAS:Bird:7929,09/08/1908,1908-09-08,1908-09-08,accepted place of collection,unverified
"North America, United States, Arizona, Cochise County",Dos Cabesas Mountains,"Dos Cabezas Mts, Ariz. [Arizona]",32.24418,-109.601181,World Geodetic System 1984,8241,m,GeoLocate ,GeoLocate,Adam Glueckert,2016-11-18,Catherpes mexicanus conspersus,CHAS:Bird:1355,02/04/1904,1904-02-04,1904-02-04,accepted place of collection,unverified
"North America, United States, Arizona, Cochise County",Dos Cabesas Mountains,"Dos Cabesas Mts., Ariz. [Arizona]",32.24418,-109.601181,World Geodetic System 1984,8241,m,GeoLocate ,GeoLocate,Adam Glueckert,2016-11-18,Toxostoma crissale crissale,CHAS:Bird:1346,02/02/1904,1904-02-02,1904-02-02,accepted place of collection,unverified
"North America, United States, Arizona, Cochise County",Dos Cabesas Mountains,"Dos Cabezos, Ariz. [Arizona]",32.24418,-109.601181,World Geodetic System 1984,8241,m,GeoLocate ,GeoLocate,Adam Glueckert,2016-11-18,Amphispiza bilineata deserticola,CHAS:Bird:855,02/05/1904,1904-02-05,1904-02-05,accepted place of collection,unverified
"North America, United States, Arizona, Cochise County",Dos Cabesas Mountains,"Dos Cabezos, Ariz.",32.24418,-109.601181,World Geodetic System 1984,8241,m,GeoLocate ,GeoLocate,Adam Glueckert,2016-11-18,Melozone fusca mesoleuca,CHAS:Bird:939,02/01/1904,1904-02-01,1904-02-01,accepted place of collection,unverified
"North America, United States, Arizona, Cochise County",Dos Cabesas Mountains,"Dos Cabezas Mts, Ariz. [Arizona]",32.24418,-109.601181,World Geodetic System 1984,8241,m,GeoLocate ,GeoLocate,Adam Glueckert,2016-11-18,Catherpes mexicanus conspersus,CHAS:Bird:1356,02/04/1904,1904-02-04,1904-02-04,accepted place of collection,unverified
"North America, United States, Arizona, Cochise County",Dos Cabesas Mountains,"Dos Cabesas Mts., Ariz. [Arizona]",32.24418,-109.601181,World Geodetic System 1984,8241,m,GeoLocate ,GeoLocate,Adam Glueckert,2016-11-18,Toxostoma crissale crissale,CHAS:Bird:1347,02/03/1904,1904-02-03,1904-02-03,accepted place of collection,unverified
"North America, United States, Arizona, Cochise County",Dos Cabesas Mountains,"Dos Cabesas Mts, Ariz.",32.24418,-109.601181,World Geodetic System 1984,8241,m,GeoLocate ,GeoLocate,Adam Glueckert,2016-11-18,Aphelocoma woodhouseii,CHAS:Bird:394,1/27/1904,1904-01-27,1904-01-27,accepted place of collection,unverified
"North America, United States, Arizona, Cochise County",Dos Cabesas Mountains,Dos Cabesas Mts.; Ariz.,32.24418,-109.601181,World Geodetic System 1984,8241,m,GeoLocate ,GeoLocate,Adam Glueckert,2016-11-18,Aphelocoma woodhouseii,CHAS:Bird:395,1/27/1904,1904-01-27,1904-01-27,accepted place of collection,unverified
"North America, United States, Arizona, Cochise County",Huachuca Mountains,Huachuca Mts,31.488986,-110.408137,World Geodetic System 1984,17000,m,GeoLocate; http://repository.azgs.az.gov/category/place-keywords/huachuca-mountains ,GeoLocate,Adam Glueckert,2016-09-21,Picoides arizonae arizonae,CHAS:Bird:7427,06/06/1911,1911-06-06,1911-06-06,accepted place of collection,unverified
"North America, United States, Arizona, Cochise County",Huachuca Mountains,"Huachuca Mountains, Arizona",31.488986,-110.408137,World Geodetic System 1984,17000,m,GeoLocate ,GeoLocate,Adam Glueckert,2016-09-21,Junco phaeonotus palliatus,CHAS:Bird:7934,06/07/1897,1897-06-07,1897-06-07,accepted place of collection,unverified
"North America, United States, Arizona, Cochise County",Huachuca Mountains,"Huachuca Mountains, Arizona",31.488986,-110.408137,World Geodetic System 1984,17000,m,GeoLocate ,GeoLocate,Adam Glueckert,2016-09-21,Vireo huttoni stephensi,CHAS:Bird:7990,06/16/1903,1903-06-16,1903-06-16,accepted place of collection,unverified
"North America, United States, Arizona, Cochise County",Huachuca Mountains,Huachuca Mts,31.488986,-110.408137,World Geodetic System 1984,17000,m,GeoLocate ,GeoLocate,Adam Glueckert,2016-09-21,Cardellina rubrifrons,CHAS:Bird:17663,07/06/1901,1901-07-06,1901-07-06,accepted place of collection,unverified
"North America, United States, Arizona, Cochise County",Huachuca Mountains,Huachuca Mts,31.488986,-110.408137,World Geodetic System 1984,17000,m,GeoLocate ,GeoLocate,Adam Glueckert,2016-09-21,Contopus pertinax pallidiventris,CHAS:Bird:7399,05/29/1899,1899-05-29,1899-05-29,accepted place of collection,unverified
"North America, United States, Arizona, Cochise County",Huachuca Mountains,Huachuca Mts,31.488986,-110.408137,World Geodetic System 1984,17000,m,GeoLocate ,GeoLocate,Adam Glueckert,2016-09-21,Cyanocitta stelleri diademata,CHAS:Bird:7389,"06/07/1899 or June 7, 1897",1897-06-07,1899-06-07,accepted place of collection,unverified
"North America, United States, Arizona, Cochise County",Huachuca Mountains,Huachuca Mts,31.488986,-110.408137,World Geodetic System 1984,17000,m,GeoLocate ,GeoLocate,Adam Glueckert,2016-09-21,Colaptes auratus,CHAS:Bird:7431,10/14/1922,1922-10-14,1922-10-14,accepted place of collection,unverified
"North America, United States, Arizona, Cochise County",Huachuca Mountains,Huachuca Mts Ariz.,31.488986,-110.408137,World Geodetic System 1984,17000,m,GeoLocate ,GeoLocate,Adam Glueckert,2016-09-21,Sialia mexicana bairdi,CHAS:Bird:8022,12/05/1925,1925-12-05,1925-12-05,accepted place of collection,unverified
"North America, United States, Arizona, Cochise County",Huachuca Mountains,"Huachuca Mts, Ariz.",31.488986,-110.408137,World Geodetic System 1984,17000,m,GeoLocate ,GeoLocate,Adam Glueckert,2016-09-21,Polioptila caerulea amoenissima,CHAS:Bird:8416,04/08/1927,1927-04-08,1927-04-08,accepted place of collection,unverified
"North America, United States, Arizona, Cochise County",Huachuca Mountains,Huachuca Mts Ariz.,31.488986,-110.408137,World Geodetic System 1984,17000,m,GeoLocate ,GeoLocate,Adam Glueckert,2016-09-21,Sialia mexicana bairdi,CHAS:Bird:8021,11/30/1925,1925-11-30,1925-11-30,accepted place of collection,unverified
"North America, United States, Arizona, Cochise County",Huachuca Mountains,Huachuca Mts,31.488986,-110.408137,World Geodetic System 1984,17000,m,GeoLocate ,GeoLocate,Adam Glueckert,2016-09-21,Vireo cassinii cassinii,CHAS:Bird:8008,05/08/1922,1922-05-08,1922-05-08,accepted place of collection,unverified
"North America, United States, Arizona, Cochise County",Huachuca Mountains,"Huachuca Mountains, Arizona",31.488986,-110.408137,World Geodetic System 1984,17000,m,GeoLocate ,GeoLocate,Adam Glueckert,2016-09-21,Junco hyemalis dorsalis,CHAS:Bird:7926,10/12/1922,1922-10-12,1922-10-12,accepted place of collection,unverified
"North America, United States, Arizona, Cochise County",Huachuca Mountains,"Huachuca Mountains, Arizona",31.488986,-110.408137,World Geodetic System 1984,17000,m,GeoLocate ,GeoLocate,Adam Glueckert,2016-09-21,Junco hyemalis dorsalis,CHAS:Bird:7927,10/10/1922,1922-10-10,1922-10-10,accepted place of collection,unverified
"North America, United States, Arizona, Cochise County",Huachuca Mountains,"Huachuca Mountains, Arizona",31.488986,-110.408137,World Geodetic System 1984,17000,m,GeoLocate ,GeoLocate,Adam Glueckert,2016-09-21,Junco phaeonotus palliatus,CHAS:Bird:7930,04/17/1927,1927-04-17,1927-04-17,accepted place of collection,unverified
"North America, United States, Arizona, Cochise County",Huachuca Mountains,"Huachuca Mountains, Arizona",31.488986,-110.408137,World Geodetic System 1984,17000,m,GeoLocate ,GeoLocate,Adam Glueckert,2016-09-21,Junco phaeonotus palliatus,CHAS:Bird:7931,11/28/1925,1925-11-28,1925-11-28,accepted place of collection,unverified
"North America, United States, Arizona, Cochise County",Huachuca Mountains,"Huachuca Mountains, Arizona",31.488986,-110.408137,World Geodetic System 1984,17000,m,GeoLocate ,GeoLocate,Adam Glueckert,2016-09-21,Junco phaeonotus palliatus,CHAS:Bird:7932,03/12/1923,1923-03-12,1923-03-12,accepted place of collection,unverified
"North America, United States, Arizona, Cochise County",Huachuca Mountains,"Huachuca Mountains, Arizona",31.488986,-110.408137,World Geodetic System 1984,17000,m,GeoLocate ,GeoLocate,Adam Glueckert,2016-09-21,Junco phaeonotus palliatus,CHAS:Bird:7933,06/15/1923,1923-03-12,1923-03-12,accepted place of collection,unverified
"North America, United States, Arizona, Cochise County",Huachuca Mountains,"Huachuca Mountains, Arizona",31.488986,-110.408137,World Geodetic System 1984,17000,m,GeoLocate ,GeoLocate,Adam Glueckert,2016-09-21,Junco hyemalis caniceps,CHAS:Bird:7924,01/20/1923,1923-01-20,1923-01-20,accepted place of collection,unverified
"North America, United States, Arizona, Cochise County",Huachuca Mountains,"Huachuca Mountains, Arizona",31.488986,-110.408137,World Geodetic System 1984,17000,m,GeoLocate ,GeoLocate,Adam Glueckert,2016-09-21,Junco hyemalis caniceps,CHAS:Bird:7925,04/08/1927,1927-04-08,1927-04-08,accepted place of collection,unverified
"North America, United States, Arizona, Cochise County",Huachuca Mountains,"Huachuca Mountains, Arizona",31.488986,-110.408137,World Geodetic System 1984,17000,m,GeoLocate ,GeoLocate,Adam Glueckert,2016-09-21,Vermivora luciae,CHAS:Bird:16765,04/12/1923,1923-04-12,1923-04-12,accepted place of collection,unverified
"North America, United States, Arizona, Cochise County",Huachuca Mountains,Huachuca Mts,31.488986,-110.408137,World Geodetic System 1984,17000,m,GeoLocate ,GeoLocate,Adam Glueckert,2016-09-21,Dendroica townsendi,CHAS:Bird:16999,05/03/1922,1922-05-03,1922-05-03,accepted place of collection,unverified
"North America, United States, Arizona, Cochise County",Huachuca Mountains,Huachuca Mts,31.488986,-110.408137,World Geodetic System 1984,17000,m,GeoLocate ,GeoLocate,Adam Glueckert,2016-09-21,Dendroica occidentalis,CHAS:Bird:17047,05/08/1922,1922-05-08,1922-05-08,accepted place of collection,unverified
"North America, United States, Arizona, Cochise County",Huachuca Mountains,Huachuca Mts,31.488986,-110.408137,World Geodetic System 1984,17000,m,GeoLocate ,GeoLocate,Adam Glueckert,2016-09-21,Dendroica occidentalis,CHAS:Bird:17050,05/01/1922,1922-05-01,1922-05-01,accepted place of collection,unverified
"North America, United States, Arizona, Cochise County",Huachuca Mountains,Huachuca Mts,31.488986,-110.408137,World Geodetic System 1984,17000,m,GeoLocate ,GeoLocate,Adam Glueckert,2016-09-21,Dendroica occidentalis,CHAS:Bird:17051,08/09/1922,1922-08-09,1922-08-09,accepted place of collection,unverified
"North America, United States, Arizona, Cochise County",Huachuca Mountains,Huachuca Mts,31.488986,-110.408137,World Geodetic System 1984,17000,m,GeoLocate ,GeoLocate,Adam Glueckert,2016-09-21,Dendroica occidentalis,CHAS:Bird:17052,08/09/1922,1922-08-09,1922-08-09,accepted place of collection,unverified
"North America, United States, Arizona, Cochise County",Huachuca Mountains,Huachuca Mts,31.488986,-110.408137,World Geodetic System 1984,17000,m,GeoLocate ,GeoLocate,Adam Glueckert,2016-09-21,Dendroica nigrescens,CHAS:Bird:17085,03/29/1927,1927-03-29,1927-03-29,accepted place of collection,unverified
"North America, United States, Arizona, Cochise County",Huachuca Mountains,Huachuca Mts,31.488986,-110.408137,World Geodetic System 1984,17000,m,GeoLocate ,GeoLocate,Adam Glueckert,2016-09-21,Dendroica nigrescens,CHAS:Bird:17087,05/15/1922,1922-05-15,1922-05-15,accepted place of collection,unverified
"North America, United States, Arizona, Cochise County",Huachuca Mountains,Huachuca Mts,31.488986,-110.408137,World Geodetic System 1984,17000,m,GeoLocate ,GeoLocate,Adam Glueckert,2016-09-21,Dendroica nigrescens,CHAS:Bird:17089,04/04/1927,1927-04-04,1927-04-04,accepted place of collection,unverified
"North America, United States, Arizona, Cochise County",Huachuca Mountains,Huachuca Mts,31.488986,-110.408137,World Geodetic System 1984,17000,m,GeoLocate ,GeoLocate,Adam Glueckert,2016-09-21,Dendroica graciae graciae,CHAS:Bird:17138,05/03/1922,1922-05-03,1922-05-03,accepted place of collection,unverified
"North America, United States, Arizona, Cochise County",Huachuca Mountains,Huachuca Mts,31.488986,-110.408137,World Geodetic System 1984,17000,m,GeoLocate ,GeoLocate,Adam Glueckert,2016-09-21,Cardellina pusilla pileoata,CHAS:Bird:17593,08/30/1922,1922-08-30,1922-08-30,accepted place of collection,unverified
"North America, United States, Arizona, Cochise County",Huachuca Mountains,Huachuca Mts,31.488986,-110.408137,World Geodetic System 1984,17000,m,GeoLocate ,GeoLocate,Adam Glueckert,2016-09-21,Cardellina pusilla pileolata,CHAS:Bird:17610,05/03/1922,1922-05-03,1922-05-03,accepted place of collection,unverified
"North America, United States, Arizona, Cochise County",Huachuca Mountains,Huachuca Mts,31.488986,-110.408137,World Geodetic System 1984,17000,m,GeoLocate ,GeoLocate,Adam Glueckert,2016-09-21,Cardellina rubrifrons,CHAS:Bird:17658,06/07/1926,1926-06-07,1926-06-07,accepted place of collection,unverified
"North America, United States, Arizona, Cochise County",Huachuca Mountains,Huachuca Mts,31.488986,-110.408137,World Geodetic System 1984,17000,m,GeoLocate ,GeoLocate,Adam Glueckert,2016-09-21,Cardellina rubrifrons,CHAS:Bird:17660,06/03/1926,1926-06-03,1926-06-03,accepted place of collection,unverified
"North America, United States, Arizona, Cochise County",Huachuca Mountains,Huachuca Mts,31.488986,-110.408137,World Geodetic System 1984,17000,m,GeoLocate ,GeoLocate,Adam Glueckert,2016-09-21,Cardellina rubrifrons,CHAS:Bird:17661,06/02/1926,1926-06-02,1926-06-02,accepted place of collection,unverified
"North America, United States, Arizona, Cochise County",Huachuca Mountains,Huachuca Mts,31.488986,-110.408137,World Geodetic System 1984,17000,m,GeoLocate ,GeoLocate,Adam Glueckert,2016-09-21,Myioborus pictus,CHAS:Bird:17704,04/04/1927,1927-04-04,1927-04-04,accepted place of collection,unverified
"North America, United States, Arizona, Cochise County",Huachuca Mountains,Huachuca Mts,31.488986,-110.408137,World Geodetic System 1984,17000,m,GeoLocate ,GeoLocate,Adam Glueckert,2016-09-21,Myioborus pictus,CHAS:Bird:17705,04/04/1927,1927-04-04,1927-04-04,accepted place of collection,unverified
"North America, United States, Arizona, Cochise County",Huachuca Mountains,Huachuca Mts,31.488986,-110.408137,World Geodetic System 1984,17000,m,GeoLocate ,GeoLocate,Adam Glueckert,2016-09-21,Myioborus pictus,CHAS:Bird:17707,05/17/1926,1926-05-17,1926-05-17,accepted place of collection,unverified
"North America, United States, Arizona, Cochise County",Huachuca Mountains,Huachuca Mts,31.488986,-110.408137,World Geodetic System 1984,17000,m,GeoLocate ,GeoLocate,Adam Glueckert,2016-09-21,Myioborus pictus,CHAS:Bird:17708,07/28/1922,1922-07-28,1922-07-28,accepted place of collection,unverified
"North America, United States, Arizona, Cochise County",Huachuca Mountains,Huachuca Mts,31.488986,-110.408137,World Geodetic System 1984,17000,m,GeoLocate ,GeoLocate,Adam Glueckert,2016-09-21,Myioborus pictus,CHAS:Bird:17709,08/30/1922,1922-08-30,1922-08-30,accepted place of collection,unverified
"North America, United States, Arizona, Cochise County",Huachuca Mountains,Huachuca Mts,31.488986,-110.408137,World Geodetic System 1984,17000,m,GeoLocate ,GeoLocate,Adam Glueckert,2016-09-21,Myioborus pictus,CHAS:Bird:17710,06/02/1926,1926-06-02,1926-06-02,accepted place of collection,unverified
"North America, United States, Arizona, Cochise County",Huachuca Mountains,Huachuca Mts,31.488986,-110.408137,World Geodetic System 1984,17000,m,GeoLocate ,GeoLocate,Adam Glueckert,2016-09-21,Carduelis psaltria,CHAS:Bird:7315,07/27/1923,1923-07-27,1923-07-27,accepted place of collection,unverified
"North America, United States, Arizona, Cochise County",Huachuca Mountains,"Huachuca Mountains, Ariz.",31.488986,-110.408137,World Geodetic System 1984,17000,m,GeoLocate,GeoLocate,Adam Glueckert,2016-11-18,Aphelocoma wollweberi arizonae,CHAS:Bird:8039,10/03/1913,1913-10-03,1913-10-03,accepted place of collection,unverified
"North America, United States, Arizona, Cochise County",Huachuca Mountains,Huachuca Mts Ariz.,31.488986,-110.408137,World Geodetic System 1984,17000,m,GeoLocate,GeoLocate,Adam Glueckert,2016-11-18,Piranga hepatica hepatica,CHAS:Bird:8163,05/27/1899,1899-05-27,1899-05-27,accepted place of collection,unverified
"North America, United States, Arizona, Cochise County",Huachuca Mountains,Huachuca Mts,31.488986,-110.408137,World Geodetic System 1984,17000,m,GeoLocate,GeoLocate,Adam Glueckert,2016-11-18,Aimophila ruficeps scotti,CHAS:Bird:7323,06/10/1903,1903-06-10,1903-06-10,accepted place of collection,unverified
"North America, United States, Arizona, Cochise County",Huachuca Mountains,Huachuca Mts.,31.488986,-110.408137,World Geodetic System 1984,17000,m,GeoLocate,GeoLocate,Adam Glueckert,2016-11-18,Empidonax hammondii,CHAS:Bird:7396,09/26/1908,1908-09-26,1908-09-26,accepted place of collection,unverified
"North America, United States, Arizona, Cochise County",Huachuca Mountains,"Huachuca Mts, Ariz.",31.488986,-110.408137,World Geodetic System 1984,17000,m,GeoLocate,GeoLocate,Adam Glueckert,2016-11-18,Sturnella magna hoopesi,CHAS:Bird:8098,01/10/1905,1905-01-10,1905-01-10,accepted place of collection,unverified
"North America, United States, Arizona, Cochise County",Huachuca Mountains,Huachuca Mts,31.488986,-110.408137,World Geodetic System 1984,17000,m,GeoLocate,GeoLocate,Adam Glueckert,2016-11-18,Dendroica occidentalis,CHAS:Bird:17053,06/23/1895,1895-06-23,1895-06-23,accepted place of collection,unverified
"North America, United States, Arizona, Cochise County",Huachuca Mountains,Huachuca Mts,31.488986,-110.408137,World Geodetic System 1984,17000,m,GeoLocate,GeoLocate,Adam Glueckert,2016-11-18,Dendroica graciae graciae,CHAS:Bird:17140,08/31/1894,1894-08-31,1894-08-31,accepted place of collection,unverified
"North America, United States, Arizona, Cochise County",Huachuca Mountains,Huachuca Mts,31.488986,-110.408137,World Geodetic System 1984,17000,m,GeoLocate,GeoLocate,Adam Glueckert,2016-11-18,Cardellina rubrifrons,CHAS:Bird:17664,05/20/1895,1895-05-20,1895-05-20,accepted place of collection,unverified
"North America, United States, Arizona, Cochise County",Huachuca Mountains,Huachuca Mts,31.488986,-110.408137,World Geodetic System 1984,17000,m,GeoLocate,GeoLocate,Adam Glueckert,2016-11-18,Myioborus pictus,CHAS:Bird:17706,08/24/1895,1895-08-24,1895-08-24,accepted place of collection,unverified
"North America, United States, Arizona, Cochise County",Huachuca Mountains,"Huachuca Mountains, Arizona",31.488986,-110.408137,World Geodetic System 1984,17000,m,GeoLocate,GeoLocate,Adam Glueckert,2016-11-18,Myioborus pictus,CHAS:Bird:1964.2.5,[transcribed directly into formatted date fields],1899-06-07,1899-06-07,accepted place of collection,unverified
"North America, United States, Arizona, Cochise County","Huachuca Mountains, Ramsey Canyon","Huachuca Mts, Ramsey Canyon, Arizona",31.462598,-110.289525,World Geodetic System 1984,2209,m,GeoLocate ,GeoLocate,Adam Glueckert,2016-09-21,Contopus pertinax pallidiventris,CHAS:Bird:8294,06/07/1926,1926-06-07,1926-06-07,accepted place of collection,unverified
"North America, United States, Arizona, Cochise County",Pinery Canyon,Pinery Canyon,31.981477,-109.371729,World Geodetic System 1984,2490,m,GeoLocate,GeoLocate,Adam Glueckert,2016-11-18,Dendroica graciae graciae,CHAS:Bird:17137,05/09/1915,1915-05-09,1915-05-09,accepted place of collection,unverified
"North America, United States, Arizona, Cochise County",Pinery Canyon,Pinery Canyon,31.981477,-109.371729,World Geodetic System 1984,2490,m,GeoLocate,GeoLocate,Adam Glueckert,2016-11-18,Dendroica graciae graciae,CHAS:Bird:17139,05/09/1915,1915-05-09,1915-05-09,accepted place of collection,unverified
"North America, United States, Arizona, Cochise County",Tombstone,"Tombstone, Arizona",31.712868,-110.067576,World Geodetic System 1984,2943,m,GeoLocate ,GeoLocate,Adam Glueckert,2016-11-09,Vermivora luciae,CHAS:Bird:16770,04/01/1893,1893-04-01,1893-04-30,accepted place of collection,unverified
"North America, United States, Arizona, Graham County","Old Columbine, Graham Mountain","Columbine, Graham Mt, Graham Co, Arizona",32.701802,-109.871415,World Geodetic System 1984,4321,m,GeoLocate,GeoLocate,Adam Glueckert,2016-09-21,Patagioenas fasciata,CHAS:Bird:9172,06/05/1940,1940-06-05,1940-06-05,accepted place of collection,unverified
"North America, United States, Arizona, Graham County","Old Columbine, Graham Mountain","Columbine, Graham Mt, Graham Co, Arizona",32.701802,-109.871415,World Geodetic System 1984,4321,m,GeoLocate,GeoLocate,Adam Glueckert,2016-09-21,Sitta carolinensis nelsoni,CHAS:Bird:9175,06/06/1940,1940-06-06,1940-06-06,accepted place of collection,unverified
"North America, United States, Arizona, Graham County","Old Columbine, Graham Mountain","Columbine, Graham Mt, Graham Co, Arizona",32.701802,-109.871415,World Geodetic System 1984,4321,m,GeoLocate,GeoLocate,Adam Glueckert,2016-09-21,Dendroica coronata auduboni,CHAS:Bird:9178,06/06/1940,1940-06-06,1940-06-06,accepted place of collection,unverified
"North America, United States, Arizona, Graham County","Old Columbine, Graham Mountain","Columbine, Graham Mt, Graham Co, Arizona",32.701802,-109.871415,World Geodetic System 1984,4321,m,GeoLocate,GeoLocate,Adam Glueckert,2016-09-21,Dendroica coronata auduboni,CHAS:Bird:9179,06/06/1940,1940-06-06,1940-06-06,accepted place of collection,unverified
"North America, United States, Arizona, Graham County","Old Columbine, Graham Mountain","Columbine, Graham Mt, Graham Co, Arizona",32.701802,-109.871415,World Geodetic System 1984,4321,m,GeoLocate,GeoLocate,Adam Glueckert,2016-09-21,Picoides villosus,CHAS:Bird:9169,06/06/1940,1940-06-06,1940-06-06,accepted place of collection,unverified
"North America, United States, Arizona, Graham County","Old Columbine, Graham Mountain","Columbine, Graham Mt, Graham Co, Arizona",32.701802,-109.871415,World Geodetic System 1984,4321,m,GeoLocate,GeoLocate,Adam Glueckert,2016-09-21,Picoides villosus,CHAS:Bird:9170,06/06/1940,1940-06-06,1940-06-06,accepted place of collection,unverified
"North America, United States, Arizona, Graham County","Old Columbine, Graham Mountain","Columbine, Graham Mt, Graham Co, Arizona",32.701802,-109.871415,World Geodetic System 1984,4321,m,GeoLocate,GeoLocate,Adam Glueckert,2016-09-21,Picoides villosus,CHAS:Bird:9171,06/06/1940,1940-06-06,1940-06-06,accepted place of collection,unverified
"North America, United States, Arizona, Graham County","Old Columbine, Graham Mountain","Columbine, Graham Mt, Graham Co, Arizona",32.701802,-109.871415,World Geodetic System 1984,4321,m,GeoLocate,GeoLocate,Adam Glueckert,2016-09-21,Cyanocitta stelleri diademata,CHAS:Bird:9165,06/06/1940,1940-06-06,1940-06-06,accepted place of collection,unverified
"North America, United States, Arizona, Graham County","Old Columbine, Graham Mountain","Columbine, Graham Mt, Graham Co, Arizona",32.701802,-109.871415,World Geodetic System 1984,4321,m,GeoLocate,GeoLocate,Adam Glueckert,2016-09-21,Cyanocitta stelleri diademata,CHAS:Bird:9164,06/05/1940,1940-06-05,1940-06-05,accepted place of collection,unverified
"North America, United States, Arizona, Graham County","Old Columbine, Graham Mountain","Columbine, Graham Mt, Graham Co, Arizona",32.701802,-109.871415,World Geodetic System 1984,4321,m,GeoLocate,GeoLocate,Adam Glueckert,2016-09-21,Sitta pygmaea melanotis,CHAS:Bird:9176,06/06/1940,1940-06-06,1940-06-06,accepted place of collection,unverified
"North America, United States, Arizona, Graham County","Old Columbine, Graham Mountain","Columbine, Graham Mt, Graham Co, Arizona",32.701802,-109.871415,World Geodetic System 1984,4321,m,GeoLocate,GeoLocate,Adam Glueckert,2016-09-21,Sitta pygmaea melanotis,CHAS:Bird:9177,06/06/1940,1940-06-06,1940-06-06,accepted place of collection,unverified
"North America, United States, Arizona, Graham County","Old Columbine, Graham Mountain","Columbine, Graham Mt, Graham Co, Arizona",32.701802,-109.871415,World Geodetic System 1984,4321,m,GeoLocate,GeoLocate,Adam Glueckert,2016-09-21,Catharus guttata audukani,CHAS:Bird:9160,06/05/1940,1940-06-05,1940-06-05,accepted place of collection,unverified
"North America, United States, Arizona, Graham County","Old Columbine, Graham Mountain","Columbine, Graham Mt, Graham Co, Arizona",32.701802,-109.871415,World Geodetic System 1984,4321,m,GeoLocate,GeoLocate,Adam Glueckert,2016-09-21,Carduelis pinus,CHAS:Bird:9173,06/05/1940,1940-06-05,1940-06-05,accepted place of collection,unverified
"North America, United States, Arizona, Graham County","Old Columbine, Graham Mountain","Columbine, Graham Mt, Graham Co, Arizona",32.701802,-109.871415,World Geodetic System 1984,4321,m,GeoLocate,GeoLocate,Adam Glueckert,2016-09-21,Piranga ludoviciana,CHAS:Bird:9162,06/05/1940,1940-06-05,1940-06-05,accepted place of collection,unverified
"North America, United States, Arizona, Graham County","Old Columbine, Graham Mountain","Columbine, Graham Mt, Graham Co, Arizona",32.701802,-109.871415,World Geodetic System 1984,4321,m,GeoLocate,GeoLocate,Adam Glueckert,2016-09-21,Vireo gilvus swainsoni,CHAS:Bird:9181,06/06/1940,1940-06-06,1940-06-06,accepted place of collection,unverified
"North America, United States, Arizona, Graham County","Old Columbine, Graham Mountain","Columbine, Graham Mt, Graham Co, Arizona",32.701802,-109.871415,World Geodetic System 1984,4321,m,GeoLocate,GeoLocate,Adam Glueckert,2016-09-21,Empidonax difficilis difficilis,CHAS:Bird:9161,06/05/1940,1940-06-05,1940-06-05,accepted place of collection,unverified
"North America, United States, Arizona, Graham County","Old Columbine, Graham Mountain","Columbine, Graham Mt, Graham Co, Arizona",32.701802,-109.871415,World Geodetic System 1984,4321,m,GeoLocate,GeoLocate,Adam Glueckert,2016-09-21,Turdus migratorius propinquus,CHAS:Bird:9174,06/06/1940,1940-06-06,1940-06-06,accepted place of collection,unverified
"North America, United States, Arizona, Graham County","Old Columbine, Graham Mountain","Columbine, Graham Mt, Graham Co, Arizona",32.701802,-109.871415,World Geodetic System 1984,4321,m,GeoLocate,GeoLocate,Adam Glueckert,2016-09-21,Sialia mexicana bairdi,CHAS:Bird:9163,06/05/1940,1940-06-05,1940-06-05,accepted place of collection,unverified
"North America, United States, Arizona, Graham County","Old Columbine, Graham Mountain","Columbine, Graham Mt, Graham Co, Arizona",32.701802,-109.871415,World Geodetic System 1984,4321,m,GeoLocate,GeoLocate,Adam Glueckert,2016-09-21,Vireo gilvus swainsoni,CHAS:Bird:9180,06/06/1940,1940-06-06,1940-06-06,accepted place of collection,unverified
"North America, United States, Arizona, Graham County","Old Columbine, Graham Mountain","Columbine, Graham Mt, Graham Co, Arizona",32.701802,-109.871415,World Geodetic System 1984,4321,m,GeoLocate,GeoLocate,Adam Glueckert,2016-09-21,Junco phaeonotus palliatus,CHAS:Bird:9166,06/05/1940,1940-06-05,1940-06-05,accepted place of collection,unverified
"North America, United States, Arizona, Graham County","Old Columbine, Graham Mountain","Columbine, Graham Mt, Graham Co, Arizona",32.701802,-109.871415,World Geodetic System 1984,4321,m,GeoLocate,GeoLocate,Adam Glueckert,2016-09-21,Junco phaeonotus palliatus,CHAS:Bird:9167,06/06/1940,1940-06-06,1940-06-06,accepted place of collection,unverified
"North America, United States, Arizona, Graham County","Old Columbine, Graham Mountain","Columbine, Graham Mt, Graham Co, Arizona",32.701802,-109.871415,World Geodetic System 1984,4321,m,GeoLocate,GeoLocate,Adam Glueckert,2016-09-21,Junco phaeonotus palliatus,CHAS:Bird:9168,06/06/1940,1940-06-06,1940-06-06,accepted place of collection,unverified
"North America, United States, Arizona, Graham County","Old Columbine, Graham Mountain, alt. 9500 ft","Graham Mtns, Columbine, Grahm Co, Ariz., 9500 ft",32.701802,-109.871415,World Geodetic System 1984,4321,m,GeoLocate,GeoLocate,Adam Glueckert,2016-09-21,Catharus guttata audukani,CHAS:Bird:9152,05/21/1940,1940-05-21,1940-05-21,accepted place of collection,unverified
"North America, United States, Arizona, Maricopa County",Gila Bend,"Gila Bend, Ariz.",32.947824,-112.71683,World Geodetic System 1984,1886,m,GeoLocate,GeoLocate,Adam Glueckert,2016-10-31,Polioptila melanura melanura,CHAS:Bird:8418,04/24/1890,1890-04-24,1890-04-24,accepted place of collection,unverified
"North America, United States, Arizona, Maricopa County",Gild Bend,"Gild Bend, Ariz.",32.947824,-112.71683,World Geodetic System 1984,1886,m,GeoLocate,GeoLocate,Adam Glueckert,2016-10-31,Auriparus flaviceps flaviceps,CHAS:Bird:8391,04/18/1891,1891-04-18,1891-04-18,accepted place of collection,unverified
"North America, United States, Arizona, Maricopa County",Phoenix,"Phoenix, Ariz. [Arizona]",33.448377,-112.074037,World Geodetic System 1984,41662,m,GeoLocate,GeoLocate,Adam Glueckert,2016-10-05,Cardellina rubrifrons,CHAS:Bird:1317,[no date recorded],1800,2016-03-12,accepted place of collection,unverified
"North America, United States, Arizona, Maricopa County",Phoenix,,33.448377,-112.074037,World Geodetic System 1984,41662,m,GeoLocate,GeoLocate,Adam Glueckert,2016-10-05,Melanerpes uropygialis,CHAS:Bird:7446,11/19/1903,1903-11-19,1903-11-19,accepted place of collection,unverified
"North America, United States, Arizona, Maricopa County",Phoenix,"Phoenix, Ariz.",33.448377,-112.074037,World Geodetic System 1984,41662,m,GeoLocate,GeoLocate,Adam Glueckert,2016-10-05,Toxostoma bendirei,CHAS:Bird:8338,12/10/1897,1897-12-10,1897-12-10,accepted place of collection,unverified
"North America, United States, Arizona, Maricopa County",Phoenix,"Phoenix, Ariz.",33.448377,-112.074037,World Geodetic System 1984,41662,m,GeoLocate,GeoLocate,Adam Glueckert,2016-10-05,Pyrocephalus rubinus mexicanus,CHAS:Bird:8305,02/04/1896,1896-02-04,1896-02-04,accepted place of collection,unverified
"North America, United States, Arizona, Maricopa County",Phoenix,"Phoenix, Ariz.",33.448377,-112.074037,World Geodetic System 1984,41662,m,GeoLocate,GeoLocate,Adam Glueckert,2016-10-05,Carduelis psaltria,CHAS:Bird:7316,03/31/1897,1897-03-31,1897-03-31,accepted place of collection,unverified
"North America, United States, Arizona, Maricopa County",Phoenix,"Phoenix, Ariz.",33.448377,-112.074037,World Geodetic System 1984,41662,m,GeoLocate,GeoLocate,Adam Glueckert,2016-10-05,Agelaius phoeniceus sonoriensis,CHAS:Bird:8335,03/26/1897,1897-03-26,1897-03-26,accepted place of collection,unverified
"North America, United States, Arizona, Maricopa County",Phoenix,"Pheonix [sic], Arizona",33.448377,-112.074037,World Geodetic System 1984,41662,m,GeoLocate,GeoLocate,Adam Glueckert,2016-10-05,Glaucidium phaloenoides ferrugiuous,CHAS:Bird:1969.14.51,"""May 8, 1896""",1896-05-08,1896-05-08,accepted place of collection,unverified
"North America, United States, Arizona, Maricopa County",Phoenix,,33.448377,-112.074037,World Geodetic System 1984,41662,m,GeoLocate,GeoLocate,Adam Glueckert,2016-10-05,Nycticorax nycticorax,CHAS:Bird:18706,04/23/1892,1892-04-23,1892-04-23,accepted place of collection,unverified
"North America, United States, Arizona, Maricopa County",Phoenix,,33.448377,-112.074037,World Geodetic System 1984,41662,m,GeoLocate,GeoLocate,Adam Glueckert,2016-10-05,Nycticorax nycticorax,CHAS:Bird:18705,04/23/1892,1892-04-23,1892-04-23,accepted place of collection,unverified
"North America, United States, Arizona, Maricopa County",Phoenix,"Phoenix, Ariz.",33.448377,-112.074037,World Geodetic System 1984,41662,m,GeoLocate,GeoLocate,Adam Glueckert,2016-10-05,Cyanocitta stelleri diademata,CHAS:Bird:415,04/17/1891,1891-04-17,1891-04-17,accepted place of collection,unverified
"North America, United States, Arizona, Maricopa County",Phoenix,"Phoenix, AZ, Maricopa Co.",33.448377,-112.074037,World Geodetic System 1984,41662,m,GeoLocate,GeoLocate,Adam Glueckert,2016-10-05,Xanthocephalus xanthocephalus,CHAS:Bird:9118,04/07/1897,1897-04-07,1897-04-07,accepted place of collection,unverified
"North America, United States, Arizona, Maricopa County",Phoenix,"Phoenix, AZ, Maricopa Co.",33.448377,-112.074037,World Geodetic System 1984,41662,m,GeoLocate,GeoLocate,Adam Glueckert,2016-10-05,Xanthocephalus xanthocephalus,CHAS:Bird:9119,04/07/1897,1897-04-07,1897-04-07,accepted place of collection,unverified
"North America, United States, Arizona, Maricopa County",Phoenix,"Phoenix, Ariz.",33.448377,-112.074037,World Geodetic System 1984,41662,m,GeoLocate,GeoLocate,Adam Glueckert,2016-10-05,Agelaius phoeniceus sonoriensis,CHAS:Bird:8332,03/25/1897,1897-03-25,1897-03-25,accepted place of collection,unverified
"North America, United States, Arizona, Maricopa County",Phoenix,"Phoenix, AZ, Maricopa Co.",33.448377,-112.074037,World Geodetic System 1984,41662,m,GeoLocate,GeoLocate,Adam Glueckert,2016-10-05,Euphagus cyanocephalus,CHAS:Bird:9121,12/10/1897,1897-12-10,1897-12-10,accepted place of collection,unverified
"North America, United States, Arizona, Maricopa County",Phoenix,"Phoenix, AZ",33.448377,-112.074037,World Geodetic System 1984,41662,m,GeoLocate,GeoLocate,Adam Glueckert,2016-10-05,Tachycineta thalassina,CHAS:Bird:9127,05/01/1899,1899-05-01,1899-05-01,accepted place of collection,unverified
"North America, United States, Arizona, Maricopa County",Phoenix,"Phoenix, Arizona",33.448377,-112.074037,World Geodetic System 1984,41662,m,GeoLocate,GeoLocate,Adam Glueckert,2016-10-05,Icterus cucullatus,CHAS:Bird:1964.2.6,[transcribed directly into formatted date fields],1899-06-10,1899-06-10,accepted place of collection,unverified
"North America, United States, Arizona, Navajo County",Fort Apache,,33.790607,-109.98871,World Geodetic System 1984,3855,m,GeoLocate,GeoLocate,Adam Glueckert,2016-11-18,Dendroica coronata auduboni,CHAS:Bird:16984,09/23/1876,1876-09-23,1876-09-23,accepted place of collection,unverified
"North America, United States, Arizona, Pima County",2 miles north of Tucson,2 mi. N. of,32.253106,-110.923732,World Geodetic System 1984,8126,m,GeoLocate,GeoLocate,Adam Glueckert,2016-09-23,Calamospiza melanocorys,CHAS:Bird:18332,02/18/1944,1944-02-18,1944-02-18,accepted place of collection,unverified
"North America, United States, Arizona, Pima County",4 miles north of Tucson,"4 miles N. of Tuscon, AZ",32.286886,-110.930942,World Geodetic System 1984,9742,m,GeoLocate,GeoLocate,Adam Glueckert,2016-09-23,Colaptes auratus,CHAS:Bird:15515,02/20/1944,1944-02-20,1944-02-20,accepted place of collection,unverified
"North America, United States, Arizona, Pima County",4 miles north of Tucson,4 mi N. of Tucson,32.286886,-110.930942,World Geodetic System 1984,9742,m,GeoLocate,GeoLocate,Adam Glueckert,2016-09-23,Pipilo aberti,CHAS:Bird:18240,02/23/1944,1944-02-23,1944-02-23,accepted place of collection,unverified
"North America, United States, Arizona, Pima County",4 miles north of Tucson,4 mi. N. of,32.286886,-110.930942,World Geodetic System 1984,9742,m,GeoLocate,GeoLocate,Adam Glueckert,2016-09-23,Amphispiza bilineata,CHAS:Bird:18375,02/20/1944,1944-02-20,1944-02-20,accepted place of collection,unverified
"North America, United States, Arizona, Pima County",4 miles north of Tucson,4 miles north Tuscon,32.286886,-110.930942,World Geodetic System 1984,9742,m,GeoLocate,GeoLocate,Adam Glueckert,2016-09-23,Sayornis saya,CHAS:Bird:15677,03/08/1944,1944-03-08,1944-03-08,accepted place of collection,unverified
"North America, United States, Arizona, Pima County",4 miles north of Tucson,4 mi N of Tucson,32.286886,-110.930942,World Geodetic System 1984,9742,m,GeoLocate,GeoLocate,Adam Glueckert,2016-09-23,Lanius ludovicianus,CHAS:Bird:16452,03/03/1944,1944-03-03,1944-03-03,accepted place of collection,unverified
"North America, United States, Arizona, Pima County",4 miles north of Tucson,4 miles north of Tuscon,32.286886,-110.930942,World Geodetic System 1984,9742,m,GeoLocate,GeoLocate,Adam Glueckert,2016-09-23,Columbina inca,CHAS:Bird:15450,03/15/1944,1944-03-15,1944-03-15,accepted place of collection,unverified
"North America, United States, Arizona, Pima County",4 miles north of Tucson,4mi N of Tuscon,32.286886,-110.930942,World Geodetic System 1984,9742,m,GeoLocate,GeoLocate,Adam Glueckert,2016-09-23,Melanerpes uropygialis,CHAS:Bird:15543,03/17/1944,1944-03-17,1944-03-17,accepted place of collection,unverified
"North America, United States, Arizona, Pima County",4 miles north of Tucson,4mi N of Tuscon,32.286886,-110.930942,World Geodetic System 1984,9742,m,GeoLocate,GeoLocate,Adam Glueckert,2016-09-23,Melanerpes uropygialis,CHAS:Bird:15544,02/28/1944,1944-02-28,1944-02-28,accepted place of collection,unverified
"North America, United States, Arizona, Pima County",4 miles north of Tucson,4 mi N of Tucson,32.286886,-110.930942,World Geodetic System 1984,9742,m,GeoLocate,GeoLocate,Adam Glueckert,2016-09-23,Passerculus sandwichensis,CHAS:Bird:18251,02/17/1944,1944-02-17,1944-02-17,accepted place of collection,unverified
"North America, United States, Arizona, Pima County",4 miles north of Tucson,4 miles north of Tucson,32.286886,-110.930942,World Geodetic System 1984,9742,m,GeoLocate,GeoLocate,Adam Glueckert,2016-09-23,Cardinalis sinuatus,CHAS:Bird:17958,02/23/1944,1944-02-23,1944-02-23,accepted place of collection,unverified
"North America, United States, Arizona, Pima County",4 miles north of Tucson,4 miles north of Tucson,32.286886,-110.930942,World Geodetic System 1984,9742,m,GeoLocate,GeoLocate,Adam Glueckert,2016-09-23,Cardinalis sinuatus,CHAS:Bird:17959,02/20/1944,1944-02-20,1944-02-20,accepted place of collection,unverified
"North America, United States, Arizona, Pima County",4 miles north of Tucson,4 miles north of Tucson,32.286886,-110.930942,World Geodetic System 1984,9742,m,GeoLocate,GeoLocate,Adam Glueckert,2016-09-23,Cardinalis sinuatus,CHAS:Bird:17960,02/29/1944,1944-02-29,1944-02-29,accepted place of collection,unverified
"North America, United States, Arizona, Pima County",4 miles north of Tucson,4 mi N of Tucson,32.286886,-110.930942,World Geodetic System 1984,9742,m,GeoLocate,GeoLocate,Adam Glueckert,2016-09-23,Toxostoma bendirei,CHAS:Bird:16177,03/17/1944,1944-03-17,1944-03-17,accepted place of collection,unverified
"North America, United States, Arizona, Pima County",4 miles north of Tucson,4 mi N Tucson,32.286886,-110.930942,World Geodetic System 1984,9742,m,GeoLocate,GeoLocate,Adam Glueckert,2016-09-23,Toxostoma crissale,CHAS:Bird:16185,02/28/1944,1944-02-28,1944-02-28,accepted place of collection,unverified
"North America, United States, Arizona, Pima County",Fort Lowell,"Fort Lowell, Ariz. [Arizona]",32.259835,-110.873795,World Geodetic System 1984,116,m,GeoLocate,GeoLocate,Adam Glueckert,2016-11-18,Campylorhynchus brunneicapillus couesi,CHAS:Bird:1352,10/19/1896,1896-10-19,1896-10-19,accepted place of collection,unverified
"North America, United States, Arizona, Pima County",Fort Lowell,"Fort Lowell, Ariz. [Arizona]",32.259835,-110.873795,World Geodetic System 1984,116,m,GeoLocate,GeoLocate,Adam Glueckert,2016-11-18,Campylorhynchus brunneicapillus couesi,CHAS:Bird:1353,02/22/1908,1908-02-22,1908-02-22,accepted place of collection,unverified
"North America, United States, Arizona, Pima County",Fort Lowell,"Fort Lowell, Ariz. [Arizona]",32.259835,-110.873795,World Geodetic System 1984,116,m,GeoLocate,GeoLocate,Adam Glueckert,2016-11-18,Campylorhynchus brunneicapillus couesi,CHAS:Bird:1354,03/31/1908,1908-03-31,1908-03-31,accepted place of collection,unverified
"North America, United States, Arizona, Pima County",Fort Lowell,"Fort Lowell, Ariz.",32.259835,-110.873795,World Geodetic System 1984,116,m,GeoLocate,GeoLocate,Adam Glueckert,2016-11-18,Empidonax griseus,CHAS:Bird:8318,04/14/1906,1906-04-14,1906-04-14,accepted place of collection,unverified
"North America, United States, Arizona, Pima County",Santa Rita Mountains,Santa Rita Mts Ariz.,31.825918,-110.774807,World Geodetic System 1984,3372,m,GeoLocate,GeoLocate,Adam Glueckert,2016-12-07,Myiarchus tuberculifer olivascens,CHAS:Bird:8307,05/19/1901,1901-05-19,1901-05-19,accepted place of collection,unverified
"North America, United States, Arizona, Pima County",Santa Rita Mountains,Santa Rita Mts Ariz. [Arizona],31.825918,-110.774807,World Geodetic System 1984,3372,m,GeoLocate,GeoLocate,Adam Glueckert,2016-12-07,Aimophila ruficeps sclater,CHAS:Bird:854,July 1884,1884-07-01,1884-07-30,accepted place of collection,unverified
"North America, United States, Arizona, Pima County",Santa Rita Mountains,Santa Rita Mountains,31.825918,-110.774807,World Geodetic System 1984,3372,m,GeoLocate,GeoLocate,Adam Glueckert,2016-12-07,Wilsonia pusilla pileolata,CHAS:Bird:8655,04/24/1937,1937-04-24,1937-04-24,accepted place of collection,unverified
"North America, United States, Arizona, Pima County",Santa Rita Mountains,"Santa Rita Mts, Ariz.",31.825918,-110.774807,World Geodetic System 1984,3372,m,GeoLocate,GeoLocate,Adam Glueckert,2016-12-07,Piranga hepatica hepatica,CHAS:Bird:8164,06/11/1889,1889-06-11,1889-06-11,accepted place of collection,unverified
"North America, United States, Arizona, Pima County",Santa Rita Mountains,Santa Rita Mts,31.825918,-110.774807,World Geodetic System 1984,3372,m,GeoLocate,GeoLocate,Adam Glueckert,2016-12-07,Myioborus pictus,CHAS:Bird:17711,07/08/1884,1884-06-08,1884-06-08,accepted place of collection,unverified
"North America, United States, Arizona, Pima County",Santa Rita Mountains,"Santa Rita Mountains, Ariz.",31.825918,-110.774807,World Geodetic System 1984,3372,m,GeoLocate,GeoLocate,Adam Glueckert,2016-12-07,Aphelocoma wollweberi arizonae,CHAS:Bird:7386,06/24/1884,1884-06-24,1884-06-24,accepted place of collection,unverified
"North America, United States, Arizona, Pima County","Santa Rita Mountains, north base Madera Canyon","Santa Rita Mts, north base, Madera Canyon, Pima Co, Arizona",31.740856,-110.878027,World Geodetic System 1984,2913,m,GeoLocate,GeoLocate,Adam Glueckert,2016-12-07,Cardellina pusilla,CHAS:Bird:19325,04/24/1937,1937-04-24,1937-04-24,accepted place of collection,unverified
"North America, United States, Arizona, Pima County","Santa Rita Mountains, north base Madera Canyon","Santa Rita Mts, north base, Madera Canyon, Pima Co, Arizona",31.740856,-110.878027,World Geodetic System 1984,2913,m,GeoLocate,GeoLocate,Adam Glueckert,2016-12-07,Molothrus ater obscurus,CHAS:Bird:8653,04/24/1937,1937-04-24,1937-04-24,accepted place of collection,unverified
"North America, United States, Arizona, Pima County","Santa Rita Mountains, north base Madera Canyon","Santa Rita Mts, north base, Madera Canyon, Pima Co, Arizona",31.740856,-110.878027,World Geodetic System 1984,2913,m,GeoLocate,GeoLocate,Adam Glueckert,2016-12-07,Picoides scalaris cactophilus,CHAS:Bird:8661,04/26/1937,1937-04-26,1937-04-26,accepted place of collection,unverified
"North America, United States, Arizona, Pima County","Santa Rita Mountains, north base Madera Canyon","Santa Rita Mts, north base, Madera Canyon, Pima Co, Arizona",31.740856,-110.878027,World Geodetic System 1984,2913,m,GeoLocate,GeoLocate,Adam Glueckert,2016-12-07,Picoides scalaris cactophilus,CHAS:Bird:8662,04/26/1937,1937-04-26,1937-04-26,accepted place of collection,unverified
"North America, United States, Arizona, Pima County","Santa Rita Mountains, north base Madera Canyon","Santa Rita Mts, north base, Madera Canyon, Pima Co, Arizona",31.740856,-110.878027,World Geodetic System 1984,2913,m,GeoLocate,GeoLocate,Adam Glueckert,2016-12-07,Bubo virginianus pallescens,CHAS:Bird:8652,04/24/1937,1937-04-24,1937-04-24,accepted place of collection,unverified
"North America, United States, Arizona, Pima County","Santa Rita Mountains, north base Madera Canyon","Santa Rita Mts, north base, Madera Canyon, Pima Co, Arizona",31.740856,-110.878027,World Geodetic System 1984,2913,m,GeoLocate,GeoLocate,Adam Glueckert,2016-12-07,Aphelocoma wollweberi arizonae,CHAS:Bird:8664,04/26/1937,1937-04-26,1937-04-26,accepted place of collection,unverified
"North America, United States, Arizona, Pima County","Santa Rita Mountains, north base Madera Canyon","Santa Rita Mts, north base, Madera Canyon, Pima Co, Arizona",31.740856,-110.878027,World Geodetic System 1984,2913,m,GeoLocate,GeoLocate,Adam Glueckert,2016-12-07,Lanius ludovicianus excubitorides,CHAS:Bird:8654,04/24/1937,1937-04-24,1937-04-24,accepted place of collection,unverified
"North America, United States, Arizona, Pima County","Santa Rita Mountains, north base Madera Canyon","Santa Rita Mts, north base, Madera Canyon, Pima Co, Arizona",31.740856,-110.878027,World Geodetic System 1984,2913,m,GeoLocate,GeoLocate,Adam Glueckert,2016-12-07,Pipilo chlorurus,CHAS:Bird:8656,04/24/1937,1937-04-24,1937-04-24,accepted place of collection,unverified
"North America, United States, Arizona, Pima County","Santa Rita Mountains, north base Madera Canyon","Santa Rita Mts, north base, Madera Canyon, Pima Co, Arizona",31.740856,-110.878027,World Geodetic System 1984,2913,m,GeoLocate,GeoLocate,Adam Glueckert,2016-12-07,Piranga hepatica hepatica,CHAS:Bird:8665,04/26/1937,1937-04-26,1937-04-26,accepted place of collection,unverified
"North America, United States, Arizona, Pima County","Santa Rita Mountains, north base Madera Canyon","Santa Rita Mts, north base, Madera Canyon, Pima Co, Arizona",31.740856,-110.878027,World Geodetic System 1984,2913,m,GeoLocate,GeoLocate,Adam Glueckert,2016-12-07,Callipepla gambelii gambelii,CHAS:Bird:8666,04/26/1937,1937-04-26,1937-04-26,accepted place of collection,unverified
"North America, United States, Arizona, Pima County","Santa Rita Mountains, north base Madera Canyon","Santa Rita Mts, north base, Madera Canyon, Pima Co, Arizona",31.740856,-110.878027,World Geodetic System 1984,2913,m,GeoLocate,GeoLocate,Adam Glueckert,2016-12-07,Callipepla gambelii gambelii,CHAS:Bird:8657,04/24/1937,1937-04-24,1937-04-24,accepted place of collection,unverified
"North America, United States, Arizona, Pima County","Santa Rita Mountains, north base Madera Canyon; 10 miles southeast Continental","Santa Rita Mts, north base, Madera Canyon, Pima Co, Arizona; 10 mi SE Continental, Santa Rita Mountains",31.740856,-110.878027,World Geodetic System 1984,2913,m,GeoLocate,GeoLocate,Adam Glueckert,2016-12-07,Zenaida asiatica mearnsi,CHAS:Bird:8659,04/25/1937,1937-04-25,1937-04-25,accepted place of collection,unverified
"North America, United States, Arizona, Pima County","Santa Rita Mountains, north base Madera Canyon; 10 miles southeast Continental","Santa Rita Mts, north base, Madera Canyon, Pima Co, Arizona; 10 mi SE Continental, Santa Rita Mountains",31.740856,-110.878027,World Geodetic System 1984,2913,m,GeoLocate,GeoLocate,Adam Glueckert,2016-12-07,Tyrannus verticalis,CHAS:Bird:8660,04/26/1937,1937-04-26,1937-04-26,accepted place of collection,unverified
"North America, United States, Arizona, Pima County","Santa Rita Mountains, north base Madera Canyon; 10 miles southeast Continental","Santa Rita Mts, north base, Madera Canyon, Pima Co, Arizona; 10 mi SE Continental, Santa Rita Mountains",31.740856,-110.878027,World Geodetic System 1984,2913,m,GeoLocate,GeoLocate,Adam Glueckert,2016-12-07,Aphelocoma wollweberi arizonae,CHAS:Bird:8663,04/26/1937,1937-04-26,1937-04-26,accepted place of collection,unverified
"North America, United States, Arizona, Pima County","Santa Rita Mountains, north base Madera Canyon; 10 miles southeast Continental","Santa Rita Mts, north base, Madera Canyon, Pima Co, Arizona; 10 mi SE Continental, Santa Rita Mountains",31.740856,-110.878027,World Geodetic System 1984,2913,m,GeoLocate,GeoLocate,Adam Glueckert,2016-12-07,Campylorhynchus brunneicapillus couesi,CHAS:Bird:8658,04/24/1937,1937-04-24,1937-04-24,accepted place of collection,unverified
"North America, United States, Arizona, Pima County",Tucson,"Tucson, Arizona",32.221743,-110.926479,World Geodetic System 1984,19578,m,GeoLocate,GeoLocate,Adam Glueckert,2016-11-18,Corvus corax sinuatus,CHAS:Bird:1969.14.52,"""Feb. 1, 1923""",1923-02-01,1923-02-28,accepted place of collection,unverified
"North America, United States, Arizona, Pima County",Tucson,,32.221743,-110.926479,World Geodetic System 1984,19578,m,GeoLocate,GeoLocate,Adam Glueckert,2016-09-23,Lanius ludovicianus,CHAS:Bird:16453,02/25/1944,1944-02-25,1944-02-25,accepted place of collection,unverified
"North America, United States, Arizona, Pima County",Tucson,,32.221743,-110.926479,World Geodetic System 1984,19578,m,GeoLocate,GeoLocate,Adam Glueckert,2016-09-23,Calamospiza melanocorys,CHAS:Bird:18335,02/18/1944,1944-02-18,1944-02-18,accepted place of collection,unverified
"North America, United States, Arizona, Pima County",Tucson,,32.221743,-110.926479,World Geodetic System 1984,19578,m,GeoLocate,GeoLocate,Adam Glueckert,2016-09-23,Melanerpes uropygialis,CHAS:Bird:7444,12/14/1925,1925-12-14,1925-12-14,accepted place of collection,unverified
"North America, United States, Arizona, Pima County",Tucson,"Tucson, Ariz.",32.221743,-110.926479,World Geodetic System 1984,19578,m,GeoLocate,GeoLocate,Adam Glueckert,2016-09-23,Melozone aberti,CHAS:Bird:7365,11/18/1925,1925-11-18,1925-11-18,accepted place of collection,unverified
"North America, United States, Arizona, Pima County",Tucson,"Tuscon, Ariz.",32.221743,-110.926479,World Geodetic System 1984,19578,m,GeoLocate,GeoLocate,Adam Glueckert,2016-09-23,Melozone aberti,CHAS:Bird:8275,12/14/1925,1925-12-14,1925-12-14,accepted place of collection,unverified
"North America, United States, Arizona, Pima County",Tucson,"Tuscon, Arizona",32.221743,-110.926479,World Geodetic System 1984,19578,m,GeoLocate,GeoLocate,Adam Glueckert,2016-09-23,Vermivora luciae,CHAS:Bird:16767,04/21/1927,1927-04-21,1927-04-21,accepted place of collection,unverified
"North America, United States, Arizona, Pima County",Tucson,"Tuscon, Arizona",32.221743,-110.926479,World Geodetic System 1984,19578,m,GeoLocate,GeoLocate,Adam Glueckert,2016-09-23,Vermivora luciae,CHAS:Bird:16769,04/21/1927,1927-04-21,1927-04-21,accepted place of collection,unverified
"North America, United States, Arizona, Pima County",Tucson,"Tuscon, Arizona",32.221743,-110.926479,World Geodetic System 1984,19578,m,GeoLocate,GeoLocate,Adam Glueckert,2016-09-23,Vermivora luciae,CHAS:Bird:16764,04/28/1926,1926-04-28,1926-04-28,accepted place of collection,unverified
"North America, United States, Arizona, Pima County",Tucson,"Tucson, Ariz.",32.221743,-110.926479,World Geodetic System 1984,19578,m,GeoLocate,GeoLocate,Adam Glueckert,2016-09-23,Picoides scalaris,CHAS:Bird:7422,12/18/1925,1925-12-18,1925-12-18,accepted place of collection,unverified
"North America, United States, Arizona, Pima County",Tucson,,32.221743,-110.926479,World Geodetic System 1984,19578,m,GeoLocate,GeoLocate,Adam Glueckert,2016-09-23,Melanerpes uropygialis,CHAS:Bird:7443,12/14/1925,1925-12-14,1925-12-14,accepted place of collection,unverified
"North America, United States, Arizona, Pima County",Tucson,"Tucson, Ariz.",32.221743,-110.926479,World Geodetic System 1984,19578,m,GeoLocate,GeoLocate,Adam Glueckert,2016-09-23,Melanerpes uropygialis uropygialis,CHAS:Bird:8119,11/15/1925,1925-11-15,1925-11-15,accepted place of collection,unverified
"North America, United States, Arizona, Pima County",Tucson,"Tuscon, Ariz.",32.221743,-110.926479,World Geodetic System 1984,19578,m,GeoLocate,GeoLocate,Adam Glueckert,2016-10-26,Pipilo chlorurus,CHAS:Bird:941,04/01/1884,1884-04-01,1884-04-01,accepted place of collection,unverified
"North America, United States, Arizona, Pima County",Tucson,"Tuscon, Ariz.",32.221743,-110.926479,World Geodetic System 1984,19578,m,GeoLocate,GeoLocate,Adam Glueckert,2016-10-26,Pipilo chlorurus,CHAS:Bird:940,04/26/1884,1884-04-26,1884-04-26,accepted place of collection,unverified
"North America, United States, Arizona, Pima County",Tucson,"Tuscon, Ariz.",32.221743,-110.926479,World Geodetic System 1984,19578,m,GeoLocate,GeoLocate,Adam Glueckert,2016-10-26,Polioptila melanura melanura,CHAS:Bird:8417,12/18/1925,1925-12-18,1925-12-18,accepted place of collection,unverified
"North America, United States, Arizona, Pima County",Tucson,,32.221743,-110.926479,World Geodetic System 1984,19578,m,GeoLocate,GeoLocate,Adam Glueckert,2016-10-26,Melospiza melodia fallax,CHAS:Bird:18600,05/1884,1884-05-01,1884-05-30,accepted place of collection,unverified
"North America, United States, Arizona, Pinal County",6 miles north of Superior,"6 mi. N. of Superior, Pinal Co., Arizona",33.38202,-111.09623,World Geodetic System 1984,5469,m,GeoLocate,GeoLocate,Adam Glueckert,2016-11-09,Amphispiza bilineata deserticola,CHAS:Bird:9182,05/24/1940,1940-05-24,1940-05-24,accepted place of collection,unverified
"North America, United States, Arizona, Pinal County","6 miles north of Superior, alt. 3000 ft","6 miles north of Superior, Arizona, Pinal Co., 3000 ft",33.38202,-111.09623,World Geodetic System 1984,5469,m,GeoLocate,GeoLocate,Adam Glueckert,2016-11-09,Archilochus alexandri,CHAS:Bird:9148,05/24/1940,1940-05-24,1940-05-24,accepted place of collection,unverified
"North America, United States, Arizona, Pinal County","6 miles north of Superior, alt. 3000 ft","6 miles north of Superior, Arizona, Pinal Co., 3000 ft",33.38202,-111.09623,World Geodetic System 1984,5469,m,GeoLocate,GeoLocate,Adam Glueckert,2016-11-09,Auriparus flaviceps flaviceps,CHAS:Bird:9150,05/24/1940,1940-05-24,1940-05-24,accepted place of collection,unverified
"North America, United States, Arizona, Pinal County","6 miles north of Superior, alt. 3000 ft","6 miles north of Superior, Arizona, Pinal Co., 3000 ft",33.38202,-111.09623,World Geodetic System 1984,5469,m,GeoLocate,GeoLocate,Adam Glueckert,2016-11-09,Sayornis saya saya,CHAS:Bird:9151,05/24/1940,1940-05-24,1940-05-24,accepted place of collection,unverified
"North America, United States, Arizona, Pinal County","6 miles north of Superior, alt. 3000 ft","6 miles north of Superior, Arizona, Pinal Co., 3000 ft",33.38202,-111.09623,World Geodetic System 1984,5469,m,GeoLocate,GeoLocate,Adam Glueckert,2016-11-09,Pipilo fuscus mesoleucus,CHAS:Bird:9149,05/24/1940,1940-05-24,1940-05-24,accepted place of collection,unverified
"North America, United States, Arizona, Pinal County",6 miles west of Superior,"6 miles west of Superior, Arizona, Pinal Co",33.294538,-111.2006,World Geodetic System 1984,4299,m,GeoLocate,GeoLocate,Adam Glueckert,2016-11-09,Tachycineta thalassina lepida,CHAS:Bird:9147,05/19/1940,1940-05-19,1940-05-19,accepted place of collection,unverified
"North America, United States, Arizona, Pinal County","6 miles west of Superior, alt. 1800 ft","6 miles west of Superior, Arizona, Pinal Co, 1800 ft",33.294538,-111.2006,World Geodetic System 1984,4299,m,GeoLocate,GeoLocate,Adam Glueckert,2016-11-09,Tachycineta thalassina lepida,CHAS:Bird:9145,05/19/1940,1940-05-19,1940-05-19,accepted place of collection,unverified
"North America, United States, Arizona, Pinal County","6 miles west of Superior, alt. 1800 ft","6 miles west of Superior, Arizona, Pinal Co, 1800 ft",33.294538,-111.2006,World Geodetic System 1984,4299,m,GeoLocate,GeoLocate,Adam Glueckert,2016-11-09,Tachycineta thalassina lepida,CHAS:Bird:9146,05/19/1940,1940-05-19,1940-05-19,accepted place of collection,unverified
"North America, United States, Arizona, Pinal County","6 miles west of Superior, alt. 1800 ft","6 miles west of Superior, Arizona, Pinal Co, 1800 ft",33.294538,-111.2006,World Geodetic System 1984,4299,m,GeoLocate,GeoLocate,Adam Glueckert,2016-11-09,Carpodacus mexicanus frontalis,CHAS:Bird:9144,05/20/1940,1940-05-20,1940-05-20,accepted place of collection,unverified
"North America, United States, Arizona, Pinal County","6 miles west of Superior, alt. 1800 ft","6 miles west of Superior, Arizona, Pinal Co, 1800 ft",33.294538,-111.2006,World Geodetic System 1984,4299,m,GeoLocate,GeoLocate,Adam Glueckert,2016-11-09,Piranga ludoviciana,CHAS:Bird:9143,05/20/1940,1940-05-20,1940-05-20,accepted place of collection,unverified
"North America, United States, Arizona, Pinal County",Casa Grande,,32.879502,-111.757352,World Geodetic System 1984,16182,m,GeoLocate,GeoLocate,Adam Glueckert,2016-10-26,Phainopepla nitens,CHAS:Bird:16442,04/22/1892,1892-04-22,1892-04-22,accepted place of collection,unverified
"North America, United States, Arizona, Pinal County",Casa Grande,,32.879502,-111.757352,World Geodetic System 1984,16182,m,GeoLocate,GeoLocate,Adam Glueckert,2016-10-26,Phainopepla nitens,CHAS:Bird:16443,04/22/1892,1892-04-22,1892-04-22,accepted place of collection,unverified
"North America, United States, Arizona, Pinal County",Casa Grande,,32.879502,-111.757352,World Geodetic System 1984,16182,m,GeoLocate,GeoLocate,Adam Glueckert,2016-10-26,Falco sparverius,CHAS:Bird:15039,04/19/1892,1892-04-19,1892-04-19,accepted place of collection,unverified
"North America, United States, Arizona, Pinal County",Florence,,33.031451,-111.387343,World Geodetic System 1984,5826,m,GeoLocate,GeoLocate,Adam Glueckert,2016-11-09,Auriparus flaviceps flaviceps,CHAS:Bird:15994,04/05/1889,1889-04-05,1889-04-05,accepted place of collection,unverified
"North America, United States, Arizona, Pinal County",near Florence,near Florence,33.031451,-111.387343,World Geodetic System 1984,7500,m,GeoLocate,GeoLocate,Adam Glueckert,2016-11-09,Pyrocephalus rubinus mexicanus,CHAS:Bird:15629,04/06/1889,1889-04-06,1889-04-06,accepted place of collection,unverified
"North America, United States, Arizona, Pinal County",near Florence,near Florence,33.031451,-111.387343,World Geodetic System 1984,7500,m,GeoLocate,GeoLocate,Adam Glueckert,2016-11-09,Pyrocephalus rubinus mexicanus,CHAS:Bird:15630,04/06/1889,1889-04-06,1889-04-06,accepted place of collection,unverified
"North America, United States, Arizona, Pinal County",near Florence,near Florence,33.031451,-111.387343,World Geodetic System 1984,7500,m,GeoLocate,GeoLocate,Adam Glueckert,2016-11-09,Tyrannus verticalis,CHAS:Bird:15643,04/06/1889,1889-04-06,1889-04-06,accepted place of collection,unverified
"North America, United States, Arizona, Pinal County",near Florence,near Florence,33.031451,-111.387343,World Geodetic System 1984,7500,m,GeoLocate,GeoLocate,Adam Glueckert,2016-11-09,Icterus cucullatus,CHAS:Bird:17881,04/06/1891,1891-04-06,1891-04-06,accepted place of collection,unverified
"North America, United States, Arizona, Pinal County",near Florence,nr Florence,33.031451,-111.387343,World Geodetic System 1984,7500,m,GeoLocate,GeoLocate,Adam Glueckert,2016-11-09,Toxostoma bendirei,CHAS:Bird:16176,04/05/1889,1889-04-05,1889-04-05,accepted place of collection,unverified
"North America, United States, Arizona, Santa Cruz County",Patagonia,"Patagonia, Ariz.",31.539538,-110.756196,World Geodetic System 1984,2512,m,GeoLocate,GeoLocate,Adam Glueckert,2016-11-09,Amphispiza bilineata deserticola,CHAS:Bird:7330,03/30/1927,1927-03-30,1927-03-30,accepted place of collection,unverified
"North America, United States, Arizona, Santa Cruz County",Patagonia,"Patagonia, Ariz. Santa Cruz Co.",31.539538,-110.756196,World Geodetic System 1984,2512,m,GeoLocate,GeoLocate,Adam Glueckert,2016-11-09,Vireo cassinii cassinii,CHAS:Bird:8010,03/30/1927,1927-03-30,1927-03-30,accepted place of collection,unverified
"North America, United States, Arizona, Santa Cruz County",Patagonia,"Patagonia, Arizona",31.539538,-110.756196,World Geodetic System 1984,2512,m,GeoLocate,GeoLocate,Adam Glueckert,2016-11-09,Vermivora luciae,CHAS:Bird:16771,03/30/1927,1927-03-30,1927-03-30,accepted place of collection,unverified
"North America, United States, Arizona, Santa Cruz County",Patagonia,"Patagonia, Ariz.",31.539538,-110.756196,World Geodetic System 1984,2512,m,GeoLocate,GeoLocate,Adam Glueckert,2016-11-09,Pipilo maculatus montanus,CHAS:Bird:7366,05/30/1917,1917-05-30,1917-05-30,accepted place of collection,unverified
"North America, United States, Arizona, Yavapai County",2 miles south of Yarnell,"2 miles south of Yarnell, Yavapai County, Ariz.",34.183947,-112.748088,World Geodetic System 1984,3592,m,GeoLocate,GeoLocate,Adam Glueckert,2016-11-18,Spizella atrogularis atrogularis,CHAS:Bird:8924,06/08/1937,1937-06-08,1937-06-08,accepted place of collection,unverified
"North America, United States, Arizona, Yavapai County",2 miles west of Wickenburg,Ariz. 2 miles west of Wickenburg,33.968641,-112.766701,World Geodetic System 1984,3291,m,GeoLocate,GeoLocate,Adam Glueckert,2016-09-23,Tachycineta thalassina lepida,CHAS:Bird:9740,05/15/1951,1951-05-15,1951-05-15,accepted place of collection,unverified
"North America, United States, Arizona, Yavapai County",3 miles west of Octave,"3 miles west of Octave, Yavapai Co, Ariz.",34.141358,-112.742513,World Geodetic System 1984,2018,m,GeoLocate,GeoLocate,Adam Glueckert,2016-11-18,Chordeiles acutipennis texensis,CHAS:Bird:8876,06/02/1937,1937-06-02,1937-06-02,accepted place of collection,unverified
"North America, United States, Arizona, Yavapai County",5 miles north of Wickenburg,"5 miles north of Wickenburg, Yavapai Co., Ariz.",34.040363,-112.730995,World Geodetic System 1984,4512,m,GeoLocate,GeoLocate,Adam Glueckert,2016-09-23,Callipepla gambelii gambelii,CHAS:Bird:8710,04/30/1937,1937-04-30,1937-04-30,accepted place of collection,unverified
"North America, United States, Arizona, Yavapai County",5 miles north of Wickenburg,"5 miles north of Wickenburg, Yavapai Co., Ariz.",34.040363,-112.730995,World Geodetic System 1984,4512,m,GeoLocate,GeoLocate,Adam Glueckert,2016-09-23,Callipepla gambelii gambelii,CHAS:Bird:8711,04/30/1937,1937-04-30,1937-04-30,accepted place of collection,unverified
"North America, United States, Arizona, Yavapai County",5 miles north of Wickenburg,"5 miles north of Wickenburg, Yavapai Co., Ariz.",34.040363,-112.730995,World Geodetic System 1984,4512,m,GeoLocate,GeoLocate,Adam Glueckert,2016-09-23,Molothrus ater obscurus,CHAS:Bird:8748,05/11/1937,1937-05-11,1937-05-11,accepted place of collection,unverified
"North America, United States, Arizona, Yavapai County",5 miles north of Wickenburg,"5 miles north of Wickenburg, Yavapai Co., Ariz.",34.040363,-112.730995,World Geodetic System 1984,4512,m,GeoLocate,GeoLocate,Adam Glueckert,2016-09-23,Molothrus ater obscurus,CHAS:Bird:8749,05/11/1937,1937-05-11,1937-05-11,accepted place of collection,unverified
"North America, United States, Arizona, Yavapai County",5 miles north of Wickenburg,"5 miles north of Wickenburg, Yavapai Co., Ariz.",34.040363,-112.730995,World Geodetic System 1984,4512,m,GeoLocate,GeoLocate,Adam Glueckert,2016-09-23,Molothrus ater obscurus,CHAS:Bird:8776,05/14/1937,1937-05-14,1937-05-14,accepted place of collection,unverified
"North America, United States, Arizona, Yavapai County",5 miles north of Wickenburg,"5 miles north of Wickenburg, Yavapai Co., Ariz.",34.040363,-112.730995,World Geodetic System 1984,4512,m,GeoLocate,GeoLocate,Adam Glueckert,2016-09-23,Molothrus ater obscurus,CHAS:Bird:8777,05/14/1937,1937-05-14,1937-05-14,accepted place of collection,unverified
"North America, United States, Arizona, Yavapai County",5 miles north of Wickenburg,"5 miles north of Wickenburg, Yavapai Co., Ariz.",34.040363,-112.730995,World Geodetic System 1984,4512,m,GeoLocate,GeoLocate,Adam Glueckert,2016-09-23,Colaptes chrysoides mearnsi,CHAS:Bird:8741,05/09/1937,1937-05-09,1937-05-09,accepted place of collection,unverified
"North America, United States, Arizona, Yavapai County",5 miles north of Wickenburg,"5mi N of Wickenburg, Yavapai Co., Arizona",34.040363,-112.730995,World Geodetic System 1984,4512,m,GeoLocate,GeoLocate,Adam Glueckert,2016-09-23,Melanerpes uropygialis uropygialis,CHAS:Bird:8667,04/29/1937,1937-04-29,1937-04-29,accepted place of collection,unverified
"North America, United States, Arizona, Yavapai County",5 miles north of Wickenburg,"5 miles north of Wickenburg, Yavapai Co., Ariz.",34.040363,-112.730995,World Geodetic System 1984,4512,m,GeoLocate,GeoLocate,Adam Glueckert,2016-09-23,Melanerpes uropygialis uropygialis,CHAS:Bird:8742,05/09/1937,1937-05-09,1937-05-09,accepted place of collection,unverified
"North America, United States, Arizona, Yavapai County",5 miles north of Wickenburg,"5 miles north of Wickenburg, Yavapai Co., Ariz.",34.040363,-112.730995,World Geodetic System 1984,4512,m,GeoLocate,GeoLocate,Adam Glueckert,2016-09-23,Callipepla gambelii gambelii,CHAS:Bird:8898,06/02/1937,1937-06-02,1937-06-02,accepted place of collection,unverified
"North America, United States, Arizona, Yavapai County",5 miles north of Wickenburg,"5 miles north of Wickenburg, Yavapai Co., Ariz.",34.040363,-112.730995,World Geodetic System 1984,4512,m,GeoLocate,GeoLocate,Adam Glueckert,2016-09-23,Callipepla gambelii gambelii,CHAS:Bird:8899,06/02/1937,1937-06-02,1937-06-02,accepted place of collection,unverified
"North America, United States, Arizona, Yavapai County",5 miles north of Wickenburg,"5 miles north of Wickenburg, Yavapai Co., Ariz.",34.040363,-112.730995,World Geodetic System 1984,4512,m,GeoLocate,GeoLocate,Adam Glueckert,2016-09-23,Callipepla gambelii gambelii,CHAS:Bird:8900,06/02/1937,1937-06-02,1937-06-02,accepted place of collection,unverified
"North America, United States, Arizona, Yavapai County",5 miles north of Wickenburg,"5 miles north of Wickenburg, Yavapai Co., Ariz.",34.040363,-112.730995,World Geodetic System 1984,4512,m,GeoLocate,GeoLocate,Adam Glueckert,2016-09-23,Callipepla gambelii gambelii,CHAS:Bird:8901,06/02/1937,1937-06-02,1937-06-02,accepted place of collection,unverified
"North America, United States, Arizona, Yavapai County",5 miles north of Wickenburg,"5 miles north of Wickenburg, Yavapai Co., Ariz.",34.040363,-112.730995,World Geodetic System 1984,4512,m,GeoLocate,GeoLocate,Adam Glueckert,2016-09-23,Chordeiles acutipennis texensis,CHAS:Bird:8774,05/13/1937,1937-05-13,1937-05-13,accepted place of collection,unverified
"North America, United States, Arizona, Yavapai County",5 miles north of Wickenburg,"5 miles north of Wickenburg, Yavapai Co., Ariz.",34.040363,-112.730995,World Geodetic System 1984,4512,m,GeoLocate,GeoLocate,Adam Glueckert,2016-09-23,Phalaenoptilus nuttallii nuttallii,CHAS:Bird:8800,05/19/1937,1937-05-19,1937-05-19,accepted place of collection,unverified
"North America, United States, Arizona, Yavapai County",5 miles north of Wickenburg,"5 miles north of Wickenburg, Yavapai Co., Ariz.",34.040363,-112.730995,World Geodetic System 1984,4512,m,GeoLocate,GeoLocate,Adam Glueckert,2016-09-23,Actitis macularius,CHAS:Bird:8778,05/14/1937,1937-05-14,1937-05-14,accepted place of collection,unverified
"North America, United States, Arizona, Yavapai County",5 miles north of Wickenburg,"5 miles north of Wickenburg, Yavapai Co., Arizona",34.040363,-112.730995,World Geodetic System 1984,4512,m,GeoLocate,GeoLocate,Adam Glueckert,2016-09-23,Pyrocephalus rubinus mexicanus,CHAS:Bird:8668,04/29/1937,1937-04-29,1937-04-29,accepted place of collection,unverified
"North America, United States, Arizona, Yavapai County",5 miles north of Wickenburg,"5 miles north of Wickenburg, Yavapai Co., Ariz.",34.040363,-112.730995,World Geodetic System 1984,4512,m,GeoLocate,GeoLocate,Adam Glueckert,2016-09-23,Pyrocephalus rubinus mexicanus,CHAS:Bird:8751,05/11/1937,1937-05-11,1937-05-11,accepted place of collection,unverified
"North America, United States, Arizona, Yavapai County",5 miles north of Wickenburg,"5 miles north of Wickenburg, Yavapai Co., Ariz.",34.040363,-112.730995,World Geodetic System 1984,4512,m,GeoLocate,GeoLocate,Adam Glueckert,2016-09-23,Pyrocephalus rubinus mexicanus,CHAS:Bird:8752,05/11/1937,1937-05-11,1937-05-11,accepted place of collection,unverified
"North America, United States, Arizona, Yavapai County",5 miles north of Wickenburg,"5 miles north of Wickenburg, Yavapai Co., Ariz.",34.040363,-112.730995,World Geodetic System 1984,4512,m,GeoLocate,GeoLocate,Adam Glueckert,2016-09-23,Catherpes mexicanus conspersus,CHAS:Bird:8779,05/17/1937,1937-05-17,1937-05-17,accepted place of collection,unverified
"North America, United States, Arizona, Yavapai County",5 miles north of Wickenburg,"5 miles north of Wickenburg, Yavapai Co., Ariz.",34.040363,-112.730995,World Geodetic System 1984,4512,m,GeoLocate,GeoLocate,Adam Glueckert,2016-09-23,Carduelis psaltria hesperophila,CHAS:Bird:8789,05/19/1937,1937-05-19,1937-05-19,accepted place of collection,unverified
"North America, United States, Arizona, Yavapai County",5 miles north of Wickenburg,"5 miles north of Wickenburg, Yavapai Co., Arizona",34.040363,-112.730995,World Geodetic System 1984,4512,m,GeoLocate,GeoLocate,Adam Glueckert,2016-09-23,Spizella breweri breweri,CHAS:Bird:8674,04/29/1937,1937-04-29,1937-04-29,accepted place of collection,unverified
"North America, United States, Arizona, Yavapai County",5 miles north of Wickenburg,"5 miles north of Wickenburg, Yavapai Co., Ariz.",34.040363,-112.730995,World Geodetic System 1984,4512,m,GeoLocate,GeoLocate,Adam Glueckert,2016-09-23,Cardinalis cardinalis superbus,CHAS:Bird:8750,05/11/1937,1937-05-11,1937-05-11,accepted place of collection,unverified
"North America, United States, Arizona, Yavapai County",5 miles north of Wickenburg,"5 miles north of Wickenburg, Yavapai Co., Arizona",34.040363,-112.730995,World Geodetic System 1984,4512,m,GeoLocate,GeoLocate,Adam Glueckert,2016-09-23,Centurus uropygialis uropygialis,CHAS:Bird:8686,05/01/1937,1937-05-01,1937-05-01,accepted place of collection,unverified
"North America, United States, Arizona, Yavapai County",5 miles north of Wickenburg,"5 miles north of Wickenburg, Yavapai Co., Ariz.",34.040363,-112.730995,World Geodetic System 1984,4512,m,GeoLocate,GeoLocate,Adam Glueckert,2016-09-23,Setophaga aestiva,CHAS:Bird:8707,05/06/1937,1937-05-06,1937-05-06,accepted place of collection,unverified
"North America, United States, Arizona, Yavapai County",5 miles north of Wickenburg,"5 miles north of Wickenburg, Yavapai Co., Arizona",34.040363,-112.730995,World Geodetic System 1984,4512,m,GeoLocate,GeoLocate,Adam Glueckert,2016-09-23,Icterus cucullatus nelsoni,CHAS:Bird:8697,05/06/1937,1937-05-06,1937-05-06,accepted place of collection,unverified
"North America, United States, Arizona, Yavapai County",5 miles north of Wickenburg,"5 miles north of Wickenburg, Yavapai Co., Arizona",34.040363,-112.730995,World Geodetic System 1984,4512,m,GeoLocate,GeoLocate,Adam Glueckert,2016-09-23,Icterus cucullatus nelsoni,CHAS:Bird:8698,05/06/1937,1937-05-06,1937-05-06,accepted place of collection,unverified
"North America, United States, Arizona, Yavapai County",5 miles north of Wickenburg,"5 miles north of Wickenburg, Yavapai Co., Ariz.",34.040363,-112.730995,World Geodetic System 1984,4512,m,GeoLocate,GeoLocate,Adam Glueckert,2016-09-23,Icterus cucullatus nelsoni,CHAS:Bird:8758,05/11/1937,1937-05-11,1937-05-11,accepted place of collection,unverified
"North America, United States, Arizona, Yavapai County",5 miles north of Wickenburg,"5 miles north of Wickenburg, Yavapai Co., Ariz.",34.040363,-112.730995,World Geodetic System 1984,4512,m,GeoLocate,GeoLocate,Adam Glueckert,2016-09-23,Picoides scalaris cactophilus,CHAS:Bird:8754,05/11/1937,1937-05-11,1937-05-11,accepted place of collection,unverified
"North America, United States, Arizona, Yavapai County",5 miles north of Wickenburg,"5 miles north of Wickenburg, Yavapai Co., Arizona",34.040363,-112.730995,World Geodetic System 1984,4512,m,GeoLocate,GeoLocate,Adam Glueckert,2016-09-23,Micrathene whitneyi whitneyi,CHAS:Bird:8691,05/03/1937,1937-05-03,1937-05-03,accepted place of collection,unverified
"North America, United States, Arizona, Yavapai County",5 miles north of Wickenburg,"5 miles north of Wickenburg, Yavapai Co., Arizona",34.040363,-112.730995,World Geodetic System 1984,4512,m,GeoLocate,GeoLocate,Adam Glueckert,2016-09-23,Callipepla gambelii gambelii,CHAS:Bird:8687,05/03/1937,1937-05-03,1937-05-03,accepted place of collection,unverified
"North America, United States, Arizona, Yavapai County",5 miles north of Wickenburg,"5 miles north of Wickenburg, Yavapai Co., Arizona",34.040363,-112.730995,World Geodetic System 1984,4512,m,GeoLocate,GeoLocate,Adam Glueckert,2016-09-23,Callipepla gambelii gambelii,CHAS:Bird:8693,05/05/1937,1937-05-05,1937-05-05,accepted place of collection,unverified
"North America, United States, Arizona, Yavapai County",5 miles north of Wickenburg,"5 miles north of Wickenburg, Yavapai Co",34.040363,-112.730995,World Geodetic System 1984,4512,m,GeoLocate,GeoLocate,Adam Glueckert,2016-09-23,Callipepla gambelii gambelii,CHAS:Bird:8701,05/06/1937,1937-05-06,1937-05-06,accepted place of collection,unverified
"North America, United States, Arizona, Yavapai County",5 miles north of Wickenburg,"5 miles north of Wickenburg, Yavapai Co., Ariz.",34.040363,-112.730995,World Geodetic System 1984,4512,m,GeoLocate,GeoLocate,Adam Glueckert,2016-09-23,Callipepla gambelii gambelii,CHAS:Bird:8702,05/06/1937,1937-05-06,1937-05-06,accepted place of collection,unverified
"North America, United States, Arizona, Yavapai County",5 miles north of Wickenburg,"5 miles north of Wickenburg, Yavapai Co., Arizona",34.040363,-112.730995,World Geodetic System 1984,4512,m,GeoLocate,GeoLocate,Adam Glueckert,2016-09-23,Callipepla gambelii gambelii,CHAS:Bird:8692,05/04/1937,1937-05-04,1937-05-04,accepted place of collection,unverified
"North America, United States, Arizona, Yavapai County",5 miles north of Wickenburg,"5 miles north of Wickenburg, Yavapai Co., Arizona",34.040363,-112.730995,World Geodetic System 1984,4512,m,GeoLocate,GeoLocate,Adam Glueckert,2016-09-23,Callipepla gambelii gambelii,CHAS:Bird:8700,05/06/1937,1937-05-06,1937-05-06,accepted place of collection,unverified
"North America, United States, Arizona, Yavapai County",5 miles north of Wickenburg,"5 miles north of Wickenburg, Yavapai Co., Arizona",34.040363,-112.730995,World Geodetic System 1984,4512,m,GeoLocate,GeoLocate,Adam Glueckert,2016-09-23,Geococcyx californianus,CHAS:Bird:8696,05/05/1937,1937-05-05,1937-05-05,accepted place of collection,unverified
"North America, United States, Arizona, Yavapai County",5 miles north of Wickenburg,"5 miles north of Wickenburg, Yavapai Co., Ariz.",34.040363,-112.730995,World Geodetic System 1984,4512,m,GeoLocate,GeoLocate,Adam Glueckert,2016-09-23,Chordeiles acutipennis texensis,CHAS:Bird:8760,05/11/1937,1937-05-11,1937-05-11,accepted place of collection,unverified
"North America, United States, Arizona, Yavapai County",5 miles north of Wickenburg,"5 miles north of Wickenburg, Yavapai Co., Arizona",34.040363,-112.730995,World Geodetic System 1984,4512,m,GeoLocate,GeoLocate,Adam Glueckert,2016-09-23,Archilochus alexandri,CHAS:Bird:8690,05/03/1937,1937-05-03,1937-05-03,accepted place of collection,unverified
"North America, United States, Arizona, Yavapai County",5 miles north of Wickenburg,"5 miles north of Wickenburg, Yavapai Co., Ariz.",34.040363,-112.730995,World Geodetic System 1984,4512,m,GeoLocate,GeoLocate,Adam Glueckert,2016-09-23,Tyrannus verticalis,CHAS:Bird:8703,05/06/1937,1937-05-06,1937-05-06,accepted place of collection,unverified
"North America, United States, Arizona, Yavapai County",5 miles north of Wickenburg,"5 miles north of Wickenburg, Yavapai Co., Arizona",34.040363,-112.730995,World Geodetic System 1984,4512,m,GeoLocate,GeoLocate,Adam Glueckert,2016-09-23,Sayornis nigricans nigricans,CHAS:Bird:8695,05/05/1937,1937-05-05,1937-05-05,accepted place of collection,unverified
"North America, United States, Arizona, Yavapai County",5 miles north of Wickenburg,"5 miles north of Wickenburg, Yavapai Co., Arizona",34.040363,-112.730995,World Geodetic System 1984,4512,m,GeoLocate,GeoLocate,Adam Glueckert,2016-09-23,Myiarchus cinerascens cinerascens,CHAS:Bird:8670,04/29/1937,1937-04-29,1937-04-29,accepted place of collection,unverified
"North America, United States, Arizona, Yavapai County",5 miles north of Wickenburg,"5 miles north of Wickenburg, Yavapai Co., Ariz.",34.040363,-112.730995,World Geodetic System 1984,4512,m,GeoLocate,GeoLocate,Adam Glueckert,2016-09-23,Empidonax difficilis difficilis,CHAS:Bird:8755,05/11/1937,1937-05-11,1937-05-11,accepted place of collection,unverified
"North America, United States, Arizona, Yavapai County",5 miles north of Wickenburg,"5 miles north of Wickenburg, Yavapai Co., Arizona",34.040363,-112.730995,World Geodetic System 1984,4512,m,GeoLocate,GeoLocate,Adam Glueckert,2016-09-23,Petrochelidon pyrrhonota malenogaster,CHAS:Bird:8684,05/01/1937,1937-05-01,1937-05-01,accepted place of collection,unverified
"North America, United States, Arizona, Yavapai County",5 miles north of Wickenburg,"5 miles north of Wickenburg, Yavapai Co., Ariz.",34.040363,-112.730995,World Geodetic System 1984,4512,m,GeoLocate,GeoLocate,Adam Glueckert,2016-09-23,Auriparus flaviceps flaviceps,CHAS:Bird:8704,05/06/1937,1937-05-06,1937-05-06,accepted place of collection,unverified
"North America, United States, Arizona, Yavapai County",5 miles north of Wickenburg,"5 miles north of Wickenburg, Yavapai Co., Arizona",34.040363,-112.730995,World Geodetic System 1984,4512,m,GeoLocate,GeoLocate,Adam Glueckert,2016-09-23,Lanius ludovicianus sonoriensis,CHAS:Bird:8685,05/01/1937,1937-05-01,1937-05-01,accepted place of collection,unverified
"North America, United States, Arizona, Yavapai County",5 miles north of Wickenburg,"5 miles north of Wickenburg, Yavapai Co., Arizona",34.040363,-112.730995,World Geodetic System 1984,4512,m,GeoLocate,GeoLocate,Adam Glueckert,2016-09-23,Phainopepla nitens lepida,CHAS:Bird:8669,04/29/1937,1937-04-29,1937-04-29,accepted place of collection,unverified
"North America, United States, Arizona, Yavapai County",5 miles north of Wickenburg,"5 miles north of Wickenburg, Yavapai Co., Arizona",34.040363,-112.730995,World Geodetic System 1984,4512,m,GeoLocate,GeoLocate,Adam Glueckert,2016-09-23,Phainopepla nitens lepida,CHAS:Bird:8694,05/05/1937,1937-05-05,1937-05-05,accepted place of collection,unverified
"North America, United States, Arizona, Yavapai County",5 miles north of Wickenburg,"5 miles north of Wickenburg, Yavapai Co., Arizona",34.040363,-112.730995,World Geodetic System 1984,4512,m,GeoLocate,GeoLocate,Adam Glueckert,2016-09-23,Phainopepla nitens lepida,CHAS:Bird:8699,05/06/1937,1937-05-06,1937-05-06,accepted place of collection,unverified
"North America, United States, Arizona, Yavapai County",5 miles north of Wickenburg,"5 miles north of Wickenburg, Yavapai Co., Ariz.",34.040363,-112.730995,World Geodetic System 1984,4512,m,GeoLocate,GeoLocate,Adam Glueckert,2016-09-23,Phainopepla nitens lepida,CHAS:Bird:8759,05/11/1937,1937-05-11,1937-05-11,accepted place of collection,unverified
"North America, United States, Arizona, Yavapai County",5 miles north of Wickenburg,"5 miles north of Wickenburg, Yavapai Co., Ariz.",34.040363,-112.730995,World Geodetic System 1984,4512,m,GeoLocate,GeoLocate,Adam Glueckert,2016-09-23,Phainopepla nitens lepida,CHAS:Bird:8761,05/12/1937,1937-05-12,1937-05-12,accepted place of collection,unverified
"North America, United States, Arizona, Yavapai County",5 miles north of Wickenburg,"5 miles north of Wickenburg, Yavapai Co., Ariz.",34.040363,-112.730995,World Geodetic System 1984,4512,m,GeoLocate,GeoLocate,Adam Glueckert,2016-09-23,Vireo swainsoni swainsoni,CHAS:Bird:8756,05/11/1937,1937-05-11,1937-05-11,accepted place of collection,unverified
"North America, United States, Arizona, Yavapai County",5 miles north of Wickenburg,"5 miles north of Wickenburg, Yavapai Co., Arizona",34.040363,-112.730995,World Geodetic System 1984,4512,m,GeoLocate,GeoLocate,Adam Glueckert,2016-09-23,Carpodacus mexicanus frontalis,CHAS:Bird:8677,04/30/1937,1937-04-30,1937-04-30,accepted place of collection,unverified
"North America, United States, Arizona, Yavapai County",5 miles north of Wickenburg,"5 miles north of Wickenburg, Yavapai Co., Arizona",34.040363,-112.730995,World Geodetic System 1984,4512,m,GeoLocate,GeoLocate,Adam Glueckert,2016-09-23,Carpodacus mexicanus frontalis,CHAS:Bird:8678,04/30/1937,1937-04-30,1937-04-30,accepted place of collection,unverified
"North America, United States, Arizona, Yavapai County",5 miles north of Wickenburg,"5 miles north of Wickenburg, Yavapai Co., Arizona",34.040363,-112.730995,World Geodetic System 1984,4512,m,GeoLocate,GeoLocate,Adam Glueckert,2016-09-23,Carpodacus mexicanus frontalis,CHAS:Bird:8679,04/30/1937,1937-04-30,1937-04-30,accepted place of collection,unverified
"North America, United States, Arizona, Yavapai County",5 miles north of Wickenburg,"5 miles north of Wickenburg, Yavapai Co., Arizona",34.040363,-112.730995,World Geodetic System 1984,4512,m,GeoLocate,GeoLocate,Adam Glueckert,2016-09-23,Carpodacus mexicanus frontalis,CHAS:Bird:8680,04/30/1937,1937-04-30,1937-04-30,accepted place of collection,unverified
"North America, United States, Arizona, Yavapai County",5 miles north of Wickenburg,"5 miles north of Wickenburg, Yavapai Co., Ariz.",34.040363,-112.730995,World Geodetic System 1984,4512,m,GeoLocate,GeoLocate,Adam Glueckert,2016-09-23,Carduelis psaltria hesperophila,CHAS:Bird:8753,05/11/1937,1937-05-11,1937-05-11,accepted place of collection,unverified
"North America, United States, Arizona, Yavapai County",5 miles north of Wickenburg,"5 miles north of Wickenburg, Yavapai Co., Arizona",34.040363,-112.730995,World Geodetic System 1984,4512,m,GeoLocate,GeoLocate,Adam Glueckert,2016-09-23,Pipilo chlorurus,CHAS:Bird:8688,05/03/1937,1937-05-03,1937-05-03,accepted place of collection,unverified
"North America, United States, Arizona, Yavapai County",5 miles north of Wickenburg,"5 miles north of Wickenburg, Yavapai Co., Ariz.",34.040363,-112.730995,World Geodetic System 1984,4512,m,GeoLocate,GeoLocate,Adam Glueckert,2016-09-23,Pipilo chlorurus,CHAS:Bird:8705,05/06/1937,1937-05-06,1937-05-06,accepted place of collection,unverified
"North America, United States, Arizona, Yavapai County",5 miles north of Wickenburg,"5 miles north of Wickenburg, Yavapai Co., Ariz.",34.040363,-112.730995,World Geodetic System 1984,4512,m,GeoLocate,GeoLocate,Adam Glueckert,2016-09-23,Pipilo fusca mesoleuca,CHAS:Bird:8708,05/08/1937,1937-05-08,1937-05-08,accepted place of collection,unverified
"North America, United States, Arizona, Yavapai County",5 miles north of Wickenburg,"5 miles north of Wickenburg, Yavapai Co., Arizona",34.040363,-112.730995,World Geodetic System 1984,4512,m,GeoLocate,GeoLocate,Adam Glueckert,2016-09-23,Amphispiza bilineata deserticola,CHAS:Bird:8671,"05/01/1937 or April 29, 1937",1937-04-29,1937-05-01,accepted place of collection,unverified
"North America, United States, Arizona, Yavapai County",5 miles north of Wickenburg,"5 miles north of Wickenburg, Yavapai Co., Arizona",34.040363,-112.730995,World Geodetic System 1984,4512,m,GeoLocate,GeoLocate,Adam Glueckert,2016-09-23,Amphispiza bilineata deserticola,CHAS:Bird:8672,04/29/1937,1937-04-29,1937-04-29,accepted place of collection,unverified
"North America, United States, Arizona, Yavapai County",5 miles north of Wickenburg,"5 miles north of Wickenburg, Yavapai Co., Arizona",34.040363,-112.730995,World Geodetic System 1984,4512,m,GeoLocate,GeoLocate,Adam Glueckert,2016-09-23,Amphispiza bilineata deserticola,CHAS:Bird:8673,04/29/1937,1937-04-29,1937-04-29,accepted place of collection,unverified
"North America, United States, Arizona, Yavapai County",5 miles north of Wickenburg,"5 miles north of Wickenburg, Yavapai Co., Arizona",34.040363,-112.730995,World Geodetic System 1984,4512,m,GeoLocate,GeoLocate,Adam Glueckert,2016-09-23,Amphispiza bilineata deserticola,CHAS:Bird:8675,04/30/1937,1937-04-30,1937-04-30,accepted place of collection,unverified
"North America, United States, Arizona, Yavapai County",5 miles north of Wickenburg,"5 miles north of Wickenburg, Yavapai Co., Arizona",34.040363,-112.730995,World Geodetic System 1984,4512,m,GeoLocate,GeoLocate,Adam Glueckert,2016-09-23,Amphispiza bilineata deserticola,CHAS:Bird:8676,04/30/1937,1937-04-30,1937-04-30,accepted place of collection,unverified
"North America, United States, Arizona, Yavapai County",5 miles north of Wickenburg,"5 miles north of Wickenburg, Yavapai Co., Arizona",34.040363,-112.730995,World Geodetic System 1984,4512,m,GeoLocate,GeoLocate,Adam Glueckert,2016-09-23,Chondestes grammacus strigatus,CHAS:Bird:8681,04/30/1937,1937-04-30,1937-04-30,accepted place of collection,unverified
"North America, United States, Arizona, Yavapai County",5 miles north of Wickenburg,"5 miles north of Wickenburg, Yavapai Co., Ariz.",34.040363,-112.730995,World Geodetic System 1984,4512,m,GeoLocate,GeoLocate,Adam Glueckert,2016-09-23,Amphispiza bilineata deserticola,CHAS:Bird:8706,05/06/1937,1937-05-06,1937-05-06,accepted place of collection,unverified
"North America, United States, Arizona, Yavapai County",5 miles north of Wickenburg,"5 miles north of Wickenburg, Yavapai Co., Ariz.",34.040363,-112.730995,World Geodetic System 1984,4512,m,GeoLocate,GeoLocate,Adam Glueckert,2016-09-23,Amphispiza bilineata deserticola,CHAS:Bird:8762,05/12/1937,1937-05-12,1937-05-12,accepted place of collection,unverified
"North America, United States, Arizona, Yavapai County",5 miles north of Wickenburg,"5 miles north of Wickenburg, Yavapai Co., Arizona",34.040363,-112.730995,World Geodetic System 1984,4512,m,GeoLocate,GeoLocate,Adam Glueckert,2016-09-23,Spizella breweri breweri,CHAS:Bird:8682,04/30/1937,1937-04-30,1937-04-30,accepted place of collection,unverified
"North America, United States, Arizona, Yavapai County",5 miles north of Wickenburg,"5 miles north of Wickenburg, Yavapai Co., Arizona",34.040363,-112.730995,World Geodetic System 1984,4512,m,GeoLocate,GeoLocate,Adam Glueckert,2016-09-23,Spizella breweri breweri,CHAS:Bird:8683,05/01/1937,1937-05-01,1937-05-01,accepted place of collection,unverified
"North America, United States, Arizona, Yavapai County",5 miles north of Wickenburg,"5 miles north of Wickenburg, Yavapai Co., Arizona",34.040363,-112.730995,World Geodetic System 1984,4512,m,GeoLocate,GeoLocate,Adam Glueckert,2016-09-23,Oreothlypis luciae,CHAS:Bird:8689,05/03/1937,1937-05-03,1937-05-03,accepted place of collection,unverified
"North America, United States, Arizona, Yavapai County",5 miles north of Wickenburg,"5 miles north of Wickenburg, Yavapai Co., Ariz.",34.040363,-112.730995,World Geodetic System 1984,4512,m,GeoLocate,GeoLocate,Adam Glueckert,2016-09-23,Vermivora luciae,CHAS:Bird:8775,05/13/1937,1937-05-13,1937-05-13,accepted place of collection,unverified
"North America, United States, Arizona, Yavapai County",5 miles north of Wickenburg,"5 miles north of Wickenburg, Yavapai Co., Ariz.",34.040363,-112.730995,World Geodetic System 1984,4512,m,GeoLocate,GeoLocate,Adam Glueckert,2016-09-23,Vermivora luciae,CHAS:Bird:8790,05/19/1937,1937-05-19,1937-05-19,accepted place of collection,unverified
"North America, United States, Arizona, Yavapai County",5 miles north of Wickenburg,"5 miles north of Wickenburg, Yavapai Co., Ariz.",34.040363,-112.730995,World Geodetic System 1984,4512,m,GeoLocate,GeoLocate,Adam Glueckert,2016-09-23,Piranga rubra cooperi,CHAS:Bird:8757,05/11/1937,1937-05-11,1937-05-11,accepted place of collection,unverified
"North America, United States, Arizona, Yavapai County",5 miles north of Wickenburg,"5 miles north of Wickenburg, Yavapai Co., Ariz.",34.040363,-112.730995,World Geodetic System 1984,4512,m,GeoLocate,GeoLocate,Adam Glueckert,2016-09-23,Oreothlypis celata,CHAS:Bird:8723,05/03/1937,1937-05-03,1937-05-03,accepted place of collection,unverified
"North America, United States, Arizona, Yavapai County",5 miles north of Wickenburg,"5 miles north of Wickenburg, Yavapai Co., Ariz.",34.040363,-112.730995,World Geodetic System 1984,4512,m,GeoLocate,GeoLocate,Adam Glueckert,2016-09-23,Setophaga occidentalis,CHAS:Bird:8788,05/17/1937,1937-05-17,1937-05-17,accepted place of collection,unverified
"North America, United States, Arizona, Yavapai County",5 miles north of Wickenburg,"5 miles north of Wickenburg, Yavapai Co., Ariz.",34.040363,-112.730995,World Geodetic System 1984,4512,m,GeoLocate,GeoLocate,Adam Glueckert,2016-09-23,Icterus cucullatus nelsoni,CHAS:Bird:8718,05/01/1937,1937-05-01,1937-05-01,accepted place of collection,unverified
"North America, United States, Arizona, Yavapai County",5 miles north of Wickenburg,"5 miles north of Wickenburg, Yavapai Co., Ariz.",34.040363,-112.730995,World Geodetic System 1984,4512,m,GeoLocate,GeoLocate,Adam Glueckert,2016-09-23,Icterus cucullatus nelsoni,CHAS:Bird:8721,05/02/1937,1937-05-02,1937-05-02,accepted place of collection,unverified
"North America, United States, Arizona, Yavapai County",5 miles north of Wickenburg,"5 miles north of Wickenburg, Yavapai Co., Ariz.",34.040363,-112.730995,World Geodetic System 1984,4512,m,GeoLocate,GeoLocate,Adam Glueckert,2016-09-23,Icterus cucullatus nelsoni,CHAS:Bird:8767,05/12/1937,1937-05-12,1937-05-12,accepted place of collection,unverified
"North America, United States, Arizona, Yavapai County",5 miles north of Wickenburg,"5 miles north of Wickenburg, Yavapai Co., Ariz.",34.040363,-112.730995,World Geodetic System 1984,4512,m,GeoLocate,GeoLocate,Adam Glueckert,2016-09-23,Picoides scalaris cactophilus,CHAS:Bird:8768,05/12/1937,1937-05-12,1937-05-12,accepted place of collection,unverified
"North America, United States, Arizona, Yavapai County",5 miles north of Wickenburg,"5 miles north of Wickenburg, Yavapai Co., Ariz.",34.040363,-112.730995,World Geodetic System 1984,4512,m,GeoLocate,GeoLocate,Adam Glueckert,2016-09-23,Picoides scalaris cactophilus,CHAS:Bird:8771,05/13/1937,1937-05-13,1937-05-13,accepted place of collection,unverified
"North America, United States, Arizona, Yavapai County",5 miles north of Wickenburg,"5 miles north of Wickenburg, Yavapai Co., Ariz.",34.040363,-112.730995,World Geodetic System 1984,4512,m,GeoLocate,GeoLocate,Adam Glueckert,2016-09-23,Melanerpes uropygialis uropygialis,CHAS:Bird:8787,05/17/1937,1937-05-17,1937-05-17,accepted place of collection,unverified
"North America, United States, Arizona, Yavapai County",5 miles north of Wickenburg,"5 miles north of Wickenburg, Yavapai Co., Ariz.",34.040363,-112.730995,World Geodetic System 1984,4512,m,GeoLocate,GeoLocate,Adam Glueckert,2016-09-23,Falco sparverius phalaena,CHAS:Bird:8780,05/14/1937,1937-05-14,1937-05-14,accepted place of collection,unverified
"North America, United States, Arizona, Yavapai County",5 miles north of Wickenburg,"5 miles north of Wickenburg, Yavapai Co., Ariz.",34.040363,-112.730995,World Geodetic System 1984,4512,m,GeoLocate,GeoLocate,Adam Glueckert,2016-09-23,Callipepla gambelii gambelii,CHAS:Bird:8709,04/30/1937,1937-04-30,1937-04-30,accepted place of collection,unverified
"North America, United States, Arizona, Yavapai County",5 miles north of Wickenburg,"5 miles north of Wickenburg, Yavapai Co., Ariz.",34.040363,-112.730995,World Geodetic System 1984,4512,m,GeoLocate,GeoLocate,Adam Glueckert,2016-09-23,Callipepla gambelii gambelii,CHAS:Bird:8712,05/01/1937,1937-05-01,1937-05-01,accepted place of collection,unverified
"North America, United States, Arizona, Yavapai County",5 miles north of Wickenburg,"5 miles north of Wickenburg, Yavapai Co., Ariz.",34.040363,-112.730995,World Geodetic System 1984,4512,m,GeoLocate,GeoLocate,Adam Glueckert,2016-09-23,Callipepla gambelii gambelii,CHAS:Bird:8725,05/05/1937,1937-05-05,1937-05-05,accepted place of collection,unverified
"North America, United States, Arizona, Yavapai County",5 miles north of Wickenburg,"5 miles north of Wickenburg, Yavapai Co., Ariz.",34.040363,-112.730995,World Geodetic System 1984,4512,m,GeoLocate,GeoLocate,Adam Glueckert,2016-09-23,Callipepla gambelii gambelii,CHAS:Bird:8726,05/05/1937,1937-05-05,1937-05-05,accepted place of collection,unverified
"North America, United States, Arizona, Yavapai County",5 miles north of Wickenburg,"5 miles north of Wickenburg, Yavapai Co., Ariz.",34.040363,-112.730995,World Geodetic System 1984,4512,m,GeoLocate,GeoLocate,Adam Glueckert,2016-09-23,Callipepla gambelii gambelii,CHAS:Bird:8727,05/05/1937,1937-05-05,1937-05-05,accepted place of collection,unverified
"North America, United States, Arizona, Yavapai County",5 miles north of Wickenburg,"5 miles north of Wickenburg, Yavapai Co., Ariz.",34.040363,-112.730995,World Geodetic System 1984,4512,m,GeoLocate,GeoLocate,Adam Glueckert,2016-09-23,Callipepla gambelii gambelii,CHAS:Bird:8732,05/06/1937,1937-05-06,1937-05-06,accepted place of collection,unverified
"North America, United States, Arizona, Yavapai County",5 miles north of Wickenburg,"5 miles north of Wickenburg, Yavapai Co., Ariz.",34.040363,-112.730995,World Geodetic System 1984,4512,m,GeoLocate,GeoLocate,Adam Glueckert,2016-09-23,Callipepla gambelii gambelii,CHAS:Bird:8724,05/04/1937,1937-05-04,1937-05-04,accepted place of collection,unverified
"North America, United States, Arizona, Yavapai County",5 miles north of Wickenburg,"5 miles north of Wickenburg, Yavapai Co., Ariz.",34.040363,-112.730995,World Geodetic System 1984,4512,m,GeoLocate,GeoLocate,Adam Glueckert,2016-09-23,Callipepla gambelii gambelii,CHAS:Bird:8731,05/06/1937,1937-05-06,1937-05-06,accepted place of collection,unverified
"North America, United States, Arizona, Yavapai County",5 miles north of Wickenburg,"5 miles north of Wickenburg, Yavapai Co., Ariz.",34.040363,-112.730995,World Geodetic System 1984,4512,m,GeoLocate,GeoLocate,Adam Glueckert,2016-09-23,Callipepla gambelii gambelii,CHAS:Bird:8733,05/06/1937,1937-05-06,1937-05-06,accepted place of collection,unverified
"North America, United States, Arizona, Yavapai County",5 miles north of Wickenburg,"5 miles north of Wickenburg, Yavapai Co., Ariz.",34.040363,-112.730995,World Geodetic System 1984,4512,m,GeoLocate,GeoLocate,Adam Glueckert,2016-09-23,Callipepla gambelii gambelii,CHAS:Bird:8877,06/02/1937,1937-06-02,1937-06-02,accepted place of collection,unverified
"North America, United States, Arizona, Yavapai County",5 miles north of Wickenburg,"5 miles north of Wickenburg, Yavapai Co., Ariz.",34.040363,-112.730995,World Geodetic System 1984,4512,m,GeoLocate,GeoLocate,Adam Glueckert,2016-09-23,Callipepla gambelii gambelii,CHAS:Bird:8878,06/02/1937,1937-06-02,1937-06-02,accepted place of collection,unverified
"North America, United States, Arizona, Yavapai County",5 miles north of Wickenburg,"5 miles north of Wickenburg, Yavapai Co., Ariz.",34.040363,-112.730995,World Geodetic System 1984,4512,m,GeoLocate,GeoLocate,Adam Glueckert,2016-09-23,Callipepla gambelii,CHAS:Bird:8879,06/02/1937,1937-06-02,1937-06-02,accepted place of collection,unverified
"North America, United States, Arizona, Yavapai County",5 miles north of Wickenburg,"5 miles north of Wickenburg, Yavapai Co., Ariz.",34.040363,-112.730995,World Geodetic System 1984,4512,m,GeoLocate,GeoLocate,Adam Glueckert,2016-09-23,Chordeiles acutipennis texensis,CHAS:Bird:8734,05/06/1937,1937-05-06,1937-05-06,accepted place of collection,unverified
"North America, United States, Arizona, Yavapai County",5 miles north of Wickenburg,"5 miles north of Wickenburg, Yavapai Co., Ariz.",34.040363,-112.730995,World Geodetic System 1984,4512,m,GeoLocate,GeoLocate,Adam Glueckert,2016-09-23,Chordeiles acutipennis texensis,CHAS:Bird:8743,05/10/1937,1937-05-10,1937-05-10,accepted place of collection,unverified
"North America, United States, Arizona, Yavapai County",5 miles north of Wickenburg,"5 miles north of Wickenburg, Yavapai Co., Ariz.",34.040363,-112.730995,World Geodetic System 1984,4512,m,GeoLocate,GeoLocate,Adam Glueckert,2016-09-23,Megaceryle alcyon caurina,CHAS:Bird:8745,05/03/1937,1937-05-03,1937-05-03,accepted place of collection,unverified
"North America, United States, Arizona, Yavapai County",5 miles north of Wickenburg,"5 miles north of Wickenburg, Yavapai Co., Ariz.",34.040363,-112.730995,World Geodetic System 1984,4512,m,GeoLocate,GeoLocate,Adam Glueckert,2016-09-30,Pyrocephalus rubinus mexicanus,CHAS:Bird:8720,05/02/1937,1937-05-02,1937-05-02,accepted place of collection,unverified
"North America, United States, Arizona, Yavapai County",5 miles north of Wickenburg,"5 miles north of Wickenburg, Yavapai Co., Ariz.",34.040363,-112.730995,World Geodetic System 1984,4512,m,GeoLocate,GeoLocate,Adam Glueckert,2016-09-23,Myiarchus cinerascens cinerascens,CHAS:Bird:8728,05/05/1937,1937-05-05,1937-05-05,accepted place of collection,unverified
"North America, United States, Arizona, Yavapai County",5 miles north of Wickenburg,"5 miles north of Wickenburg, Yavapai Co., Ariz.",34.040363,-112.730995,World Geodetic System 1984,4512,m,GeoLocate,GeoLocate,Adam Glueckert,2016-09-23,Myiarchus cinerascens cinerascens,CHAS:Bird:8744,05/10/1937,1937-05-10,1937-05-10,accepted place of collection,unverified
"North America, United States, Arizona, Yavapai County",5 miles north of Wickenburg,"5 miles north of Wickenburg, Yavapai Co., Ariz.",34.040363,-112.730995,World Geodetic System 1984,4512,m,GeoLocate,GeoLocate,Adam Glueckert,2016-09-23,Myiarchus cinerascens cinerascens,CHAS:Bird:8769,05/12/1937,1937-05-12,1937-05-12,accepted place of collection,unverified
"North America, United States, Arizona, Yavapai County",5 miles north of Wickenburg,"5 miles north of Wickenburg, Yavapai Co., Ariz.",34.040363,-112.730995,World Geodetic System 1984,4512,m,GeoLocate,GeoLocate,Adam Glueckert,2016-09-23,Myiarchus cinerascens cinerascens,CHAS:Bird:8770,05/13/1937,1937-05-13,1937-05-13,accepted place of collection,unverified
"North America, United States, Arizona, Yavapai County",5 miles north of Wickenburg,"5 miles north of Wickenburg, Yavapai Co., Ariz.",34.040363,-112.730995,World Geodetic System 1984,4512,m,GeoLocate,GeoLocate,Adam Glueckert,2016-09-23,Empidonax oberholseri,CHAS:Bird:8738,05/06/1937,1937-05-06,1937-05-06,accepted place of collection,unverified
"North America, United States, Arizona, Yavapai County",5 miles north of Wickenburg,"5 miles north of Wickenburg, Yavapai Co., Ariz.",34.040363,-112.730995,World Geodetic System 1984,4512,m,GeoLocate,GeoLocate,Adam Glueckert,2016-09-23,Petrochelidon pyrrhonota malenogaster,CHAS:Bird:8772,05/13/1937,1937-05-13,1937-05-13,accepted place of collection,unverified
"North America, United States, Arizona, Yavapai County",5 miles north of Wickenburg,"5 miles north of Wickenburg, Yavapai Co., Ariz.",34.040363,-112.730995,World Geodetic System 1984,4512,m,GeoLocate,GeoLocate,Adam Glueckert,2016-09-23,Petrochelidon pyrrhonota malenogaster,CHAS:Bird:8783,05/15/1937,1937-05-15,1937-05-15,accepted place of collection,unverified
"North America, United States, Arizona, Yavapai County",5 miles north of Wickenburg,"5 miles north of Wickenburg, Yavapai Co., Ariz.",34.040363,-112.730995,World Geodetic System 1984,4512,m,GeoLocate,GeoLocate,Adam Glueckert,2016-09-23,Petrochelidon pyrrhonota malenogaster,CHAS:Bird:8784,05/15/1937,1937-05-15,1937-05-15,accepted place of collection,unverified
"North America, United States, Arizona, Yavapai County",5 miles north of Wickenburg,"5 miles north of Wickenburg, Yavapai Co., Ariz.",34.040363,-112.730995,World Geodetic System 1984,4512,m,GeoLocate,GeoLocate,Adam Glueckert,2016-09-23,Petrochelidon pyrrhonota malenogaster,CHAS:Bird:8785,05/17/1937,1937-05-17,1937-05-17,accepted place of collection,unverified
"North America, United States, Arizona, Yavapai County",5 miles north of Wickenburg,"5 miles north of Wickenburg, Yavapai Co., Ariz.",34.040363,-112.730995,World Geodetic System 1984,4512,m,GeoLocate,GeoLocate,Adam Glueckert,2016-09-23,Petrochelidon pyrrhonota malenogaster,CHAS:Bird:8786,05/17/1937,1937-05-17,1937-05-17,accepted place of collection,unverified
"North America, United States, Arizona, Yavapai County",5 miles north of Wickenburg,"5 miles north of Wickenburg, Yavapai Co., Ariz.",34.040363,-112.730995,World Geodetic System 1984,4512,m,GeoLocate,GeoLocate,Adam Glueckert,2016-09-23,Phainopepla nitens lepida,CHAS:Bird:8735,05/06/1937,1937-05-06,1937-05-06,accepted place of collection,unverified
"North America, United States, Arizona, Yavapai County",5 miles north of Wickenburg,"5 miles north of Wickenburg, Yavapai Co., Ariz.",34.040363,-112.730995,World Geodetic System 1984,4512,m,GeoLocate,GeoLocate,Adam Glueckert,2016-09-23,Phainopepla nitens lepida,CHAS:Bird:8740,05/09/1937,1937-05-09,1937-05-09,accepted place of collection,unverified
"North America, United States, Arizona, Yavapai County",5 miles north of Wickenburg,"5 miles north of Wickenburg, Yavapai Co., Ariz.",34.040363,-112.730995,World Geodetic System 1984,4512,m,GeoLocate,GeoLocate,Adam Glueckert,2016-09-23,Phainopepla nitens lepida,CHAS:Bird:8766,05/12/1937,1937-05-12,1937-05-12,accepted place of collection,unverified
"North America, United States, Arizona, Yavapai County",5 miles north of Wickenburg,"5 miles north of Wickenburg, Yavapai Co., Ariz.",34.040363,-112.730995,World Geodetic System 1984,4512,m,GeoLocate,GeoLocate,Adam Glueckert,2016-09-23,Vireo cassinii cassinii,CHAS:Bird:8719,05/01/1937,1937-05-01,1937-05-01,accepted place of collection,unverified
"North America, United States, Arizona, Yavapai County",5 miles north of Wickenburg,"5 miles north of Wickenburg, Yavapai Co., Ariz.",34.040363,-112.730995,World Geodetic System 1984,4512,m,GeoLocate,GeoLocate,Adam Glueckert,2016-09-23,Carpodacus mexicanus frontalis,CHAS:Bird:8715,05/01/1937,1937-05-01,1937-05-01,accepted place of collection,unverified
"North America, United States, Arizona, Yavapai County",5 miles north of Wickenburg,"5 miles north of Wickenburg, Yavapai Co., Ariz.",34.040363,-112.730995,World Geodetic System 1984,4512,m,GeoLocate,GeoLocate,Adam Glueckert,2016-09-23,Carpodacus mexicanus frontalis,CHAS:Bird:8716,05/01/1937,1937-05-01,1937-05-01,accepted place of collection,unverified
"North America, United States, Arizona, Yavapai County",5 miles north of Wickenburg,"5 miles north of Wickenburg, Yavapai Co., Ariz.",34.040363,-112.730995,World Geodetic System 1984,4512,m,GeoLocate,GeoLocate,Adam Glueckert,2016-09-23,Carpodacus mexicanus frontalis,CHAS:Bird:8722,05/03/1937,1937-05-03,1937-05-03,accepted place of collection,unverified
"North America, United States, Arizona, Yavapai County",5 miles north of Wickenburg,"5 miles north of Wickenburg, Yavapai Co., Ariz.",34.040363,-112.730995,World Geodetic System 1984,4512,m,GeoLocate,GeoLocate,Adam Glueckert,2016-09-23,Carpodacus mexicanus frontalis,CHAS:Bird:8729,05/05/1937,1937-05-05,1937-05-05,accepted place of collection,unverified
"North America, United States, Arizona, Yavapai County",5 miles north of Wickenburg,"5 miles north of Wickenburg, Yavapai Co., Ariz.",34.040363,-112.730995,World Geodetic System 1984,4512,m,GeoLocate,GeoLocate,Adam Glueckert,2016-09-23,Carpodacus mexicanus frontalis,CHAS:Bird:8730,05/05/1937,1937-05-05,1937-05-05,accepted place of collection,unverified
"North America, United States, Arizona, Yavapai County",5 miles north of Wickenburg,"5 miles north of Wickenburg, Yavapai Co., Ariz.",34.040363,-112.730995,World Geodetic System 1984,4512,m,GeoLocate,GeoLocate,Adam Glueckert,2016-09-23,Carpodacus mexicanus frontalis,CHAS:Bird:8763,05/12/1937,1937-05-12,1937-05-12,accepted place of collection,unverified
"North America, United States, Arizona, Yavapai County",5 miles north of Wickenburg,"5 miles north of Wickenburg, Yavapai Co., Ariz.",34.040363,-112.730995,World Geodetic System 1984,4512,m,GeoLocate,GeoLocate,Adam Glueckert,2016-09-23,Carpodacus mexicanus frontalis,CHAS:Bird:8764,05/12/1937,1937-05-12,1937-05-12,accepted place of collection,unverified
"North America, United States, Arizona, Yavapai County",5 miles north of Wickenburg,"5 miles north of Wickenburg, Yavapai Co., Ariz.",34.040363,-112.730995,World Geodetic System 1984,4512,m,GeoLocate,GeoLocate,Adam Glueckert,2016-09-23,Carpodacus mexicanus frontalis,CHAS:Bird:8765,05/12/1937,1937-05-12,1937-05-12,accepted place of collection,unverified
"North America, United States, Arizona, Yavapai County",5 miles north of Wickenburg,"5 miles north of Wickenburg, Yavapai Co., Ariz.",34.040363,-112.730995,World Geodetic System 1984,4512,m,GeoLocate,GeoLocate,Adam Glueckert,2016-09-23,Carpodacus mexicanus frontalis,CHAS:Bird:8773,05/13/1937,1937-05-13,1937-05-13,accepted place of collection,unverified
"North America, United States, Arizona, Yavapai County",5 miles north of Wickenburg,"5 miles north of Wickenburg, Yavapai Co., Ariz.",34.040363,-112.730995,World Geodetic System 1984,4512,m,GeoLocate,GeoLocate,Adam Glueckert,2016-09-23,Pipilo chlorurus,CHAS:Bird:8714,05/01/1937,1937-05-01,1937-05-01,accepted place of collection,unverified
"North America, United States, Arizona, Yavapai County",5 miles north of Wickenburg,"5 miles north of Wickenburg, Yavapai Co., Ariz.",34.040363,-112.730995,World Geodetic System 1984,4512,m,GeoLocate,GeoLocate,Adam Glueckert,2016-09-23,Pipilo chlorurus,CHAS:Bird:8747,05/11/1937,1937-05-11,1937-05-11,accepted place of collection,unverified
"North America, United States, Arizona, Yavapai County",5 miles north of Wickenburg,"5 miles north of Wickenburg, Yavapai Co., Ariz.",34.040363,-112.730995,World Geodetic System 1984,4512,m,GeoLocate,GeoLocate,Adam Glueckert,2016-09-23,Amphispiza bilineata deserticola,CHAS:Bird:8713,05/01/1937,1937-05-01,1937-05-01,accepted place of collection,unverified
"North America, United States, Arizona, Yavapai County",5 miles north of Wickenburg,"5 miles north of Wickenburg, Yavapai Co., Ariz.",34.040363,-112.730995,World Geodetic System 1984,4512,m,GeoLocate,GeoLocate,Adam Glueckert,2016-09-23,Amphispiza bilineata deserticola,CHAS:Bird:8736,05/06/1937,1937-05-06,1937-05-06,accepted place of collection,unverified
"North America, United States, Arizona, Yavapai County",5 miles north of Wickenburg,"5 miles north of Wickenburg, Yavapai Co., Ariz.",34.040363,-112.730995,World Geodetic System 1984,4512,m,GeoLocate,GeoLocate,Adam Glueckert,2016-09-23,Spizella breweri,CHAS:Bird:8717,05/01/1937,1937-05-01,1937-05-01,accepted place of collection,unverified
"North America, United States, Arizona, Yavapai County",5 miles north of Wickenburg,"5 miles north of Wickenburg, Yavapai Co., Ariz.",34.040363,-112.730995,World Geodetic System 1984,4512,m,GeoLocate,GeoLocate,Adam Glueckert,2016-09-23,Spizella breweri breweri,CHAS:Bird:8737,05/06/1937,1937-05-06,1937-05-06,accepted place of collection,unverified
"North America, United States, Arizona, Yavapai County",5 miles north of Wickenburg,"5 miles north of Wickenburg, Yavapai Co., Ariz.",34.040363,-112.730995,World Geodetic System 1984,4512,m,GeoLocate,GeoLocate,Adam Glueckert,2016-09-23,Spizella breweri breweri,CHAS:Bird:8739,05/01/1937,1937-05-01,1937-05-01,accepted place of collection,unverified
"North America, United States, Arizona, Yavapai County",5 miles north of Wickenburg,"5 miles north of Wickenburg, Yavapai Co., Ariz.",34.040363,-112.730995,World Geodetic System 1984,4512,m,GeoLocate,GeoLocate,Adam Glueckert,2016-09-23,Spizella breweri breweri,CHAS:Bird:8746,05/11/1937,1937-05-11,1937-05-11,accepted place of collection,unverified
"North America, United States, Arizona, Yavapai County",5 miles north of Wickenburg,"5 miles north of Wickenburg, Yavapai Co., Ariz.",34.040363,-112.730995,World Geodetic System 1984,4512,m,GeoLocate,GeoLocate,Adam Glueckert,2016-09-23,Petrochelidon pyrrhonota malenogaster,CHAS:Bird:8781,05/15/1937,1937-05-15,1937-05-15,accepted place of collection,unverified
"North America, United States, Arizona, Yavapai County",5 miles north of Wickenburg,"5 miles north of Wickenburg, Yavapai Co., Ariz.",34.040363,-112.730995,World Geodetic System 1984,4512,m,GeoLocate,GeoLocate,Adam Glueckert,2016-09-23,Petrochelidon pyrrhonota malenogaster,CHAS:Bird:8782,05/15/1937,1937-05-15,1937-05-15,accepted place of collection,unverified
"North America, United States, Arizona, Yavapai County",6 miles north of Wickenburg,"6mi N of Wickenburg, Yavapai Co., Arizona",34.052899,-112.72842,World Geodetic System 1984,7560,m,GeoLocate,GeoLocate,Adam Glueckert,2016-11-09,Bubo virginianus pallescens,CHAS:Bird:9198,05/13/1937,1937-05-13,1937-05-13,accepted place of collection,unverified
"North America, United States, Arizona, Yavapai County",6 miles north of Yarnell,"6 miles north of Yarnell, Yavapai County, Ariz.",34.309083,-112.745341,World Geodetic System 1984,5540,m,GeoLocate,GeoLocate,Adam Glueckert,2016-09-23,Icterus galbula,CHAS:Bird:8865,05/28/1937,1937-05-28,1937-05-28,accepted place of collection,unverified
"North America, United States, Arizona, Yavapai County",6 miles north of Yarnell,"6 miles north of Yarnell, Yavapai County, Ariz.",34.309083,-112.745341,World Geodetic System 1984,5540,m,GeoLocate,GeoLocate,Adam Glueckert,2016-09-23,Buteo jamaicensis calurus,CHAS:Bird:8929,05/29/1937,1937-05-29,1937-05-29,accepted place of collection,unverified
"North America, United States, Arizona, Yavapai County",6 miles north of Yarnell,"6 miles north of Yarnell, Yavapai County, Ariz.",34.309083,-112.745341,World Geodetic System 1984,5540,m,GeoLocate,GeoLocate,Adam Glueckert,2016-09-23,Amphispiza bilineata deserticola,CHAS:Bird:8866,05/28/1937,1937-05-28,1937-05-28,accepted place of collection,unverified
"North America, United States, Arizona, Yavapai County",6 miles north of Yarnell,"6 miles north of Yarnell, Yavapai County, Ariz.",34.309083,-112.745341,World Geodetic System 1984,5540,m,GeoLocate,GeoLocate,Adam Glueckert,2016-09-23,Colaptes auratus collaris,CHAS:Bird:8861,05/29/1937,1937-05-29,1937-05-29,accepted place of collection,unverified
"North America, United States, Arizona, Yavapai County",6 miles north of Yarnell,"6 miles north of Yarnell, Yavapai County, Ariz.",34.309083,-112.745341,World Geodetic System 1984,5540,m,GeoLocate,GeoLocate,Adam Glueckert,2016-09-23,Colaptes auratus collaris,CHAS:Bird:8918,06/04/1937,1937-06-04,1937-06-04,accepted place of collection,unverified
"North America, United States, Arizona, Yavapai County",6 miles north of Yarnell,"6 miles north of Yarnell, Yavapai County, Ariz.",34.309083,-112.745341,World Geodetic System 1984,5540,m,GeoLocate,GeoLocate,Adam Glueckert,2016-09-23,Melanerpes uropygialis uropygialis,CHAS:Bird:8860,05/29/1937,1937-05-29,1937-05-29,accepted place of collection,unverified
"North America, United States, Arizona, Yavapai County",6 miles north of Yarnell,"6 miles north of Yarnell, Yavapai County, Ariz.",34.309083,-112.745341,World Geodetic System 1984,5540,m,GeoLocate,GeoLocate,Adam Glueckert,2016-09-23,Melanerpes uropygialis uropygialis,CHAS:Bird:8868,05/31/1937,1937-05-31,1937-05-31,accepted place of collection,unverified
"North America, United States, Arizona, Yavapai County",6 miles north of Yarnell,"6 miles north of Yarnell, Yavapai County, Ariz.",34.309083,-112.745341,World Geodetic System 1984,5540,m,GeoLocate,GeoLocate,Adam Glueckert,2016-09-23,Picoides scalaris cactophilus,CHAS:Bird:8910,06/03/1937,1937-06-03,1937-06-03,accepted place of collection,unverified
"North America, United States, Arizona, Yavapai County",6 miles north of Yarnell,"6 miles north of Yarnell, Yavapai County, Ariz.",34.309083,-112.745341,World Geodetic System 1984,5540,m,GeoLocate,GeoLocate,Adam Glueckert,2016-09-23,Picoides scalaris cactophilus,CHAS:Bird:8911,"06/04/1937 or June 3, 1967",1937-06-03,1937-06-04,accepted place of collection,unverified
"North America, United States, Arizona, Yavapai County",6 miles north of Yarnell,"6 miles north of Yarnell, Yavapai County, Ariz.",34.309083,-112.745341,World Geodetic System 1984,5540,m,GeoLocate,GeoLocate,Adam Glueckert,2016-09-23,Icterus galbula,CHAS:Bird:8858,05/29/1937,1937-05-29,1937-05-29,accepted place of collection,unverified
"North America, United States, Arizona, Yavapai County",6 miles north of Yarnell,"6 miles north of Yarnell, Yavapai County, Ariz.",34.309083,-112.745341,World Geodetic System 1984,5540,m,GeoLocate,GeoLocate,Adam Glueckert,2016-09-23,Icterus galbula,CHAS:Bird:8859,05/29/1937,1937-05-29,1937-05-29,accepted place of collection,unverified
"North America, United States, Arizona, Yavapai County",6 miles north of Yarnell,"6 miles north of Yarnell, Yavapai County, Ariz.",34.309083,-112.745341,World Geodetic System 1984,5540,m,GeoLocate,GeoLocate,Adam Glueckert,2016-09-23,Sturnella neglecta,CHAS:Bird:8913,06/03/1937,1937-06-03,1937-06-03,accepted place of collection,unverified
"North America, United States, Arizona, Yavapai County",6 miles north of Yarnell,"6 miles north of Yarnell, Yavapai County, Ariz.",34.309083,-112.745341,World Geodetic System 1984,5540,m,GeoLocate,GeoLocate,Adam Glueckert,2016-09-23,Cathartes aura septentrionalis,CHAS:Bird:8897,06/08/1937,1937-06-08,1937-06-08,accepted place of collection,unverified
"North America, United States, Arizona, Yavapai County",6 miles north of Yarnell,"6 miles north of Yarnell, Yavapai County, Ariz.",34.309083,-112.745341,World Geodetic System 1984,5540,m,GeoLocate,GeoLocate,Adam Glueckert,2016-09-23,Buteo jamaicensis calurus,CHAS:Bird:8867,05/28/1937,1937-05-28,1937-05-28,accepted place of collection,unverified
"North America, United States, Arizona, Yavapai County",6 miles north of Yarnell,"6 miles north of Yarnell, Yavapai County, Ariz.",34.309083,-112.745341,World Geodetic System 1984,5540,m,GeoLocate,GeoLocate,Adam Glueckert,2016-09-23,Pyrocephalus rubinus mexicanus,CHAS:Bird:8850,05/28/1937,1937-05-28,1937-05-28,accepted place of collection,unverified
"North America, United States, Arizona, Yavapai County",6 miles north of Yarnell,"6 miles north of Yarnell, Yavapai County, Ariz.",34.309083,-112.745341,World Geodetic System 1984,5540,m,GeoLocate,GeoLocate,Adam Glueckert,2016-09-23,Pyrocephalus rubinus mexicanus,CHAS:Bird:8851,05/28/1937,1937-05-28,1937-05-28,accepted place of collection,unverified
"North America, United States, Arizona, Yavapai County",6 miles north of Yarnell,"6 miles north of Yarnell, Yavapai County, Ariz.",34.309083,-112.745341,World Geodetic System 1984,5540,m,GeoLocate,GeoLocate,Adam Glueckert,2016-09-23,Pyrocephalus rubinus mexicanus,CHAS:Bird:8852,05/28/1937,1937-05-28,1937-05-28,accepted place of collection,unverified
"North America, United States, Arizona, Yavapai County",6 miles north of Yarnell,"6 miles north of Yarnell, Yavapai County, Ariz.",34.309083,-112.745341,World Geodetic System 1984,5540,m,GeoLocate,GeoLocate,Adam Glueckert,2016-09-23,Tyrannus verticalis,CHAS:Bird:8855,05/29/1937,1937-05-29,1937-05-29,accepted place of collection,unverified
"North America, United States, Arizona, Yavapai County",6 miles north of Yarnell,"6 miles north of Yarnell, Yavapai County, Ariz.",34.309083,-112.745341,World Geodetic System 1984,5540,m,GeoLocate,GeoLocate,Adam Glueckert,2016-09-23,Tyrannus verticalis,CHAS:Bird:8856,05/29/1937,1937-05-29,1937-05-29,accepted place of collection,unverified
"North America, United States, Arizona, Yavapai County",6 miles north of Yarnell,"6 miles north of Yarnell, Yavapai County, Ariz.",34.309083,-112.745341,World Geodetic System 1984,5540,m,GeoLocate,GeoLocate,Adam Glueckert,2016-09-23,Tyrannus vociferans,CHAS:Bird:8857,05/29/1937,1937-05-29,1937-05-29,accepted place of collection,unverified
"North America, United States, Arizona, Yavapai County",6 miles north of Yarnell,"6 miles north of Yarnell, Yavapai County, Ariz.",34.309083,-112.745341,World Geodetic System 1984,5540,m,GeoLocate,GeoLocate,Adam Glueckert,2016-09-23,Aphelocoma woodhouseii,CHAS:Bird:8920,06/05/1937,1937-06-05,1937-06-05,accepted place of collection,unverified
"North America, United States, Arizona, Yavapai County",6 miles north of Yarnell,"6 miles north of Yarnell, Yavapai County, Ariz.",34.309083,-112.745341,World Geodetic System 1984,5540,m,GeoLocate,GeoLocate,Adam Glueckert,2016-09-23,Campylorhynchus brunneicapillus couesi,CHAS:Bird:8921,06/06/1937,1937-06-06,1937-06-06,accepted place of collection,unverified
"North America, United States, Arizona, Yavapai County",6 miles north of Yarnell,"6 miles north of Yarnell, Yavapai County, Ariz.",34.309083,-112.745341,World Geodetic System 1984,5540,m,GeoLocate,GeoLocate,Adam Glueckert,2016-09-23,Mimus polyglottos leucopterus,CHAS:Bird:8919,06/05/1937,1937-06-05,1937-06-05,accepted place of collection,unverified
"North America, United States, Arizona, Yavapai County",6 miles north of Yarnell,"6 miles north of Yarnell, Yavapai County, Ariz.",34.309083,-112.745341,World Geodetic System 1984,5540,m,GeoLocate,GeoLocate,Adam Glueckert,2016-09-23,Vireo vicinior,CHAS:Bird:8905,06/03/1937,1937-06-03,1937-06-03,accepted place of collection,unverified
"North America, United States, Arizona, Yavapai County",6 miles north of Yarnell,"6 miles north of Yarnell, Yavapai County, Ariz.",34.309083,-112.745341,World Geodetic System 1984,5540,m,GeoLocate,GeoLocate,Adam Glueckert,2016-09-23,Carduelis psaltria hesperophila,CHAS:Bird:8923,06/07/1937,1937-06-07,1937-06-07,accepted place of collection,unverified
"North America, United States, Arizona, Yavapai County",6 miles north of Yarnell,"6 miles north of Yarnell, Yavapai County, Ariz.",34.309083,-112.745341,World Geodetic System 1984,5540,m,GeoLocate,GeoLocate,Adam Glueckert,2016-09-23,Amphispiza bilineata deserticola,CHAS:Bird:8906,06/02/1937,1937-06-02,1937-06-02,accepted place of collection,unverified
"North America, United States, Arizona, Yavapai County",6 miles north of Yarnell,"6 miles north of Yarnell, Yavapai County, Ariz.",34.309083,-112.745341,World Geodetic System 1984,5540,m,GeoLocate,GeoLocate,Adam Glueckert,2016-09-30,Sayornis saya saya,CHAS:Bird:8912,06/03/1937,1937-06-03,1937-06-03,accepted place of collection,unverified
"North America, United States, Arizona, Yavapai County",6 miles north of Yarnell,"6 miles north of Yarnell, Yavapai County, Ariz.",34.309083,-112.745341,World Geodetic System 1984,5540,m,GeoLocate,GeoLocate,Adam Glueckert,2016-09-23,Eremophila alpestris occidentalis,CHAS:Bird:8854,05/28/1937,1937-05-28,1937-05-28,accepted place of collection,unverified
"North America, United States, Arizona, Yavapai County",6 miles north of Yarnell,"6 miles north of Yarnell, Yavapai County, Ariz.",34.309083,-112.745341,World Geodetic System 1984,5540,m,GeoLocate,GeoLocate,Adam Glueckert,2016-09-23,Eremophila alpestris occidentalis,CHAS:Bird:8914,06/04/1937,1937-06-04,1937-06-04,accepted place of collection,unverified
"North America, United States, Arizona, Yavapai County",6 miles north of Yarnell,"6 miles north of Yarnell, Yavapai County, Ariz.",34.309083,-112.745341,World Geodetic System 1984,5540,m,GeoLocate,GeoLocate,Adam Glueckert,2016-09-23,Eremophila alpestris occidentalis,CHAS:Bird:8916,06/04/1937,1937-06-04,1937-06-04,accepted place of collection,unverified
"North America, United States, Arizona, Yavapai County",6 miles north of Yarnell,"6 miles north of Yarnell, Yavapai County, Ariz.",34.309083,-112.745341,World Geodetic System 1984,5540,m,GeoLocate,GeoLocate,Adam Glueckert,2016-09-23,Eremophila alpestris occidentalis,CHAS:Bird:8917,06/04/1937,1937-06-04,1937-06-04,accepted place of collection,unverified
"North America, United States, Arizona, Yavapai County",6 miles north of Yarnell,"6 miles north of Yarnell, Yavapai County, Ariz.",34.309083,-112.745341,World Geodetic System 1984,5540,m,GeoLocate,GeoLocate,Adam Glueckert,2016-09-23,Eremophila alpestris occidentalis,CHAS:Bird:8915,06/04/1937,1937-06-04,1937-06-04,accepted place of collection,unverified
"North America, United States, Arizona, Yavapai County",6 miles north of Yarnell,"6 miles north of Yarnell, Yavapai County, Ariz.",34.309083,-112.745341,World Geodetic System 1984,5540,m,GeoLocate,GeoLocate,Adam Glueckert,2016-09-23,Chondestes grammacus strigatus,CHAS:Bird:8853,05/28/1937,1937-05-28,1937-05-28,accepted place of collection,unverified
"North America, United States, Arizona, Yavapai County",6 miles north of Yarnell,"6 miles north of Yarnell, Yavapai County, Ariz.",34.309083,-112.745341,World Geodetic System 1984,5540,m,GeoLocate,GeoLocate,Adam Glueckert,2016-09-23,Chondestes grammacus strigatus,CHAS:Bird:8902,06/02/1937,1937-06-02,1937-06-02,accepted place of collection,unverified
"North America, United States, Arizona, Yavapai County",6 miles north of Yarnell,"6 miles north of Yarnell, Yavapai County, Ariz.",34.309083,-112.745341,World Geodetic System 1984,5540,m,GeoLocate,GeoLocate,Adam Glueckert,2016-09-23,Chondestes grammacus strigatus,CHAS:Bird:8904,06/02/1937,1937-06-02,1937-06-02,accepted place of collection,unverified
"North America, United States, Arizona, Yavapai County",6 miles north of Yarnell,"6 miles north of Yarnell, Yavapai County, Ariz.",34.309083,-112.745341,World Geodetic System 1984,5540,m,GeoLocate,GeoLocate,Adam Glueckert,2016-09-23,Chondestes grammacus strigatus,CHAS:Bird:8903,06/02/1937,1937-06-02,1937-06-02,accepted place of collection,unverified
"North America, United States, Arizona, Yavapai County",6 miles north of Yarnell,"6 miles north of Yarnell, Yavapai County, Ariz.",34.309083,-112.745341,World Geodetic System 1984,5540,m,GeoLocate,GeoLocate,Adam Glueckert,2016-09-23,Amphispiza bilineata deserticola,CHAS:Bird:8907,06/02/1937,1937-06-02,1937-06-02,accepted place of collection,unverified
"North America, United States, Arizona, Yavapai County",6 miles north of Yarnell,"6 miles north of Yarnell, Yavapai County, Ariz.",34.309083,-112.745341,World Geodetic System 1984,5540,m,GeoLocate,GeoLocate,Adam Glueckert,2016-09-23,Amphispiza bilineata deserticola,CHAS:Bird:8908,06/02/1937,1937-06-02,1937-06-02,accepted place of collection,unverified
"North America, United States, Arizona, Yavapai County",6 miles north of Yarnell,"6 miles north of Yarnell, Yavapai County, Ariz.",34.309083,-112.745341,World Geodetic System 1984,5540,m,GeoLocate,GeoLocate,Adam Glueckert,2016-09-23,Amphispiza bilineata deserticola,CHAS:Bird:8909,06/02/1937,1937-06-02,1937-06-02,accepted place of collection,unverified
"North America, United States, Arizona, Yavapai County",6 miles north of Yarnell,"6 mi. n. of Yarnell, Yavapai Co., Ariz.",34.309083,-112.745341,World Geodetic System 1984,5540,m,GeoLocate,GeoLocate,Adam Glueckert,2016-09-23,Mimus polyglottos leucopterus,CHAS:Bird:9195,06/07/1937,1937-06-07,1937-06-07,accepted place of collection,unverified
"North America, United States, Arizona, Yavapai County",6 miles north of Yarnell,"6 miles north of Yarnell, Yavapai County, Ariz.",34.309083,-112.745341,World Geodetic System 1984,5540,m,GeoLocate,GeoLocate,Adam Glueckert,2016-09-23,Icterus cucullatus nelsoni,CHAS:Bird:8824,05/29/1937,1937-05-29,1937-05-29,accepted place of collection,unverified
"North America, United States, Arizona, Yavapai County",6 miles north of Yarnell,"6 miles north of Yarnell, Yavapai County, Ariz.",34.309083,-112.745341,World Geodetic System 1984,5540,m,GeoLocate,GeoLocate,Adam Glueckert,2016-09-23,Icterus galbula,CHAS:Bird:8826,05/29/1937,1937-05-29,1937-05-29,accepted place of collection,unverified
"North America, United States, Arizona, Yavapai County",6 miles north of Yarnell,"6 miles north of Yarnell, Yavapai County, Ariz.",34.309083,-112.745341,World Geodetic System 1984,5540,m,GeoLocate,GeoLocate,Adam Glueckert,2016-09-23,Icterus galbula,CHAS:Bird:8827,05/29/1937,1937-05-29,1937-05-29,accepted place of collection,unverified
"North America, United States, Arizona, Yavapai County",6 miles north of Yarnell,"6 miles north of Yarnell, Yavapai County, Ariz.",34.309083,-112.745341,World Geodetic System 1984,5540,m,GeoLocate,GeoLocate,Adam Glueckert,2016-09-23,Icterus galbula,CHAS:Bird:8872,05/31/1937,1937-05-31,1937-05-31,accepted place of collection,unverified
"North America, United States, Arizona, Yavapai County",6 miles north of Yarnell,"6 miles north of Yarnell, Yavapai County, Ariz.",34.309083,-112.745341,World Geodetic System 1984,5540,m,GeoLocate,GeoLocate,Adam Glueckert,2016-09-23,Icterus cucullatus nelsoni,CHAS:Bird:8884,06/04/1937,1937-06-04,1937-06-04,accepted place of collection,unverified
"North America, United States, Arizona, Yavapai County",6 miles north of Yarnell,"6 miles north of Yarnell, Yavapai County, Ariz.",34.309083,-112.745341,World Geodetic System 1984,5540,m,GeoLocate,GeoLocate,Adam Glueckert,2016-09-23,Icterus cucullatus nelsoni,CHAS:Bird:8895,06/07/1937,1937-06-07,1937-06-07,accepted place of collection,unverified
"North America, United States, Arizona, Yavapai County",6 miles north of Yarnell,"6 miles north of Yarnell, Yavapai County, Ariz.",34.309083,-112.745341,World Geodetic System 1984,5540,m,GeoLocate,GeoLocate,Adam Glueckert,2016-09-23,Sturnella neglecta,CHAS:Bird:8882,06/03/1937,1937-06-03,1937-06-03,accepted place of collection,unverified
"North America, United States, Arizona, Yavapai County",6 miles north of Yarnell,"6 miles north of Yarnell, Yavapai County, Ariz.",34.309083,-112.745341,World Geodetic System 1984,5540,m,GeoLocate,GeoLocate,Adam Glueckert,2016-09-23,Falco sparverius phalaena,CHAS:Bird:8829,05/29/1937,1937-05-29,1937-05-29,accepted place of collection,unverified
"North America, United States, Arizona, Yavapai County",6 miles north of Yarnell,"6 miles north of Yarnell, Yavapai County, Ariz.",34.309083,-112.745341,World Geodetic System 1984,5540,m,GeoLocate,GeoLocate,Adam Glueckert,2016-09-23,Bubo virginianus pallescens,CHAS:Bird:8830,05/29/1937,1937-05-29,1937-05-29,accepted place of collection,unverified
"North America, United States, Arizona, Yavapai County",6 miles north of Yarnell,"6 miles north of Yarnell, Yavapai County, Ariz.",34.309083,-112.745341,World Geodetic System 1984,5540,m,GeoLocate,GeoLocate,Adam Glueckert,2016-09-23,Zenaida macroura marginella,CHAS:Bird:8828,05/29/1937,1937-05-29,1937-05-29,accepted place of collection,unverified
"North America, United States, Arizona, Yavapai County",6 miles north of Yarnell,"6 miles north of Yarnell, Yavapai County, Ariz.",34.309083,-112.745341,World Geodetic System 1984,5540,m,GeoLocate,GeoLocate,Adam Glueckert,2016-09-23,Tyrannus verticalis,CHAS:Bird:8896,06/07/1937,1937-06-07,1937-06-07,accepted place of collection,unverified
"North America, United States, Arizona, Yavapai County",6 miles north of Yarnell,"6 miles north of Yarnell, Yavapai County, Ariz.",34.309083,-112.745341,World Geodetic System 1984,5540,m,GeoLocate,GeoLocate,Adam Glueckert,2016-09-23,Tyrannus vociferans,CHAS:Bird:8825,05/29/1937,1937-05-29,1937-05-29,accepted place of collection,unverified
"North America, United States, Arizona, Yavapai County",6 miles north of Yarnell,"6 miles north of Yarnell, Yavapai County, Ariz.",34.309083,-112.745341,World Geodetic System 1984,5540,m,GeoLocate,GeoLocate,Adam Glueckert,2016-09-23,Tyrannus vociferans,CHAS:Bird:8874,05/31/1937,1937-05-31,1937-05-31,accepted place of collection,unverified
"North America, United States, Arizona, Yavapai County",6 miles north of Yarnell,"6 miles north of Yarnell, Yavapai County, Ariz.",34.309083,-112.745341,World Geodetic System 1984,5540,m,GeoLocate,GeoLocate,Adam Glueckert,2016-09-23,Contopus sordidulus sordidulus,CHAS:Bird:8873,05/31/1937,1937-05-31,1937-05-31,accepted place of collection,unverified
"North America, United States, Arizona, Yavapai County",6 miles north of Yarnell,"6 miles north of Yarnell, Yavapai County, Ariz.",34.309083,-112.745341,World Geodetic System 1984,5540,m,GeoLocate,GeoLocate,Adam Glueckert,2016-09-23,Contopus sordidulus sordidulus,CHAS:Bird:8889,06/05/1937,1937-06-05,1937-06-05,accepted place of collection,unverified
"North America, United States, Arizona, Yavapai County",6 miles north of Yarnell,6 miles north of Yarnell,34.309083,-112.745341,World Geodetic System 1984,5540,m,GeoLocate,GeoLocate,Adam Glueckert,2016-09-23,Eremophila alpestris occidentalis,CHAS:Bird:8823,05/28/1937,1937-05-28,1937-05-28,accepted place of collection,unverified
"North America, United States, Arizona, Yavapai County",6 miles north of Yarnell,"6 miles north of Yarnell, Yavapai County, Ariz.",34.309083,-112.745341,World Geodetic System 1984,5540,m,GeoLocate,GeoLocate,Adam Glueckert,2016-09-23,Eremophila alpestris occidentalis,CHAS:Bird:8888,06/05/1937,1937-06-05,1937-06-05,accepted place of collection,unverified
"North America, United States, Arizona, Yavapai County",6 miles north of Yarnell,"6 miles north of Yarnell, Yavapai County, Ariz.",34.309083,-112.745341,World Geodetic System 1984,5540,m,GeoLocate,GeoLocate,Adam Glueckert,2016-09-23,Eremophila alpestris occidentalis,CHAS:Bird:8883,06/03/1937,1937-06-03,1937-06-03,accepted place of collection,unverified
"North America, United States, Arizona, Yavapai County",6 miles north of Yarnell,"6 miles north of Yarnell, Yavapai County, Ariz.",34.309083,-112.745341,World Geodetic System 1984,5540,m,GeoLocate,GeoLocate,Adam Glueckert,2016-09-23,Aphelocoma woodhouseii,CHAS:Bird:8887,06/04/1937,1937-06-04,1937-06-04,accepted place of collection,unverified
"North America, United States, Arizona, Yavapai County",6 miles north of Yarnell,"6 miles north of Yarnell, Yavapai County, Ariz.",34.309083,-112.745341,World Geodetic System 1984,5540,m,GeoLocate,GeoLocate,Adam Glueckert,2016-09-23,Mimus polyglottos leucopterus,CHAS:Bird:8875,05/31/1937,1937-05-31,1937-05-31,accepted place of collection,unverified
"North America, United States, Arizona, Yavapai County",6 miles north of Yarnell,"6 miles north of Yarnell, Yavapai County, Ariz.",34.309083,-112.745341,World Geodetic System 1984,5540,m,GeoLocate,GeoLocate,Adam Glueckert,2016-09-23,Mimus polyglottos leucopterus,CHAS:Bird:8925,06/09/1937,1937-06-09,1937-06-09,accepted place of collection,unverified
"North America, United States, Arizona, Yavapai County",6 miles north of Yarnell,"6 miles north of Yarnell, Yavapai County, Ariz.",34.309083,-112.745341,World Geodetic System 1984,5540,m,GeoLocate,GeoLocate,Adam Glueckert,2016-09-23,Carpodacus mexicanus frontalis,CHAS:Bird:8885,06/04/1937,1937-06-04,1937-06-04,accepted place of collection,unverified
"North America, United States, Arizona, Yavapai County",6 miles north of Yarnell,"6 miles north of Yarnell, Yavapai County, Ariz.",34.309083,-112.745341,World Geodetic System 1984,5540,m,GeoLocate,GeoLocate,Adam Glueckert,2016-09-23,Carpodacus mexicanus frontalis,CHAS:Bird:8886,06/04/1937,1937-06-04,1937-06-04,accepted place of collection,unverified
"North America, United States, Arizona, Yavapai County",6 miles north of Yarnell,"6 miles north of Yarnell, Yavapai County, Ariz.",34.309083,-112.745341,World Geodetic System 1984,5540,m,GeoLocate,GeoLocate,Adam Glueckert,2016-09-23,Carduelis psaltria hesperophila,CHAS:Bird:8892,06/05/1937,1937-06-05,1937-06-05,accepted place of collection,unverified
"North America, United States, Arizona, Yavapai County",6 miles north of Yarnell,"6 miles north of Yarnell, Yavapai County, Ariz.",34.309083,-112.745341,World Geodetic System 1984,5540,m,GeoLocate,GeoLocate,Adam Glueckert,2016-09-23,Chondestes grammacus strigatus,CHAS:Bird:8870,05/31/1937,1937-05-31,1937-05-31,accepted place of collection,unverified
"North America, United States, Arizona, Yavapai County",6 miles north of Yarnell,"6 miles north of Yarnell, Yavapai County, Ariz.",34.309083,-112.745341,World Geodetic System 1984,5540,m,GeoLocate,GeoLocate,Adam Glueckert,2016-09-23,Chondestes grammacus strigatus,CHAS:Bird:8869,05/31/1937,1937-05-31,1937-05-31,accepted place of collection,unverified
"North America, United States, Arizona, Yavapai County",6 miles north of Yarnell,"6 miles north of Yarnell, Yavapai County, Ariz.",34.309083,-112.745341,World Geodetic System 1984,5540,m,GeoLocate,GeoLocate,Adam Glueckert,2016-09-23,Chondestes grammacus strigatus,CHAS:Bird:8871,05/31/1937,1937-05-31,1937-05-31,accepted place of collection,unverified
"North America, United States, Arizona, Yavapai County",6 miles north of Yarnell,"6 miles north of Yarnell, Yavapai County, Ariz.",34.309083,-112.745341,World Geodetic System 1984,5540,m,GeoLocate,GeoLocate,Adam Glueckert,2016-09-23,Chondestes grammacus strigatus,CHAS:Bird:8880,06/03/1937,1937-06-03,1937-06-03,accepted place of collection,unverified
"North America, United States, Arizona, Yavapai County",6 miles north of Yarnell,"6 miles north of Yarnell, Yavapai County, Ariz.",34.309083,-112.745341,World Geodetic System 1984,5540,m,GeoLocate,GeoLocate,Adam Glueckert,2016-09-23,Amphispiza bilineata deserticola,CHAS:Bird:8881,06/03/1937,1937-06-03,1937-06-03,accepted place of collection,unverified
"North America, United States, Arizona, Yavapai County",6 miles north of Yarnell,"6 miles north of Yarnell, Yavapai County, Ariz.",34.309083,-112.745341,World Geodetic System 1984,5540,m,GeoLocate,GeoLocate,Adam Glueckert,2016-09-23,Chondestes grammacus strigatus,CHAS:Bird:8894,06/07/1937,1937-06-07,1937-06-07,accepted place of collection,unverified
"North America, United States, Arizona, Yavapai County",6 miles north of Yarnell,"6 miles north of Yarnell, Yavapai County, Ariz.",34.309083,-112.745341,World Geodetic System 1984,5540,m,GeoLocate,GeoLocate,Adam Glueckert,2016-09-30,Amphispiza bilineata deserticola,CHAS:Bird:8926,06/09/1937,1937-06-09,1937-06-09,accepted place of collection,unverified
"North America, United States, Arizona, Yavapai County",6 miles north of Yarnell,"6 miles north of Yarnell, Yavapai County, Ariz.",34.309083,-112.745341,World Geodetic System 1984,5540,m,GeoLocate,GeoLocate,Adam Glueckert,2016-09-23,Vermivora luciae,CHAS:Bird:8891,06/05/1937,1937-06-05,1937-06-05,accepted place of collection,unverified
"North America, United States, Arizona, Yavapai County",6 miles north of Yarnell,"6 miles north of Yarnell, Yavapai County, Ariz.",34.309083,-112.745341,World Geodetic System 1984,5540,m,GeoLocate,GeoLocate,Adam Glueckert,2016-09-23,Passer domesticus,CHAS:Bird:8890,06/05/1937,1937-06-05,1937-06-05,accepted place of collection,unverified
"North America, United States, Arizona, Yavapai County",6 miles north of Yarnell,"6 miles north of Yarnell, Yavapai County, Ariz.",34.309083,-112.745341,World Geodetic System 1984,5540,m,GeoLocate,GeoLocate,Adam Glueckert,2016-09-23,Tyrannus verticalis,CHAS:Bird:8862,05/29/1937,1937-05-29,1937-05-29,accepted place of collection,unverified
"North America, United States, Arizona, Yavapai County",6 miles north of Yarnell,"6 miles north of Yarnell, Yavapai County, Ariz.",34.309083,-112.745341,World Geodetic System 1984,5540,m,GeoLocate,GeoLocate,Adam Glueckert,2016-09-23,Tyrannus verticalis,CHAS:Bird:8863,05/29/1937,1937-05-29,1937-05-29,accepted place of collection,unverified
"North America, United States, Arizona, Yavapai County",6 miles north of Yarnell,"6 miles north of Yarnell, Yavapai County, Ariz.",34.309083,-112.745341,World Geodetic System 1984,5540,m,GeoLocate,GeoLocate,Adam Glueckert,2016-09-23,Carpodacus mexicanus frontalis,CHAS:Bird:8864,05/29/1937,1937-05-29,1937-05-29,accepted place of collection,unverified
"North America, United States, Arizona, Yavapai County",Prescott,"Prescott, Ariz.",34.540024,-112.468502,World Geodetic System 1984,12606,m,GeoLocate,GeoLocate,Adam Glueckert,2016-10-05,Melanerpes formicivorus aculeata,CHAS:Bird:8107,01/05/1926,1926-01-05,1926-01-05,accepted place of collection,unverified
"North America, United States, Arizona, Yavapai County",Prescott,"Prescott, Ariz.",34.540024,-112.468502,World Geodetic System 1984,12606,m,GeoLocate,GeoLocate,Adam Glueckert,2016-10-05,Sitta pygmaea pygmaea,CHAS:Bird:8402,03/17/1926,1926-03-17,1926-03-17,accepted place of collection,unverified
"North America, United States, Arizona, Yavapai County",Prescott,"Prescott, Ariz",34.540024,-112.468502,World Geodetic System 1984,12606,m,GeoLocate,GeoLocate,Adam Glueckert,2016-10-05,Sialia mexicana bairdi,CHAS:Bird:8020,01/13/1926,1926-01-13,1926-01-13,accepted place of collection,unverified
"North America, United States, Arizona, Yavapai County",Prescott,"Prescott, Ariz.",34.540024,-112.468502,World Geodetic System 1984,12606,m,GeoLocate,GeoLocate,Adam Glueckert,2016-10-05,Sitta carolinensis nelsoni,CHAS:Bird:8399,01/08/1926,1926-01-08,1926-01-08,accepted place of collection,unverified
"North America, United States, Arizona, Yavapai County",Prescott,"Prescott, Ariz.",34.540024,-112.468502,World Geodetic System 1984,12606,m,GeoLocate,GeoLocate,Adam Glueckert,2016-10-05,Sayornis nigricans nigricans,CHAS:Bird:8306,06/25/1925,1925-06-25,1925-06-25,accepted place of collection,unverified
"North America, United States, Arizona, Yavapai County",Prescott,"Prescott, Ariz.",34.540024,-112.468502,World Geodetic System 1984,12606,m,GeoLocate,GeoLocate,Adam Glueckert,2016-10-05,Baeolophus ridgwayi ridgwayi,CHAS:Bird:8365,01/17/1927,1927-01-17,1927-01-17,accepted place of collection,unverified
"North America, United States, Arizona, Yavapai County",Prescott,,34.540024,-112.468502,World Geodetic System 1984,12606,m,GeoLocate,GeoLocate,Adam Glueckert,2016-10-05,Dendroica petechia sonorana,CHAS:Bird:16914,05/11/1925,1925-05-11,1925-05-11,accepted place of collection,unverified
"North America, United States, Arizona, Yavapai County",Prescott,,34.540024,-112.468502,World Geodetic System 1984,12606,m,GeoLocate,GeoLocate,Adam Glueckert,2016-10-05,Dendroica coronata auduboni,CHAS:Bird:16975,03/14/1925,1925-03-14,1925-03-14,accepted place of collection,unverified
"North America, United States, Arizona, Yavapai County",Prescott,"Prescott, Ariz.",34.540024,-112.468502,World Geodetic System 1984,12606,m,GeoLocate,GeoLocate,Adam Glueckert,2016-10-05,Agelaius phoeniceus sonoriensis,CHAS:Bird:8333,01/21/1926,1926-01-21,1926-01-21,accepted place of collection,unverified
"North America, United States, Arizona, Yavapai County",Prescott,"Prescott, Ariz.",34.540024,-112.468502,World Geodetic System 1984,12606,m,GeoLocate,GeoLocate,Adam Glueckert,2016-10-05,Agelaius phoeniceus sonoriensis,CHAS:Bird:8334,01/21/1926,1926-01-21,1926-01-21,accepted place of collection,unverified
"North America, United States, Arizona, Yavapai County",Prescott,"Prescott, Ariz.",34.540024,-112.468502,World Geodetic System 1984,12606,m,GeoLocate,GeoLocate,Adam Glueckert,2016-10-05,Picoides scalaris cactophilus,CHAS:Bird:8138,01/27/1925,1925-01-27,1925-01-27,accepted place of collection,unverified
"North America, United States, Arizona, Yavapai County",Wickenburg,,33.968641,-112.729622,World Geodetic System 1984,7560,m,GeoLocate,GeoLocate,Adam Glueckert,2016-11-09,Auriparus flaviceps,CHAS:Bird:19326,05/07/1937,1937-05-07,1937-05-07,accepted place of collection,unverified
"North America, United States, Arizona, Yavapai County",Yarnell,"Yarnell, Yavapai County, Arizona",34.221693,-112.747401,World Geodetic System 1984,5151,m,GeoLocate,GeoLocate,Adam Glueckert,2016-10-15,Buteo swainsoni,CHAS:Bird:8893,06/06/1937,1937-06-06,1937-06-06,accepted place of collection,unverified
"North America, United States, Arizona, Yavapai County",Yarnell,"Yarnell, Yavapai County, Arizona",34.221693,-112.747401,World Geodetic System 1984,5151,m,,GeoLocate,Adam Glueckert,2016-09-17,Picoides scalaris cactophilus,CHAS:Bird:8836,05/24/1937,1937-05-24,1937-05-24,accepted place of collection,unverified
"North America, United States, Arizona, Yavapai County",Yarnell,"Yarnell, Yavapai County, Arizona",34.221693,-112.747401,World Geodetic System 1984,5151,m,GeoLocate,GeoLocate,Adam Glueckert,2016-10-15,Catharus ustulatus ustulatus,CHAS:Bird:8809,05/23/1937,1937-05-23,1937-05-23,accepted place of collection,unverified
"North America, United States, Arizona, Yavapai County",Yarnell,"Yarnell, Yavapai County, Arizona",34.221693,-112.747401,World Geodetic System 1984,5151,m,GeoLocate,GeoLocate,Adam Glueckert,2016-10-15,Setophaga townsendi,CHAS:Bird:8837,05/24/1937,1937-05-24,1937-05-24,accepted place of collection,unverified
"North America, United States, Arizona, Yavapai County",Yarnell,"Yarnell, Yavapai County, Arizona",34.221693,-112.747401,World Geodetic System 1984,5151,m,GeoLocate,GeoLocate,Adam Glueckert,2016-10-15,Picoides scalaris cactophilus,CHAS:Bird:8808,05/23/1937,1937-05-23,1937-05-23,accepted place of collection,unverified
"North America, United States, Arizona, Yavapai County",Yarnell,"Yarnell, Yavapai County, Arizona",34.221693,-112.747401,World Geodetic System 1984,5151,m,GeoLocate,GeoLocate,Adam Glueckert,2016-10-15,Buteo albonotatus,CHAS:Bird:8801,05/21/1937,1937-05-21,1937-05-21,accepted place of collection,unverified
"North America, United States, Arizona, Yavapai County",Yarnell,"Yarnell, Yavapai County, Arizona",34.221693,-112.747401,World Geodetic System 1984,5151,m,GeoLocate,GeoLocate,Adam Glueckert,2016-09-30,Chordeiles acutipennis texensis,CHAS:Bird:8847,05/27/1937,1937-05-27,1937-05-27,accepted place of collection,unverified
"North America, United States, Arizona, Yavapai County",Yarnell,"Yarnell, Yavapai County, Arizona",34.221693,-112.747401,World Geodetic System 1984,5151,m,GeoLocate,GeoLocate,Adam Glueckert,2016-09-30,Chordeiles acutipennis texensis,CHAS:Bird:8848,05/27/1937,1937-05-27,1937-05-27,accepted place of collection,unverified
"North America, United States, Arizona, Yavapai County",Yarnell,"Yarnell, Yavapai County, Arizona",34.221693,-112.747401,World Geodetic System 1984,5151,m,GeoLocate,GeoLocate,Adam Glueckert,2016-09-30,Chordeiles acutipennis texensis,CHAS:Bird:8849,05/27/1937,1937-05-27,1937-05-27,accepted place of collection,unverified
"North America, United States, Arizona, Yavapai County",Yarnell,"Yarnell, Yavapai County, Arizona",34.221693,-112.747401,World Geodetic System 1984,5151,m,GeoLocate,GeoLocate,Adam Glueckert,2016-09-30,Selasphorus platycercus platycercus,CHAS:Bird:8812,05/23/1937,1937-05-23,1937-05-23,accepted place of collection,unverified
"North America, United States, Arizona, Yavapai County",Yarnell,"Yarnell, Yavapai County, Arizona",34.221693,-112.747401,World Geodetic System 1984,5151,m,GeoLocate,GeoLocate,Adam Glueckert,2016-09-30,Selasphorus platycercus platycercus,CHAS:Bird:8813,05/23/1937,1937-05-23,1937-05-23,accepted place of collection,unverified
"North America, United States, Arizona, Yavapai County",Yarnell,"Yarnell, Yavapai County, Arizona",34.221693,-112.747401,World Geodetic System 1984,5151,m,GeoLocate,GeoLocate,Adam Glueckert,2016-09-30,Charadrius vociferus vociferus,CHAS:Bird:8845,05/26/1937,1937-05-26,1937-05-26,accepted place of collection,unverified
"North America, United States, Arizona, Yavapai County",Yarnell,"Yarnell, Yavapai County, Arizona",34.221693,-112.747401,World Geodetic System 1984,5151,m,GeoLocate,GeoLocate,Adam Glueckert,2016-09-30,Aphelocoma wqoodhouseii,CHAS:Bird:8802,05/22/1937,1937-05-22,1937-05-22,accepted place of collection,unverified
"North America, United States, Arizona, Yavapai County",Yarnell,"Yarnell, Yavapai County, Arizona",34.221693,-112.747401,World Geodetic System 1984,5151,m,GeoLocate,GeoLocate,Adam Glueckert,2016-09-30,Aphelocoma woodhouseii,CHAS:Bird:8846,05/27/1937,1937-05-27,1937-05-27,accepted place of collection,unverified
"North America, United States, Arizona, Yavapai County",Yarnell,"Yarnell, Yavapai County, Arizona",34.221693,-112.747401,World Geodetic System 1984,5151,m,GeoLocate,GeoLocate,Adam Glueckert,2016-09-30,Baeolophus wollweberi annexus,CHAS:Bird:8805,05/22/1937,1937-05-22,1937-05-22,accepted place of collection,unverified
"North America, United States, Arizona, Yavapai County",Yarnell,"Yarnell, Yavapai County, Arizona",34.221693,-112.747401,World Geodetic System 1984,5151,m,GeoLocate,GeoLocate,Adam Glueckert,2016-09-30,Baeolophus inornatus griseus,CHAS:Bird:8810,05/23/1937,1937-05-23,1937-05-23,accepted place of collection,unverified
"North America, United States, Arizona, Yavapai County",Yarnell,"Yarnell, Yavapai County, Arizona",34.221693,-112.747401,World Geodetic System 1984,5151,m,GeoLocate,GeoLocate,Adam Glueckert,2016-09-30,Baeolophus inornatus griseus,CHAS:Bird:8811,05/23/1937,1937-05-23,1937-05-23,accepted place of collection,unverified
"North America, United States, Arizona, Yavapai County",Yarnell,"Yarnell, Yavapai County, Arizona",34.221693,-112.747401,World Geodetic System 1984,5151,m,GeoLocate,GeoLocate,Adam Glueckert,2016-09-30,Thryomanes bewickii eremophilus,CHAS:Bird:8804,05/22/1937,1937-05-22,1937-05-22,accepted place of collection,unverified
"North America, United States, Arizona, Yavapai County",Yarnell,"Yarnell, Yavapai County, Arizona",34.221693,-112.747401,World Geodetic System 1984,5151,m,GeoLocate,GeoLocate,Adam Glueckert,2016-09-30,Vireo vicinior,CHAS:Bird:8840,05/24/1937,1937-05-24,1937-05-24,accepted place of collection,unverified
"North America, United States, Arizona, Yavapai County",Yarnell,"Yarnell, Yavapai County, Arizona",34.221693,-112.747401,World Geodetic System 1984,5151,m,GeoLocate,GeoLocate,Adam Glueckert,2016-09-30,Pipilo maculatus montanus,CHAS:Bird:8803,05/22/1937,1937-05-22,1937-05-22,accepted place of collection,unverified
"North America, United States, Arizona, Yavapai County",Yarnell,"Yarnell, Yavapai County, Arizona",34.221693,-112.747401,World Geodetic System 1984,5151,m,GeoLocate,GeoLocate,Adam Glueckert,2016-09-30,Pipilo maculatus montanus,CHAS:Bird:8838,05/24/1937,1937-05-24,1937-05-24,accepted place of collection,unverified
"North America, United States, Arizona, Yavapai County",Yarnell,"Yarnell, Yavapai County, Arizona",34.221693,-112.747401,World Geodetic System 1984,5151,m,GeoLocate,GeoLocate,Adam Glueckert,2016-09-30,Spizella passerina arizonae,CHAS:Bird:8806,05/23/1937,1937-05-23,1937-05-23,accepted place of collection,unverified
"North America, United States, Arizona, Yavapai County",Yarnell,"Yarnell, Yavapai County, Arizona",34.221693,-112.747401,World Geodetic System 1984,5151,m,GeoLocate,GeoLocate,Adam Glueckert,2016-10-15,Piranga rubra cooperi,CHAS:Bird:8807,05/23/1937,1937-05-23,1937-05-23,accepted place of collection,unverified
"North America, United States, Arizona, Yavapai County",Yarnell,"Yarnell, Yavapai County, Arizona",34.221693,-112.747401,World Geodetic System 1984,5151,m,GeoLocate,GeoLocate,Adam Glueckert,2016-09-30,Pheucticus melanocephalus papago,CHAS:Bird:8814,05/24/1937,1937-05-24,1937-05-24,accepted place of collection,unverified
"North America, United States, Arizona, Yavapai County",Yarnell,"Yarnell, Yavapai County, Arizona",34.221693,-112.747401,World Geodetic System 1984,5151,m,GeoLocate,GeoLocate,Adam Glueckert,2016-09-30,Pheucticus melanocephalus papago,CHAS:Bird:8842,05/25/1937,1937-05-25,1937-05-25,accepted place of collection,unverified
"North America, United States, Arizona, Yavapai County",Yarnell,"Yarnell, Yavapai County, Arizona",34.221693,-112.747401,World Geodetic System 1984,5151,m,GeoLocate,GeoLocate,Adam Glueckert,2016-09-30,Pheucticus melanocephalus papago,CHAS:Bird:8843,05/25/1937,1937-05-25,1937-05-25,accepted place of collection,unverified
"North America, United States, Arizona, Yavapai County",Yarnell,"Yarnell, Yavapai County, Arizona",34.221693,-112.747401,World Geodetic System 1984,5151,m,GeoLocate,GeoLocate,Adam Glueckert,2016-09-30,Vireo vicinior,CHAS:Bird:8839,05/24/1937,1937-05-24,1937-05-24,accepted place of collection,unverified
"North America, United States, Arizona, Yavapai County",Yarnell,"Yarnell, Yavapai County, Arizona",34.221693,-112.747401,World Geodetic System 1984,5151,m,GeoLocate,GeoLocate,Adam Glueckert,2016-09-30,Aves,CHAS:Bird:8930,05/29/1973,1937-05-29,1937-05-29,accepted place of collection,unverified
"North America, United States, Arizona, Yavapai County",Yarnell,"Yarnell, Yavapai County, Arizona",34.221693,-112.747401,World Geodetic System 1984,5151,m,GeoLocate,GeoLocate,Adam Glueckert,2016-09-30,Myiarchus cinerascens cinerascens,CHAS:Bird:8844,05/25/1937,1937-05-25,1937-05-25,accepted place of collection,unverified
"North America, United States, Arizona, Yavapai County",Yarnell,"Yarnell, Yavapai County, Arizona",34.221693,-112.747401,World Geodetic System 1984,5151,m,GeoLocate,GeoLocate,Adam Glueckert,2016-10-15,Vireo swainsoni,CHAS:Bird:8841,05/25/1937,1937-05-25,1937-05-25,accepted place of collection,unverified
"North America, United States, Arizona, Yavapai County",Yarnell,"Yarnell, Yavapai County, Arizona",34.221693,-112.747401,World Geodetic System 1984,5151,m,GeoLocate,GeoLocate,Adam Glueckert,2016-10-15,Icteria virens longicauda,CHAS:Bird:8798,05/24/1937,1937-05-24,1937-05-24,accepted place of collection,unverified
"North America, United States, Arizona, Yavapai County",Yarnell,"Yarnell, Yavapai County, Arizona",34.221693,-112.747401,World Geodetic System 1984,5151,m,GeoLocate,GeoLocate,Adam Glueckert,2016-10-15,Icterus galbula,CHAS:Bird:8822,05/28/1937,1937-05-28,1937-05-28,accepted place of collection,unverified
"North America, United States, Arizona, Yavapai County",Yarnell,"Yarnell, Yavapai County, Arizona",34.221693,-112.747401,World Geodetic System 1984,5151,m,GeoLocate,GeoLocate,Adam Glueckert,2016-10-15,Icterus cucullatus nelsoni,CHAS:Bird:8834,05/28/1937,1937-05-28,1937-05-28,accepted place of collection,unverified
